=== mar. 20 janv. 2026 14:44:50 CET steps=2000 batch=1 seed=1768918691 ===
[pilot] base k_table top pairs:
  k_base=18 permA=0 permB=0
  k_base=12 permA=29 permB=0
  k_base=12 permA=22 permB=0
  k_base=12 permA=13 permB=0
  k_base=12 permA=6 permB=0
[pilot] A multisets raw=792 (expected=792) enum_mode=multiset cayley_unique=26 perms=30 -> total scored = 780
[pilot] B multisets raw=792 (expected=792) enum_mode=multiset cayley_unique=26 perms=30 -> total scored = 780
[pilot] A frontier kept 128 candidates with points: (4,20), (0,49)
[pilot] B frontier kept 128 candidates with points: (4,20), (0,49)
[pilot] C2xC2xC2 n=288 d0=17 A_sets=26*30 -> keep 128; B_sets=26*30 -> keep 128
[pilot] MEAS n=288 k=4 dx_ub=23 dz_ub=16 d_ub=16 steps=2000 id=C2xC2xC2_c00012
[pilot] MEAS n=288 k=4 dx_ub=16 dz_ub=18 d_ub=16 steps=2000 id=C2xC2xC2_c00045
[pilot] TARGET_REJECT d_ub=14 target=16 id=C2xC2xC2_c00069
[pilot] MEAS n=288 k=4 dx_ub=16 dz_ub=20 d_ub=16 steps=2000 id=C2xC2xC2_c00095
[pilot] MEAS n=288 k=4 dx_ub=17 dz_ub=18 d_ub=17 steps=2000 id=C2xC2xC2_c00101
[saved] id=C2xC2xC2_c00101 -> results/c2xc2xc2_d16_20260120_144450/promising/C2xC2xC2_c00101 (reason: d>=sqrt(n))
[pilot] MEAS n=288 k=4 dx_ub=20 dz_ub=16 d_ub=16 steps=2000 id=C2xC2xC2_c00110
[pilot] MEAS n=288 k=4 dx_ub=17 dz_ub=16 d_ub=16 steps=2000 id=C2xC2xC2_c00124
[pilot] TARGET_REJECT d_ub=6 target=16 id=C2xC2xC2_c00126
[pilot] TARGET_REJECT d_ub=12 target=16 id=C2xC2xC2_c00138
[pilot] MEAS n=288 k=4 dx_ub=20 dz_ub=20 d_ub=20 steps=2000 id=C2xC2xC2_c00141
[saved] id=C2xC2xC2_c00141 -> results/c2xc2xc2_d16_20260120_144450/promising/C2xC2xC2_c00141 (reason: d>=sqrt(n))
[pilot] MEAS n=288 k=8 dx_ub=17 dz_ub=17 d_ub=17 steps=2000 id=C2xC2xC2_c00145
[saved] id=C2xC2xC2_c00145 -> results/c2xc2xc2_d16_20260120_144450/promising/C2xC2xC2_c00145 (reason: d>=sqrt(n))
[pilot] TARGET_REJECT d_ub=12 target=16 id=C2xC2xC2_c00181
[pilot] TARGET_REJECT d_ub=12 target=16 id=C2xC2xC2_c00192
[pilot] MEAS n=288 k=8 dx_ub=18 dz_ub=16 d_ub=16 steps=2000 id=C2xC2xC2_c00198
[pilot] MEAS n=288 k=4 dx_ub=20 dz_ub=24 d_ub=20 steps=2000 id=C2xC2xC2_c00258
[saved] id=C2xC2xC2_c00258 -> results/c2xc2xc2_d16_20260120_144450/promising/C2xC2xC2_c00258 (reason: d>=sqrt(n))
[pilot] MEAS n=288 k=4 dx_ub=20 dz_ub=16 d_ub=16 steps=2000 id=C2xC2xC2_c00267
[pilot] MEAS n=288 k=4 dx_ub=16 dz_ub=16 d_ub=16 steps=2000 id=C2xC2xC2_c00279
[pilot] TARGET_REJECT d_ub=12 target=16 id=C2xC2xC2_c00285
[pilot] TARGET_REJECT d_ub=14 target=16 id=C2xC2xC2_c00289
[pilot] MEAS n=288 k=4 dx_ub=20 dz_ub=20 d_ub=20 steps=2000 id=C2xC2xC2_c00294
[saved] id=C2xC2xC2_c00294 -> results/c2xc2xc2_d16_20260120_144450/promising/C2xC2xC2_c00294 (reason: d>=sqrt(n))
[pilot] TARGET_REJECT d_ub=15 target=16 id=C2xC2xC2_c00304
[pilot] TARGET_REJECT d_ub=6 target=16 id=C2xC2xC2_c00327
[pilot] MEAS n=288 k=4 dx_ub=16 dz_ub=16 d_ub=16 steps=2000 id=C2xC2xC2_c00331
[pilot] MEAS n=288 k=4 dx_ub=23 dz_ub=20 d_ub=20 steps=2000 id=C2xC2xC2_c00340
[saved] id=C2xC2xC2_c00340 -> results/c2xc2xc2_d16_20260120_144450/promising/C2xC2xC2_c00340 (reason: d>=sqrt(n))
[pilot] MEAS n=288 k=4 dx_ub=24 dz_ub=19 d_ub=19 steps=2000 id=C2xC2xC2_c00393
[saved] id=C2xC2xC2_c00393 -> results/c2xc2xc2_d16_20260120_144450/promising/C2xC2xC2_c00393 (reason: d>=sqrt(n))
[pilot] TARGET_REJECT d_ub=12 target=16 id=C2xC2xC2_c00394
[pilot] MEAS n=288 k=4 dx_ub=20 dz_ub=18 d_ub=18 steps=2000 id=C2xC2xC2_c00395
[saved] id=C2xC2xC2_c00395 -> results/c2xc2xc2_d16_20260120_144450/promising/C2xC2xC2_c00395 (reason: d>=sqrt(n))
[pilot] MEAS n=288 k=4 dx_ub=20 dz_ub=18 d_ub=18 steps=2000 id=C2xC2xC2_c00401
[saved] id=C2xC2xC2_c00401 -> results/c2xc2xc2_d16_20260120_144450/promising/C2xC2xC2_c00401 (reason: d>=sqrt(n))
[pilot] MEAS n=288 k=8 dx_ub=16 dz_ub=17 d_ub=16 steps=2000 id=C2xC2xC2_c00407
[pilot] MEAS n=288 k=4 dx_ub=17 dz_ub=17 d_ub=17 steps=2000 id=C2xC2xC2_c00451
[saved] id=C2xC2xC2_c00451 -> results/c2xc2xc2_d16_20260120_144450/promising/C2xC2xC2_c00451 (reason: d>=sqrt(n))
[pilot] MEAS n=288 k=4 dx_ub=20 dz_ub=16 d_ub=16 steps=2000 id=C2xC2xC2_c00453
[pilot] MEAS n=288 k=4 dx_ub=17 dz_ub=20 d_ub=17 steps=2000 id=C2xC2xC2_c00474
[saved] id=C2xC2xC2_c00474 -> results/c2xc2xc2_d16_20260120_144450/promising/C2xC2xC2_c00474 (reason: d>=sqrt(n))
[pilot] MEAS n=288 k=8 dx_ub=18 dz_ub=16 d_ub=16 steps=2000 id=C2xC2xC2_c00485
[pilot] MEAS n=288 k=4 dx_ub=23 dz_ub=20 d_ub=20 steps=2000 id=C2xC2xC2_c00486
[saved] id=C2xC2xC2_c00486 -> results/c2xc2xc2_d16_20260120_144450/promising/C2xC2xC2_c00486 (reason: d>=sqrt(n))
[best_by_k] group=C2xC2xC2 n=288
k  | d_ub | steps | dx_ub | dz_ub | id
 4 |   20 |  2000 |    20 |    20 | C2xC2xC2_c00141
 8 |   17 |  2000 |    17 |    17 | C2xC2xC2_c00145
[coverage] group=C2xC2xC2 A_sel=128 B_sel=128 Q_meas=34 ratio_ge_sqrt=0.001 ratio_sel=0.002
[coverage] run summary:
[coverage] group=C2xC2xC2 A_sel=128 B_sel=128 Q_meas=34 ratio_ge_sqrt=0.001 ratio_sel=0.002
[summary] best-by-k (measured; includes rejects):
  k=4 best_d_ub=20 count_measured=20 example_id=C2xC2xC2_c00141
  k=8 best_d_ub=17 count_measured=14 example_id=C2xC2xC2_c00145
[summary] best-by-k (survivors; target=16):
  k=4 best_d_ub=20 count_survivors=20 example_id=C2xC2xC2_c00141
  k=8 best_d_ub=17 count_survivors=4 example_id=C2xC2xC2_c00145
[pilot] top results:
  01 group=C2xC2xC2 n=288 k=4 d_ub=20 permA=27 permB=8 saved=True
  02 group=C2xC2xC2 n=288 k=4 d_ub=20 permA=11 permB=27 saved=True
  03 group=C2xC2xC2 n=288 k=4 d_ub=20 permA=8 permB=11 saved=True
  04 group=C2xC2xC2 n=288 k=4 d_ub=20 permA=7 permB=20 saved=True
  05 group=C2xC2xC2 n=288 k=4 d_ub=20 permA=7 permB=20 saved=True
  06 group=C2xC2xC2 n=288 k=4 d_ub=19 permA=27 permB=12 saved=True
  07 group=C2xC2xC2 n=288 k=4 d_ub=18 permA=20 permB=20 saved=True
  08 group=C2xC2xC2 n=288 k=4 d_ub=18 permA=12 permB=11 saved=True
  09 group=C2xC2xC2 n=288 k=8 d_ub=17 permA=7 permB=11 saved=True
  10 group=C2xC2xC2 n=288 k=4 d_ub=17 permA=27 permB=11 saved=True

