=== mar. 20 janv. 2026 15:19:29 CET steps=5000 batch=53 seed=1768922156 ===
[pilot] base k_table top pairs:
  k_base=18 permA=0 permB=0
  k_base=12 permA=29 permB=0
  k_base=12 permA=22 permB=0
  k_base=12 permA=13 permB=0
  k_base=12 permA=6 permB=0
[pilot] A multisets raw=792 (expected=792) enum_mode=multiset cayley_unique=26 perms=30 -> total scored = 780
[pilot] B multisets raw=792 (expected=792) enum_mode=multiset cayley_unique=26 perms=30 -> total scored = 780
[pilot] A frontier kept 128 candidates with points: (4,20), (0,49)
[pilot] B frontier kept 128 candidates with points: (4,20), (0,49)
[pilot] C2xC2xC2 n=288 d0=17 A_sets=26*30 -> keep 128; B_sets=26*30 -> keep 128
[pilot] MEAS n=288 k=4 dx_ub=16 dz_ub=16 d_ub=16 steps=5000 id=C2xC2xC2_c00011
[pilot] MEAS n=288 k=4 dx_ub=20 dz_ub=23 d_ub=20 steps=5000 id=C2xC2xC2_c00039
[saved] id=C2xC2xC2_c00039 -> results/c2xc2xc2_d16_20260120_151929/promising/C2xC2xC2_c00039 (reason: d>=sqrt(n))
[pilot] MEAS n=288 k=4 dx_ub=16 dz_ub=16 d_ub=16 steps=5000 id=C2xC2xC2_c00062
[pilot] MEAS n=288 k=8 dx_ub=16 dz_ub=16 d_ub=16 steps=5000 id=C2xC2xC2_c00077
[pilot] MEAS n=288 k=4 dx_ub=17 dz_ub=16 d_ub=16 steps=5000 id=C2xC2xC2_c00110
[pilot] MEAS n=288 k=8 dx_ub=20 dz_ub=16 d_ub=16 steps=5000 id=C2xC2xC2_c00143
[pilot] MEAS n=288 k=4 dx_ub=20 dz_ub=16 d_ub=16 steps=5000 id=C2xC2xC2_c00153
[pilot] MEAS n=288 k=4 dx_ub=20 dz_ub=20 d_ub=20 steps=5000 id=C2xC2xC2_c00162
[saved] id=C2xC2xC2_c00162 -> results/c2xc2xc2_d16_20260120_151929/promising/C2xC2xC2_c00162 (reason: d>=sqrt(n))
[pilot] MEAS n=288 k=4 dx_ub=20 dz_ub=16 d_ub=16 steps=5000 id=C2xC2xC2_c00164
[pilot] MEAS n=288 k=4 dx_ub=16 dz_ub=20 d_ub=16 steps=5000 id=C2xC2xC2_c00194
[pilot] MEAS n=288 k=4 dx_ub=17 dz_ub=16 d_ub=16 steps=5000 id=C2xC2xC2_c00195
[pilot] MEAS n=288 k=4 dx_ub=17 dz_ub=20 d_ub=17 steps=5000 id=C2xC2xC2_c00206
[saved] id=C2xC2xC2_c00206 -> results/c2xc2xc2_d16_20260120_151929/promising/C2xC2xC2_c00206 (reason: d>=sqrt(n))
[pilot] MEAS n=288 k=8 dx_ub=16 dz_ub=17 d_ub=16 steps=5000 id=C2xC2xC2_c00223
[pilot] MEAS n=288 k=4 dx_ub=20 dz_ub=16 d_ub=16 steps=5000 id=C2xC2xC2_c00251
[pilot] MEAS n=288 k=4 dx_ub=17 dz_ub=17 d_ub=17 steps=5000 id=C2xC2xC2_c00281
[saved] id=C2xC2xC2_c00281 -> results/c2xc2xc2_d16_20260120_151929/promising/C2xC2xC2_c00281 (reason: d>=sqrt(n))
[pilot] MEAS n=288 k=4 dx_ub=20 dz_ub=20 d_ub=20 steps=5000 id=C2xC2xC2_c00305
[saved] id=C2xC2xC2_c00305 -> results/c2xc2xc2_d16_20260120_151929/promising/C2xC2xC2_c00305 (reason: d>=sqrt(n))
[pilot] MEAS n=288 k=4 dx_ub=20 dz_ub=20 d_ub=20 steps=5000 id=C2xC2xC2_c00310
[saved] id=C2xC2xC2_c00310 -> results/c2xc2xc2_d16_20260120_151929/promising/C2xC2xC2_c00310 (reason: d>=sqrt(n))
[pilot] TARGET_REJECT d_ub=15 target=16 id=C2xC2xC2_c00350
[pilot] MEAS n=288 k=4 dx_ub=20 dz_ub=17 d_ub=17 steps=5000 id=C2xC2xC2_c00387
[saved] id=C2xC2xC2_c00387 -> results/c2xc2xc2_d16_20260120_151929/promising/C2xC2xC2_c00387 (reason: d>=sqrt(n))
[pilot] TARGET_REJECT d_ub=14 target=16 id=C2xC2xC2_c00389
[pilot] TARGET_REJECT d_ub=12 target=16 id=C2xC2xC2_c00394
[pilot] MEAS n=288 k=8 dx_ub=16 dz_ub=16 d_ub=16 steps=5000 id=C2xC2xC2_c00436
[pilot] MEAS n=288 k=8 dx_ub=17 dz_ub=16 d_ub=16 steps=5000 id=C2xC2xC2_c00447
[pilot] TARGET_REJECT d_ub=12 target=16 id=C2xC2xC2_c00448
[pilot] MEAS n=288 k=4 dx_ub=20 dz_ub=22 d_ub=20 steps=5000 id=C2xC2xC2_c00451
[saved] id=C2xC2xC2_c00451 -> results/c2xc2xc2_d16_20260120_151929/promising/C2xC2xC2_c00451 (reason: d>=sqrt(n))
[pilot] MEAS n=288 k=4 dx_ub=19 dz_ub=19 d_ub=19 steps=5000 id=C2xC2xC2_c00461
[saved] id=C2xC2xC2_c00461 -> results/c2xc2xc2_d16_20260120_151929/promising/C2xC2xC2_c00461 (reason: d>=sqrt(n))
[best_by_k] group=C2xC2xC2 n=288
k  | d_ub | steps | dx_ub | dz_ub | id
 4 |   20 |  5000 |    20 |    23 | C2xC2xC2_c00039
 8 |   16 |  5000 |    16 |    16 | C2xC2xC2_c00077
[coverage] group=C2xC2xC2 A_sel=128 B_sel=128 Q_meas=26 ratio_ge_sqrt=0.000 ratio_sel=0.002
[coverage] run summary:
[coverage] group=C2xC2xC2 A_sel=128 B_sel=128 Q_meas=26 ratio_ge_sqrt=0.000 ratio_sel=0.002
[summary] best-by-k (measured; includes rejects):
  k=4 best_d_ub=20 count_measured=18 example_id=C2xC2xC2_c00039
  k=8 best_d_ub=16 count_measured=8 example_id=C2xC2xC2_c00077
[summary] best-by-k (survivors; target=16):
  k=4 best_d_ub=20 count_survivors=17 example_id=C2xC2xC2_c00039
  k=8 best_d_ub=16 count_survivors=5 example_id=C2xC2xC2_c00077
[pilot] top results:
  01 group=C2xC2xC2 n=288 k=4 d_ub=20 permA=11 permB=27 saved=True
  02 group=C2xC2xC2 n=288 k=4 d_ub=20 permA=20 permB=27 saved=True
  03 group=C2xC2xC2 n=288 k=4 d_ub=20 permA=11 permB=27 saved=True
  04 group=C2xC2xC2 n=288 k=4 d_ub=20 permA=27 permB=7 saved=True
  05 group=C2xC2xC2 n=288 k=4 d_ub=20 permA=8 permB=11 saved=True
  06 group=C2xC2xC2 n=288 k=4 d_ub=19 permA=8 permB=27 saved=True
  07 group=C2xC2xC2 n=288 k=4 d_ub=17 permA=20 permB=8 saved=True
  08 group=C2xC2xC2 n=288 k=4 d_ub=17 permA=20 permB=20 saved=True
  09 group=C2xC2xC2 n=288 k=4 d_ub=17 permA=27 permB=20 saved=True
  10 group=C2xC2xC2 n=288 k=8 d_ub=16 permA=8 permB=12 saved=False

