=== mar. 20 janv. 2026 16:49:05 CET steps=5000 batch=91 seed=1768922194 ===
[pilot] base k_table top pairs:
  k_base=18 permA=0 permB=0
  k_base=12 permA=29 permB=0
  k_base=12 permA=22 permB=0
  k_base=12 permA=13 permB=0
  k_base=12 permA=6 permB=0
[pilot] A multisets raw=792 (expected=792) enum_mode=multiset cayley_unique=26 perms=30 -> total scored = 780
[pilot] B multisets raw=792 (expected=792) enum_mode=multiset cayley_unique=26 perms=30 -> total scored = 780
[pilot] A frontier kept 128 candidates with points: (4,20), (0,49)
[pilot] B frontier kept 128 candidates with points: (4,20), (0,49)
[pilot] C2xC2xC2 n=288 d0=17 A_sets=26*30 -> keep 128; B_sets=26*30 -> keep 128
[pilot] MEAS n=288 k=8 dx_ub=17 dz_ub=19 d_ub=17 steps=5000 id=C2xC2xC2_c00021
[saved] id=C2xC2xC2_c00021 -> results/c2xc2xc2_d16_20260120_164905/promising/C2xC2xC2_c00021 (reason: d>=sqrt(n))
[pilot] MEAS n=288 k=4 dx_ub=17 dz_ub=20 d_ub=17 steps=5000 id=C2xC2xC2_c00069
[saved] id=C2xC2xC2_c00069 -> results/c2xc2xc2_d16_20260120_164905/promising/C2xC2xC2_c00069 (reason: d>=sqrt(n))
[pilot] MEAS n=288 k=4 dx_ub=20 dz_ub=20 d_ub=20 steps=5000 id=C2xC2xC2_c00083
[saved] id=C2xC2xC2_c00083 -> results/c2xc2xc2_d16_20260120_164905/promising/C2xC2xC2_c00083 (reason: d>=sqrt(n))
[pilot] MEAS n=288 k=4 dx_ub=16 dz_ub=16 d_ub=16 steps=5000 id=C2xC2xC2_c00107
[pilot] MEAS n=288 k=4 dx_ub=20 dz_ub=20 d_ub=20 steps=5000 id=C2xC2xC2_c00195
[saved] id=C2xC2xC2_c00195 -> results/c2xc2xc2_d16_20260120_164905/promising/C2xC2xC2_c00195 (reason: d>=sqrt(n))
[pilot] TARGET_REJECT d_ub=12 target=16 id=C2xC2xC2_c00219
[pilot] MEAS n=288 k=4 dx_ub=20 dz_ub=20 d_ub=20 steps=5000 id=C2xC2xC2_c00223
[saved] id=C2xC2xC2_c00223 -> results/c2xc2xc2_d16_20260120_164905/promising/C2xC2xC2_c00223 (reason: d>=sqrt(n))
[pilot] MEAS n=288 k=4 dx_ub=20 dz_ub=16 d_ub=16 steps=5000 id=C2xC2xC2_c00225
[pilot] MEAS n=288 k=4 dx_ub=18 dz_ub=16 d_ub=16 steps=5000 id=C2xC2xC2_c00244
[pilot] MEAS n=288 k=4 dx_ub=20 dz_ub=20 d_ub=20 steps=5000 id=C2xC2xC2_c00262
[saved] id=C2xC2xC2_c00262 -> results/c2xc2xc2_d16_20260120_164905/promising/C2xC2xC2_c00262 (reason: d>=sqrt(n))
[pilot] MEAS n=288 k=8 dx_ub=16 dz_ub=17 d_ub=16 steps=5000 id=C2xC2xC2_c00273
[pilot] MEAS n=288 k=4 dx_ub=20 dz_ub=21 d_ub=20 steps=5000 id=C2xC2xC2_c00285
[saved] id=C2xC2xC2_c00285 -> results/c2xc2xc2_d16_20260120_164905/promising/C2xC2xC2_c00285 (reason: d>=sqrt(n))
[pilot] MEAS n=288 k=4 dx_ub=20 dz_ub=20 d_ub=20 steps=5000 id=C2xC2xC2_c00287
[saved] id=C2xC2xC2_c00287 -> results/c2xc2xc2_d16_20260120_164905/promising/C2xC2xC2_c00287 (reason: d>=sqrt(n))
[pilot] MEAS n=288 k=4 dx_ub=22 dz_ub=16 d_ub=16 steps=5000 id=C2xC2xC2_c00288
[pilot] TARGET_REJECT d_ub=14 target=16 id=C2xC2xC2_c00357
[pilot] MEAS n=288 k=4 dx_ub=20 dz_ub=17 d_ub=17 steps=5000 id=C2xC2xC2_c00386
[saved] id=C2xC2xC2_c00386 -> results/c2xc2xc2_d16_20260120_164905/promising/C2xC2xC2_c00386 (reason: d>=sqrt(n))
[pilot] MEAS n=288 k=4 dx_ub=20 dz_ub=18 d_ub=18 steps=5000 id=C2xC2xC2_c00420
[saved] id=C2xC2xC2_c00420 -> results/c2xc2xc2_d16_20260120_164905/promising/C2xC2xC2_c00420 (reason: d>=sqrt(n))
[pilot] MEAS n=288 k=4 dx_ub=20 dz_ub=20 d_ub=20 steps=5000 id=C2xC2xC2_c00438
[saved] id=C2xC2xC2_c00438 -> results/c2xc2xc2_d16_20260120_164905/promising/C2xC2xC2_c00438 (reason: d>=sqrt(n))
[pilot] MEAS n=288 k=8 dx_ub=17 dz_ub=16 d_ub=16 steps=5000 id=C2xC2xC2_c00464
[pilot] MEAS n=288 k=4 dx_ub=20 dz_ub=17 d_ub=17 steps=5000 id=C2xC2xC2_c00473
[saved] id=C2xC2xC2_c00473 -> results/c2xc2xc2_d16_20260120_164905/promising/C2xC2xC2_c00473 (reason: d>=sqrt(n))
[pilot] MEAS n=288 k=4 dx_ub=20 dz_ub=20 d_ub=20 steps=5000 id=C2xC2xC2_c00481
[saved] id=C2xC2xC2_c00481 -> results/c2xc2xc2_d16_20260120_164905/promising/C2xC2xC2_c00481 (reason: d>=sqrt(n))
[pilot] MEAS n=288 k=8 dx_ub=16 dz_ub=18 d_ub=16 steps=5000 id=C2xC2xC2_c00495
[best_by_k] group=C2xC2xC2 n=288
k  | d_ub | steps | dx_ub | dz_ub | id
 4 |   20 |  5000 |    20 |    20 | C2xC2xC2_c00083
 8 |   17 |  5000 |    17 |    19 | C2xC2xC2_c00021
[coverage] group=C2xC2xC2 A_sel=128 B_sel=128 Q_meas=22 ratio_ge_sqrt=0.000 ratio_sel=0.001
[coverage] run summary:
[coverage] group=C2xC2xC2 A_sel=128 B_sel=128 Q_meas=22 ratio_ge_sqrt=0.000 ratio_sel=0.001
[summary] best-by-k (measured; includes rejects):
  k=4 best_d_ub=20 count_measured=17 example_id=C2xC2xC2_c00083
  k=8 best_d_ub=17 count_measured=5 example_id=C2xC2xC2_c00021
[summary] best-by-k (survivors; target=16):
  k=4 best_d_ub=20 count_survivors=16 example_id=C2xC2xC2_c00083
  k=8 best_d_ub=17 count_survivors=4 example_id=C2xC2xC2_c00021
[pilot] top results:
  01 group=C2xC2xC2 n=288 k=4 d_ub=20 permA=7 permB=20 saved=True
  02 group=C2xC2xC2 n=288 k=4 d_ub=20 permA=27 permB=11 saved=True
  03 group=C2xC2xC2 n=288 k=4 d_ub=20 permA=20 permB=11 saved=True
  04 group=C2xC2xC2 n=288 k=4 d_ub=20 permA=8 permB=11 saved=True
  05 group=C2xC2xC2 n=288 k=4 d_ub=20 permA=20 permB=11 saved=True
  06 group=C2xC2xC2 n=288 k=4 d_ub=20 permA=20 permB=12 saved=True
  07 group=C2xC2xC2 n=288 k=4 d_ub=20 permA=11 permB=20 saved=True
  08 group=C2xC2xC2 n=288 k=4 d_ub=20 permA=7 permB=27 saved=True
  09 group=C2xC2xC2 n=288 k=4 d_ub=18 permA=20 permB=11 saved=True
  10 group=C2xC2xC2 n=288 k=8 d_ub=17 permA=11 permB=12 saved=True

