=== mar. 20 janv. 2026 15:24:58 CET steps=5000 batch=63 seed=1768922166 ===
[pilot] base k_table top pairs:
  k_base=18 permA=0 permB=0
  k_base=12 permA=29 permB=0
  k_base=12 permA=22 permB=0
  k_base=12 permA=13 permB=0
  k_base=12 permA=6 permB=0
[pilot] A multisets raw=792 (expected=792) enum_mode=multiset cayley_unique=26 perms=30 -> total scored = 780
[pilot] B multisets raw=792 (expected=792) enum_mode=multiset cayley_unique=26 perms=30 -> total scored = 780
[pilot] A frontier kept 128 candidates with points: (4,20), (0,49)
[pilot] B frontier kept 128 candidates with points: (4,20), (0,49)
[pilot] C2xC2xC2 n=288 d0=17 A_sets=26*30 -> keep 128; B_sets=26*30 -> keep 128
[pilot] MEAS n=288 k=4 dx_ub=20 dz_ub=17 d_ub=17 steps=5000 id=C2xC2xC2_c00048
[saved] id=C2xC2xC2_c00048 -> results/c2xc2xc2_d16_20260120_152458/promising/C2xC2xC2_c00048 (reason: d>=sqrt(n))
[pilot] TARGET_REJECT d_ub=13 target=16 id=C2xC2xC2_c00053
[pilot] TARGET_REJECT d_ub=12 target=16 id=C2xC2xC2_c00076
[pilot] MEAS n=288 k=4 dx_ub=20 dz_ub=20 d_ub=20 steps=5000 id=C2xC2xC2_c00079
[saved] id=C2xC2xC2_c00079 -> results/c2xc2xc2_d16_20260120_152458/promising/C2xC2xC2_c00079 (reason: d>=sqrt(n))
[pilot] TARGET_REJECT d_ub=12 target=16 id=C2xC2xC2_c00082
[pilot] TARGET_REJECT d_ub=14 target=16 id=C2xC2xC2_c00090
[pilot] MEAS n=288 k=4 dx_ub=16 dz_ub=20 d_ub=16 steps=5000 id=C2xC2xC2_c00104
[pilot] MEAS n=288 k=4 dx_ub=22 dz_ub=20 d_ub=20 steps=5000 id=C2xC2xC2_c00108
[saved] id=C2xC2xC2_c00108 -> results/c2xc2xc2_d16_20260120_152458/promising/C2xC2xC2_c00108 (reason: d>=sqrt(n))
[pilot] MEAS n=288 k=4 dx_ub=20 dz_ub=18 d_ub=18 steps=5000 id=C2xC2xC2_c00131
[saved] id=C2xC2xC2_c00131 -> results/c2xc2xc2_d16_20260120_152458/promising/C2xC2xC2_c00131 (reason: d>=sqrt(n))
[pilot] MEAS n=288 k=4 dx_ub=20 dz_ub=20 d_ub=20 steps=5000 id=C2xC2xC2_c00143
[saved] id=C2xC2xC2_c00143 -> results/c2xc2xc2_d16_20260120_152458/promising/C2xC2xC2_c00143 (reason: d>=sqrt(n))
[pilot] TARGET_REJECT d_ub=12 target=16 id=C2xC2xC2_c00175
[pilot] TARGET_REJECT d_ub=14 target=16 id=C2xC2xC2_c00183
[pilot] MEAS n=288 k=4 dx_ub=17 dz_ub=20 d_ub=17 steps=5000 id=C2xC2xC2_c00196
[saved] id=C2xC2xC2_c00196 -> results/c2xc2xc2_d16_20260120_152458/promising/C2xC2xC2_c00196 (reason: d>=sqrt(n))
[pilot] MEAS n=288 k=4 dx_ub=20 dz_ub=16 d_ub=16 steps=5000 id=C2xC2xC2_c00200
[pilot] MEAS n=288 k=4 dx_ub=17 dz_ub=16 d_ub=16 steps=5000 id=C2xC2xC2_c00203
[pilot] MEAS n=288 k=4 dx_ub=18 dz_ub=16 d_ub=16 steps=5000 id=C2xC2xC2_c00205
[pilot] TARGET_REJECT d_ub=12 target=16 id=C2xC2xC2_c00211
[pilot] MEAS n=288 k=8 dx_ub=16 dz_ub=17 d_ub=16 steps=5000 id=C2xC2xC2_c00219
[pilot] MEAS n=288 k=4 dx_ub=20 dz_ub=16 d_ub=16 steps=5000 id=C2xC2xC2_c00226
[pilot] MEAS n=288 k=8 dx_ub=17 dz_ub=16 d_ub=16 steps=5000 id=C2xC2xC2_c00245
[pilot] TARGET_REJECT d_ub=12 target=16 id=C2xC2xC2_c00280
[pilot] MEAS n=288 k=4 dx_ub=20 dz_ub=20 d_ub=20 steps=5000 id=C2xC2xC2_c00315
[saved] id=C2xC2xC2_c00315 -> results/c2xc2xc2_d16_20260120_152458/promising/C2xC2xC2_c00315 (reason: d>=sqrt(n))
[pilot] MEAS n=288 k=4 dx_ub=20 dz_ub=20 d_ub=20 steps=5000 id=C2xC2xC2_c00341
[saved] id=C2xC2xC2_c00341 -> results/c2xc2xc2_d16_20260120_152458/promising/C2xC2xC2_c00341 (reason: d>=sqrt(n))
[pilot] TARGET_REJECT d_ub=6 target=16 id=C2xC2xC2_c00351
[pilot] MEAS n=288 k=8 dx_ub=18 dz_ub=16 d_ub=16 steps=5000 id=C2xC2xC2_c00409
[pilot] TARGET_REJECT d_ub=12 target=16 id=C2xC2xC2_c00412
[pilot] TARGET_REJECT d_ub=6 target=16 id=C2xC2xC2_c00418
[pilot] MEAS n=288 k=4 dx_ub=20 dz_ub=20 d_ub=20 steps=5000 id=C2xC2xC2_c00442
[saved] id=C2xC2xC2_c00442 -> results/c2xc2xc2_d16_20260120_152458/promising/C2xC2xC2_c00442 (reason: d>=sqrt(n))
[pilot] MEAS n=288 k=4 dx_ub=20 dz_ub=21 d_ub=20 steps=5000 id=C2xC2xC2_c00461
[saved] id=C2xC2xC2_c00461 -> results/c2xc2xc2_d16_20260120_152458/promising/C2xC2xC2_c00461 (reason: d>=sqrt(n))
[pilot] TARGET_REJECT d_ub=14 target=16 id=C2xC2xC2_c00462
[best_by_k] group=C2xC2xC2 n=288
k  | d_ub | steps | dx_ub | dz_ub | id
 4 |   20 |  5000 |    20 |    20 | C2xC2xC2_c00079
 8 |   16 |  5000 |    16 |    17 | C2xC2xC2_c00219
[coverage] group=C2xC2xC2 A_sel=128 B_sel=128 Q_meas=30 ratio_ge_sqrt=0.001 ratio_sel=0.002
[coverage] run summary:
[coverage] group=C2xC2xC2 A_sel=128 B_sel=128 Q_meas=30 ratio_ge_sqrt=0.001 ratio_sel=0.002
[summary] best-by-k (measured; includes rejects):
  k=4 best_d_ub=20 count_measured=20 example_id=C2xC2xC2_c00079
  k=8 best_d_ub=16 count_measured=10 example_id=C2xC2xC2_c00219
[summary] best-by-k (survivors; target=16):
  k=4 best_d_ub=20 count_survivors=15 example_id=C2xC2xC2_c00079
  k=8 best_d_ub=16 count_survivors=3 example_id=C2xC2xC2_c00219
[pilot] top results:
  01 group=C2xC2xC2 n=288 k=4 d_ub=20 permA=11 permB=8 saved=True
  02 group=C2xC2xC2 n=288 k=4 d_ub=20 permA=20 permB=27 saved=True
  03 group=C2xC2xC2 n=288 k=4 d_ub=20 permA=20 permB=11 saved=True
  04 group=C2xC2xC2 n=288 k=4 d_ub=20 permA=12 permB=27 saved=True
  05 group=C2xC2xC2 n=288 k=4 d_ub=20 permA=11 permB=12 saved=True
  06 group=C2xC2xC2 n=288 k=4 d_ub=20 permA=12 permB=12 saved=True
  07 group=C2xC2xC2 n=288 k=4 d_ub=20 permA=27 permB=7 saved=True
  08 group=C2xC2xC2 n=288 k=4 d_ub=18 permA=8 permB=11 saved=True
  09 group=C2xC2xC2 n=288 k=4 d_ub=17 permA=8 permB=27 saved=True
  10 group=C2xC2xC2 n=288 k=4 d_ub=17 permA=11 permB=20 saved=True

