=== mer. 21 janv. 2026 01:10:07 CET steps=20000 batch=20 seed=1768937123 ===
[pilot] base k_table top pairs:
  k_base=18 permA=0 permB=0
  k_base=12 permA=29 permB=0
  k_base=12 permA=22 permB=0
  k_base=12 permA=13 permB=0
  k_base=12 permA=6 permB=0
[pilot] A multisets raw=792 (expected=792) enum_mode=multiset cayley_unique=26 perms=30 -> total scored = 780
[pilot] B multisets raw=792 (expected=792) enum_mode=multiset cayley_unique=26 perms=30 -> total scored = 780
[pilot] A frontier kept 128 candidates with points: (4,20), (0,49)
[pilot] B frontier kept 128 candidates with points: (4,20), (0,49)
[pilot] C2xC2xC2 n=288 d0=17 A_sets=26*30 -> keep 128; B_sets=26*30 -> keep 128
[pilot] TARGET_REJECT d_ub=6 target=16 id=C2xC2xC2_c00013
[pilot] TARGET_REJECT d_ub=12 target=16 id=C2xC2xC2_c00022
[pilot] MEAS n=288 k=4 dx_ub=18 dz_ub=17 d_ub=17 steps=20000 id=C2xC2xC2_c00024
[saved] id=C2xC2xC2_c00024 -> results/c2xc2xc2_d16_20260121_011007/promising/C2xC2xC2_c00024 (reason: d>=sqrt(n))
[pilot] MEAS n=288 k=4 dx_ub=19 dz_ub=17 d_ub=17 steps=20000 id=C2xC2xC2_c00055
[saved] id=C2xC2xC2_c00055 -> results/c2xc2xc2_d16_20260121_011007/promising/C2xC2xC2_c00055 (reason: d>=sqrt(n))
[pilot] MEAS n=288 k=4 dx_ub=19 dz_ub=19 d_ub=19 steps=20000 id=C2xC2xC2_c00082
[saved] id=C2xC2xC2_c00082 -> results/c2xc2xc2_d16_20260121_011007/promising/C2xC2xC2_c00082 (reason: d>=sqrt(n))
[pilot] MEAS n=288 k=4 dx_ub=17 dz_ub=16 d_ub=16 steps=20000 id=C2xC2xC2_c00097
[pilot] TARGET_REJECT d_ub=13 target=16 id=C2xC2xC2_c00101
[pilot] TARGET_REJECT d_ub=14 target=16 id=C2xC2xC2_c00106
[pilot] TARGET_REJECT d_ub=12 target=16 id=C2xC2xC2_c00115
[pilot] MEAS n=288 k=8 dx_ub=16 dz_ub=18 d_ub=16 steps=20000 id=C2xC2xC2_c00123
[pilot] MEAS n=288 k=4 dx_ub=18 dz_ub=16 d_ub=16 steps=20000 id=C2xC2xC2_c00181
[pilot] MEAS n=288 k=8 dx_ub=17 dz_ub=16 d_ub=16 steps=20000 id=C2xC2xC2_c00209
[pilot] MEAS n=288 k=4 dx_ub=17 dz_ub=20 d_ub=17 steps=20000 id=C2xC2xC2_c00215
[saved] id=C2xC2xC2_c00215 -> results/c2xc2xc2_d16_20260121_011007/promising/C2xC2xC2_c00215 (reason: d>=sqrt(n))
[pilot] MEAS n=288 k=4 dx_ub=18 dz_ub=20 d_ub=18 steps=20000 id=C2xC2xC2_c00241
[saved] id=C2xC2xC2_c00241 -> results/c2xc2xc2_d16_20260121_011007/promising/C2xC2xC2_c00241 (reason: d>=sqrt(n))
[pilot] MEAS n=288 k=4 dx_ub=16 dz_ub=20 d_ub=16 steps=20000 id=C2xC2xC2_c00263
[pilot] TARGET_REJECT d_ub=12 target=16 id=C2xC2xC2_c00289
[pilot] MEAS n=288 k=4 dx_ub=20 dz_ub=17 d_ub=17 steps=20000 id=C2xC2xC2_c00312
[saved] id=C2xC2xC2_c00312 -> results/c2xc2xc2_d16_20260121_011007/promising/C2xC2xC2_c00312 (reason: d>=sqrt(n))
[pilot] MEAS n=288 k=4 dx_ub=20 dz_ub=20 d_ub=20 steps=20000 id=C2xC2xC2_c00339
[saved] id=C2xC2xC2_c00339 -> results/c2xc2xc2_d16_20260121_011007/promising/C2xC2xC2_c00339 (reason: d>=sqrt(n))
[pilot] MEAS n=288 k=4 dx_ub=19 dz_ub=20 d_ub=19 steps=20000 id=C2xC2xC2_c00342
[saved] id=C2xC2xC2_c00342 -> results/c2xc2xc2_d16_20260121_011007/promising/C2xC2xC2_c00342 (reason: d>=sqrt(n))
[pilot] MEAS n=288 k=4 dx_ub=20 dz_ub=20 d_ub=20 steps=20000 id=C2xC2xC2_c00353
[saved] id=C2xC2xC2_c00353 -> results/c2xc2xc2_d16_20260121_011007/promising/C2xC2xC2_c00353 (reason: d>=sqrt(n))
[pilot] TARGET_REJECT d_ub=14 target=16 id=C2xC2xC2_c00367
[pilot] MEAS n=288 k=4 dx_ub=17 dz_ub=17 d_ub=17 steps=20000 id=C2xC2xC2_c00393
[saved] id=C2xC2xC2_c00393 -> results/c2xc2xc2_d16_20260121_011007/promising/C2xC2xC2_c00393 (reason: d>=sqrt(n))
[pilot] MEAS n=288 k=4 dx_ub=16 dz_ub=16 d_ub=16 steps=20000 id=C2xC2xC2_c00414
[pilot] MEAS n=288 k=4 dx_ub=20 dz_ub=19 d_ub=19 steps=20000 id=C2xC2xC2_c00416
[saved] id=C2xC2xC2_c00416 -> results/c2xc2xc2_d16_20260121_011007/promising/C2xC2xC2_c00416 (reason: d>=sqrt(n))
[pilot] TARGET_REJECT d_ub=15 target=16 id=C2xC2xC2_c00419
[pilot] MEAS n=288 k=4 dx_ub=16 dz_ub=18 d_ub=16 steps=20000 id=C2xC2xC2_c00440
[pilot] MEAS n=288 k=4 dx_ub=20 dz_ub=17 d_ub=17 steps=20000 id=C2xC2xC2_c00444
[saved] id=C2xC2xC2_c00444 -> results/c2xc2xc2_d16_20260121_011007/promising/C2xC2xC2_c00444 (reason: d>=sqrt(n))
[pilot] MEAS n=288 k=4 dx_ub=16 dz_ub=16 d_ub=16 steps=20000 id=C2xC2xC2_c00460
[pilot] MEAS n=288 k=4 dx_ub=16 dz_ub=17 d_ub=16 steps=20000 id=C2xC2xC2_c00472
[best_by_k] group=C2xC2xC2 n=288
k  | d_ub | steps | dx_ub | dz_ub | id
 4 |   20 | 20000 |    20 |    20 | C2xC2xC2_c00339
 8 |   16 | 20000 |    16 |    18 | C2xC2xC2_c00123
[coverage] group=C2xC2xC2 A_sel=128 B_sel=128 Q_meas=29 ratio_ge_sqrt=0.001 ratio_sel=0.002
[coverage] run summary:
[coverage] group=C2xC2xC2 A_sel=128 B_sel=128 Q_meas=29 ratio_ge_sqrt=0.001 ratio_sel=0.002
[summary] best-by-k (measured; includes rejects):
  k=4 best_d_ub=20 count_measured=20 example_id=C2xC2xC2_c00339
  k=8 best_d_ub=16 count_measured=9 example_id=C2xC2xC2_c00123
[summary] best-by-k (survivors; target=16):
  k=4 best_d_ub=20 count_survivors=19 example_id=C2xC2xC2_c00339
  k=8 best_d_ub=16 count_survivors=2 example_id=C2xC2xC2_c00123
[pilot] top results:
  01 group=C2xC2xC2 n=288 k=4 d_ub=20 permA=27 permB=27 saved=True
  02 group=C2xC2xC2 n=288 k=4 d_ub=20 permA=27 permB=11 saved=True
  03 group=C2xC2xC2 n=288 k=4 d_ub=19 permA=20 permB=27 saved=True
  04 group=C2xC2xC2 n=288 k=4 d_ub=19 permA=27 permB=27 saved=True
  05 group=C2xC2xC2 n=288 k=4 d_ub=19 permA=7 permB=8 saved=True
  06 group=C2xC2xC2 n=288 k=4 d_ub=18 permA=12 permB=27 saved=True
  07 group=C2xC2xC2 n=288 k=4 d_ub=17 permA=11 permB=11 saved=True
  08 group=C2xC2xC2 n=288 k=4 d_ub=17 permA=20 permB=8 saved=True
  09 group=C2xC2xC2 n=288 k=4 d_ub=17 permA=27 permB=20 saved=True
  10 group=C2xC2xC2 n=288 k=4 d_ub=17 permA=11 permB=8 saved=True

