=== mar. 20 janv. 2026 15:29:22 CET steps=5000 batch=72 seed=1768922175 ===
[pilot] base k_table top pairs:
  k_base=18 permA=0 permB=0
  k_base=12 permA=29 permB=0
  k_base=12 permA=22 permB=0
  k_base=12 permA=13 permB=0
  k_base=12 permA=6 permB=0
[pilot] A multisets raw=792 (expected=792) enum_mode=multiset cayley_unique=26 perms=30 -> total scored = 780
[pilot] B multisets raw=792 (expected=792) enum_mode=multiset cayley_unique=26 perms=30 -> total scored = 780
[pilot] A frontier kept 128 candidates with points: (4,20), (0,49)
[pilot] B frontier kept 128 candidates with points: (4,20), (0,49)
[pilot] C2xC2xC2 n=288 d0=17 A_sets=26*30 -> keep 128; B_sets=26*30 -> keep 128
[pilot] MEAS n=288 k=4 dx_ub=20 dz_ub=20 d_ub=20 steps=5000 id=C2xC2xC2_c00000
[saved] id=C2xC2xC2_c00000 -> results/c2xc2xc2_d16_20260120_152922/promising/C2xC2xC2_c00000 (reason: d>=sqrt(n))
[pilot] TARGET_REJECT d_ub=12 target=16 id=C2xC2xC2_c00011
[pilot] MEAS n=288 k=4 dx_ub=16 dz_ub=16 d_ub=16 steps=5000 id=C2xC2xC2_c00018
[pilot] MEAS n=288 k=4 dx_ub=17 dz_ub=20 d_ub=17 steps=5000 id=C2xC2xC2_c00062
[saved] id=C2xC2xC2_c00062 -> results/c2xc2xc2_d16_20260120_152922/promising/C2xC2xC2_c00062 (reason: d>=sqrt(n))
[pilot] MEAS n=288 k=4 dx_ub=20 dz_ub=20 d_ub=20 steps=5000 id=C2xC2xC2_c00135
[saved] id=C2xC2xC2_c00135 -> results/c2xc2xc2_d16_20260120_152922/promising/C2xC2xC2_c00135 (reason: d>=sqrt(n))
[pilot] MEAS n=288 k=4 dx_ub=22 dz_ub=20 d_ub=20 steps=5000 id=C2xC2xC2_c00137
[saved] id=C2xC2xC2_c00137 -> results/c2xc2xc2_d16_20260120_152922/promising/C2xC2xC2_c00137 (reason: d>=sqrt(n))
[pilot] TARGET_REJECT d_ub=14 target=16 id=C2xC2xC2_c00146
[pilot] MEAS n=288 k=4 dx_ub=16 dz_ub=18 d_ub=16 steps=5000 id=C2xC2xC2_c00158
[pilot] MEAS n=288 k=4 dx_ub=16 dz_ub=20 d_ub=16 steps=5000 id=C2xC2xC2_c00189
[pilot] MEAS n=288 k=4 dx_ub=21 dz_ub=20 d_ub=20 steps=5000 id=C2xC2xC2_c00208
[saved] id=C2xC2xC2_c00208 -> results/c2xc2xc2_d16_20260120_152922/promising/C2xC2xC2_c00208 (reason: d>=sqrt(n))
[pilot] MEAS n=288 k=4 dx_ub=20 dz_ub=20 d_ub=20 steps=5000 id=C2xC2xC2_c00220
[saved] id=C2xC2xC2_c00220 -> results/c2xc2xc2_d16_20260120_152922/promising/C2xC2xC2_c00220 (reason: d>=sqrt(n))
[pilot] MEAS n=288 k=4 dx_ub=16 dz_ub=16 d_ub=16 steps=5000 id=C2xC2xC2_c00264
[pilot] MEAS n=288 k=4 dx_ub=20 dz_ub=17 d_ub=17 steps=5000 id=C2xC2xC2_c00275
[saved] id=C2xC2xC2_c00275 -> results/c2xc2xc2_d16_20260120_152922/promising/C2xC2xC2_c00275 (reason: d>=sqrt(n))
[pilot] MEAS n=288 k=4 dx_ub=20 dz_ub=20 d_ub=20 steps=5000 id=C2xC2xC2_c00283
[saved] id=C2xC2xC2_c00283 -> results/c2xc2xc2_d16_20260120_152922/promising/C2xC2xC2_c00283 (reason: d>=sqrt(n))
[pilot] MEAS n=288 k=4 dx_ub=19 dz_ub=17 d_ub=17 steps=5000 id=C2xC2xC2_c00302
[saved] id=C2xC2xC2_c00302 -> results/c2xc2xc2_d16_20260120_152922/promising/C2xC2xC2_c00302 (reason: d>=sqrt(n))
[pilot] MEAS n=288 k=8 dx_ub=16 dz_ub=17 d_ub=16 steps=5000 id=C2xC2xC2_c00305
[pilot] MEAS n=288 k=4 dx_ub=17 dz_ub=16 d_ub=16 steps=5000 id=C2xC2xC2_c00334
[pilot] TARGET_REJECT d_ub=13 target=16 id=C2xC2xC2_c00343
[pilot] MEAS n=288 k=4 dx_ub=18 dz_ub=20 d_ub=18 steps=5000 id=C2xC2xC2_c00368
[saved] id=C2xC2xC2_c00368 -> results/c2xc2xc2_d16_20260120_152922/promising/C2xC2xC2_c00368 (reason: d>=sqrt(n))
[pilot] MEAS n=288 k=4 dx_ub=16 dz_ub=16 d_ub=16 steps=5000 id=C2xC2xC2_c00383
[pilot] TARGET_REJECT d_ub=12 target=16 id=C2xC2xC2_c00436
[pilot] MEAS n=288 k=4 dx_ub=16 dz_ub=16 d_ub=16 steps=5000 id=C2xC2xC2_c00446
[pilot] TARGET_REJECT d_ub=15 target=16 id=C2xC2xC2_c00462
[pilot] MEAS n=288 k=4 dx_ub=16 dz_ub=18 d_ub=16 steps=5000 id=C2xC2xC2_c00472
[best_by_k] group=C2xC2xC2 n=288
k  | d_ub | steps | dx_ub | dz_ub | id
 4 |   20 |  5000 |    20 |    20 | C2xC2xC2_c00000
 8 |   16 |  5000 |    16 |    17 | C2xC2xC2_c00305
[coverage] group=C2xC2xC2 A_sel=128 B_sel=128 Q_meas=24 ratio_ge_sqrt=0.000 ratio_sel=0.001
[coverage] run summary:
[coverage] group=C2xC2xC2 A_sel=128 B_sel=128 Q_meas=24 ratio_ge_sqrt=0.000 ratio_sel=0.001
[summary] best-by-k (measured; includes rejects):
  k=4 best_d_ub=20 count_measured=19 example_id=C2xC2xC2_c00000
  k=8 best_d_ub=16 count_measured=5 example_id=C2xC2xC2_c00305
[summary] best-by-k (survivors; target=16):
  k=4 best_d_ub=20 count_survivors=18 example_id=C2xC2xC2_c00000
  k=8 best_d_ub=16 count_survivors=1 example_id=C2xC2xC2_c00305
[pilot] top results:
  01 group=C2xC2xC2 n=288 k=4 d_ub=20 permA=11 permB=20 saved=True
  02 group=C2xC2xC2 n=288 k=4 d_ub=20 permA=27 permB=8 saved=True
  03 group=C2xC2xC2 n=288 k=4 d_ub=20 permA=8 permB=27 saved=True
  04 group=C2xC2xC2 n=288 k=4 d_ub=20 permA=27 permB=8 saved=True
  05 group=C2xC2xC2 n=288 k=4 d_ub=20 permA=8 permB=11 saved=True
  06 group=C2xC2xC2 n=288 k=4 d_ub=20 permA=7 permB=27 saved=True
  07 group=C2xC2xC2 n=288 k=4 d_ub=18 permA=20 permB=8 saved=True
  08 group=C2xC2xC2 n=288 k=4 d_ub=17 permA=7 permB=7 saved=True
  09 group=C2xC2xC2 n=288 k=4 d_ub=17 permA=20 permB=20 saved=True
  10 group=C2xC2xC2 n=288 k=4 d_ub=17 permA=8 permB=27 saved=True

