=== mar. 20 janv. 2026 15:12:05 CET steps=5000 batch=39 seed=1768922142 ===
[pilot] base k_table top pairs:
  k_base=18 permA=0 permB=0
  k_base=12 permA=29 permB=0
  k_base=12 permA=22 permB=0
  k_base=12 permA=13 permB=0
  k_base=12 permA=6 permB=0
[pilot] A multisets raw=792 (expected=792) enum_mode=multiset cayley_unique=26 perms=30 -> total scored = 780
[pilot] B multisets raw=792 (expected=792) enum_mode=multiset cayley_unique=26 perms=30 -> total scored = 780
[pilot] A frontier kept 128 candidates with points: (4,20), (0,49)
[pilot] B frontier kept 128 candidates with points: (4,20), (0,49)
[pilot] C2xC2xC2 n=288 d0=17 A_sets=26*30 -> keep 128; B_sets=26*30 -> keep 128
[pilot] MEAS n=288 k=4 dx_ub=17 dz_ub=20 d_ub=17 steps=5000 id=C2xC2xC2_c00003
[saved] id=C2xC2xC2_c00003 -> results/c2xc2xc2_d16_20260120_151205/promising/C2xC2xC2_c00003 (reason: d>=sqrt(n))
[pilot] TARGET_REJECT d_ub=12 target=16 id=C2xC2xC2_c00012
[pilot] TARGET_REJECT d_ub=14 target=16 id=C2xC2xC2_c00035
[pilot] MEAS n=288 k=4 dx_ub=16 dz_ub=20 d_ub=16 steps=5000 id=C2xC2xC2_c00040
[pilot] MEAS n=288 k=4 dx_ub=19 dz_ub=20 d_ub=19 steps=5000 id=C2xC2xC2_c00044
[saved] id=C2xC2xC2_c00044 -> results/c2xc2xc2_d16_20260120_151205/promising/C2xC2xC2_c00044 (reason: d>=sqrt(n))
[pilot] TARGET_REJECT d_ub=12 target=16 id=C2xC2xC2_c00048
[pilot] MEAS n=288 k=4 dx_ub=16 dz_ub=17 d_ub=16 steps=5000 id=C2xC2xC2_c00077
[pilot] TARGET_REJECT d_ub=12 target=16 id=C2xC2xC2_c00145
[pilot] MEAS n=288 k=4 dx_ub=16 dz_ub=18 d_ub=16 steps=5000 id=C2xC2xC2_c00151
[pilot] MEAS n=288 k=4 dx_ub=20 dz_ub=20 d_ub=20 steps=5000 id=C2xC2xC2_c00159
[saved] id=C2xC2xC2_c00159 -> results/c2xc2xc2_d16_20260120_151205/promising/C2xC2xC2_c00159 (reason: d>=sqrt(n))
[pilot] TARGET_REJECT d_ub=15 target=16 id=C2xC2xC2_c00172
[pilot] MEAS n=288 k=8 dx_ub=16 dz_ub=18 d_ub=16 steps=5000 id=C2xC2xC2_c00219
[pilot] MEAS n=288 k=4 dx_ub=19 dz_ub=20 d_ub=19 steps=5000 id=C2xC2xC2_c00228
[saved] id=C2xC2xC2_c00228 -> results/c2xc2xc2_d16_20260120_151205/promising/C2xC2xC2_c00228 (reason: d>=sqrt(n))
[pilot] MEAS n=288 k=4 dx_ub=17 dz_ub=20 d_ub=17 steps=5000 id=C2xC2xC2_c00239
[saved] id=C2xC2xC2_c00239 -> results/c2xc2xc2_d16_20260120_151205/promising/C2xC2xC2_c00239 (reason: d>=sqrt(n))
[pilot] MEAS n=288 k=4 dx_ub=16 dz_ub=17 d_ub=16 steps=5000 id=C2xC2xC2_c00254
[pilot] MEAS n=288 k=4 dx_ub=19 dz_ub=20 d_ub=19 steps=5000 id=C2xC2xC2_c00264
[saved] id=C2xC2xC2_c00264 -> results/c2xc2xc2_d16_20260120_151205/promising/C2xC2xC2_c00264 (reason: d>=sqrt(n))
[pilot] MEAS n=288 k=4 dx_ub=20 dz_ub=20 d_ub=20 steps=5000 id=C2xC2xC2_c00273
[saved] id=C2xC2xC2_c00273 -> results/c2xc2xc2_d16_20260120_151205/promising/C2xC2xC2_c00273 (reason: d>=sqrt(n))
[pilot] MEAS n=288 k=4 dx_ub=17 dz_ub=19 d_ub=17 steps=5000 id=C2xC2xC2_c00292
[saved] id=C2xC2xC2_c00292 -> results/c2xc2xc2_d16_20260120_151205/promising/C2xC2xC2_c00292 (reason: d>=sqrt(n))
[pilot] TARGET_REJECT d_ub=12 target=16 id=C2xC2xC2_c00324
[pilot] MEAS n=288 k=4 dx_ub=19 dz_ub=20 d_ub=19 steps=5000 id=C2xC2xC2_c00329
[saved] id=C2xC2xC2_c00329 -> results/c2xc2xc2_d16_20260120_151205/promising/C2xC2xC2_c00329 (reason: d>=sqrt(n))
[pilot] MEAS n=288 k=4 dx_ub=17 dz_ub=20 d_ub=17 steps=5000 id=C2xC2xC2_c00339
[saved] id=C2xC2xC2_c00339 -> results/c2xc2xc2_d16_20260120_151205/promising/C2xC2xC2_c00339 (reason: d>=sqrt(n))
[pilot] MEAS n=288 k=4 dx_ub=20 dz_ub=23 d_ub=20 steps=5000 id=C2xC2xC2_c00366
[saved] id=C2xC2xC2_c00366 -> results/c2xc2xc2_d16_20260120_151205/promising/C2xC2xC2_c00366 (reason: d>=sqrt(n))
[pilot] TARGET_REJECT d_ub=12 target=16 id=C2xC2xC2_c00378
[pilot] TARGET_REJECT d_ub=15 target=16 id=C2xC2xC2_c00385
[pilot] MEAS n=288 k=8 dx_ub=16 dz_ub=17 d_ub=16 steps=5000 id=C2xC2xC2_c00396
[pilot] MEAS n=288 k=4 dx_ub=16 dz_ub=20 d_ub=16 steps=5000 id=C2xC2xC2_c00457
[pilot] TARGET_REJECT d_ub=12 target=16 id=C2xC2xC2_c00475
[pilot] TARGET_REJECT d_ub=12 target=16 id=C2xC2xC2_c00498
[best_by_k] group=C2xC2xC2 n=288
k  | d_ub | steps | dx_ub | dz_ub | id
 4 |   20 |  5000 |    20 |    20 | C2xC2xC2_c00159
 8 |   16 |  5000 |    16 |    18 | C2xC2xC2_c00219
[coverage] group=C2xC2xC2 A_sel=128 B_sel=128 Q_meas=28 ratio_ge_sqrt=0.001 ratio_sel=0.002
[coverage] run summary:
[coverage] group=C2xC2xC2 A_sel=128 B_sel=128 Q_meas=28 ratio_ge_sqrt=0.001 ratio_sel=0.002
[summary] best-by-k (measured; includes rejects):
  k=4 best_d_ub=20 count_measured=20 example_id=C2xC2xC2_c00159
  k=8 best_d_ub=16 count_measured=8 example_id=C2xC2xC2_c00219
[summary] best-by-k (survivors; target=16):
  k=4 best_d_ub=20 count_survivors=16 example_id=C2xC2xC2_c00159
  k=8 best_d_ub=16 count_survivors=2 example_id=C2xC2xC2_c00219
[pilot] top results:
  01 group=C2xC2xC2 n=288 k=4 d_ub=20 permA=11 permB=8 saved=True
  02 group=C2xC2xC2 n=288 k=4 d_ub=20 permA=12 permB=20 saved=True
  03 group=C2xC2xC2 n=288 k=4 d_ub=20 permA=8 permB=11 saved=True
  04 group=C2xC2xC2 n=288 k=4 d_ub=19 permA=27 permB=11 saved=True
  05 group=C2xC2xC2 n=288 k=4 d_ub=19 permA=11 permB=11 saved=True
  06 group=C2xC2xC2 n=288 k=4 d_ub=19 permA=8 permB=12 saved=True
  07 group=C2xC2xC2 n=288 k=4 d_ub=19 permA=8 permB=27 saved=True
  08 group=C2xC2xC2 n=288 k=4 d_ub=17 permA=8 permB=11 saved=True
  09 group=C2xC2xC2 n=288 k=4 d_ub=17 permA=12 permB=8 saved=True
  10 group=C2xC2xC2 n=288 k=4 d_ub=17 permA=27 permB=8 saved=True

