=== mar. 20 janv. 2026 15:39:01 CET steps=5000 batch=82 seed=1768922185 ===
[pilot] base k_table top pairs:
  k_base=18 permA=0 permB=0
  k_base=12 permA=29 permB=0
  k_base=12 permA=22 permB=0
  k_base=12 permA=13 permB=0
  k_base=12 permA=6 permB=0
[pilot] A multisets raw=792 (expected=792) enum_mode=multiset cayley_unique=26 perms=30 -> total scored = 780
[pilot] B multisets raw=792 (expected=792) enum_mode=multiset cayley_unique=26 perms=30 -> total scored = 780
[pilot] A frontier kept 128 candidates with points: (4,20), (0,49)
[pilot] B frontier kept 128 candidates with points: (4,20), (0,49)
[pilot] C2xC2xC2 n=288 d0=17 A_sets=26*30 -> keep 128; B_sets=26*30 -> keep 128
[pilot] MEAS n=288 k=4 dx_ub=16 dz_ub=19 d_ub=16 steps=5000 id=C2xC2xC2_c00001
[pilot] MEAS n=288 k=4 dx_ub=20 dz_ub=16 d_ub=16 steps=5000 id=C2xC2xC2_c00055
[pilot] MEAS n=288 k=4 dx_ub=16 dz_ub=16 d_ub=16 steps=5000 id=C2xC2xC2_c00067
[pilot] MEAS n=288 k=8 dx_ub=16 dz_ub=18 d_ub=16 steps=5000 id=C2xC2xC2_c00073
[pilot] MEAS n=288 k=4 dx_ub=17 dz_ub=16 d_ub=16 steps=5000 id=C2xC2xC2_c00080
[pilot] MEAS n=288 k=4 dx_ub=20 dz_ub=20 d_ub=20 steps=5000 id=C2xC2xC2_c00107
[saved] id=C2xC2xC2_c00107 -> results/c2xc2xc2_d16_20260120_153902/promising/C2xC2xC2_c00107 (reason: d>=sqrt(n))
[pilot] MEAS n=288 k=4 dx_ub=17 dz_ub=20 d_ub=17 steps=5000 id=C2xC2xC2_c00108
[saved] id=C2xC2xC2_c00108 -> results/c2xc2xc2_d16_20260120_153902/promising/C2xC2xC2_c00108 (reason: d>=sqrt(n))
[pilot] MEAS n=288 k=4 dx_ub=20 dz_ub=19 d_ub=19 steps=5000 id=C2xC2xC2_c00145
[saved] id=C2xC2xC2_c00145 -> results/c2xc2xc2_d16_20260120_153902/promising/C2xC2xC2_c00145 (reason: d>=sqrt(n))
[pilot] MEAS n=288 k=4 dx_ub=20 dz_ub=17 d_ub=17 steps=5000 id=C2xC2xC2_c00149
[saved] id=C2xC2xC2_c00149 -> results/c2xc2xc2_d16_20260120_153902/promising/C2xC2xC2_c00149 (reason: d>=sqrt(n))
[pilot] MEAS n=288 k=4 dx_ub=20 dz_ub=16 d_ub=16 steps=5000 id=C2xC2xC2_c00152
[pilot] MEAS n=288 k=8 dx_ub=16 dz_ub=17 d_ub=16 steps=5000 id=C2xC2xC2_c00166
[pilot] TARGET_REJECT d_ub=12 target=16 id=C2xC2xC2_c00167
[pilot] MEAS n=288 k=4 dx_ub=21 dz_ub=21 d_ub=21 steps=5000 id=C2xC2xC2_c00187
[saved] id=C2xC2xC2_c00187 -> results/c2xc2xc2_d16_20260120_153902/promising/C2xC2xC2_c00187 (reason: d>=sqrt(n))
[pilot] MEAS n=288 k=8 dx_ub=16 dz_ub=17 d_ub=16 steps=5000 id=C2xC2xC2_c00202
[pilot] MEAS n=288 k=4 dx_ub=16 dz_ub=17 d_ub=16 steps=5000 id=C2xC2xC2_c00219
[pilot] MEAS n=288 k=8 dx_ub=16 dz_ub=16 d_ub=16 steps=5000 id=C2xC2xC2_c00227
[pilot] TARGET_REJECT d_ub=12 target=16 id=C2xC2xC2_c00230
[pilot] MEAS n=288 k=8 dx_ub=18 dz_ub=16 d_ub=16 steps=5000 id=C2xC2xC2_c00272
[pilot] TARGET_REJECT d_ub=6 target=16 id=C2xC2xC2_c00276
[pilot] MEAS n=288 k=4 dx_ub=20 dz_ub=16 d_ub=16 steps=5000 id=C2xC2xC2_c00279
[pilot] TARGET_REJECT d_ub=12 target=16 id=C2xC2xC2_c00320
[pilot] TARGET_REJECT d_ub=12 target=16 id=C2xC2xC2_c00322
[pilot] MEAS n=288 k=4 dx_ub=20 dz_ub=22 d_ub=20 steps=5000 id=C2xC2xC2_c00338
[saved] id=C2xC2xC2_c00338 -> results/c2xc2xc2_d16_20260120_153902/promising/C2xC2xC2_c00338 (reason: d>=sqrt(n))
[pilot] MEAS n=288 k=4 dx_ub=19 dz_ub=20 d_ub=19 steps=5000 id=C2xC2xC2_c00355
[saved] id=C2xC2xC2_c00355 -> results/c2xc2xc2_d16_20260120_153902/promising/C2xC2xC2_c00355 (reason: d>=sqrt(n))
[pilot] MEAS n=288 k=4 dx_ub=17 dz_ub=20 d_ub=17 steps=5000 id=C2xC2xC2_c00414
[saved] id=C2xC2xC2_c00414 -> results/c2xc2xc2_d16_20260120_153902/promising/C2xC2xC2_c00414 (reason: d>=sqrt(n))
[pilot] MEAS n=288 k=4 dx_ub=20 dz_ub=17 d_ub=17 steps=5000 id=C2xC2xC2_c00436
[saved] id=C2xC2xC2_c00436 -> results/c2xc2xc2_d16_20260120_153902/promising/C2xC2xC2_c00436 (reason: d>=sqrt(n))
[pilot] MEAS n=288 k=4 dx_ub=20 dz_ub=20 d_ub=20 steps=5000 id=C2xC2xC2_c00447
[saved] id=C2xC2xC2_c00447 -> results/c2xc2xc2_d16_20260120_153902/promising/C2xC2xC2_c00447 (reason: d>=sqrt(n))
[pilot] TARGET_REJECT d_ub=12 target=16 id=C2xC2xC2_c00461
[pilot] MEAS n=288 k=4 dx_ub=17 dz_ub=20 d_ub=17 steps=5000 id=C2xC2xC2_c00483
[saved] id=C2xC2xC2_c00483 -> results/c2xc2xc2_d16_20260120_153902/promising/C2xC2xC2_c00483 (reason: d>=sqrt(n))
[pilot] TARGET_REJECT d_ub=12 target=16 id=C2xC2xC2_c00485
[best_by_k] group=C2xC2xC2 n=288
k  | d_ub | steps | dx_ub | dz_ub | id
 4 |   21 |  5000 |    21 |    21 | C2xC2xC2_c00187
 8 |   16 |  5000 |    16 |    18 | C2xC2xC2_c00073
[coverage] group=C2xC2xC2 A_sel=128 B_sel=128 Q_meas=30 ratio_ge_sqrt=0.001 ratio_sel=0.002
[coverage] run summary:
[coverage] group=C2xC2xC2 A_sel=128 B_sel=128 Q_meas=30 ratio_ge_sqrt=0.001 ratio_sel=0.002
[summary] best-by-k (measured; includes rejects):
  k=4 best_d_ub=21 count_measured=21 example_id=C2xC2xC2_c00187
  k=8 best_d_ub=16 count_measured=9 example_id=C2xC2xC2_c00073
[summary] best-by-k (survivors; target=16):
  k=4 best_d_ub=21 count_survivors=18 example_id=C2xC2xC2_c00187
  k=8 best_d_ub=16 count_survivors=5 example_id=C2xC2xC2_c00073
[pilot] top results:
  01 group=C2xC2xC2 n=288 k=4 d_ub=21 permA=27 permB=11 saved=True
  02 group=C2xC2xC2 n=288 k=4 d_ub=20 permA=20 permB=8 saved=True
  03 group=C2xC2xC2 n=288 k=4 d_ub=20 permA=8 permB=11 saved=True
  04 group=C2xC2xC2 n=288 k=4 d_ub=20 permA=12 permB=8 saved=True
  05 group=C2xC2xC2 n=288 k=4 d_ub=19 permA=11 permB=8 saved=True
  06 group=C2xC2xC2 n=288 k=4 d_ub=19 permA=20 permB=11 saved=True
  07 group=C2xC2xC2 n=288 k=4 d_ub=17 permA=20 permB=8 saved=True
  08 group=C2xC2xC2 n=288 k=4 d_ub=17 permA=11 permB=8 saved=True
  09 group=C2xC2xC2 n=288 k=4 d_ub=17 permA=27 permB=20 saved=True
  10 group=C2xC2xC2 n=288 k=4 d_ub=17 permA=11 permB=27 saved=True

