=== mar. 20 janv. 2026 15:25:32 CET steps=5000 batch=64 seed=1768922167 ===
[pilot] base k_table top pairs:
  k_base=18 permA=0 permB=0
  k_base=12 permA=29 permB=0
  k_base=12 permA=22 permB=0
  k_base=12 permA=13 permB=0
  k_base=12 permA=6 permB=0
[pilot] A multisets raw=792 (expected=792) enum_mode=multiset cayley_unique=26 perms=30 -> total scored = 780
[pilot] B multisets raw=792 (expected=792) enum_mode=multiset cayley_unique=26 perms=30 -> total scored = 780
[pilot] A frontier kept 128 candidates with points: (4,20), (0,49)
[pilot] B frontier kept 128 candidates with points: (4,20), (0,49)
[pilot] C2xC2xC2 n=288 d0=17 A_sets=26*30 -> keep 128; B_sets=26*30 -> keep 128
[pilot] TARGET_REJECT d_ub=12 target=16 id=C2xC2xC2_c00005
[pilot] MEAS n=288 k=4 dx_ub=20 dz_ub=16 d_ub=16 steps=5000 id=C2xC2xC2_c00006
[pilot] TARGET_REJECT d_ub=12 target=16 id=C2xC2xC2_c00044
[pilot] MEAS n=288 k=4 dx_ub=20 dz_ub=20 d_ub=20 steps=5000 id=C2xC2xC2_c00070
[saved] id=C2xC2xC2_c00070 -> results/c2xc2xc2_d16_20260120_152532/promising/C2xC2xC2_c00070 (reason: d>=sqrt(n))
[pilot] TARGET_REJECT d_ub=15 target=16 id=C2xC2xC2_c00074
[pilot] MEAS n=288 k=4 dx_ub=17 dz_ub=16 d_ub=16 steps=5000 id=C2xC2xC2_c00082
[pilot] MEAS n=288 k=4 dx_ub=19 dz_ub=20 d_ub=19 steps=5000 id=C2xC2xC2_c00107
[saved] id=C2xC2xC2_c00107 -> results/c2xc2xc2_d16_20260120_152532/promising/C2xC2xC2_c00107 (reason: d>=sqrt(n))
[pilot] MEAS n=288 k=4 dx_ub=20 dz_ub=20 d_ub=20 steps=5000 id=C2xC2xC2_c00131
[saved] id=C2xC2xC2_c00131 -> results/c2xc2xc2_d16_20260120_152532/promising/C2xC2xC2_c00131 (reason: d>=sqrt(n))
[pilot] TARGET_REJECT d_ub=12 target=16 id=C2xC2xC2_c00133
[pilot] MEAS n=288 k=4 dx_ub=20 dz_ub=20 d_ub=20 steps=5000 id=C2xC2xC2_c00191
[saved] id=C2xC2xC2_c00191 -> results/c2xc2xc2_d16_20260120_152532/promising/C2xC2xC2_c00191 (reason: d>=sqrt(n))
[pilot] MEAS n=288 k=8 dx_ub=16 dz_ub=18 d_ub=16 steps=5000 id=C2xC2xC2_c00195
[pilot] TARGET_REJECT d_ub=12 target=16 id=C2xC2xC2_c00199
[pilot] MEAS n=288 k=4 dx_ub=20 dz_ub=20 d_ub=20 steps=5000 id=C2xC2xC2_c00230
[saved] id=C2xC2xC2_c00230 -> results/c2xc2xc2_d16_20260120_152532/promising/C2xC2xC2_c00230 (reason: d>=sqrt(n))
[pilot] MEAS n=288 k=4 dx_ub=20 dz_ub=20 d_ub=20 steps=5000 id=C2xC2xC2_c00236
[saved] id=C2xC2xC2_c00236 -> results/c2xc2xc2_d16_20260120_152532/promising/C2xC2xC2_c00236 (reason: d>=sqrt(n))
[pilot] MEAS n=288 k=4 dx_ub=16 dz_ub=20 d_ub=16 steps=5000 id=C2xC2xC2_c00282
[pilot] TARGET_REJECT d_ub=14 target=16 id=C2xC2xC2_c00288
[pilot] MEAS n=288 k=4 dx_ub=20 dz_ub=19 d_ub=19 steps=5000 id=C2xC2xC2_c00301
[saved] id=C2xC2xC2_c00301 -> results/c2xc2xc2_d16_20260120_152532/promising/C2xC2xC2_c00301 (reason: d>=sqrt(n))
[pilot] TARGET_REJECT d_ub=14 target=16 id=C2xC2xC2_c00304
[pilot] TARGET_REJECT d_ub=12 target=16 id=C2xC2xC2_c00307
[pilot] MEAS n=288 k=8 dx_ub=17 dz_ub=16 d_ub=16 steps=5000 id=C2xC2xC2_c00311
[pilot] TARGET_REJECT d_ub=14 target=16 id=C2xC2xC2_c00317
[pilot] MEAS n=288 k=4 dx_ub=20 dz_ub=20 d_ub=20 steps=5000 id=C2xC2xC2_c00325
[saved] id=C2xC2xC2_c00325 -> results/c2xc2xc2_d16_20260120_152532/promising/C2xC2xC2_c00325 (reason: d>=sqrt(n))
[pilot] TARGET_REJECT d_ub=12 target=16 id=C2xC2xC2_c00327
[pilot] TARGET_REJECT d_ub=12 target=16 id=C2xC2xC2_c00351
[pilot] TARGET_REJECT d_ub=14 target=16 id=C2xC2xC2_c00370
[pilot] MEAS n=288 k=4 dx_ub=21 dz_ub=17 d_ub=17 steps=5000 id=C2xC2xC2_c00371
[saved] id=C2xC2xC2_c00371 -> results/c2xc2xc2_d16_20260120_152532/promising/C2xC2xC2_c00371 (reason: d>=sqrt(n))
[pilot] TARGET_REJECT d_ub=15 target=16 id=C2xC2xC2_c00448
[pilot] MEAS n=288 k=4 dx_ub=20 dz_ub=20 d_ub=20 steps=5000 id=C2xC2xC2_c00450
[saved] id=C2xC2xC2_c00450 -> results/c2xc2xc2_d16_20260120_152532/promising/C2xC2xC2_c00450 (reason: d>=sqrt(n))
[best_by_k] group=C2xC2xC2 n=288
k  | d_ub | steps | dx_ub | dz_ub | id
 4 |   20 |  5000 |    20 |    20 | C2xC2xC2_c00070
 8 |   16 |  5000 |    16 |    18 | C2xC2xC2_c00195
[coverage] group=C2xC2xC2 A_sel=128 B_sel=128 Q_meas=28 ratio_ge_sqrt=0.001 ratio_sel=0.002
[coverage] run summary:
[coverage] group=C2xC2xC2 A_sel=128 B_sel=128 Q_meas=28 ratio_ge_sqrt=0.001 ratio_sel=0.002
[summary] best-by-k (measured; includes rejects):
  k=4 best_d_ub=20 count_measured=18 example_id=C2xC2xC2_c00070
  k=8 best_d_ub=16 count_measured=10 example_id=C2xC2xC2_c00195
[summary] best-by-k (survivors; target=16):
  k=4 best_d_ub=20 count_survivors=13 example_id=C2xC2xC2_c00070
  k=8 best_d_ub=16 count_survivors=2 example_id=C2xC2xC2_c00195
[pilot] top results:
  01 group=C2xC2xC2 n=288 k=4 d_ub=20 permA=27 permB=11 saved=True
  02 group=C2xC2xC2 n=288 k=4 d_ub=20 permA=11 permB=8 saved=True
  03 group=C2xC2xC2 n=288 k=4 d_ub=20 permA=11 permB=27 saved=True
  04 group=C2xC2xC2 n=288 k=4 d_ub=20 permA=12 permB=27 saved=True
  05 group=C2xC2xC2 n=288 k=4 d_ub=20 permA=11 permB=11 saved=True
  06 group=C2xC2xC2 n=288 k=4 d_ub=20 permA=12 permB=12 saved=True
  07 group=C2xC2xC2 n=288 k=4 d_ub=20 permA=12 permB=12 saved=True
  08 group=C2xC2xC2 n=288 k=4 d_ub=19 permA=27 permB=11 saved=True
  09 group=C2xC2xC2 n=288 k=4 d_ub=19 permA=8 permB=8 saved=True
  10 group=C2xC2xC2 n=288 k=4 d_ub=17 permA=11 permB=8 saved=True

