=== mar. 20 janv. 2026 15:33:04 CET steps=5000 batch=74 seed=1768922177 ===
[pilot] base k_table top pairs:
  k_base=18 permA=0 permB=0
  k_base=12 permA=29 permB=0
  k_base=12 permA=22 permB=0
  k_base=12 permA=13 permB=0
  k_base=12 permA=6 permB=0
[pilot] A multisets raw=792 (expected=792) enum_mode=multiset cayley_unique=26 perms=30 -> total scored = 780
[pilot] B multisets raw=792 (expected=792) enum_mode=multiset cayley_unique=26 perms=30 -> total scored = 780
[pilot] A frontier kept 128 candidates with points: (4,20), (0,49)
[pilot] B frontier kept 128 candidates with points: (4,20), (0,49)
[pilot] C2xC2xC2 n=288 d0=17 A_sets=26*30 -> keep 128; B_sets=26*30 -> keep 128
[pilot] MEAS n=288 k=4 dx_ub=17 dz_ub=20 d_ub=17 steps=5000 id=C2xC2xC2_c00049
[saved] id=C2xC2xC2_c00049 -> results/c2xc2xc2_d16_20260120_153304/promising/C2xC2xC2_c00049 (reason: d>=sqrt(n))
[pilot] MEAS n=288 k=4 dx_ub=20 dz_ub=20 d_ub=20 steps=5000 id=C2xC2xC2_c00077
[saved] id=C2xC2xC2_c00077 -> results/c2xc2xc2_d16_20260120_153304/promising/C2xC2xC2_c00077 (reason: d>=sqrt(n))
[pilot] MEAS n=288 k=4 dx_ub=20 dz_ub=16 d_ub=16 steps=5000 id=C2xC2xC2_c00078
[pilot] MEAS n=288 k=8 dx_ub=16 dz_ub=17 d_ub=16 steps=5000 id=C2xC2xC2_c00123
[pilot] TARGET_REJECT d_ub=12 target=16 id=C2xC2xC2_c00127
[pilot] TARGET_REJECT d_ub=12 target=16 id=C2xC2xC2_c00130
[pilot] MEAS n=288 k=4 dx_ub=20 dz_ub=20 d_ub=20 steps=5000 id=C2xC2xC2_c00134
[saved] id=C2xC2xC2_c00134 -> results/c2xc2xc2_d16_20260120_153304/promising/C2xC2xC2_c00134 (reason: d>=sqrt(n))
[pilot] MEAS n=288 k=4 dx_ub=21 dz_ub=20 d_ub=20 steps=5000 id=C2xC2xC2_c00176
[saved] id=C2xC2xC2_c00176 -> results/c2xc2xc2_d16_20260120_153304/promising/C2xC2xC2_c00176 (reason: d>=sqrt(n))
[pilot] MEAS n=288 k=4 dx_ub=16 dz_ub=16 d_ub=16 steps=5000 id=C2xC2xC2_c00203
[pilot] MEAS n=288 k=4 dx_ub=16 dz_ub=21 d_ub=16 steps=5000 id=C2xC2xC2_c00235
[pilot] MEAS n=288 k=4 dx_ub=18 dz_ub=16 d_ub=16 steps=5000 id=C2xC2xC2_c00241
[pilot] TARGET_REJECT d_ub=12 target=16 id=C2xC2xC2_c00242
[pilot] MEAS n=288 k=8 dx_ub=17 dz_ub=16 d_ub=16 steps=5000 id=C2xC2xC2_c00254
[pilot] TARGET_REJECT d_ub=15 target=16 id=C2xC2xC2_c00260
[pilot] MEAS n=288 k=4 dx_ub=20 dz_ub=20 d_ub=20 steps=5000 id=C2xC2xC2_c00279
[saved] id=C2xC2xC2_c00279 -> results/c2xc2xc2_d16_20260120_153304/promising/C2xC2xC2_c00279 (reason: d>=sqrt(n))
[pilot] TARGET_REJECT d_ub=15 target=16 id=C2xC2xC2_c00291
[pilot] MEAS n=288 k=4 dx_ub=20 dz_ub=20 d_ub=20 steps=5000 id=C2xC2xC2_c00303
[saved] id=C2xC2xC2_c00303 -> results/c2xc2xc2_d16_20260120_153304/promising/C2xC2xC2_c00303 (reason: d>=sqrt(n))
[pilot] MEAS n=288 k=4 dx_ub=20 dz_ub=20 d_ub=20 steps=5000 id=C2xC2xC2_c00348
[saved] id=C2xC2xC2_c00348 -> results/c2xc2xc2_d16_20260120_153304/promising/C2xC2xC2_c00348 (reason: d>=sqrt(n))
[pilot] MEAS n=288 k=4 dx_ub=19 dz_ub=16 d_ub=16 steps=5000 id=C2xC2xC2_c00349
[pilot] MEAS n=288 k=4 dx_ub=21 dz_ub=20 d_ub=20 steps=5000 id=C2xC2xC2_c00363
[saved] id=C2xC2xC2_c00363 -> results/c2xc2xc2_d16_20260120_153304/promising/C2xC2xC2_c00363 (reason: d>=sqrt(n))
[pilot] MEAS n=288 k=4 dx_ub=20 dz_ub=20 d_ub=20 steps=5000 id=C2xC2xC2_c00367
[saved] id=C2xC2xC2_c00367 -> results/c2xc2xc2_d16_20260120_153304/promising/C2xC2xC2_c00367 (reason: d>=sqrt(n))
[pilot] MEAS n=288 k=4 dx_ub=20 dz_ub=20 d_ub=20 steps=5000 id=C2xC2xC2_c00374
[saved] id=C2xC2xC2_c00374 -> results/c2xc2xc2_d16_20260120_153304/promising/C2xC2xC2_c00374 (reason: d>=sqrt(n))
[pilot] TARGET_REJECT d_ub=12 target=16 id=C2xC2xC2_c00379
[pilot] MEAS n=288 k=4 dx_ub=16 dz_ub=20 d_ub=16 steps=5000 id=C2xC2xC2_c00384
[pilot] TARGET_REJECT d_ub=14 target=16 id=C2xC2xC2_c00451
[pilot] MEAS n=288 k=4 dx_ub=16 dz_ub=20 d_ub=16 steps=5000 id=C2xC2xC2_c00457
[pilot] MEAS n=288 k=4 dx_ub=19 dz_ub=20 d_ub=19 steps=5000 id=C2xC2xC2_c00462
[saved] id=C2xC2xC2_c00462 -> results/c2xc2xc2_d16_20260120_153304/promising/C2xC2xC2_c00462 (reason: d>=sqrt(n))
[pilot] TARGET_REJECT d_ub=12 target=16 id=C2xC2xC2_c00463
[pilot] MEAS n=288 k=4 dx_ub=19 dz_ub=20 d_ub=19 steps=5000 id=C2xC2xC2_c00486
[saved] id=C2xC2xC2_c00486 -> results/c2xc2xc2_d16_20260120_153304/promising/C2xC2xC2_c00486 (reason: d>=sqrt(n))
[best_by_k] group=C2xC2xC2 n=288
k  | d_ub | steps | dx_ub | dz_ub | id
 4 |   20 |  5000 |    20 |    20 | C2xC2xC2_c00077
 8 |   16 |  5000 |    16 |    17 | C2xC2xC2_c00123
[coverage] group=C2xC2xC2 A_sel=128 B_sel=128 Q_meas=29 ratio_ge_sqrt=0.001 ratio_sel=0.002
[coverage] run summary:
[coverage] group=C2xC2xC2 A_sel=128 B_sel=128 Q_meas=29 ratio_ge_sqrt=0.001 ratio_sel=0.002
[summary] best-by-k (measured; includes rejects):
  k=4 best_d_ub=20 count_measured=23 example_id=C2xC2xC2_c00077
  k=8 best_d_ub=16 count_measured=6 example_id=C2xC2xC2_c00123
[summary] best-by-k (survivors; target=16):
  k=4 best_d_ub=20 count_survivors=19 example_id=C2xC2xC2_c00077
  k=8 best_d_ub=16 count_survivors=2 example_id=C2xC2xC2_c00123
[pilot] top results:
  01 group=C2xC2xC2 n=288 k=4 d_ub=20 permA=20 permB=27 saved=True
  02 group=C2xC2xC2 n=288 k=4 d_ub=20 permA=27 permB=8 saved=True
  03 group=C2xC2xC2 n=288 k=4 d_ub=20 permA=8 permB=11 saved=True
  04 group=C2xC2xC2 n=288 k=4 d_ub=20 permA=7 permB=12 saved=True
  05 group=C2xC2xC2 n=288 k=4 d_ub=20 permA=12 permB=27 saved=True
  06 group=C2xC2xC2 n=288 k=4 d_ub=20 permA=27 permB=8 saved=True
  07 group=C2xC2xC2 n=288 k=4 d_ub=20 permA=11 permB=27 saved=True
  08 group=C2xC2xC2 n=288 k=4 d_ub=20 permA=8 permB=11 saved=True
  09 group=C2xC2xC2 n=288 k=4 d_ub=20 permA=7 permB=20 saved=True
  10 group=C2xC2xC2 n=288 k=4 d_ub=19 permA=12 permB=27 saved=True

