=== mer. 21 janv. 2026 00:25:18 CET steps=20000 batch=16 seed=1768937119 ===
[pilot] base k_table top pairs:
  k_base=18 permA=0 permB=0
  k_base=12 permA=29 permB=0
  k_base=12 permA=22 permB=0
  k_base=12 permA=13 permB=0
  k_base=12 permA=6 permB=0
[pilot] A multisets raw=792 (expected=792) enum_mode=multiset cayley_unique=26 perms=30 -> total scored = 780
[pilot] B multisets raw=792 (expected=792) enum_mode=multiset cayley_unique=26 perms=30 -> total scored = 780
[pilot] A frontier kept 128 candidates with points: (4,20), (0,49)
[pilot] B frontier kept 128 candidates with points: (4,20), (0,49)
[pilot] C2xC2xC2 n=288 d0=17 A_sets=26*30 -> keep 128; B_sets=26*30 -> keep 128
[pilot] MEAS n=288 k=4 dx_ub=17 dz_ub=20 d_ub=17 steps=20000 id=C2xC2xC2_c00019
[saved] id=C2xC2xC2_c00019 -> results/c2xc2xc2_d16_20260121_002518/promising/C2xC2xC2_c00019 (reason: d>=sqrt(n))
[pilot] MEAS n=288 k=4 dx_ub=19 dz_ub=20 d_ub=19 steps=20000 id=C2xC2xC2_c00054
[saved] id=C2xC2xC2_c00054 -> results/c2xc2xc2_d16_20260121_002518/promising/C2xC2xC2_c00054 (reason: d>=sqrt(n))
[pilot] TARGET_REJECT d_ub=12 target=16 id=C2xC2xC2_c00068
[pilot] MEAS n=288 k=4 dx_ub=16 dz_ub=16 d_ub=16 steps=20000 id=C2xC2xC2_c00119
[pilot] TARGET_REJECT d_ub=12 target=16 id=C2xC2xC2_c00141
[pilot] MEAS n=288 k=8 dx_ub=17 dz_ub=16 d_ub=16 steps=20000 id=C2xC2xC2_c00161
[pilot] MEAS n=288 k=4 dx_ub=16 dz_ub=20 d_ub=16 steps=20000 id=C2xC2xC2_c00165
[pilot] MEAS n=288 k=4 dx_ub=20 dz_ub=16 d_ub=16 steps=20000 id=C2xC2xC2_c00206
[pilot] TARGET_REJECT d_ub=6 target=16 id=C2xC2xC2_c00219
[pilot] TARGET_REJECT d_ub=12 target=16 id=C2xC2xC2_c00221
[pilot] TARGET_REJECT d_ub=12 target=16 id=C2xC2xC2_c00233
[pilot] TARGET_REJECT d_ub=6 target=16 id=C2xC2xC2_c00242
[pilot] MEAS n=288 k=4 dx_ub=20 dz_ub=20 d_ub=20 steps=20000 id=C2xC2xC2_c00244
[saved] id=C2xC2xC2_c00244 -> results/c2xc2xc2_d16_20260121_002518/promising/C2xC2xC2_c00244 (reason: d>=sqrt(n))
[pilot] MEAS n=288 k=4 dx_ub=20 dz_ub=18 d_ub=18 steps=20000 id=C2xC2xC2_c00245
[saved] id=C2xC2xC2_c00245 -> results/c2xc2xc2_d16_20260121_002518/promising/C2xC2xC2_c00245 (reason: d>=sqrt(n))
[pilot] MEAS n=288 k=4 dx_ub=20 dz_ub=20 d_ub=20 steps=20000 id=C2xC2xC2_c00279
[saved] id=C2xC2xC2_c00279 -> results/c2xc2xc2_d16_20260121_002518/promising/C2xC2xC2_c00279 (reason: d>=sqrt(n))
[pilot] MEAS n=288 k=4 dx_ub=20 dz_ub=20 d_ub=20 steps=20000 id=C2xC2xC2_c00326
[saved] id=C2xC2xC2_c00326 -> results/c2xc2xc2_d16_20260121_002518/promising/C2xC2xC2_c00326 (reason: d>=sqrt(n))
[pilot] TARGET_REJECT d_ub=12 target=16 id=C2xC2xC2_c00351
[pilot] MEAS n=288 k=4 dx_ub=16 dz_ub=20 d_ub=16 steps=20000 id=C2xC2xC2_c00354
[pilot] TARGET_REJECT d_ub=14 target=16 id=C2xC2xC2_c00360
[pilot] MEAS n=288 k=4 dx_ub=16 dz_ub=20 d_ub=16 steps=20000 id=C2xC2xC2_c00373
[pilot] MEAS n=288 k=4 dx_ub=19 dz_ub=20 d_ub=19 steps=20000 id=C2xC2xC2_c00379
[saved] id=C2xC2xC2_c00379 -> results/c2xc2xc2_d16_20260121_002518/promising/C2xC2xC2_c00379 (reason: d>=sqrt(n))
[pilot] MEAS n=288 k=4 dx_ub=20 dz_ub=20 d_ub=20 steps=20000 id=C2xC2xC2_c00398
[saved] id=C2xC2xC2_c00398 -> results/c2xc2xc2_d16_20260121_002518/promising/C2xC2xC2_c00398 (reason: d>=sqrt(n))
[pilot] MEAS n=288 k=4 dx_ub=16 dz_ub=16 d_ub=16 steps=20000 id=C2xC2xC2_c00406
[pilot] MEAS n=288 k=4 dx_ub=20 dz_ub=20 d_ub=20 steps=20000 id=C2xC2xC2_c00427
[saved] id=C2xC2xC2_c00427 -> results/c2xc2xc2_d16_20260121_002518/promising/C2xC2xC2_c00427 (reason: d>=sqrt(n))
[pilot] MEAS n=288 k=4 dx_ub=19 dz_ub=20 d_ub=19 steps=20000 id=C2xC2xC2_c00471
[saved] id=C2xC2xC2_c00471 -> results/c2xc2xc2_d16_20260121_002518/promising/C2xC2xC2_c00471 (reason: d>=sqrt(n))
[pilot] TARGET_REJECT d_ub=12 target=16 id=C2xC2xC2_c00475
[pilot] MEAS n=288 k=4 dx_ub=17 dz_ub=16 d_ub=16 steps=20000 id=C2xC2xC2_c00483
[best_by_k] group=C2xC2xC2 n=288
k  | d_ub | steps | dx_ub | dz_ub | id
 4 |   20 | 20000 |    20 |    20 | C2xC2xC2_c00244
 8 |   16 | 20000 |    17 |    16 | C2xC2xC2_c00161
[coverage] group=C2xC2xC2 A_sel=128 B_sel=128 Q_meas=27 ratio_ge_sqrt=0.000 ratio_sel=0.002
[coverage] run summary:
[coverage] group=C2xC2xC2 A_sel=128 B_sel=128 Q_meas=27 ratio_ge_sqrt=0.000 ratio_sel=0.002
[summary] best-by-k (measured; includes rejects):
  k=4 best_d_ub=20 count_measured=22 example_id=C2xC2xC2_c00244
  k=8 best_d_ub=16 count_measured=5 example_id=C2xC2xC2_c00161
[summary] best-by-k (survivors; target=16):
  k=4 best_d_ub=20 count_survivors=17 example_id=C2xC2xC2_c00244
  k=8 best_d_ub=16 count_survivors=1 example_id=C2xC2xC2_c00161
[pilot] top results:
  01 group=C2xC2xC2 n=288 k=4 d_ub=20 permA=11 permB=8 saved=True
  02 group=C2xC2xC2 n=288 k=4 d_ub=20 permA=27 permB=27 saved=True
  03 group=C2xC2xC2 n=288 k=4 d_ub=20 permA=11 permB=20 saved=True
  04 group=C2xC2xC2 n=288 k=4 d_ub=20 permA=27 permB=8 saved=True
  05 group=C2xC2xC2 n=288 k=4 d_ub=20 permA=20 permB=27 saved=True
  06 group=C2xC2xC2 n=288 k=4 d_ub=19 permA=20 permB=11 saved=True
  07 group=C2xC2xC2 n=288 k=4 d_ub=19 permA=27 permB=11 saved=True
  08 group=C2xC2xC2 n=288 k=4 d_ub=19 permA=12 permB=27 saved=True
  09 group=C2xC2xC2 n=288 k=4 d_ub=18 permA=20 permB=27 saved=True
  10 group=C2xC2xC2 n=288 k=4 d_ub=17 permA=7 permB=11 saved=True

