=== mar. 20 janv. 2026 15:12:37 CET steps=5000 batch=40 seed=1768922143 ===
[pilot] base k_table top pairs:
  k_base=18 permA=0 permB=0
  k_base=12 permA=29 permB=0
  k_base=12 permA=22 permB=0
  k_base=12 permA=13 permB=0
  k_base=12 permA=6 permB=0
[pilot] A multisets raw=792 (expected=792) enum_mode=multiset cayley_unique=26 perms=30 -> total scored = 780
[pilot] B multisets raw=792 (expected=792) enum_mode=multiset cayley_unique=26 perms=30 -> total scored = 780
[pilot] A frontier kept 128 candidates with points: (4,20), (0,49)
[pilot] B frontier kept 128 candidates with points: (4,20), (0,49)
[pilot] C2xC2xC2 n=288 d0=17 A_sets=26*30 -> keep 128; B_sets=26*30 -> keep 128
[pilot] MEAS n=288 k=4 dx_ub=20 dz_ub=19 d_ub=19 steps=5000 id=C2xC2xC2_c00007
[saved] id=C2xC2xC2_c00007 -> results/c2xc2xc2_d16_20260120_151237/promising/C2xC2xC2_c00007 (reason: d>=sqrt(n))
[pilot] TARGET_REJECT d_ub=14 target=16 id=C2xC2xC2_c00039
[pilot] MEAS n=288 k=4 dx_ub=20 dz_ub=20 d_ub=20 steps=5000 id=C2xC2xC2_c00063
[saved] id=C2xC2xC2_c00063 -> results/c2xc2xc2_d16_20260120_151237/promising/C2xC2xC2_c00063 (reason: d>=sqrt(n))
[pilot] TARGET_REJECT d_ub=12 target=16 id=C2xC2xC2_c00097
[pilot] MEAS n=288 k=8 dx_ub=17 dz_ub=16 d_ub=16 steps=5000 id=C2xC2xC2_c00114
[pilot] MEAS n=288 k=4 dx_ub=19 dz_ub=19 d_ub=19 steps=5000 id=C2xC2xC2_c00132
[saved] id=C2xC2xC2_c00132 -> results/c2xc2xc2_d16_20260120_151237/promising/C2xC2xC2_c00132 (reason: d>=sqrt(n))
[pilot] MEAS n=288 k=4 dx_ub=18 dz_ub=16 d_ub=16 steps=5000 id=C2xC2xC2_c00165
[pilot] TARGET_REJECT d_ub=12 target=16 id=C2xC2xC2_c00170
[pilot] MEAS n=288 k=4 dx_ub=20 dz_ub=21 d_ub=20 steps=5000 id=C2xC2xC2_c00172
[saved] id=C2xC2xC2_c00172 -> results/c2xc2xc2_d16_20260120_151237/promising/C2xC2xC2_c00172 (reason: d>=sqrt(n))
[pilot] TARGET_REJECT d_ub=14 target=16 id=C2xC2xC2_c00176
[pilot] TARGET_REJECT d_ub=12 target=16 id=C2xC2xC2_c00192
[pilot] MEAS n=288 k=4 dx_ub=22 dz_ub=21 d_ub=21 steps=5000 id=C2xC2xC2_c00193
[saved] id=C2xC2xC2_c00193 -> results/c2xc2xc2_d16_20260120_151237/promising/C2xC2xC2_c00193 (reason: d>=sqrt(n))
[pilot] TARGET_REJECT d_ub=6 target=16 id=C2xC2xC2_c00198
[pilot] TARGET_REJECT d_ub=12 target=16 id=C2xC2xC2_c00213
[pilot] MEAS n=288 k=4 dx_ub=16 dz_ub=20 d_ub=16 steps=5000 id=C2xC2xC2_c00272
[pilot] TARGET_REJECT d_ub=12 target=16 id=C2xC2xC2_c00277
[pilot] MEAS n=288 k=4 dx_ub=20 dz_ub=20 d_ub=20 steps=5000 id=C2xC2xC2_c00290
[saved] id=C2xC2xC2_c00290 -> results/c2xc2xc2_d16_20260120_151237/promising/C2xC2xC2_c00290 (reason: d>=sqrt(n))
[pilot] MEAS n=288 k=4 dx_ub=16 dz_ub=16 d_ub=16 steps=5000 id=C2xC2xC2_c00292
[pilot] MEAS n=288 k=4 dx_ub=20 dz_ub=18 d_ub=18 steps=5000 id=C2xC2xC2_c00358
[saved] id=C2xC2xC2_c00358 -> results/c2xc2xc2_d16_20260120_151237/promising/C2xC2xC2_c00358 (reason: d>=sqrt(n))
[pilot] TARGET_REJECT d_ub=14 target=16 id=C2xC2xC2_c00365
[pilot] MEAS n=288 k=4 dx_ub=22 dz_ub=20 d_ub=20 steps=5000 id=C2xC2xC2_c00369
[saved] id=C2xC2xC2_c00369 -> results/c2xc2xc2_d16_20260120_151237/promising/C2xC2xC2_c00369 (reason: d>=sqrt(n))
[pilot] MEAS n=288 k=4 dx_ub=20 dz_ub=18 d_ub=18 steps=5000 id=C2xC2xC2_c00403
[saved] id=C2xC2xC2_c00403 -> results/c2xc2xc2_d16_20260120_151237/promising/C2xC2xC2_c00403 (reason: d>=sqrt(n))
[pilot] TARGET_REJECT d_ub=6 target=16 id=C2xC2xC2_c00417
[pilot] MEAS n=288 k=4 dx_ub=17 dz_ub=19 d_ub=17 steps=5000 id=C2xC2xC2_c00430
[saved] id=C2xC2xC2_c00430 -> results/c2xc2xc2_d16_20260120_151237/promising/C2xC2xC2_c00430 (reason: d>=sqrt(n))
[pilot] MEAS n=288 k=4 dx_ub=17 dz_ub=21 d_ub=17 steps=5000 id=C2xC2xC2_c00493
[saved] id=C2xC2xC2_c00493 -> results/c2xc2xc2_d16_20260120_151237/promising/C2xC2xC2_c00493 (reason: d>=sqrt(n))
[best_by_k] group=C2xC2xC2 n=288
k  | d_ub | steps | dx_ub | dz_ub | id
 4 |   21 |  5000 |    22 |    21 | C2xC2xC2_c00193
 8 |   16 |  5000 |    17 |    16 | C2xC2xC2_c00114
[coverage] group=C2xC2xC2 A_sel=128 B_sel=128 Q_meas=25 ratio_ge_sqrt=0.000 ratio_sel=0.002
[coverage] run summary:
[coverage] group=C2xC2xC2 A_sel=128 B_sel=128 Q_meas=25 ratio_ge_sqrt=0.000 ratio_sel=0.002
[summary] best-by-k (measured; includes rejects):
  k=4 best_d_ub=21 count_measured=17 example_id=C2xC2xC2_c00193
  k=8 best_d_ub=16 count_measured=8 example_id=C2xC2xC2_c00114
[summary] best-by-k (survivors; target=16):
  k=4 best_d_ub=21 count_survivors=14 example_id=C2xC2xC2_c00193
  k=8 best_d_ub=16 count_survivors=1 example_id=C2xC2xC2_c00114
[pilot] top results:
  01 group=C2xC2xC2 n=288 k=4 d_ub=21 permA=27 permB=8 saved=True
  02 group=C2xC2xC2 n=288 k=4 d_ub=20 permA=27 permB=20 saved=True
  03 group=C2xC2xC2 n=288 k=4 d_ub=20 permA=12 permB=7 saved=True
  04 group=C2xC2xC2 n=288 k=4 d_ub=20 permA=20 permB=20 saved=True
  05 group=C2xC2xC2 n=288 k=4 d_ub=20 permA=11 permB=27 saved=True
  06 group=C2xC2xC2 n=288 k=4 d_ub=19 permA=11 permB=20 saved=True
  07 group=C2xC2xC2 n=288 k=4 d_ub=19 permA=8 permB=8 saved=True
  08 group=C2xC2xC2 n=288 k=4 d_ub=18 permA=7 permB=8 saved=True
  09 group=C2xC2xC2 n=288 k=4 d_ub=18 permA=20 permB=11 saved=True
  10 group=C2xC2xC2 n=288 k=4 d_ub=17 permA=8 permB=27 saved=True

