=== mar. 20 janv. 2026 15:08:49 CET steps=5000 batch=33 seed=1768922136 ===
[pilot] base k_table top pairs:
  k_base=18 permA=0 permB=0
  k_base=12 permA=29 permB=0
  k_base=12 permA=22 permB=0
  k_base=12 permA=13 permB=0
  k_base=12 permA=6 permB=0
[pilot] A multisets raw=792 (expected=792) enum_mode=multiset cayley_unique=26 perms=30 -> total scored = 780
[pilot] B multisets raw=792 (expected=792) enum_mode=multiset cayley_unique=26 perms=30 -> total scored = 780
[pilot] A frontier kept 128 candidates with points: (4,20), (0,49)
[pilot] B frontier kept 128 candidates with points: (4,20), (0,49)
[pilot] C2xC2xC2 n=288 d0=17 A_sets=26*30 -> keep 128; B_sets=26*30 -> keep 128
[pilot] TARGET_REJECT d_ub=12 target=16 id=C2xC2xC2_c00044
[pilot] MEAS n=288 k=4 dx_ub=20 dz_ub=16 d_ub=16 steps=5000 id=C2xC2xC2_c00057
[pilot] TARGET_REJECT d_ub=12 target=16 id=C2xC2xC2_c00078
[pilot] MEAS n=288 k=4 dx_ub=19 dz_ub=19 d_ub=19 steps=5000 id=C2xC2xC2_c00110
[saved] id=C2xC2xC2_c00110 -> results/c2xc2xc2_d16_20260120_150849/promising/C2xC2xC2_c00110 (reason: d>=sqrt(n))
[pilot] TARGET_REJECT d_ub=14 target=16 id=C2xC2xC2_c00137
[pilot] TARGET_REJECT d_ub=12 target=16 id=C2xC2xC2_c00145
[pilot] TARGET_REJECT d_ub=12 target=16 id=C2xC2xC2_c00183
[pilot] MEAS n=288 k=8 dx_ub=16 dz_ub=18 d_ub=16 steps=5000 id=C2xC2xC2_c00190
[pilot] MEAS n=288 k=4 dx_ub=16 dz_ub=16 d_ub=16 steps=5000 id=C2xC2xC2_c00199
[pilot] MEAS n=288 k=4 dx_ub=20 dz_ub=20 d_ub=20 steps=5000 id=C2xC2xC2_c00201
[saved] id=C2xC2xC2_c00201 -> results/c2xc2xc2_d16_20260120_150849/promising/C2xC2xC2_c00201 (reason: d>=sqrt(n))
[pilot] MEAS n=288 k=8 dx_ub=17 dz_ub=16 d_ub=16 steps=5000 id=C2xC2xC2_c00217
[pilot] MEAS n=288 k=8 dx_ub=16 dz_ub=16 d_ub=16 steps=5000 id=C2xC2xC2_c00218
[pilot] MEAS n=288 k=4 dx_ub=20 dz_ub=20 d_ub=20 steps=5000 id=C2xC2xC2_c00220
[saved] id=C2xC2xC2_c00220 -> results/c2xc2xc2_d16_20260120_150849/promising/C2xC2xC2_c00220 (reason: d>=sqrt(n))
[pilot] MEAS n=288 k=4 dx_ub=20 dz_ub=21 d_ub=20 steps=5000 id=C2xC2xC2_c00222
[saved] id=C2xC2xC2_c00222 -> results/c2xc2xc2_d16_20260120_150849/promising/C2xC2xC2_c00222 (reason: d>=sqrt(n))
[pilot] TARGET_REJECT d_ub=14 target=16 id=C2xC2xC2_c00224
[pilot] MEAS n=288 k=4 dx_ub=20 dz_ub=16 d_ub=16 steps=5000 id=C2xC2xC2_c00243
[pilot] MEAS n=288 k=4 dx_ub=17 dz_ub=17 d_ub=17 steps=5000 id=C2xC2xC2_c00316
[saved] id=C2xC2xC2_c00316 -> results/c2xc2xc2_d16_20260120_150849/promising/C2xC2xC2_c00316 (reason: d>=sqrt(n))
[pilot] MEAS n=288 k=4 dx_ub=17 dz_ub=20 d_ub=17 steps=5000 id=C2xC2xC2_c00318
[saved] id=C2xC2xC2_c00318 -> results/c2xc2xc2_d16_20260120_150849/promising/C2xC2xC2_c00318 (reason: d>=sqrt(n))
[pilot] MEAS n=288 k=8 dx_ub=16 dz_ub=16 d_ub=16 steps=5000 id=C2xC2xC2_c00327
[pilot] MEAS n=288 k=4 dx_ub=19 dz_ub=16 d_ub=16 steps=5000 id=C2xC2xC2_c00371
[pilot] MEAS n=288 k=4 dx_ub=20 dz_ub=21 d_ub=20 steps=5000 id=C2xC2xC2_c00373
[saved] id=C2xC2xC2_c00373 -> results/c2xc2xc2_d16_20260120_150849/promising/C2xC2xC2_c00373 (reason: d>=sqrt(n))
[pilot] MEAS n=288 k=4 dx_ub=16 dz_ub=16 d_ub=16 steps=5000 id=C2xC2xC2_c00408
[pilot] TARGET_REJECT d_ub=6 target=16 id=C2xC2xC2_c00412
[pilot] TARGET_REJECT d_ub=12 target=16 id=C2xC2xC2_c00414
[pilot] MEAS n=288 k=4 dx_ub=17 dz_ub=20 d_ub=17 steps=5000 id=C2xC2xC2_c00465
[saved] id=C2xC2xC2_c00465 -> results/c2xc2xc2_d16_20260120_150849/promising/C2xC2xC2_c00465 (reason: d>=sqrt(n))
[pilot] MEAS n=288 k=8 dx_ub=16 dz_ub=16 d_ub=16 steps=5000 id=C2xC2xC2_c00487
[pilot] MEAS n=288 k=4 dx_ub=20 dz_ub=19 d_ub=19 steps=5000 id=C2xC2xC2_c00489
[saved] id=C2xC2xC2_c00489 -> results/c2xc2xc2_d16_20260120_150849/promising/C2xC2xC2_c00489 (reason: d>=sqrt(n))
[best_by_k] group=C2xC2xC2 n=288
k  | d_ub | steps | dx_ub | dz_ub | id
 4 |   20 |  5000 |    20 |    20 | C2xC2xC2_c00201
 8 |   16 |  5000 |    16 |    18 | C2xC2xC2_c00190
[coverage] group=C2xC2xC2 A_sel=128 B_sel=128 Q_meas=27 ratio_ge_sqrt=0.000 ratio_sel=0.002
[coverage] run summary:
[coverage] group=C2xC2xC2 A_sel=128 B_sel=128 Q_meas=27 ratio_ge_sqrt=0.000 ratio_sel=0.002
[summary] best-by-k (measured; includes rejects):
  k=4 best_d_ub=20 count_measured=17 example_id=C2xC2xC2_c00201
  k=8 best_d_ub=16 count_measured=10 example_id=C2xC2xC2_c00190
[summary] best-by-k (survivors; target=16):
  k=4 best_d_ub=20 count_survivors=14 example_id=C2xC2xC2_c00201
  k=8 best_d_ub=16 count_survivors=5 example_id=C2xC2xC2_c00190
[pilot] top results:
  01 group=C2xC2xC2 n=288 k=4 d_ub=20 permA=20 permB=11 saved=True
  02 group=C2xC2xC2 n=288 k=4 d_ub=20 permA=8 permB=11 saved=True
  03 group=C2xC2xC2 n=288 k=4 d_ub=20 permA=11 permB=11 saved=True
  04 group=C2xC2xC2 n=288 k=4 d_ub=20 permA=8 permB=11 saved=True
  05 group=C2xC2xC2 n=288 k=4 d_ub=19 permA=8 permB=27 saved=True
  06 group=C2xC2xC2 n=288 k=4 d_ub=19 permA=27 permB=20 saved=True
  07 group=C2xC2xC2 n=288 k=4 d_ub=17 permA=20 permB=20 saved=True
  08 group=C2xC2xC2 n=288 k=4 d_ub=17 permA=20 permB=8 saved=True
  09 group=C2xC2xC2 n=288 k=4 d_ub=17 permA=7 permB=27 saved=True
  10 group=C2xC2xC2 n=288 k=8 d_ub=16 permA=12 permB=11 saved=False

