=== mar. 20 janv. 2026 15:06:02 CET steps=5000 batch=28 seed=1768922131 ===
[pilot] base k_table top pairs:
  k_base=18 permA=0 permB=0
  k_base=12 permA=29 permB=0
  k_base=12 permA=22 permB=0
  k_base=12 permA=13 permB=0
  k_base=12 permA=6 permB=0
[pilot] A multisets raw=792 (expected=792) enum_mode=multiset cayley_unique=26 perms=30 -> total scored = 780
[pilot] B multisets raw=792 (expected=792) enum_mode=multiset cayley_unique=26 perms=30 -> total scored = 780
[pilot] A frontier kept 128 candidates with points: (4,20), (0,49)
[pilot] B frontier kept 128 candidates with points: (4,20), (0,49)
[pilot] C2xC2xC2 n=288 d0=17 A_sets=26*30 -> keep 128; B_sets=26*30 -> keep 128
[pilot] MEAS n=288 k=4 dx_ub=17 dz_ub=20 d_ub=17 steps=5000 id=C2xC2xC2_c00008
[saved] id=C2xC2xC2_c00008 -> results/c2xc2xc2_d16_20260120_150602/promising/C2xC2xC2_c00008 (reason: d>=sqrt(n))
[pilot] MEAS n=288 k=4 dx_ub=20 dz_ub=18 d_ub=18 steps=5000 id=C2xC2xC2_c00022
[saved] id=C2xC2xC2_c00022 -> results/c2xc2xc2_d16_20260120_150602/promising/C2xC2xC2_c00022 (reason: d>=sqrt(n))
[pilot] MEAS n=288 k=4 dx_ub=17 dz_ub=16 d_ub=16 steps=5000 id=C2xC2xC2_c00036
[pilot] MEAS n=288 k=4 dx_ub=20 dz_ub=20 d_ub=20 steps=5000 id=C2xC2xC2_c00057
[saved] id=C2xC2xC2_c00057 -> results/c2xc2xc2_d16_20260120_150602/promising/C2xC2xC2_c00057 (reason: d>=sqrt(n))
[pilot] MEAS n=288 k=4 dx_ub=20 dz_ub=20 d_ub=20 steps=5000 id=C2xC2xC2_c00067
[saved] id=C2xC2xC2_c00067 -> results/c2xc2xc2_d16_20260120_150602/promising/C2xC2xC2_c00067 (reason: d>=sqrt(n))
[pilot] MEAS n=288 k=4 dx_ub=16 dz_ub=17 d_ub=16 steps=5000 id=C2xC2xC2_c00072
[pilot] MEAS n=288 k=4 dx_ub=17 dz_ub=20 d_ub=17 steps=5000 id=C2xC2xC2_c00090
[saved] id=C2xC2xC2_c00090 -> results/c2xc2xc2_d16_20260120_150602/promising/C2xC2xC2_c00090 (reason: d>=sqrt(n))
[pilot] TARGET_REJECT d_ub=12 target=16 id=C2xC2xC2_c00091
[pilot] MEAS n=288 k=4 dx_ub=16 dz_ub=18 d_ub=16 steps=5000 id=C2xC2xC2_c00111
[pilot] MEAS n=288 k=4 dx_ub=17 dz_ub=16 d_ub=16 steps=5000 id=C2xC2xC2_c00132
[pilot] MEAS n=288 k=4 dx_ub=17 dz_ub=20 d_ub=17 steps=5000 id=C2xC2xC2_c00159
[saved] id=C2xC2xC2_c00159 -> results/c2xc2xc2_d16_20260120_150602/promising/C2xC2xC2_c00159 (reason: d>=sqrt(n))
[pilot] MEAS n=288 k=8 dx_ub=16 dz_ub=17 d_ub=16 steps=5000 id=C2xC2xC2_c00180
[pilot] MEAS n=288 k=4 dx_ub=20 dz_ub=16 d_ub=16 steps=5000 id=C2xC2xC2_c00185
[pilot] MEAS n=288 k=4 dx_ub=19 dz_ub=20 d_ub=19 steps=5000 id=C2xC2xC2_c00215
[saved] id=C2xC2xC2_c00215 -> results/c2xc2xc2_d16_20260120_150602/promising/C2xC2xC2_c00215 (reason: d>=sqrt(n))
[pilot] MEAS n=288 k=4 dx_ub=23 dz_ub=19 d_ub=19 steps=5000 id=C2xC2xC2_c00233
[saved] id=C2xC2xC2_c00233 -> results/c2xc2xc2_d16_20260120_150602/promising/C2xC2xC2_c00233 (reason: d>=sqrt(n))
[pilot] MEAS n=288 k=4 dx_ub=16 dz_ub=17 d_ub=16 steps=5000 id=C2xC2xC2_c00268
[pilot] MEAS n=288 k=4 dx_ub=20 dz_ub=20 d_ub=20 steps=5000 id=C2xC2xC2_c00274
[saved] id=C2xC2xC2_c00274 -> results/c2xc2xc2_d16_20260120_150602/promising/C2xC2xC2_c00274 (reason: d>=sqrt(n))
[pilot] MEAS n=288 k=4 dx_ub=20 dz_ub=16 d_ub=16 steps=5000 id=C2xC2xC2_c00313
[pilot] TARGET_REJECT d_ub=12 target=16 id=C2xC2xC2_c00322
[pilot] MEAS n=288 k=4 dx_ub=20 dz_ub=20 d_ub=20 steps=5000 id=C2xC2xC2_c00387
[saved] id=C2xC2xC2_c00387 -> results/c2xc2xc2_d16_20260120_150602/promising/C2xC2xC2_c00387 (reason: d>=sqrt(n))
[pilot] MEAS n=288 k=4 dx_ub=20 dz_ub=18 d_ub=18 steps=5000 id=C2xC2xC2_c00412
[saved] id=C2xC2xC2_c00412 -> results/c2xc2xc2_d16_20260120_150602/promising/C2xC2xC2_c00412 (reason: d>=sqrt(n))
[pilot] MEAS n=288 k=4 dx_ub=20 dz_ub=16 d_ub=16 steps=5000 id=C2xC2xC2_c00413
[pilot] MEAS n=288 k=4 dx_ub=16 dz_ub=16 d_ub=16 steps=5000 id=C2xC2xC2_c00442
[pilot] TARGET_REJECT d_ub=14 target=16 id=C2xC2xC2_c00443
[pilot] TARGET_REJECT d_ub=6 target=16 id=C2xC2xC2_c00473
[best_by_k] group=C2xC2xC2 n=288
k  | d_ub | steps | dx_ub | dz_ub | id
 4 |   20 |  5000 |    20 |    20 | C2xC2xC2_c00057
 8 |   16 |  5000 |    16 |    17 | C2xC2xC2_c00180
[coverage] group=C2xC2xC2 A_sel=128 B_sel=128 Q_meas=25 ratio_ge_sqrt=0.000 ratio_sel=0.002
[coverage] run summary:
[coverage] group=C2xC2xC2 A_sel=128 B_sel=128 Q_meas=25 ratio_ge_sqrt=0.000 ratio_sel=0.002
[summary] best-by-k (measured; includes rejects):
  k=4 best_d_ub=20 count_measured=21 example_id=C2xC2xC2_c00057
  k=8 best_d_ub=16 count_measured=4 example_id=C2xC2xC2_c00180
[summary] best-by-k (survivors; target=16):
  k=4 best_d_ub=20 count_survivors=20 example_id=C2xC2xC2_c00057
  k=8 best_d_ub=16 count_survivors=1 example_id=C2xC2xC2_c00180
[pilot] top results:
  01 group=C2xC2xC2 n=288 k=4 d_ub=20 permA=8 permB=11 saved=True
  02 group=C2xC2xC2 n=288 k=4 d_ub=20 permA=20 permB=11 saved=True
  03 group=C2xC2xC2 n=288 k=4 d_ub=20 permA=11 permB=27 saved=True
  04 group=C2xC2xC2 n=288 k=4 d_ub=20 permA=27 permB=20 saved=True
  05 group=C2xC2xC2 n=288 k=4 d_ub=19 permA=12 permB=11 saved=True
  06 group=C2xC2xC2 n=288 k=4 d_ub=19 permA=27 permB=20 saved=True
  07 group=C2xC2xC2 n=288 k=4 d_ub=18 permA=7 permB=8 saved=True
  08 group=C2xC2xC2 n=288 k=4 d_ub=18 permA=27 permB=12 saved=True
  09 group=C2xC2xC2 n=288 k=4 d_ub=17 permA=7 permB=11 saved=True
  10 group=C2xC2xC2 n=288 k=4 d_ub=17 permA=27 permB=20 saved=True

