=== mar. 20 janv. 2026 15:34:28 CET steps=5000 batch=76 seed=1768922179 ===
[pilot] base k_table top pairs:
  k_base=18 permA=0 permB=0
  k_base=12 permA=29 permB=0
  k_base=12 permA=22 permB=0
  k_base=12 permA=13 permB=0
  k_base=12 permA=6 permB=0
[pilot] A multisets raw=792 (expected=792) enum_mode=multiset cayley_unique=26 perms=30 -> total scored = 780
[pilot] B multisets raw=792 (expected=792) enum_mode=multiset cayley_unique=26 perms=30 -> total scored = 780
[pilot] A frontier kept 128 candidates with points: (4,20), (0,49)
[pilot] B frontier kept 128 candidates with points: (4,20), (0,49)
[pilot] C2xC2xC2 n=288 d0=17 A_sets=26*30 -> keep 128; B_sets=26*30 -> keep 128
[pilot] MEAS n=288 k=4 dx_ub=23 dz_ub=23 d_ub=23 steps=5000 id=C2xC2xC2_c00002
[saved] id=C2xC2xC2_c00002 -> results/c2xc2xc2_d16_20260120_153428/promising/C2xC2xC2_c00002 (reason: d>=sqrt(n))
[pilot] MEAS n=288 k=4 dx_ub=20 dz_ub=20 d_ub=20 steps=5000 id=C2xC2xC2_c00056
[saved] id=C2xC2xC2_c00056 -> results/c2xc2xc2_d16_20260120_153428/promising/C2xC2xC2_c00056 (reason: d>=sqrt(n))
[pilot] MEAS n=288 k=4 dx_ub=18 dz_ub=20 d_ub=18 steps=5000 id=C2xC2xC2_c00104
[saved] id=C2xC2xC2_c00104 -> results/c2xc2xc2_d16_20260120_153428/promising/C2xC2xC2_c00104 (reason: d>=sqrt(n))
[pilot] MEAS n=288 k=4 dx_ub=17 dz_ub=18 d_ub=17 steps=5000 id=C2xC2xC2_c00108
[saved] id=C2xC2xC2_c00108 -> results/c2xc2xc2_d16_20260120_153428/promising/C2xC2xC2_c00108 (reason: d>=sqrt(n))
[pilot] TARGET_REJECT d_ub=15 target=16 id=C2xC2xC2_c00128
[pilot] MEAS n=288 k=4 dx_ub=20 dz_ub=20 d_ub=20 steps=5000 id=C2xC2xC2_c00129
[saved] id=C2xC2xC2_c00129 -> results/c2xc2xc2_d16_20260120_153428/promising/C2xC2xC2_c00129 (reason: d>=sqrt(n))
[pilot] MEAS n=288 k=4 dx_ub=16 dz_ub=16 d_ub=16 steps=5000 id=C2xC2xC2_c00139
[pilot] MEAS n=288 k=4 dx_ub=17 dz_ub=16 d_ub=16 steps=5000 id=C2xC2xC2_c00155
[pilot] MEAS n=288 k=8 dx_ub=16 dz_ub=17 d_ub=16 steps=5000 id=C2xC2xC2_c00156
[pilot] MEAS n=288 k=4 dx_ub=17 dz_ub=16 d_ub=16 steps=5000 id=C2xC2xC2_c00161
[pilot] MEAS n=288 k=4 dx_ub=20 dz_ub=19 d_ub=19 steps=5000 id=C2xC2xC2_c00212
[saved] id=C2xC2xC2_c00212 -> results/c2xc2xc2_d16_20260120_153428/promising/C2xC2xC2_c00212 (reason: d>=sqrt(n))
[pilot] MEAS n=288 k=4 dx_ub=18 dz_ub=16 d_ub=16 steps=5000 id=C2xC2xC2_c00219
[pilot] MEAS n=288 k=4 dx_ub=17 dz_ub=17 d_ub=17 steps=5000 id=C2xC2xC2_c00270
[saved] id=C2xC2xC2_c00270 -> results/c2xc2xc2_d16_20260120_153428/promising/C2xC2xC2_c00270 (reason: d>=sqrt(n))
[pilot] TARGET_REJECT d_ub=12 target=16 id=C2xC2xC2_c00283
[pilot] MEAS n=288 k=4 dx_ub=16 dz_ub=18 d_ub=16 steps=5000 id=C2xC2xC2_c00293
[pilot] TARGET_REJECT d_ub=12 target=16 id=C2xC2xC2_c00304
[pilot] MEAS n=288 k=4 dx_ub=19 dz_ub=20 d_ub=19 steps=5000 id=C2xC2xC2_c00310
[saved] id=C2xC2xC2_c00310 -> results/c2xc2xc2_d16_20260120_153428/promising/C2xC2xC2_c00310 (reason: d>=sqrt(n))
[pilot] MEAS n=288 k=4 dx_ub=16 dz_ub=20 d_ub=16 steps=5000 id=C2xC2xC2_c00327
[pilot] MEAS n=288 k=4 dx_ub=19 dz_ub=17 d_ub=17 steps=5000 id=C2xC2xC2_c00346
[saved] id=C2xC2xC2_c00346 -> results/c2xc2xc2_d16_20260120_153428/promising/C2xC2xC2_c00346 (reason: d>=sqrt(n))
[pilot] MEAS n=288 k=4 dx_ub=20 dz_ub=20 d_ub=20 steps=5000 id=C2xC2xC2_c00348
[saved] id=C2xC2xC2_c00348 -> results/c2xc2xc2_d16_20260120_153428/promising/C2xC2xC2_c00348 (reason: d>=sqrt(n))
[pilot] MEAS n=288 k=4 dx_ub=16 dz_ub=20 d_ub=16 steps=5000 id=C2xC2xC2_c00393
[pilot] MEAS n=288 k=4 dx_ub=19 dz_ub=20 d_ub=19 steps=5000 id=C2xC2xC2_c00414
[saved] id=C2xC2xC2_c00414 -> results/c2xc2xc2_d16_20260120_153428/promising/C2xC2xC2_c00414 (reason: d>=sqrt(n))
[pilot] TARGET_REJECT d_ub=14 target=16 id=C2xC2xC2_c00449
[pilot] MEAS n=288 k=8 dx_ub=16 dz_ub=17 d_ub=16 steps=5000 id=C2xC2xC2_c00477
[pilot] MEAS n=288 k=4 dx_ub=18 dz_ub=16 d_ub=16 steps=5000 id=C2xC2xC2_c00482
[best_by_k] group=C2xC2xC2 n=288
k  | d_ub | steps | dx_ub | dz_ub | id
 4 |   23 |  5000 |    23 |    23 | C2xC2xC2_c00002
 8 |   16 |  5000 |    16 |    17 | C2xC2xC2_c00156
[coverage] group=C2xC2xC2 A_sel=128 B_sel=128 Q_meas=25 ratio_ge_sqrt=0.000 ratio_sel=0.002
[coverage] run summary:
[coverage] group=C2xC2xC2 A_sel=128 B_sel=128 Q_meas=25 ratio_ge_sqrt=0.000 ratio_sel=0.002
[summary] best-by-k (measured; includes rejects):
  k=4 best_d_ub=23 count_measured=19 example_id=C2xC2xC2_c00002
  k=8 best_d_ub=16 count_measured=6 example_id=C2xC2xC2_c00156
[summary] best-by-k (survivors; target=16):
  k=4 best_d_ub=23 count_survivors=19 example_id=C2xC2xC2_c00002
  k=8 best_d_ub=16 count_survivors=2 example_id=C2xC2xC2_c00156
[pilot] top results:
  01 group=C2xC2xC2 n=288 k=4 d_ub=23 permA=20 permB=12 saved=True
  02 group=C2xC2xC2 n=288 k=4 d_ub=20 permA=8 permB=27 saved=True
  03 group=C2xC2xC2 n=288 k=4 d_ub=20 permA=27 permB=8 saved=True
  04 group=C2xC2xC2 n=288 k=4 d_ub=20 permA=20 permB=20 saved=True
  05 group=C2xC2xC2 n=288 k=4 d_ub=19 permA=11 permB=8 saved=True
  06 group=C2xC2xC2 n=288 k=4 d_ub=19 permA=12 permB=11 saved=True
  07 group=C2xC2xC2 n=288 k=4 d_ub=19 permA=8 permB=8 saved=True
  08 group=C2xC2xC2 n=288 k=4 d_ub=18 permA=20 permB=11 saved=True
  09 group=C2xC2xC2 n=288 k=4 d_ub=17 permA=20 permB=8 saved=True
  10 group=C2xC2xC2 n=288 k=4 d_ub=17 permA=20 permB=20 saved=True

