=== mer. 21 janv. 2026 08:18:50 CET steps=20000 batch=41 seed=1768937144 ===
[pilot] base k_table top pairs:
  k_base=18 permA=0 permB=0
  k_base=12 permA=29 permB=0
  k_base=12 permA=22 permB=0
  k_base=12 permA=13 permB=0
  k_base=12 permA=6 permB=0
[pilot] A multisets raw=792 (expected=792) enum_mode=multiset cayley_unique=26 perms=30 -> total scored = 780
[pilot] B multisets raw=792 (expected=792) enum_mode=multiset cayley_unique=26 perms=30 -> total scored = 780
[pilot] A frontier kept 128 candidates with points: (4,20), (0,49)
[pilot] B frontier kept 128 candidates with points: (4,20), (0,49)
[pilot] C2xC2xC2 n=288 d0=17 A_sets=26*30 -> keep 128; B_sets=26*30 -> keep 128
[pilot] TARGET_REJECT d_ub=14 target=16 id=C2xC2xC2_c00001
[pilot] TARGET_REJECT d_ub=12 target=16 id=C2xC2xC2_c00009
[pilot] MEAS n=288 k=4 dx_ub=20 dz_ub=20 d_ub=20 steps=20000 id=C2xC2xC2_c00022
[saved] id=C2xC2xC2_c00022 -> results/c2xc2xc2_d16_20260121_081850/promising/C2xC2xC2_c00022 (reason: d>=sqrt(n))
[pilot] MEAS n=288 k=4 dx_ub=20 dz_ub=19 d_ub=19 steps=20000 id=C2xC2xC2_c00025
[saved] id=C2xC2xC2_c00025 -> results/c2xc2xc2_d16_20260121_081850/promising/C2xC2xC2_c00025 (reason: d>=sqrt(n))
[pilot] MEAS n=288 k=4 dx_ub=20 dz_ub=20 d_ub=20 steps=20000 id=C2xC2xC2_c00030
[saved] id=C2xC2xC2_c00030 -> results/c2xc2xc2_d16_20260121_081850/promising/C2xC2xC2_c00030 (reason: d>=sqrt(n))
[pilot] MEAS n=288 k=4 dx_ub=20 dz_ub=20 d_ub=20 steps=20000 id=C2xC2xC2_c00073
[saved] id=C2xC2xC2_c00073 -> results/c2xc2xc2_d16_20260121_081850/promising/C2xC2xC2_c00073 (reason: d>=sqrt(n))
[pilot] MEAS n=288 k=4 dx_ub=19 dz_ub=20 d_ub=19 steps=20000 id=C2xC2xC2_c00076
[saved] id=C2xC2xC2_c00076 -> results/c2xc2xc2_d16_20260121_081850/promising/C2xC2xC2_c00076 (reason: d>=sqrt(n))
[pilot] TARGET_REJECT d_ub=12 target=16 id=C2xC2xC2_c00103
[pilot] TARGET_REJECT d_ub=12 target=16 id=C2xC2xC2_c00108
[pilot] MEAS n=288 k=4 dx_ub=17 dz_ub=16 d_ub=16 steps=20000 id=C2xC2xC2_c00145
[pilot] MEAS n=288 k=4 dx_ub=17 dz_ub=20 d_ub=17 steps=20000 id=C2xC2xC2_c00194
[saved] id=C2xC2xC2_c00194 -> results/c2xc2xc2_d16_20260121_081850/promising/C2xC2xC2_c00194 (reason: d>=sqrt(n))
[pilot] MEAS n=288 k=4 dx_ub=20 dz_ub=20 d_ub=20 steps=20000 id=C2xC2xC2_c00196
[saved] id=C2xC2xC2_c00196 -> results/c2xc2xc2_d16_20260121_081850/promising/C2xC2xC2_c00196 (reason: d>=sqrt(n))
[pilot] MEAS n=288 k=4 dx_ub=17 dz_ub=20 d_ub=17 steps=20000 id=C2xC2xC2_c00200
[saved] id=C2xC2xC2_c00200 -> results/c2xc2xc2_d16_20260121_081850/promising/C2xC2xC2_c00200 (reason: d>=sqrt(n))
[pilot] TARGET_REJECT d_ub=12 target=16 id=C2xC2xC2_c00206
[pilot] TARGET_REJECT d_ub=14 target=16 id=C2xC2xC2_c00208
[pilot] TARGET_REJECT d_ub=14 target=16 id=C2xC2xC2_c00213
[pilot] MEAS n=288 k=4 dx_ub=20 dz_ub=16 d_ub=16 steps=20000 id=C2xC2xC2_c00240
[pilot] TARGET_REJECT d_ub=12 target=16 id=C2xC2xC2_c00274
[pilot] TARGET_REJECT d_ub=12 target=16 id=C2xC2xC2_c00310
[pilot] TARGET_REJECT d_ub=12 target=16 id=C2xC2xC2_c00351
[pilot] MEAS n=288 k=4 dx_ub=17 dz_ub=16 d_ub=16 steps=20000 id=C2xC2xC2_c00375
[pilot] MEAS n=288 k=4 dx_ub=17 dz_ub=20 d_ub=17 steps=20000 id=C2xC2xC2_c00379
[saved] id=C2xC2xC2_c00379 -> results/c2xc2xc2_d16_20260121_081850/promising/C2xC2xC2_c00379 (reason: d>=sqrt(n))
[pilot] MEAS n=288 k=4 dx_ub=20 dz_ub=20 d_ub=20 steps=20000 id=C2xC2xC2_c00380
[saved] id=C2xC2xC2_c00380 -> results/c2xc2xc2_d16_20260121_081850/promising/C2xC2xC2_c00380 (reason: d>=sqrt(n))
[pilot] MEAS n=288 k=4 dx_ub=19 dz_ub=19 d_ub=19 steps=20000 id=C2xC2xC2_c00389
[saved] id=C2xC2xC2_c00389 -> results/c2xc2xc2_d16_20260121_081850/promising/C2xC2xC2_c00389 (reason: d>=sqrt(n))
[pilot] TARGET_REJECT d_ub=15 target=16 id=C2xC2xC2_c00391
[pilot] TARGET_REJECT d_ub=12 target=16 id=C2xC2xC2_c00397
[pilot] TARGET_REJECT d_ub=12 target=16 id=C2xC2xC2_c00419
[pilot] MEAS n=288 k=4 dx_ub=17 dz_ub=17 d_ub=17 steps=20000 id=C2xC2xC2_c00434
[saved] id=C2xC2xC2_c00434 -> results/c2xc2xc2_d16_20260121_081850/promising/C2xC2xC2_c00434 (reason: d>=sqrt(n))
[pilot] MEAS n=288 k=4 dx_ub=16 dz_ub=18 d_ub=16 steps=20000 id=C2xC2xC2_c00438
[pilot] MEAS n=288 k=4 dx_ub=19 dz_ub=20 d_ub=19 steps=20000 id=C2xC2xC2_c00444
[saved] id=C2xC2xC2_c00444 -> results/c2xc2xc2_d16_20260121_081850/promising/C2xC2xC2_c00444 (reason: d>=sqrt(n))
[pilot] MEAS n=288 k=4 dx_ub=16 dz_ub=17 d_ub=16 steps=20000 id=C2xC2xC2_c00450
[pilot] MEAS n=288 k=4 dx_ub=20 dz_ub=16 d_ub=16 steps=20000 id=C2xC2xC2_c00494
[best_by_k] group=C2xC2xC2 n=288
k  | d_ub | steps | dx_ub | dz_ub | id
 4 |   20 | 20000 |    20 |    20 | C2xC2xC2_c00022
[coverage] group=C2xC2xC2 A_sel=128 B_sel=128 Q_meas=32 ratio_ge_sqrt=0.001 ratio_sel=0.002
[coverage] run summary:
[coverage] group=C2xC2xC2 A_sel=128 B_sel=128 Q_meas=32 ratio_ge_sqrt=0.001 ratio_sel=0.002
[summary] best-by-k (measured; includes rejects):
  k=4 best_d_ub=20 count_measured=22 example_id=C2xC2xC2_c00022
  k=8 best_d_ub=15 count_measured=10 example_id=C2xC2xC2_c00391
[summary] best-by-k (survivors; target=16):
  k=4 best_d_ub=20 count_survivors=19 example_id=C2xC2xC2_c00022
[pilot] top results:
  01 group=C2xC2xC2 n=288 k=4 d_ub=20 permA=11 permB=8 saved=True
  02 group=C2xC2xC2 n=288 k=4 d_ub=20 permA=7 permB=27 saved=True
  03 group=C2xC2xC2 n=288 k=4 d_ub=20 permA=11 permB=8 saved=True
  04 group=C2xC2xC2 n=288 k=4 d_ub=20 permA=20 permB=7 saved=True
  05 group=C2xC2xC2 n=288 k=4 d_ub=20 permA=8 permB=11 saved=True
  06 group=C2xC2xC2 n=288 k=4 d_ub=19 permA=11 permB=8 saved=True
  07 group=C2xC2xC2 n=288 k=4 d_ub=19 permA=12 permB=20 saved=True
  08 group=C2xC2xC2 n=288 k=4 d_ub=19 permA=20 permB=20 saved=True
  09 group=C2xC2xC2 n=288 k=4 d_ub=19 permA=20 permB=8 saved=True
  10 group=C2xC2xC2 n=288 k=4 d_ub=17 permA=11 permB=12 saved=True

