=== mer. 21 janv. 2026 07:06:44 CET steps=20000 batch=36 seed=1768937139 ===
[pilot] base k_table top pairs:
  k_base=18 permA=0 permB=0
  k_base=12 permA=29 permB=0
  k_base=12 permA=22 permB=0
  k_base=12 permA=13 permB=0
  k_base=12 permA=6 permB=0
[pilot] A multisets raw=792 (expected=792) enum_mode=multiset cayley_unique=26 perms=30 -> total scored = 780
[pilot] B multisets raw=792 (expected=792) enum_mode=multiset cayley_unique=26 perms=30 -> total scored = 780
[pilot] A frontier kept 128 candidates with points: (4,20), (0,49)
[pilot] B frontier kept 128 candidates with points: (4,20), (0,49)
[pilot] C2xC2xC2 n=288 d0=17 A_sets=26*30 -> keep 128; B_sets=26*30 -> keep 128
[pilot] MEAS n=288 k=8 dx_ub=16 dz_ub=18 d_ub=16 steps=20000 id=C2xC2xC2_c00022
[pilot] MEAS n=288 k=4 dx_ub=20 dz_ub=20 d_ub=20 steps=20000 id=C2xC2xC2_c00023
[saved] id=C2xC2xC2_c00023 -> results/c2xc2xc2_d16_20260121_070644/promising/C2xC2xC2_c00023 (reason: d>=sqrt(n))
[pilot] MEAS n=288 k=4 dx_ub=20 dz_ub=20 d_ub=20 steps=20000 id=C2xC2xC2_c00027
[saved] id=C2xC2xC2_c00027 -> results/c2xc2xc2_d16_20260121_070644/promising/C2xC2xC2_c00027 (reason: d>=sqrt(n))
[pilot] TARGET_REJECT d_ub=12 target=16 id=C2xC2xC2_c00031
[pilot] MEAS n=288 k=4 dx_ub=20 dz_ub=20 d_ub=20 steps=20000 id=C2xC2xC2_c00067
[saved] id=C2xC2xC2_c00067 -> results/c2xc2xc2_d16_20260121_070644/promising/C2xC2xC2_c00067 (reason: d>=sqrt(n))
[pilot] MEAS n=288 k=4 dx_ub=16 dz_ub=18 d_ub=16 steps=20000 id=C2xC2xC2_c00077
[pilot] MEAS n=288 k=4 dx_ub=16 dz_ub=16 d_ub=16 steps=20000 id=C2xC2xC2_c00121
[pilot] MEAS n=288 k=4 dx_ub=20 dz_ub=20 d_ub=20 steps=20000 id=C2xC2xC2_c00134
[saved] id=C2xC2xC2_c00134 -> results/c2xc2xc2_d16_20260121_070644/promising/C2xC2xC2_c00134 (reason: d>=sqrt(n))
[pilot] MEAS n=288 k=8 dx_ub=17 dz_ub=16 d_ub=16 steps=20000 id=C2xC2xC2_c00158
[pilot] MEAS n=288 k=4 dx_ub=20 dz_ub=18 d_ub=18 steps=20000 id=C2xC2xC2_c00190
[saved] id=C2xC2xC2_c00190 -> results/c2xc2xc2_d16_20260121_070644/promising/C2xC2xC2_c00190 (reason: d>=sqrt(n))
[pilot] MEAS n=288 k=4 dx_ub=19 dz_ub=20 d_ub=19 steps=20000 id=C2xC2xC2_c00203
[saved] id=C2xC2xC2_c00203 -> results/c2xc2xc2_d16_20260121_070644/promising/C2xC2xC2_c00203 (reason: d>=sqrt(n))
[pilot] MEAS n=288 k=4 dx_ub=20 dz_ub=20 d_ub=20 steps=20000 id=C2xC2xC2_c00212
[saved] id=C2xC2xC2_c00212 -> results/c2xc2xc2_d16_20260121_070644/promising/C2xC2xC2_c00212 (reason: d>=sqrt(n))
[pilot] MEAS n=288 k=4 dx_ub=18 dz_ub=16 d_ub=16 steps=20000 id=C2xC2xC2_c00238
[pilot] MEAS n=288 k=4 dx_ub=16 dz_ub=17 d_ub=16 steps=20000 id=C2xC2xC2_c00245
[pilot] TARGET_REJECT d_ub=12 target=16 id=C2xC2xC2_c00256
[pilot] MEAS n=288 k=4 dx_ub=20 dz_ub=20 d_ub=20 steps=20000 id=C2xC2xC2_c00270
[saved] id=C2xC2xC2_c00270 -> results/c2xc2xc2_d16_20260121_070644/promising/C2xC2xC2_c00270 (reason: d>=sqrt(n))
[pilot] MEAS n=288 k=8 dx_ub=16 dz_ub=18 d_ub=16 steps=20000 id=C2xC2xC2_c00278
[pilot] MEAS n=288 k=4 dx_ub=20 dz_ub=19 d_ub=19 steps=20000 id=C2xC2xC2_c00336
[saved] id=C2xC2xC2_c00336 -> results/c2xc2xc2_d16_20260121_070644/promising/C2xC2xC2_c00336 (reason: d>=sqrt(n))
[pilot] MEAS n=288 k=4 dx_ub=20 dz_ub=19 d_ub=19 steps=20000 id=C2xC2xC2_c00345
[saved] id=C2xC2xC2_c00345 -> results/c2xc2xc2_d16_20260121_070644/promising/C2xC2xC2_c00345 (reason: d>=sqrt(n))
[pilot] TARGET_REJECT d_ub=14 target=16 id=C2xC2xC2_c00360
[pilot] TARGET_REJECT d_ub=12 target=16 id=C2xC2xC2_c00380
[pilot] MEAS n=288 k=4 dx_ub=20 dz_ub=19 d_ub=19 steps=20000 id=C2xC2xC2_c00388
[saved] id=C2xC2xC2_c00388 -> results/c2xc2xc2_d16_20260121_070644/promising/C2xC2xC2_c00388 (reason: d>=sqrt(n))
[pilot] MEAS n=288 k=4 dx_ub=16 dz_ub=16 d_ub=16 steps=20000 id=C2xC2xC2_c00399
[pilot] TARGET_REJECT d_ub=15 target=16 id=C2xC2xC2_c00443
[pilot] MEAS n=288 k=4 dx_ub=17 dz_ub=17 d_ub=17 steps=20000 id=C2xC2xC2_c00474
[saved] id=C2xC2xC2_c00474 -> results/c2xc2xc2_d16_20260121_070644/promising/C2xC2xC2_c00474 (reason: d>=sqrt(n))
[pilot] MEAS n=288 k=4 dx_ub=20 dz_ub=20 d_ub=20 steps=20000 id=C2xC2xC2_c00479
[saved] id=C2xC2xC2_c00479 -> results/c2xc2xc2_d16_20260121_070644/promising/C2xC2xC2_c00479 (reason: d>=sqrt(n))
[pilot] MEAS n=288 k=4 dx_ub=20 dz_ub=20 d_ub=20 steps=20000 id=C2xC2xC2_c00494
[saved] id=C2xC2xC2_c00494 -> results/c2xc2xc2_d16_20260121_070644/promising/C2xC2xC2_c00494 (reason: d>=sqrt(n))
[pilot] MEAS n=288 k=4 dx_ub=18 dz_ub=16 d_ub=16 steps=20000 id=C2xC2xC2_c00499
[best_by_k] group=C2xC2xC2 n=288
k  | d_ub | steps | dx_ub | dz_ub | id
 4 |   20 | 20000 |    20 |    20 | C2xC2xC2_c00023
 8 |   16 | 20000 |    16 |    18 | C2xC2xC2_c00022
[coverage] group=C2xC2xC2 A_sel=128 B_sel=128 Q_meas=28 ratio_ge_sqrt=0.001 ratio_sel=0.002
[coverage] run summary:
[coverage] group=C2xC2xC2 A_sel=128 B_sel=128 Q_meas=28 ratio_ge_sqrt=0.001 ratio_sel=0.002
[summary] best-by-k (measured; includes rejects):
  k=4 best_d_ub=20 count_measured=22 example_id=C2xC2xC2_c00023
  k=8 best_d_ub=16 count_measured=6 example_id=C2xC2xC2_c00022
[summary] best-by-k (survivors; target=16):
  k=4 best_d_ub=20 count_survivors=20 example_id=C2xC2xC2_c00023
  k=8 best_d_ub=16 count_survivors=3 example_id=C2xC2xC2_c00022
[pilot] top results:
  01 group=C2xC2xC2 n=288 k=4 d_ub=20 permA=7 permB=20 saved=True
  02 group=C2xC2xC2 n=288 k=4 d_ub=20 permA=11 permB=8 saved=True
  03 group=C2xC2xC2 n=288 k=4 d_ub=20 permA=27 permB=20 saved=True
  04 group=C2xC2xC2 n=288 k=4 d_ub=20 permA=11 permB=20 saved=True
  05 group=C2xC2xC2 n=288 k=4 d_ub=20 permA=11 permB=8 saved=True
  06 group=C2xC2xC2 n=288 k=4 d_ub=20 permA=27 permB=11 saved=True
  07 group=C2xC2xC2 n=288 k=4 d_ub=20 permA=27 permB=7 saved=True
  08 group=C2xC2xC2 n=288 k=4 d_ub=20 permA=8 permB=7 saved=True
  09 group=C2xC2xC2 n=288 k=4 d_ub=19 permA=12 permB=20 saved=True
  10 group=C2xC2xC2 n=288 k=4 d_ub=19 permA=11 permB=20 saved=True

