=== mar. 20 janv. 2026 15:02:48 CET steps=5000 batch=22 seed=1768922125 ===
[pilot] base k_table top pairs:
  k_base=18 permA=0 permB=0
  k_base=12 permA=29 permB=0
  k_base=12 permA=22 permB=0
  k_base=12 permA=13 permB=0
  k_base=12 permA=6 permB=0
[pilot] A multisets raw=792 (expected=792) enum_mode=multiset cayley_unique=26 perms=30 -> total scored = 780
[pilot] B multisets raw=792 (expected=792) enum_mode=multiset cayley_unique=26 perms=30 -> total scored = 780
[pilot] A frontier kept 128 candidates with points: (4,20), (0,49)
[pilot] B frontier kept 128 candidates with points: (4,20), (0,49)
[pilot] C2xC2xC2 n=288 d0=17 A_sets=26*30 -> keep 128; B_sets=26*30 -> keep 128
[pilot] MEAS n=288 k=4 dx_ub=20 dz_ub=20 d_ub=20 steps=5000 id=C2xC2xC2_c00027
[saved] id=C2xC2xC2_c00027 -> results/c2xc2xc2_d16_20260120_150248/promising/C2xC2xC2_c00027 (reason: d>=sqrt(n))
[pilot] MEAS n=288 k=8 dx_ub=17 dz_ub=18 d_ub=17 steps=5000 id=C2xC2xC2_c00029
[saved] id=C2xC2xC2_c00029 -> results/c2xc2xc2_d16_20260120_150248/promising/C2xC2xC2_c00029 (reason: d>=sqrt(n))
[pilot] MEAS n=288 k=4 dx_ub=16 dz_ub=20 d_ub=16 steps=5000 id=C2xC2xC2_c00042
[pilot] TARGET_REJECT d_ub=12 target=16 id=C2xC2xC2_c00065
[pilot] MEAS n=288 k=4 dx_ub=21 dz_ub=20 d_ub=20 steps=5000 id=C2xC2xC2_c00072
[saved] id=C2xC2xC2_c00072 -> results/c2xc2xc2_d16_20260120_150248/promising/C2xC2xC2_c00072 (reason: d>=sqrt(n))
[pilot] MEAS n=288 k=4 dx_ub=16 dz_ub=20 d_ub=16 steps=5000 id=C2xC2xC2_c00074
[pilot] MEAS n=288 k=4 dx_ub=16 dz_ub=16 d_ub=16 steps=5000 id=C2xC2xC2_c00104
[pilot] MEAS n=288 k=4 dx_ub=16 dz_ub=16 d_ub=16 steps=5000 id=C2xC2xC2_c00116
[pilot] TARGET_REJECT d_ub=12 target=16 id=C2xC2xC2_c00124
[pilot] TARGET_REJECT d_ub=12 target=16 id=C2xC2xC2_c00153
[pilot] TARGET_REJECT d_ub=15 target=16 id=C2xC2xC2_c00200
[pilot] MEAS n=288 k=4 dx_ub=17 dz_ub=16 d_ub=16 steps=5000 id=C2xC2xC2_c00201
[pilot] TARGET_REJECT d_ub=14 target=16 id=C2xC2xC2_c00259
[pilot] MEAS n=288 k=4 dx_ub=16 dz_ub=16 d_ub=16 steps=5000 id=C2xC2xC2_c00268
[pilot] MEAS n=288 k=4 dx_ub=20 dz_ub=16 d_ub=16 steps=5000 id=C2xC2xC2_c00276
[pilot] TARGET_REJECT d_ub=14 target=16 id=C2xC2xC2_c00323
[pilot] MEAS n=288 k=4 dx_ub=20 dz_ub=16 d_ub=16 steps=5000 id=C2xC2xC2_c00329
[pilot] MEAS n=288 k=4 dx_ub=20 dz_ub=20 d_ub=20 steps=5000 id=C2xC2xC2_c00374
[saved] id=C2xC2xC2_c00374 -> results/c2xc2xc2_d16_20260120_150248/promising/C2xC2xC2_c00374 (reason: d>=sqrt(n))
[pilot] TARGET_REJECT d_ub=14 target=16 id=C2xC2xC2_c00388
[pilot] MEAS n=288 k=8 dx_ub=16 dz_ub=16 d_ub=16 steps=5000 id=C2xC2xC2_c00390
[pilot] MEAS n=288 k=4 dx_ub=21 dz_ub=16 d_ub=16 steps=5000 id=C2xC2xC2_c00397
[pilot] MEAS n=288 k=4 dx_ub=20 dz_ub=20 d_ub=20 steps=5000 id=C2xC2xC2_c00418
[saved] id=C2xC2xC2_c00418 -> results/c2xc2xc2_d16_20260120_150248/promising/C2xC2xC2_c00418 (reason: d>=sqrt(n))
[pilot] MEAS n=288 k=4 dx_ub=20 dz_ub=20 d_ub=20 steps=5000 id=C2xC2xC2_c00425
[saved] id=C2xC2xC2_c00425 -> results/c2xc2xc2_d16_20260120_150248/promising/C2xC2xC2_c00425 (reason: d>=sqrt(n))
[pilot] MEAS n=288 k=4 dx_ub=16 dz_ub=16 d_ub=16 steps=5000 id=C2xC2xC2_c00428
[pilot] MEAS n=288 k=4 dx_ub=20 dz_ub=20 d_ub=20 steps=5000 id=C2xC2xC2_c00437
[saved] id=C2xC2xC2_c00437 -> results/c2xc2xc2_d16_20260120_150248/promising/C2xC2xC2_c00437 (reason: d>=sqrt(n))
[pilot] MEAS n=288 k=4 dx_ub=20 dz_ub=22 d_ub=20 steps=5000 id=C2xC2xC2_c00444
[saved] id=C2xC2xC2_c00444 -> results/c2xc2xc2_d16_20260120_150248/promising/C2xC2xC2_c00444 (reason: d>=sqrt(n))
[pilot] MEAS n=288 k=4 dx_ub=20 dz_ub=20 d_ub=20 steps=5000 id=C2xC2xC2_c00468
[saved] id=C2xC2xC2_c00468 -> results/c2xc2xc2_d16_20260120_150248/promising/C2xC2xC2_c00468 (reason: d>=sqrt(n))
[pilot] MEAS n=288 k=4 dx_ub=16 dz_ub=16 d_ub=16 steps=5000 id=C2xC2xC2_c00474
[pilot] TARGET_REJECT d_ub=14 target=16 id=C2xC2xC2_c00490
[best_by_k] group=C2xC2xC2 n=288
k  | d_ub | steps | dx_ub | dz_ub | id
 4 |   20 |  5000 |    20 |    20 | C2xC2xC2_c00027
 8 |   17 |  5000 |    17 |    18 | C2xC2xC2_c00029
[coverage] group=C2xC2xC2 A_sel=128 B_sel=128 Q_meas=29 ratio_ge_sqrt=0.001 ratio_sel=0.002
[coverage] run summary:
[coverage] group=C2xC2xC2 A_sel=128 B_sel=128 Q_meas=29 ratio_ge_sqrt=0.001 ratio_sel=0.002
[summary] best-by-k (measured; includes rejects):
  k=4 best_d_ub=20 count_measured=22 example_id=C2xC2xC2_c00027
  k=8 best_d_ub=17 count_measured=7 example_id=C2xC2xC2_c00029
[summary] best-by-k (survivors; target=16):
  k=4 best_d_ub=20 count_survivors=19 example_id=C2xC2xC2_c00027
  k=8 best_d_ub=17 count_survivors=2 example_id=C2xC2xC2_c00029
[pilot] top results:
  01 group=C2xC2xC2 n=288 k=4 d_ub=20 permA=7 permB=27 saved=True
  02 group=C2xC2xC2 n=288 k=4 d_ub=20 permA=27 permB=8 saved=True
  03 group=C2xC2xC2 n=288 k=4 d_ub=20 permA=12 permB=8 saved=True
  04 group=C2xC2xC2 n=288 k=4 d_ub=20 permA=27 permB=8 saved=True
  05 group=C2xC2xC2 n=288 k=4 d_ub=20 permA=11 permB=12 saved=True
  06 group=C2xC2xC2 n=288 k=4 d_ub=20 permA=12 permB=27 saved=True
  07 group=C2xC2xC2 n=288 k=4 d_ub=20 permA=11 permB=20 saved=True
  08 group=C2xC2xC2 n=288 k=4 d_ub=20 permA=11 permB=8 saved=True
  09 group=C2xC2xC2 n=288 k=8 d_ub=17 permA=11 permB=20 saved=True
  10 group=C2xC2xC2 n=288 k=8 d_ub=16 permA=27 permB=8 saved=False

