=== mar. 20 janv. 2026 22:24:59 CET steps=20000 batch=10 seed=1768937113 ===
[pilot] base k_table top pairs:
  k_base=18 permA=0 permB=0
  k_base=12 permA=29 permB=0
  k_base=12 permA=22 permB=0
  k_base=12 permA=13 permB=0
  k_base=12 permA=6 permB=0
[pilot] A multisets raw=792 (expected=792) enum_mode=multiset cayley_unique=26 perms=30 -> total scored = 780
[pilot] B multisets raw=792 (expected=792) enum_mode=multiset cayley_unique=26 perms=30 -> total scored = 780
[pilot] A frontier kept 128 candidates with points: (4,20), (0,49)
[pilot] B frontier kept 128 candidates with points: (4,20), (0,49)
[pilot] C2xC2xC2 n=288 d0=17 A_sets=26*30 -> keep 128; B_sets=26*30 -> keep 128
[pilot] TARGET_REJECT d_ub=14 target=16 id=C2xC2xC2_c00058
[pilot] TARGET_REJECT d_ub=14 target=16 id=C2xC2xC2_c00071
[pilot] MEAS n=288 k=4 dx_ub=20 dz_ub=16 d_ub=16 steps=20000 id=C2xC2xC2_c00084
[pilot] TARGET_REJECT d_ub=12 target=16 id=C2xC2xC2_c00095
[pilot] MEAS n=288 k=4 dx_ub=20 dz_ub=16 d_ub=16 steps=20000 id=C2xC2xC2_c00101
[pilot] MEAS n=288 k=4 dx_ub=20 dz_ub=16 d_ub=16 steps=20000 id=C2xC2xC2_c00124
[pilot] MEAS n=288 k=8 dx_ub=16 dz_ub=16 d_ub=16 steps=20000 id=C2xC2xC2_c00129
[pilot] TARGET_REJECT d_ub=12 target=16 id=C2xC2xC2_c00167
[pilot] MEAS n=288 k=4 dx_ub=16 dz_ub=16 d_ub=16 steps=20000 id=C2xC2xC2_c00180
[pilot] MEAS n=288 k=4 dx_ub=16 dz_ub=16 d_ub=16 steps=20000 id=C2xC2xC2_c00204
[pilot] MEAS n=288 k=4 dx_ub=18 dz_ub=20 d_ub=18 steps=20000 id=C2xC2xC2_c00223
[saved] id=C2xC2xC2_c00223 -> results/c2xc2xc2_d16_20260120_222459/promising/C2xC2xC2_c00223 (reason: d>=sqrt(n))
[pilot] TARGET_REJECT d_ub=12 target=16 id=C2xC2xC2_c00224
[pilot] MEAS n=288 k=8 dx_ub=17 dz_ub=20 d_ub=17 steps=20000 id=C2xC2xC2_c00242
[saved] id=C2xC2xC2_c00242 -> results/c2xc2xc2_d16_20260120_222459/promising/C2xC2xC2_c00242 (reason: d>=sqrt(n))
[pilot] MEAS n=288 k=4 dx_ub=20 dz_ub=19 d_ub=19 steps=20000 id=C2xC2xC2_c00252
[saved] id=C2xC2xC2_c00252 -> results/c2xc2xc2_d16_20260120_222459/promising/C2xC2xC2_c00252 (reason: d>=sqrt(n))
[pilot] MEAS n=288 k=4 dx_ub=20 dz_ub=20 d_ub=20 steps=20000 id=C2xC2xC2_c00277
[saved] id=C2xC2xC2_c00277 -> results/c2xc2xc2_d16_20260120_222459/promising/C2xC2xC2_c00277 (reason: d>=sqrt(n))
[pilot] MEAS n=288 k=4 dx_ub=16 dz_ub=19 d_ub=16 steps=20000 id=C2xC2xC2_c00283
[pilot] TARGET_REJECT d_ub=14 target=16 id=C2xC2xC2_c00285
[pilot] MEAS n=288 k=4 dx_ub=19 dz_ub=20 d_ub=19 steps=20000 id=C2xC2xC2_c00289
[saved] id=C2xC2xC2_c00289 -> results/c2xc2xc2_d16_20260120_222459/promising/C2xC2xC2_c00289 (reason: d>=sqrt(n))
[pilot] MEAS n=288 k=4 dx_ub=18 dz_ub=16 d_ub=16 steps=20000 id=C2xC2xC2_c00292
[pilot] MEAS n=288 k=4 dx_ub=20 dz_ub=20 d_ub=20 steps=20000 id=C2xC2xC2_c00308
[saved] id=C2xC2xC2_c00308 -> results/c2xc2xc2_d16_20260120_222459/promising/C2xC2xC2_c00308 (reason: d>=sqrt(n))
[pilot] MEAS n=288 k=4 dx_ub=17 dz_ub=20 d_ub=17 steps=20000 id=C2xC2xC2_c00311
[saved] id=C2xC2xC2_c00311 -> results/c2xc2xc2_d16_20260120_222459/promising/C2xC2xC2_c00311 (reason: d>=sqrt(n))
[pilot] MEAS n=288 k=4 dx_ub=16 dz_ub=16 d_ub=16 steps=20000 id=C2xC2xC2_c00343
[pilot] TARGET_REJECT d_ub=14 target=16 id=C2xC2xC2_c00391
[pilot] TARGET_REJECT d_ub=12 target=16 id=C2xC2xC2_c00407
[pilot] TARGET_REJECT d_ub=12 target=16 id=C2xC2xC2_c00416
[pilot] MEAS n=288 k=4 dx_ub=20 dz_ub=18 d_ub=18 steps=20000 id=C2xC2xC2_c00423
[saved] id=C2xC2xC2_c00423 -> results/c2xc2xc2_d16_20260120_222459/promising/C2xC2xC2_c00423 (reason: d>=sqrt(n))
[pilot] TARGET_REJECT d_ub=6 target=16 id=C2xC2xC2_c00426
[pilot] MEAS n=288 k=4 dx_ub=16 dz_ub=16 d_ub=16 steps=20000 id=C2xC2xC2_c00432
[pilot] MEAS n=288 k=8 dx_ub=16 dz_ub=18 d_ub=16 steps=20000 id=C2xC2xC2_c00441
[pilot] MEAS n=288 k=4 dx_ub=17 dz_ub=16 d_ub=16 steps=20000 id=C2xC2xC2_c00460
[best_by_k] group=C2xC2xC2 n=288
k  | d_ub | steps | dx_ub | dz_ub | id
 4 |   20 | 20000 |    20 |    20 | C2xC2xC2_c00277
 8 |   17 | 20000 |    17 |    20 | C2xC2xC2_c00242
[coverage] group=C2xC2xC2 A_sel=128 B_sel=128 Q_meas=30 ratio_ge_sqrt=0.001 ratio_sel=0.002
[coverage] run summary:
[coverage] group=C2xC2xC2 A_sel=128 B_sel=128 Q_meas=30 ratio_ge_sqrt=0.001 ratio_sel=0.002
[summary] best-by-k (measured; includes rejects):
  k=4 best_d_ub=20 count_measured=19 example_id=C2xC2xC2_c00277
  k=8 best_d_ub=17 count_measured=11 example_id=C2xC2xC2_c00242
[summary] best-by-k (survivors; target=16):
  k=4 best_d_ub=20 count_survivors=17 example_id=C2xC2xC2_c00277
  k=8 best_d_ub=17 count_survivors=3 example_id=C2xC2xC2_c00242
[pilot] top results:
  01 group=C2xC2xC2 n=288 k=4 d_ub=20 permA=11 permB=12 saved=True
  02 group=C2xC2xC2 n=288 k=4 d_ub=20 permA=20 permB=12 saved=True
  03 group=C2xC2xC2 n=288 k=4 d_ub=19 permA=8 permB=11 saved=True
  04 group=C2xC2xC2 n=288 k=4 d_ub=19 permA=20 permB=12 saved=True
  05 group=C2xC2xC2 n=288 k=4 d_ub=18 permA=12 permB=27 saved=True
  06 group=C2xC2xC2 n=288 k=4 d_ub=18 permA=20 permB=11 saved=True
  07 group=C2xC2xC2 n=288 k=8 d_ub=17 permA=20 permB=12 saved=True
  08 group=C2xC2xC2 n=288 k=4 d_ub=17 permA=20 permB=8 saved=True
  09 group=C2xC2xC2 n=288 k=8 d_ub=16 permA=12 permB=20 saved=False
  10 group=C2xC2xC2 n=288 k=8 d_ub=16 permA=11 permB=20 saved=False

