=== mar. 20 janv. 2026 14:55:40 CET steps=5000 batch=8 seed=1768922111 ===
[pilot] base k_table top pairs:
  k_base=18 permA=0 permB=0
  k_base=12 permA=29 permB=0
  k_base=12 permA=22 permB=0
  k_base=12 permA=13 permB=0
  k_base=12 permA=6 permB=0
[pilot] A multisets raw=792 (expected=792) enum_mode=multiset cayley_unique=26 perms=30 -> total scored = 780
[pilot] B multisets raw=792 (expected=792) enum_mode=multiset cayley_unique=26 perms=30 -> total scored = 780
[pilot] A frontier kept 128 candidates with points: (4,20), (0,49)
[pilot] B frontier kept 128 candidates with points: (4,20), (0,49)
[pilot] C2xC2xC2 n=288 d0=17 A_sets=26*30 -> keep 128; B_sets=26*30 -> keep 128
[pilot] MEAS n=288 k=4 dx_ub=16 dz_ub=16 d_ub=16 steps=5000 id=C2xC2xC2_c00008
[pilot] MEAS n=288 k=4 dx_ub=16 dz_ub=16 d_ub=16 steps=5000 id=C2xC2xC2_c00012
[pilot] TARGET_REJECT d_ub=6 target=16 id=C2xC2xC2_c00023
[pilot] TARGET_REJECT d_ub=12 target=16 id=C2xC2xC2_c00049
[pilot] MEAS n=288 k=4 dx_ub=17 dz_ub=16 d_ub=16 steps=5000 id=C2xC2xC2_c00068
[pilot] MEAS n=288 k=4 dx_ub=20 dz_ub=20 d_ub=20 steps=5000 id=C2xC2xC2_c00071
[saved] id=C2xC2xC2_c00071 -> results/c2xc2xc2_d16_20260120_145540/promising/C2xC2xC2_c00071 (reason: d>=sqrt(n))
[pilot] MEAS n=288 k=4 dx_ub=17 dz_ub=16 d_ub=16 steps=5000 id=C2xC2xC2_c00090
[pilot] MEAS n=288 k=4 dx_ub=16 dz_ub=20 d_ub=16 steps=5000 id=C2xC2xC2_c00146
[pilot] MEAS n=288 k=4 dx_ub=16 dz_ub=16 d_ub=16 steps=5000 id=C2xC2xC2_c00183
[pilot] MEAS n=288 k=4 dx_ub=20 dz_ub=20 d_ub=20 steps=5000 id=C2xC2xC2_c00200
[saved] id=C2xC2xC2_c00200 -> results/c2xc2xc2_d16_20260120_145540/promising/C2xC2xC2_c00200 (reason: d>=sqrt(n))
[pilot] TARGET_REJECT d_ub=12 target=16 id=C2xC2xC2_c00222
[pilot] MEAS n=288 k=4 dx_ub=16 dz_ub=16 d_ub=16 steps=5000 id=C2xC2xC2_c00232
[pilot] MEAS n=288 k=4 dx_ub=20 dz_ub=20 d_ub=20 steps=5000 id=C2xC2xC2_c00240
[saved] id=C2xC2xC2_c00240 -> results/c2xc2xc2_d16_20260120_145540/promising/C2xC2xC2_c00240 (reason: d>=sqrt(n))
[pilot] MEAS n=288 k=8 dx_ub=16 dz_ub=18 d_ub=16 steps=5000 id=C2xC2xC2_c00257
[pilot] TARGET_REJECT d_ub=14 target=16 id=C2xC2xC2_c00292
[pilot] TARGET_REJECT d_ub=12 target=16 id=C2xC2xC2_c00297
[pilot] MEAS n=288 k=4 dx_ub=16 dz_ub=20 d_ub=16 steps=5000 id=C2xC2xC2_c00334
[pilot] MEAS n=288 k=8 dx_ub=16 dz_ub=18 d_ub=16 steps=5000 id=C2xC2xC2_c00355
[pilot] MEAS n=288 k=4 dx_ub=20 dz_ub=20 d_ub=20 steps=5000 id=C2xC2xC2_c00364
[saved] id=C2xC2xC2_c00364 -> results/c2xc2xc2_d16_20260120_145540/promising/C2xC2xC2_c00364 (reason: d>=sqrt(n))
[pilot] MEAS n=288 k=8 dx_ub=16 dz_ub=18 d_ub=16 steps=5000 id=C2xC2xC2_c00383
[pilot] MEAS n=288 k=4 dx_ub=20 dz_ub=20 d_ub=20 steps=5000 id=C2xC2xC2_c00386
[saved] id=C2xC2xC2_c00386 -> results/c2xc2xc2_d16_20260120_145540/promising/C2xC2xC2_c00386 (reason: d>=sqrt(n))
[pilot] MEAS n=288 k=4 dx_ub=16 dz_ub=20 d_ub=16 steps=5000 id=C2xC2xC2_c00395
[pilot] MEAS n=288 k=4 dx_ub=20 dz_ub=17 d_ub=17 steps=5000 id=C2xC2xC2_c00400
[saved] id=C2xC2xC2_c00400 -> results/c2xc2xc2_d16_20260120_145540/promising/C2xC2xC2_c00400 (reason: d>=sqrt(n))
[pilot] MEAS n=288 k=4 dx_ub=20 dz_ub=19 d_ub=19 steps=5000 id=C2xC2xC2_c00417
[saved] id=C2xC2xC2_c00417 -> results/c2xc2xc2_d16_20260120_145540/promising/C2xC2xC2_c00417 (reason: d>=sqrt(n))
[pilot] MEAS n=288 k=4 dx_ub=16 dz_ub=16 d_ub=16 steps=5000 id=C2xC2xC2_c00421
[pilot] MEAS n=288 k=4 dx_ub=16 dz_ub=18 d_ub=16 steps=5000 id=C2xC2xC2_c00434
[pilot] MEAS n=288 k=4 dx_ub=17 dz_ub=20 d_ub=17 steps=5000 id=C2xC2xC2_c00459
[saved] id=C2xC2xC2_c00459 -> results/c2xc2xc2_d16_20260120_145540/promising/C2xC2xC2_c00459 (reason: d>=sqrt(n))
[pilot] MEAS n=288 k=4 dx_ub=17 dz_ub=16 d_ub=16 steps=5000 id=C2xC2xC2_c00463
[best_by_k] group=C2xC2xC2 n=288
k  | d_ub | steps | dx_ub | dz_ub | id
 4 |   20 |  5000 |    20 |    20 | C2xC2xC2_c00071
 8 |   16 |  5000 |    16 |    18 | C2xC2xC2_c00257
[coverage] group=C2xC2xC2 A_sel=128 B_sel=128 Q_meas=28 ratio_ge_sqrt=0.001 ratio_sel=0.002
[coverage] run summary:
[coverage] group=C2xC2xC2 A_sel=128 B_sel=128 Q_meas=28 ratio_ge_sqrt=0.001 ratio_sel=0.002
[summary] best-by-k (measured; includes rejects):
  k=4 best_d_ub=20 count_measured=21 example_id=C2xC2xC2_c00071
  k=8 best_d_ub=16 count_measured=7 example_id=C2xC2xC2_c00257
[summary] best-by-k (survivors; target=16):
  k=4 best_d_ub=20 count_survivors=20 example_id=C2xC2xC2_c00071
  k=8 best_d_ub=16 count_survivors=3 example_id=C2xC2xC2_c00257
[pilot] top results:
  01 group=C2xC2xC2 n=288 k=4 d_ub=20 permA=11 permB=8 saved=True
  02 group=C2xC2xC2 n=288 k=4 d_ub=20 permA=11 permB=20 saved=True
  03 group=C2xC2xC2 n=288 k=4 d_ub=20 permA=12 permB=11 saved=True
  04 group=C2xC2xC2 n=288 k=4 d_ub=20 permA=20 permB=20 saved=True
  05 group=C2xC2xC2 n=288 k=4 d_ub=20 permA=11 permB=12 saved=True
  06 group=C2xC2xC2 n=288 k=4 d_ub=19 permA=12 permB=27 saved=True
  07 group=C2xC2xC2 n=288 k=4 d_ub=17 permA=11 permB=27 saved=True
  08 group=C2xC2xC2 n=288 k=4 d_ub=17 permA=20 permB=27 saved=True
  09 group=C2xC2xC2 n=288 k=8 d_ub=16 permA=11 permB=8 saved=False
  10 group=C2xC2xC2 n=288 k=8 d_ub=16 permA=7 permB=8 saved=False

