=== mer. 21 janv. 2026 04:26:07 CET steps=20000 batch=29 seed=1768937132 ===
[pilot] base k_table top pairs:
  k_base=18 permA=0 permB=0
  k_base=12 permA=29 permB=0
  k_base=12 permA=22 permB=0
  k_base=12 permA=13 permB=0
  k_base=12 permA=6 permB=0
[pilot] A multisets raw=792 (expected=792) enum_mode=multiset cayley_unique=26 perms=30 -> total scored = 780
[pilot] B multisets raw=792 (expected=792) enum_mode=multiset cayley_unique=26 perms=30 -> total scored = 780
[pilot] A frontier kept 128 candidates with points: (4,20), (0,49)
[pilot] B frontier kept 128 candidates with points: (4,20), (0,49)
[pilot] C2xC2xC2 n=288 d0=17 A_sets=26*30 -> keep 128; B_sets=26*30 -> keep 128
[pilot] MEAS n=288 k=4 dx_ub=20 dz_ub=16 d_ub=16 steps=20000 id=C2xC2xC2_c00017
[pilot] MEAS n=288 k=4 dx_ub=17 dz_ub=20 d_ub=17 steps=20000 id=C2xC2xC2_c00069
[saved] id=C2xC2xC2_c00069 -> results/c2xc2xc2_d16_20260121_042607/promising/C2xC2xC2_c00069 (reason: d>=sqrt(n))
[pilot] MEAS n=288 k=4 dx_ub=17 dz_ub=20 d_ub=17 steps=20000 id=C2xC2xC2_c00088
[saved] id=C2xC2xC2_c00088 -> results/c2xc2xc2_d16_20260121_042607/promising/C2xC2xC2_c00088 (reason: d>=sqrt(n))
[pilot] MEAS n=288 k=4 dx_ub=17 dz_ub=16 d_ub=16 steps=20000 id=C2xC2xC2_c00090
[pilot] TARGET_REJECT d_ub=12 target=16 id=C2xC2xC2_c00102
[pilot] TARGET_REJECT d_ub=12 target=16 id=C2xC2xC2_c00104
[pilot] MEAS n=288 k=4 dx_ub=17 dz_ub=16 d_ub=16 steps=20000 id=C2xC2xC2_c00107
[pilot] MEAS n=288 k=8 dx_ub=16 dz_ub=17 d_ub=16 steps=20000 id=C2xC2xC2_c00117
[pilot] MEAS n=288 k=8 dx_ub=16 dz_ub=18 d_ub=16 steps=20000 id=C2xC2xC2_c00138
[pilot] MEAS n=288 k=4 dx_ub=20 dz_ub=20 d_ub=20 steps=20000 id=C2xC2xC2_c00149
[saved] id=C2xC2xC2_c00149 -> results/c2xc2xc2_d16_20260121_042607/promising/C2xC2xC2_c00149 (reason: d>=sqrt(n))
[pilot] MEAS n=288 k=4 dx_ub=18 dz_ub=16 d_ub=16 steps=20000 id=C2xC2xC2_c00162
[pilot] MEAS n=288 k=4 dx_ub=19 dz_ub=20 d_ub=19 steps=20000 id=C2xC2xC2_c00188
[saved] id=C2xC2xC2_c00188 -> results/c2xc2xc2_d16_20260121_042607/promising/C2xC2xC2_c00188 (reason: d>=sqrt(n))
[pilot] MEAS n=288 k=4 dx_ub=20 dz_ub=16 d_ub=16 steps=20000 id=C2xC2xC2_c00225
[pilot] TARGET_REJECT d_ub=12 target=16 id=C2xC2xC2_c00242
[pilot] MEAS n=288 k=4 dx_ub=16 dz_ub=17 d_ub=16 steps=20000 id=C2xC2xC2_c00251
[pilot] MEAS n=288 k=4 dx_ub=20 dz_ub=18 d_ub=18 steps=20000 id=C2xC2xC2_c00252
[saved] id=C2xC2xC2_c00252 -> results/c2xc2xc2_d16_20260121_042607/promising/C2xC2xC2_c00252 (reason: d>=sqrt(n))
[pilot] MEAS n=288 k=4 dx_ub=16 dz_ub=16 d_ub=16 steps=20000 id=C2xC2xC2_c00274
[pilot] TARGET_REJECT d_ub=6 target=16 id=C2xC2xC2_c00275
[pilot] MEAS n=288 k=4 dx_ub=20 dz_ub=20 d_ub=20 steps=20000 id=C2xC2xC2_c00365
[saved] id=C2xC2xC2_c00365 -> results/c2xc2xc2_d16_20260121_042607/promising/C2xC2xC2_c00365 (reason: d>=sqrt(n))
[pilot] MEAS n=288 k=4 dx_ub=20 dz_ub=16 d_ub=16 steps=20000 id=C2xC2xC2_c00371
[pilot] MEAS n=288 k=4 dx_ub=20 dz_ub=20 d_ub=20 steps=20000 id=C2xC2xC2_c00420
[saved] id=C2xC2xC2_c00420 -> results/c2xc2xc2_d16_20260121_042607/promising/C2xC2xC2_c00420 (reason: d>=sqrt(n))
[pilot] MEAS n=288 k=4 dx_ub=17 dz_ub=16 d_ub=16 steps=20000 id=C2xC2xC2_c00426
[pilot] MEAS n=288 k=4 dx_ub=18 dz_ub=16 d_ub=16 steps=20000 id=C2xC2xC2_c00442
[pilot] MEAS n=288 k=4 dx_ub=17 dz_ub=19 d_ub=17 steps=20000 id=C2xC2xC2_c00449
[saved] id=C2xC2xC2_c00449 -> results/c2xc2xc2_d16_20260121_042607/promising/C2xC2xC2_c00449 (reason: d>=sqrt(n))
[pilot] MEAS n=288 k=4 dx_ub=16 dz_ub=18 d_ub=16 steps=20000 id=C2xC2xC2_c00450
[pilot] TARGET_REJECT d_ub=12 target=16 id=C2xC2xC2_c00473
[pilot] MEAS n=288 k=4 dx_ub=20 dz_ub=20 d_ub=20 steps=20000 id=C2xC2xC2_c00491
[saved] id=C2xC2xC2_c00491 -> results/c2xc2xc2_d16_20260121_042607/promising/C2xC2xC2_c00491 (reason: d>=sqrt(n))
[best_by_k] group=C2xC2xC2 n=288
k  | d_ub | steps | dx_ub | dz_ub | id
 4 |   20 | 20000 |    20 |    20 | C2xC2xC2_c00149
 8 |   16 | 20000 |    16 |    17 | C2xC2xC2_c00117
[coverage] group=C2xC2xC2 A_sel=128 B_sel=128 Q_meas=27 ratio_ge_sqrt=0.000 ratio_sel=0.002
[coverage] run summary:
[coverage] group=C2xC2xC2 A_sel=128 B_sel=128 Q_meas=27 ratio_ge_sqrt=0.000 ratio_sel=0.002
[summary] best-by-k (measured; includes rejects):
  k=4 best_d_ub=20 count_measured=22 example_id=C2xC2xC2_c00149
  k=8 best_d_ub=16 count_measured=5 example_id=C2xC2xC2_c00117
[summary] best-by-k (survivors; target=16):
  k=4 best_d_ub=20 count_survivors=20 example_id=C2xC2xC2_c00149
  k=8 best_d_ub=16 count_survivors=2 example_id=C2xC2xC2_c00117
[pilot] top results:
  01 group=C2xC2xC2 n=288 k=4 d_ub=20 permA=8 permB=12 saved=True
  02 group=C2xC2xC2 n=288 k=4 d_ub=20 permA=11 permB=12 saved=True
  03 group=C2xC2xC2 n=288 k=4 d_ub=20 permA=27 permB=11 saved=True
  04 group=C2xC2xC2 n=288 k=4 d_ub=20 permA=20 permB=27 saved=True
  05 group=C2xC2xC2 n=288 k=4 d_ub=19 permA=8 permB=27 saved=True
  06 group=C2xC2xC2 n=288 k=4 d_ub=18 permA=11 permB=27 saved=True
  07 group=C2xC2xC2 n=288 k=4 d_ub=17 permA=7 permB=27 saved=True
  08 group=C2xC2xC2 n=288 k=4 d_ub=17 permA=8 permB=20 saved=True
  09 group=C2xC2xC2 n=288 k=4 d_ub=17 permA=27 permB=8 saved=True
  10 group=C2xC2xC2 n=288 k=8 d_ub=16 permA=20 permB=11 saved=False

