=== mar. 20 janv. 2026 15:09:57 CET steps=5000 batch=35 seed=1768922138 ===
[pilot] base k_table top pairs:
  k_base=18 permA=0 permB=0
  k_base=12 permA=29 permB=0
  k_base=12 permA=22 permB=0
  k_base=12 permA=13 permB=0
  k_base=12 permA=6 permB=0
[pilot] A multisets raw=792 (expected=792) enum_mode=multiset cayley_unique=26 perms=30 -> total scored = 780
[pilot] B multisets raw=792 (expected=792) enum_mode=multiset cayley_unique=26 perms=30 -> total scored = 780
[pilot] A frontier kept 128 candidates with points: (4,20), (0,49)
[pilot] B frontier kept 128 candidates with points: (4,20), (0,49)
[pilot] C2xC2xC2 n=288 d0=17 A_sets=26*30 -> keep 128; B_sets=26*30 -> keep 128
[pilot] MEAS n=288 k=4 dx_ub=20 dz_ub=20 d_ub=20 steps=5000 id=C2xC2xC2_c00005
[saved] id=C2xC2xC2_c00005 -> results/c2xc2xc2_d16_20260120_150957/promising/C2xC2xC2_c00005 (reason: d>=sqrt(n))
[pilot] MEAS n=288 k=4 dx_ub=20 dz_ub=20 d_ub=20 steps=5000 id=C2xC2xC2_c00039
[saved] id=C2xC2xC2_c00039 -> results/c2xc2xc2_d16_20260120_150957/promising/C2xC2xC2_c00039 (reason: d>=sqrt(n))
[pilot] TARGET_REJECT d_ub=15 target=16 id=C2xC2xC2_c00075
[pilot] MEAS n=288 k=4 dx_ub=16 dz_ub=16 d_ub=16 steps=5000 id=C2xC2xC2_c00076
[pilot] TARGET_REJECT d_ub=6 target=16 id=C2xC2xC2_c00086
[pilot] MEAS n=288 k=4 dx_ub=20 dz_ub=20 d_ub=20 steps=5000 id=C2xC2xC2_c00091
[saved] id=C2xC2xC2_c00091 -> results/c2xc2xc2_d16_20260120_150957/promising/C2xC2xC2_c00091 (reason: d>=sqrt(n))
[pilot] MEAS n=288 k=4 dx_ub=17 dz_ub=16 d_ub=16 steps=5000 id=C2xC2xC2_c00101
[pilot] MEAS n=288 k=4 dx_ub=18 dz_ub=16 d_ub=16 steps=5000 id=C2xC2xC2_c00109
[pilot] MEAS n=288 k=4 dx_ub=20 dz_ub=20 d_ub=20 steps=5000 id=C2xC2xC2_c00113
[saved] id=C2xC2xC2_c00113 -> results/c2xc2xc2_d16_20260120_150957/promising/C2xC2xC2_c00113 (reason: d>=sqrt(n))
[pilot] TARGET_REJECT d_ub=11 target=16 id=C2xC2xC2_c00124
[pilot] TARGET_REJECT d_ub=12 target=16 id=C2xC2xC2_c00136
[pilot] TARGET_REJECT d_ub=12 target=16 id=C2xC2xC2_c00147
[pilot] MEAS n=288 k=4 dx_ub=21 dz_ub=20 d_ub=20 steps=5000 id=C2xC2xC2_c00161
[saved] id=C2xC2xC2_c00161 -> results/c2xc2xc2_d16_20260120_150957/promising/C2xC2xC2_c00161 (reason: d>=sqrt(n))
[pilot] MEAS n=288 k=4 dx_ub=20 dz_ub=16 d_ub=16 steps=5000 id=C2xC2xC2_c00183
[pilot] MEAS n=288 k=4 dx_ub=18 dz_ub=22 d_ub=18 steps=5000 id=C2xC2xC2_c00227
[saved] id=C2xC2xC2_c00227 -> results/c2xc2xc2_d16_20260120_150957/promising/C2xC2xC2_c00227 (reason: d>=sqrt(n))
[pilot] TARGET_REJECT d_ub=12 target=16 id=C2xC2xC2_c00308
[pilot] MEAS n=288 k=4 dx_ub=17 dz_ub=20 d_ub=17 steps=5000 id=C2xC2xC2_c00312
[saved] id=C2xC2xC2_c00312 -> results/c2xc2xc2_d16_20260120_150957/promising/C2xC2xC2_c00312 (reason: d>=sqrt(n))
[pilot] MEAS n=288 k=4 dx_ub=20 dz_ub=20 d_ub=20 steps=5000 id=C2xC2xC2_c00375
[saved] id=C2xC2xC2_c00375 -> results/c2xc2xc2_d16_20260120_150957/promising/C2xC2xC2_c00375 (reason: d>=sqrt(n))
[pilot] MEAS n=288 k=4 dx_ub=17 dz_ub=20 d_ub=17 steps=5000 id=C2xC2xC2_c00386
[saved] id=C2xC2xC2_c00386 -> results/c2xc2xc2_d16_20260120_150957/promising/C2xC2xC2_c00386 (reason: d>=sqrt(n))
[pilot] MEAS n=288 k=4 dx_ub=20 dz_ub=19 d_ub=19 steps=5000 id=C2xC2xC2_c00389
[saved] id=C2xC2xC2_c00389 -> results/c2xc2xc2_d16_20260120_150957/promising/C2xC2xC2_c00389 (reason: d>=sqrt(n))
[pilot] TARGET_REJECT d_ub=12 target=16 id=C2xC2xC2_c00390
[pilot] TARGET_REJECT d_ub=12 target=16 id=C2xC2xC2_c00405
[pilot] TARGET_REJECT d_ub=14 target=16 id=C2xC2xC2_c00431
[pilot] MEAS n=288 k=4 dx_ub=20 dz_ub=18 d_ub=18 steps=5000 id=C2xC2xC2_c00456
[saved] id=C2xC2xC2_c00456 -> results/c2xc2xc2_d16_20260120_150957/promising/C2xC2xC2_c00456 (reason: d>=sqrt(n))
[pilot] MEAS n=288 k=4 dx_ub=16 dz_ub=18 d_ub=16 steps=5000 id=C2xC2xC2_c00479
[pilot] MEAS n=288 k=4 dx_ub=20 dz_ub=20 d_ub=20 steps=5000 id=C2xC2xC2_c00491
[saved] id=C2xC2xC2_c00491 -> results/c2xc2xc2_d16_20260120_150957/promising/C2xC2xC2_c00491 (reason: d>=sqrt(n))
[best_by_k] group=C2xC2xC2 n=288
k  | d_ub | steps | dx_ub | dz_ub | id
 4 |   20 |  5000 |    20 |    20 | C2xC2xC2_c00005
[coverage] group=C2xC2xC2 A_sel=128 B_sel=128 Q_meas=26 ratio_ge_sqrt=0.000 ratio_sel=0.002
[coverage] run summary:
[coverage] group=C2xC2xC2 A_sel=128 B_sel=128 Q_meas=26 ratio_ge_sqrt=0.000 ratio_sel=0.002
[summary] best-by-k (measured; includes rejects):
  k=4 best_d_ub=20 count_measured=22 example_id=C2xC2xC2_c00005
  k=8 best_d_ub=14 count_measured=4 example_id=C2xC2xC2_c00431
[summary] best-by-k (survivors; target=16):
  k=4 best_d_ub=20 count_survivors=17 example_id=C2xC2xC2_c00005
[pilot] top results:
  01 group=C2xC2xC2 n=288 k=4 d_ub=20 permA=7 permB=27 saved=True
  02 group=C2xC2xC2 n=288 k=4 d_ub=20 permA=27 permB=20 saved=True
  03 group=C2xC2xC2 n=288 k=4 d_ub=20 permA=7 permB=8 saved=True
  04 group=C2xC2xC2 n=288 k=4 d_ub=20 permA=27 permB=11 saved=True
  05 group=C2xC2xC2 n=288 k=4 d_ub=20 permA=8 permB=11 saved=True
  06 group=C2xC2xC2 n=288 k=4 d_ub=20 permA=7 permB=20 saved=True
  07 group=C2xC2xC2 n=288 k=4 d_ub=20 permA=11 permB=12 saved=True
  08 group=C2xC2xC2 n=288 k=4 d_ub=19 permA=11 permB=12 saved=True
  09 group=C2xC2xC2 n=288 k=4 d_ub=18 permA=12 permB=27 saved=True
  10 group=C2xC2xC2 n=288 k=4 d_ub=18 permA=20 permB=11 saved=True

