=== mar. 20 janv. 2026 15:37:43 CET steps=5000 batch=80 seed=1768922183 ===
[pilot] base k_table top pairs:
  k_base=18 permA=0 permB=0
  k_base=12 permA=29 permB=0
  k_base=12 permA=22 permB=0
  k_base=12 permA=13 permB=0
  k_base=12 permA=6 permB=0
[pilot] A multisets raw=792 (expected=792) enum_mode=multiset cayley_unique=26 perms=30 -> total scored = 780
[pilot] B multisets raw=792 (expected=792) enum_mode=multiset cayley_unique=26 perms=30 -> total scored = 780
[pilot] A frontier kept 128 candidates with points: (4,20), (0,49)
[pilot] B frontier kept 128 candidates with points: (4,20), (0,49)
[pilot] C2xC2xC2 n=288 d0=17 A_sets=26*30 -> keep 128; B_sets=26*30 -> keep 128
[pilot] MEAS n=288 k=4 dx_ub=16 dz_ub=20 d_ub=16 steps=5000 id=C2xC2xC2_c00018
[pilot] MEAS n=288 k=4 dx_ub=20 dz_ub=20 d_ub=20 steps=5000 id=C2xC2xC2_c00024
[saved] id=C2xC2xC2_c00024 -> results/c2xc2xc2_d16_20260120_153743/promising/C2xC2xC2_c00024 (reason: d>=sqrt(n))
[pilot] MEAS n=288 k=4 dx_ub=20 dz_ub=20 d_ub=20 steps=5000 id=C2xC2xC2_c00026
[saved] id=C2xC2xC2_c00026 -> results/c2xc2xc2_d16_20260120_153743/promising/C2xC2xC2_c00026 (reason: d>=sqrt(n))
[pilot] TARGET_REJECT d_ub=12 target=16 id=C2xC2xC2_c00028
[pilot] TARGET_REJECT d_ub=15 target=16 id=C2xC2xC2_c00040
[pilot] TARGET_REJECT d_ub=13 target=16 id=C2xC2xC2_c00076
[pilot] MEAS n=288 k=4 dx_ub=16 dz_ub=17 d_ub=16 steps=5000 id=C2xC2xC2_c00129
[pilot] MEAS n=288 k=4 dx_ub=20 dz_ub=16 d_ub=16 steps=5000 id=C2xC2xC2_c00197
[pilot] TARGET_REJECT d_ub=12 target=16 id=C2xC2xC2_c00215
[pilot] TARGET_REJECT d_ub=12 target=16 id=C2xC2xC2_c00231
[pilot] MEAS n=288 k=8 dx_ub=16 dz_ub=16 d_ub=16 steps=5000 id=C2xC2xC2_c00234
[pilot] TARGET_REJECT d_ub=12 target=16 id=C2xC2xC2_c00256
[pilot] MEAS n=288 k=4 dx_ub=20 dz_ub=20 d_ub=20 steps=5000 id=C2xC2xC2_c00277
[saved] id=C2xC2xC2_c00277 -> results/c2xc2xc2_d16_20260120_153743/promising/C2xC2xC2_c00277 (reason: d>=sqrt(n))
[pilot] MEAS n=288 k=4 dx_ub=17 dz_ub=20 d_ub=17 steps=5000 id=C2xC2xC2_c00306
[saved] id=C2xC2xC2_c00306 -> results/c2xc2xc2_d16_20260120_153743/promising/C2xC2xC2_c00306 (reason: d>=sqrt(n))
[pilot] MEAS n=288 k=4 dx_ub=19 dz_ub=19 d_ub=19 steps=5000 id=C2xC2xC2_c00308
[saved] id=C2xC2xC2_c00308 -> results/c2xc2xc2_d16_20260120_153743/promising/C2xC2xC2_c00308 (reason: d>=sqrt(n))
[pilot] MEAS n=288 k=4 dx_ub=16 dz_ub=16 d_ub=16 steps=5000 id=C2xC2xC2_c00374
[pilot] MEAS n=288 k=4 dx_ub=19 dz_ub=20 d_ub=19 steps=5000 id=C2xC2xC2_c00382
[saved] id=C2xC2xC2_c00382 -> results/c2xc2xc2_d16_20260120_153743/promising/C2xC2xC2_c00382 (reason: d>=sqrt(n))
[pilot] TARGET_REJECT d_ub=12 target=16 id=C2xC2xC2_c00394
[pilot] MEAS n=288 k=4 dx_ub=20 dz_ub=20 d_ub=20 steps=5000 id=C2xC2xC2_c00398
[saved] id=C2xC2xC2_c00398 -> results/c2xc2xc2_d16_20260120_153743/promising/C2xC2xC2_c00398 (reason: d>=sqrt(n))
[pilot] MEAS n=288 k=4 dx_ub=19 dz_ub=20 d_ub=19 steps=5000 id=C2xC2xC2_c00409
[saved] id=C2xC2xC2_c00409 -> results/c2xc2xc2_d16_20260120_153743/promising/C2xC2xC2_c00409 (reason: d>=sqrt(n))
[pilot] TARGET_REJECT d_ub=12 target=16 id=C2xC2xC2_c00456
[pilot] MEAS n=288 k=4 dx_ub=20 dz_ub=17 d_ub=17 steps=5000 id=C2xC2xC2_c00461
[saved] id=C2xC2xC2_c00461 -> results/c2xc2xc2_d16_20260120_153743/promising/C2xC2xC2_c00461 (reason: d>=sqrt(n))
[pilot] MEAS n=288 k=8 dx_ub=20 dz_ub=16 d_ub=16 steps=5000 id=C2xC2xC2_c00470
[pilot] MEAS n=288 k=4 dx_ub=19 dz_ub=20 d_ub=19 steps=5000 id=C2xC2xC2_c00480
[saved] id=C2xC2xC2_c00480 -> results/c2xc2xc2_d16_20260120_153743/promising/C2xC2xC2_c00480 (reason: d>=sqrt(n))
[pilot] MEAS n=288 k=4 dx_ub=17 dz_ub=21 d_ub=17 steps=5000 id=C2xC2xC2_c00494
[saved] id=C2xC2xC2_c00494 -> results/c2xc2xc2_d16_20260120_153743/promising/C2xC2xC2_c00494 (reason: d>=sqrt(n))
[best_by_k] group=C2xC2xC2 n=288
k  | d_ub | steps | dx_ub | dz_ub | id
 4 |   20 |  5000 |    20 |    20 | C2xC2xC2_c00024
 8 |   16 |  5000 |    16 |    16 | C2xC2xC2_c00234
[coverage] group=C2xC2xC2 A_sel=128 B_sel=128 Q_meas=25 ratio_ge_sqrt=0.000 ratio_sel=0.002
[coverage] run summary:
[coverage] group=C2xC2xC2 A_sel=128 B_sel=128 Q_meas=25 ratio_ge_sqrt=0.000 ratio_sel=0.002
[summary] best-by-k (measured; includes rejects):
  k=4 best_d_ub=20 count_measured=18 example_id=C2xC2xC2_c00024
  k=8 best_d_ub=16 count_measured=7 example_id=C2xC2xC2_c00234
[summary] best-by-k (survivors; target=16):
  k=4 best_d_ub=20 count_survivors=15 example_id=C2xC2xC2_c00024
  k=8 best_d_ub=16 count_survivors=2 example_id=C2xC2xC2_c00234
[pilot] top results:
  01 group=C2xC2xC2 n=288 k=4 d_ub=20 permA=12 permB=27 saved=True
  02 group=C2xC2xC2 n=288 k=4 d_ub=20 permA=11 permB=20 saved=True
  03 group=C2xC2xC2 n=288 k=4 d_ub=20 permA=27 permB=8 saved=True
  04 group=C2xC2xC2 n=288 k=4 d_ub=20 permA=7 permB=27 saved=True
  05 group=C2xC2xC2 n=288 k=4 d_ub=19 permA=8 permB=27 saved=True
  06 group=C2xC2xC2 n=288 k=4 d_ub=19 permA=20 permB=8 saved=True
  07 group=C2xC2xC2 n=288 k=4 d_ub=19 permA=8 permB=11 saved=True
  08 group=C2xC2xC2 n=288 k=4 d_ub=19 permA=11 permB=20 saved=True
  09 group=C2xC2xC2 n=288 k=4 d_ub=17 permA=8 permB=11 saved=True
  10 group=C2xC2xC2 n=288 k=4 d_ub=17 permA=20 permB=20 saved=True

