=== mar. 20 janv. 2026 15:36:48 CET steps=5000 batch=79 seed=1768922182 ===
[pilot] base k_table top pairs:
  k_base=18 permA=0 permB=0
  k_base=12 permA=29 permB=0
  k_base=12 permA=22 permB=0
  k_base=12 permA=13 permB=0
  k_base=12 permA=6 permB=0
[pilot] A multisets raw=792 (expected=792) enum_mode=multiset cayley_unique=26 perms=30 -> total scored = 780
[pilot] B multisets raw=792 (expected=792) enum_mode=multiset cayley_unique=26 perms=30 -> total scored = 780
[pilot] A frontier kept 128 candidates with points: (4,20), (0,49)
[pilot] B frontier kept 128 candidates with points: (4,20), (0,49)
[pilot] C2xC2xC2 n=288 d0=17 A_sets=26*30 -> keep 128; B_sets=26*30 -> keep 128
[pilot] MEAS n=288 k=8 dx_ub=18 dz_ub=16 d_ub=16 steps=5000 id=C2xC2xC2_c00058
[pilot] TARGET_REJECT d_ub=14 target=16 id=C2xC2xC2_c00073
[pilot] TARGET_REJECT d_ub=12 target=16 id=C2xC2xC2_c00079
[pilot] MEAS n=288 k=4 dx_ub=19 dz_ub=20 d_ub=19 steps=5000 id=C2xC2xC2_c00100
[saved] id=C2xC2xC2_c00100 -> results/c2xc2xc2_d16_20260120_153648/promising/C2xC2xC2_c00100 (reason: d>=sqrt(n))
[pilot] TARGET_REJECT d_ub=12 target=16 id=C2xC2xC2_c00108
[pilot] MEAS n=288 k=4 dx_ub=19 dz_ub=17 d_ub=17 steps=5000 id=C2xC2xC2_c00114
[saved] id=C2xC2xC2_c00114 -> results/c2xc2xc2_d16_20260120_153648/promising/C2xC2xC2_c00114 (reason: d>=sqrt(n))
[pilot] TARGET_REJECT d_ub=12 target=16 id=C2xC2xC2_c00117
[pilot] MEAS n=288 k=4 dx_ub=20 dz_ub=19 d_ub=19 steps=5000 id=C2xC2xC2_c00120
[saved] id=C2xC2xC2_c00120 -> results/c2xc2xc2_d16_20260120_153648/promising/C2xC2xC2_c00120 (reason: d>=sqrt(n))
[pilot] TARGET_REJECT d_ub=12 target=16 id=C2xC2xC2_c00156
[pilot] MEAS n=288 k=4 dx_ub=21 dz_ub=16 d_ub=16 steps=5000 id=C2xC2xC2_c00184
[pilot] TARGET_REJECT d_ub=12 target=16 id=C2xC2xC2_c00196
[pilot] MEAS n=288 k=4 dx_ub=20 dz_ub=20 d_ub=20 steps=5000 id=C2xC2xC2_c00226
[saved] id=C2xC2xC2_c00226 -> results/c2xc2xc2_d16_20260120_153648/promising/C2xC2xC2_c00226 (reason: d>=sqrt(n))
[pilot] MEAS n=288 k=4 dx_ub=19 dz_ub=16 d_ub=16 steps=5000 id=C2xC2xC2_c00250
[pilot] MEAS n=288 k=8 dx_ub=16 dz_ub=16 d_ub=16 steps=5000 id=C2xC2xC2_c00287
[pilot] MEAS n=288 k=8 dx_ub=16 dz_ub=16 d_ub=16 steps=5000 id=C2xC2xC2_c00293
[pilot] TARGET_REJECT d_ub=12 target=16 id=C2xC2xC2_c00302
[pilot] MEAS n=288 k=4 dx_ub=16 dz_ub=18 d_ub=16 steps=5000 id=C2xC2xC2_c00334
[pilot] MEAS n=288 k=4 dx_ub=20 dz_ub=20 d_ub=20 steps=5000 id=C2xC2xC2_c00358
[saved] id=C2xC2xC2_c00358 -> results/c2xc2xc2_d16_20260120_153648/promising/C2xC2xC2_c00358 (reason: d>=sqrt(n))
[pilot] MEAS n=288 k=4 dx_ub=16 dz_ub=16 d_ub=16 steps=5000 id=C2xC2xC2_c00379
[pilot] MEAS n=288 k=4 dx_ub=16 dz_ub=16 d_ub=16 steps=5000 id=C2xC2xC2_c00380
[pilot] MEAS n=288 k=4 dx_ub=17 dz_ub=20 d_ub=17 steps=5000 id=C2xC2xC2_c00391
[saved] id=C2xC2xC2_c00391 -> results/c2xc2xc2_d16_20260120_153648/promising/C2xC2xC2_c00391 (reason: d>=sqrt(n))
[pilot] MEAS n=288 k=4 dx_ub=23 dz_ub=19 d_ub=19 steps=5000 id=C2xC2xC2_c00393
[saved] id=C2xC2xC2_c00393 -> results/c2xc2xc2_d16_20260120_153648/promising/C2xC2xC2_c00393 (reason: d>=sqrt(n))
[pilot] MEAS n=288 k=4 dx_ub=17 dz_ub=16 d_ub=16 steps=5000 id=C2xC2xC2_c00408
[pilot] MEAS n=288 k=4 dx_ub=16 dz_ub=18 d_ub=16 steps=5000 id=C2xC2xC2_c00412
[pilot] MEAS n=288 k=4 dx_ub=21 dz_ub=20 d_ub=20 steps=5000 id=C2xC2xC2_c00414
[saved] id=C2xC2xC2_c00414 -> results/c2xc2xc2_d16_20260120_153648/promising/C2xC2xC2_c00414 (reason: d>=sqrt(n))
[pilot] MEAS n=288 k=4 dx_ub=16 dz_ub=20 d_ub=16 steps=5000 id=C2xC2xC2_c00430
[pilot] MEAS n=288 k=4 dx_ub=19 dz_ub=20 d_ub=19 steps=5000 id=C2xC2xC2_c00460
[saved] id=C2xC2xC2_c00460 -> results/c2xc2xc2_d16_20260120_153648/promising/C2xC2xC2_c00460 (reason: d>=sqrt(n))
[pilot] TARGET_REJECT d_ub=12 target=16 id=C2xC2xC2_c00479
[pilot] MEAS n=288 k=4 dx_ub=22 dz_ub=22 d_ub=22 steps=5000 id=C2xC2xC2_c00486
[saved] id=C2xC2xC2_c00486 -> results/c2xc2xc2_d16_20260120_153648/promising/C2xC2xC2_c00486 (reason: d>=sqrt(n))
[pilot] MEAS n=288 k=4 dx_ub=16 dz_ub=16 d_ub=16 steps=5000 id=C2xC2xC2_c00488
[best_by_k] group=C2xC2xC2 n=288
k  | d_ub | steps | dx_ub | dz_ub | id
 4 |   22 |  5000 |    22 |    22 | C2xC2xC2_c00486
 8 |   16 |  5000 |    18 |    16 | C2xC2xC2_c00058
[coverage] group=C2xC2xC2 A_sel=128 B_sel=128 Q_meas=30 ratio_ge_sqrt=0.001 ratio_sel=0.002
[coverage] run summary:
[coverage] group=C2xC2xC2 A_sel=128 B_sel=128 Q_meas=30 ratio_ge_sqrt=0.001 ratio_sel=0.002
[summary] best-by-k (measured; includes rejects):
  k=4 best_d_ub=22 count_measured=23 example_id=C2xC2xC2_c00486
  k=8 best_d_ub=16 count_measured=7 example_id=C2xC2xC2_c00058
[summary] best-by-k (survivors; target=16):
  k=4 best_d_ub=22 count_survivors=19 example_id=C2xC2xC2_c00486
  k=8 best_d_ub=16 count_survivors=3 example_id=C2xC2xC2_c00058
[pilot] top results:
  01 group=C2xC2xC2 n=288 k=4 d_ub=22 permA=11 permB=7 saved=True
  02 group=C2xC2xC2 n=288 k=4 d_ub=20 permA=11 permB=8 saved=True
  03 group=C2xC2xC2 n=288 k=4 d_ub=20 permA=11 permB=27 saved=True
  04 group=C2xC2xC2 n=288 k=4 d_ub=20 permA=11 permB=11 saved=True
  05 group=C2xC2xC2 n=288 k=4 d_ub=19 permA=8 permB=8 saved=True
  06 group=C2xC2xC2 n=288 k=4 d_ub=19 permA=20 permB=11 saved=True
  07 group=C2xC2xC2 n=288 k=4 d_ub=19 permA=11 permB=20 saved=True
  08 group=C2xC2xC2 n=288 k=4 d_ub=19 permA=12 permB=20 saved=True
  09 group=C2xC2xC2 n=288 k=4 d_ub=17 permA=27 permB=8 saved=True
  10 group=C2xC2xC2 n=288 k=4 d_ub=17 permA=7 permB=11 saved=True

