=== mar. 20 janv. 2026 15:04:24 CET steps=5000 batch=25 seed=1768922128 ===
[pilot] base k_table top pairs:
  k_base=18 permA=0 permB=0
  k_base=12 permA=29 permB=0
  k_base=12 permA=22 permB=0
  k_base=12 permA=13 permB=0
  k_base=12 permA=6 permB=0
[pilot] A multisets raw=792 (expected=792) enum_mode=multiset cayley_unique=26 perms=30 -> total scored = 780
[pilot] B multisets raw=792 (expected=792) enum_mode=multiset cayley_unique=26 perms=30 -> total scored = 780
[pilot] A frontier kept 128 candidates with points: (4,20), (0,49)
[pilot] B frontier kept 128 candidates with points: (4,20), (0,49)
[pilot] C2xC2xC2 n=288 d0=17 A_sets=26*30 -> keep 128; B_sets=26*30 -> keep 128
[pilot] MEAS n=288 k=4 dx_ub=18 dz_ub=16 d_ub=16 steps=5000 id=C2xC2xC2_c00004
[pilot] MEAS n=288 k=4 dx_ub=17 dz_ub=20 d_ub=17 steps=5000 id=C2xC2xC2_c00023
[saved] id=C2xC2xC2_c00023 -> results/c2xc2xc2_d16_20260120_150424/promising/C2xC2xC2_c00023 (reason: d>=sqrt(n))
[pilot] TARGET_REJECT d_ub=12 target=16 id=C2xC2xC2_c00030
[pilot] MEAS n=288 k=4 dx_ub=16 dz_ub=17 d_ub=16 steps=5000 id=C2xC2xC2_c00071
[pilot] MEAS n=288 k=4 dx_ub=16 dz_ub=22 d_ub=16 steps=5000 id=C2xC2xC2_c00075
[pilot] TARGET_REJECT d_ub=12 target=16 id=C2xC2xC2_c00087
[pilot] TARGET_REJECT d_ub=12 target=16 id=C2xC2xC2_c00118
[pilot] MEAS n=288 k=4 dx_ub=16 dz_ub=16 d_ub=16 steps=5000 id=C2xC2xC2_c00168
[pilot] MEAS n=288 k=4 dx_ub=20 dz_ub=19 d_ub=19 steps=5000 id=C2xC2xC2_c00200
[saved] id=C2xC2xC2_c00200 -> results/c2xc2xc2_d16_20260120_150424/promising/C2xC2xC2_c00200 (reason: d>=sqrt(n))
[pilot] MEAS n=288 k=4 dx_ub=20 dz_ub=20 d_ub=20 steps=5000 id=C2xC2xC2_c00205
[saved] id=C2xC2xC2_c00205 -> results/c2xc2xc2_d16_20260120_150424/promising/C2xC2xC2_c00205 (reason: d>=sqrt(n))
[pilot] MEAS n=288 k=4 dx_ub=16 dz_ub=17 d_ub=16 steps=5000 id=C2xC2xC2_c00211
[pilot] MEAS n=288 k=8 dx_ub=19 dz_ub=16 d_ub=16 steps=5000 id=C2xC2xC2_c00213
[pilot] MEAS n=288 k=4 dx_ub=16 dz_ub=20 d_ub=16 steps=5000 id=C2xC2xC2_c00219
[pilot] MEAS n=288 k=4 dx_ub=17 dz_ub=20 d_ub=17 steps=5000 id=C2xC2xC2_c00220
[saved] id=C2xC2xC2_c00220 -> results/c2xc2xc2_d16_20260120_150424/promising/C2xC2xC2_c00220 (reason: d>=sqrt(n))
[pilot] MEAS n=288 k=4 dx_ub=20 dz_ub=20 d_ub=20 steps=5000 id=C2xC2xC2_c00223
[saved] id=C2xC2xC2_c00223 -> results/c2xc2xc2_d16_20260120_150424/promising/C2xC2xC2_c00223 (reason: d>=sqrt(n))
[pilot] MEAS n=288 k=4 dx_ub=17 dz_ub=20 d_ub=17 steps=5000 id=C2xC2xC2_c00264
[saved] id=C2xC2xC2_c00264 -> results/c2xc2xc2_d16_20260120_150424/promising/C2xC2xC2_c00264 (reason: d>=sqrt(n))
[pilot] MEAS n=288 k=4 dx_ub=18 dz_ub=17 d_ub=17 steps=5000 id=C2xC2xC2_c00273
[saved] id=C2xC2xC2_c00273 -> results/c2xc2xc2_d16_20260120_150424/promising/C2xC2xC2_c00273 (reason: d>=sqrt(n))
[pilot] MEAS n=288 k=4 dx_ub=20 dz_ub=20 d_ub=20 steps=5000 id=C2xC2xC2_c00368
[saved] id=C2xC2xC2_c00368 -> results/c2xc2xc2_d16_20260120_150424/promising/C2xC2xC2_c00368 (reason: d>=sqrt(n))
[pilot] MEAS n=288 k=8 dx_ub=18 dz_ub=16 d_ub=16 steps=5000 id=C2xC2xC2_c00369
[pilot] MEAS n=288 k=4 dx_ub=20 dz_ub=20 d_ub=20 steps=5000 id=C2xC2xC2_c00388
[saved] id=C2xC2xC2_c00388 -> results/c2xc2xc2_d16_20260120_150424/promising/C2xC2xC2_c00388 (reason: d>=sqrt(n))
[pilot] TARGET_REJECT d_ub=13 target=16 id=C2xC2xC2_c00394
[pilot] MEAS n=288 k=4 dx_ub=20 dz_ub=22 d_ub=20 steps=5000 id=C2xC2xC2_c00425
[saved] id=C2xC2xC2_c00425 -> results/c2xc2xc2_d16_20260120_150424/promising/C2xC2xC2_c00425 (reason: d>=sqrt(n))
[pilot] MEAS n=288 k=4 dx_ub=16 dz_ub=16 d_ub=16 steps=5000 id=C2xC2xC2_c00441
[pilot] MEAS n=288 k=8 dx_ub=16 dz_ub=17 d_ub=16 steps=5000 id=C2xC2xC2_c00469
[pilot] MEAS n=288 k=4 dx_ub=20 dz_ub=20 d_ub=20 steps=5000 id=C2xC2xC2_c00480
[saved] id=C2xC2xC2_c00480 -> results/c2xc2xc2_d16_20260120_150424/promising/C2xC2xC2_c00480 (reason: d>=sqrt(n))
[best_by_k] group=C2xC2xC2 n=288
k  | d_ub | steps | dx_ub | dz_ub | id
 4 |   20 |  5000 |    20 |    20 | C2xC2xC2_c00205
 8 |   16 |  5000 |    19 |    16 | C2xC2xC2_c00213
[coverage] group=C2xC2xC2 A_sel=128 B_sel=128 Q_meas=25 ratio_ge_sqrt=0.000 ratio_sel=0.002
[coverage] run summary:
[coverage] group=C2xC2xC2 A_sel=128 B_sel=128 Q_meas=25 ratio_ge_sqrt=0.000 ratio_sel=0.002
[summary] best-by-k (measured; includes rejects):
  k=4 best_d_ub=20 count_measured=18 example_id=C2xC2xC2_c00205
  k=8 best_d_ub=16 count_measured=7 example_id=C2xC2xC2_c00213
[summary] best-by-k (survivors; target=16):
  k=4 best_d_ub=20 count_survivors=18 example_id=C2xC2xC2_c00205
  k=8 best_d_ub=16 count_survivors=3 example_id=C2xC2xC2_c00213
[pilot] top results:
  01 group=C2xC2xC2 n=288 k=4 d_ub=20 permA=11 permB=7 saved=True
  02 group=C2xC2xC2 n=288 k=4 d_ub=20 permA=12 permB=27 saved=True
  03 group=C2xC2xC2 n=288 k=4 d_ub=20 permA=20 permB=11 saved=True
  04 group=C2xC2xC2 n=288 k=4 d_ub=20 permA=12 permB=11 saved=True
  05 group=C2xC2xC2 n=288 k=4 d_ub=20 permA=27 permB=11 saved=True
  06 group=C2xC2xC2 n=288 k=4 d_ub=20 permA=27 permB=12 saved=True
  07 group=C2xC2xC2 n=288 k=4 d_ub=19 permA=12 permB=11 saved=True
  08 group=C2xC2xC2 n=288 k=4 d_ub=17 permA=20 permB=27 saved=True
  09 group=C2xC2xC2 n=288 k=4 d_ub=17 permA=7 permB=11 saved=True
  10 group=C2xC2xC2 n=288 k=4 d_ub=17 permA=20 permB=8 saved=True

