=== mar. 20 janv. 2026 15:13:54 CET steps=5000 batch=43 seed=1768922146 ===
[pilot] base k_table top pairs:
  k_base=18 permA=0 permB=0
  k_base=12 permA=29 permB=0
  k_base=12 permA=22 permB=0
  k_base=12 permA=13 permB=0
  k_base=12 permA=6 permB=0
[pilot] A multisets raw=792 (expected=792) enum_mode=multiset cayley_unique=26 perms=30 -> total scored = 780
[pilot] B multisets raw=792 (expected=792) enum_mode=multiset cayley_unique=26 perms=30 -> total scored = 780
[pilot] A frontier kept 128 candidates with points: (4,20), (0,49)
[pilot] B frontier kept 128 candidates with points: (4,20), (0,49)
[pilot] C2xC2xC2 n=288 d0=17 A_sets=26*30 -> keep 128; B_sets=26*30 -> keep 128
[pilot] MEAS n=288 k=4 dx_ub=20 dz_ub=20 d_ub=20 steps=5000 id=C2xC2xC2_c00003
[saved] id=C2xC2xC2_c00003 -> results/c2xc2xc2_d16_20260120_151354/promising/C2xC2xC2_c00003 (reason: d>=sqrt(n))
[pilot] MEAS n=288 k=4 dx_ub=17 dz_ub=20 d_ub=17 steps=5000 id=C2xC2xC2_c00021
[saved] id=C2xC2xC2_c00021 -> results/c2xc2xc2_d16_20260120_151354/promising/C2xC2xC2_c00021 (reason: d>=sqrt(n))
[pilot] MEAS n=288 k=4 dx_ub=20 dz_ub=20 d_ub=20 steps=5000 id=C2xC2xC2_c00054
[saved] id=C2xC2xC2_c00054 -> results/c2xc2xc2_d16_20260120_151354/promising/C2xC2xC2_c00054 (reason: d>=sqrt(n))
[pilot] MEAS n=288 k=4 dx_ub=19 dz_ub=18 d_ub=18 steps=5000 id=C2xC2xC2_c00071
[saved] id=C2xC2xC2_c00071 -> results/c2xc2xc2_d16_20260120_151354/promising/C2xC2xC2_c00071 (reason: d>=sqrt(n))
[pilot] MEAS n=288 k=4 dx_ub=17 dz_ub=16 d_ub=16 steps=5000 id=C2xC2xC2_c00114
[pilot] MEAS n=288 k=4 dx_ub=16 dz_ub=20 d_ub=16 steps=5000 id=C2xC2xC2_c00151
[pilot] MEAS n=288 k=4 dx_ub=16 dz_ub=16 d_ub=16 steps=5000 id=C2xC2xC2_c00155
[pilot] MEAS n=288 k=4 dx_ub=16 dz_ub=17 d_ub=16 steps=5000 id=C2xC2xC2_c00183
[pilot] MEAS n=288 k=4 dx_ub=17 dz_ub=19 d_ub=17 steps=5000 id=C2xC2xC2_c00197
[saved] id=C2xC2xC2_c00197 -> results/c2xc2xc2_d16_20260120_151354/promising/C2xC2xC2_c00197 (reason: d>=sqrt(n))
[pilot] MEAS n=288 k=4 dx_ub=20 dz_ub=20 d_ub=20 steps=5000 id=C2xC2xC2_c00225
[saved] id=C2xC2xC2_c00225 -> results/c2xc2xc2_d16_20260120_151354/promising/C2xC2xC2_c00225 (reason: d>=sqrt(n))
[pilot] MEAS n=288 k=4 dx_ub=20 dz_ub=20 d_ub=20 steps=5000 id=C2xC2xC2_c00252
[saved] id=C2xC2xC2_c00252 -> results/c2xc2xc2_d16_20260120_151354/promising/C2xC2xC2_c00252 (reason: d>=sqrt(n))
[pilot] MEAS n=288 k=4 dx_ub=19 dz_ub=20 d_ub=19 steps=5000 id=C2xC2xC2_c00280
[saved] id=C2xC2xC2_c00280 -> results/c2xc2xc2_d16_20260120_151354/promising/C2xC2xC2_c00280 (reason: d>=sqrt(n))
[pilot] MEAS n=288 k=4 dx_ub=16 dz_ub=18 d_ub=16 steps=5000 id=C2xC2xC2_c00294
[pilot] TARGET_REJECT d_ub=12 target=16 id=C2xC2xC2_c00305
[pilot] MEAS n=288 k=4 dx_ub=20 dz_ub=21 d_ub=20 steps=5000 id=C2xC2xC2_c00319
[saved] id=C2xC2xC2_c00319 -> results/c2xc2xc2_d16_20260120_151354/promising/C2xC2xC2_c00319 (reason: d>=sqrt(n))
[pilot] MEAS n=288 k=4 dx_ub=20 dz_ub=17 d_ub=17 steps=5000 id=C2xC2xC2_c00323
[saved] id=C2xC2xC2_c00323 -> results/c2xc2xc2_d16_20260120_151354/promising/C2xC2xC2_c00323 (reason: d>=sqrt(n))
[pilot] TARGET_REJECT d_ub=15 target=16 id=C2xC2xC2_c00331
[pilot] MEAS n=288 k=4 dx_ub=19 dz_ub=20 d_ub=19 steps=5000 id=C2xC2xC2_c00334
[saved] id=C2xC2xC2_c00334 -> results/c2xc2xc2_d16_20260120_151354/promising/C2xC2xC2_c00334 (reason: d>=sqrt(n))
[pilot] MEAS n=288 k=4 dx_ub=18 dz_ub=16 d_ub=16 steps=5000 id=C2xC2xC2_c00338
[pilot] MEAS n=288 k=4 dx_ub=17 dz_ub=17 d_ub=17 steps=5000 id=C2xC2xC2_c00393
[saved] id=C2xC2xC2_c00393 -> results/c2xc2xc2_d16_20260120_151354/promising/C2xC2xC2_c00393 (reason: d>=sqrt(n))
[pilot] MEAS n=288 k=8 dx_ub=18 dz_ub=18 d_ub=18 steps=5000 id=C2xC2xC2_c00421
[saved] id=C2xC2xC2_c00421 -> results/c2xc2xc2_d16_20260120_151354/promising/C2xC2xC2_c00421 (reason: d>=sqrt(n))
[pilot] MEAS n=288 k=8 dx_ub=18 dz_ub=16 d_ub=16 steps=5000 id=C2xC2xC2_c00446
[pilot] MEAS n=288 k=4 dx_ub=20 dz_ub=20 d_ub=20 steps=5000 id=C2xC2xC2_c00459
[saved] id=C2xC2xC2_c00459 -> results/c2xc2xc2_d16_20260120_151354/promising/C2xC2xC2_c00459 (reason: d>=sqrt(n))
[pilot] TARGET_REJECT d_ub=6 target=16 id=C2xC2xC2_c00486
[pilot] MEAS n=288 k=4 dx_ub=20 dz_ub=20 d_ub=20 steps=5000 id=C2xC2xC2_c00491
[saved] id=C2xC2xC2_c00491 -> results/c2xc2xc2_d16_20260120_151354/promising/C2xC2xC2_c00491 (reason: d>=sqrt(n))
[pilot] TARGET_REJECT d_ub=15 target=16 id=C2xC2xC2_c00494
[best_by_k] group=C2xC2xC2 n=288
k  | d_ub | steps | dx_ub | dz_ub | id
 4 |   20 |  5000 |    20 |    20 | C2xC2xC2_c00003
 8 |   18 |  5000 |    18 |    18 | C2xC2xC2_c00421
[coverage] group=C2xC2xC2 A_sel=128 B_sel=128 Q_meas=26 ratio_ge_sqrt=0.000 ratio_sel=0.002
[coverage] run summary:
[coverage] group=C2xC2xC2 A_sel=128 B_sel=128 Q_meas=26 ratio_ge_sqrt=0.000 ratio_sel=0.002
[summary] best-by-k (measured; includes rejects):
  k=4 best_d_ub=20 count_measured=21 example_id=C2xC2xC2_c00003
  k=8 best_d_ub=18 count_measured=5 example_id=C2xC2xC2_c00421
[summary] best-by-k (survivors; target=16):
  k=4 best_d_ub=20 count_survivors=20 example_id=C2xC2xC2_c00003
  k=8 best_d_ub=18 count_survivors=2 example_id=C2xC2xC2_c00421
[pilot] top results:
  01 group=C2xC2xC2 n=288 k=4 d_ub=20 permA=7 permB=27 saved=True
  02 group=C2xC2xC2 n=288 k=4 d_ub=20 permA=8 permB=11 saved=True
  03 group=C2xC2xC2 n=288 k=4 d_ub=20 permA=20 permB=12 saved=True
  04 group=C2xC2xC2 n=288 k=4 d_ub=20 permA=11 permB=8 saved=True
  05 group=C2xC2xC2 n=288 k=4 d_ub=20 permA=27 permB=8 saved=True
  06 group=C2xC2xC2 n=288 k=4 d_ub=20 permA=8 permB=20 saved=True
  07 group=C2xC2xC2 n=288 k=4 d_ub=20 permA=11 permB=12 saved=True
  08 group=C2xC2xC2 n=288 k=4 d_ub=19 permA=11 permB=20 saved=True
  09 group=C2xC2xC2 n=288 k=4 d_ub=19 permA=27 permB=11 saved=True
  10 group=C2xC2xC2 n=288 k=8 d_ub=18 permA=7 permB=20 saved=True

