=== mar. 20 janv. 2026 15:09:22 CET steps=5000 batch=34 seed=1768922137 ===
[pilot] base k_table top pairs:
  k_base=18 permA=0 permB=0
  k_base=12 permA=29 permB=0
  k_base=12 permA=22 permB=0
  k_base=12 permA=13 permB=0
  k_base=12 permA=6 permB=0
[pilot] A multisets raw=792 (expected=792) enum_mode=multiset cayley_unique=26 perms=30 -> total scored = 780
[pilot] B multisets raw=792 (expected=792) enum_mode=multiset cayley_unique=26 perms=30 -> total scored = 780
[pilot] A frontier kept 128 candidates with points: (4,20), (0,49)
[pilot] B frontier kept 128 candidates with points: (4,20), (0,49)
[pilot] C2xC2xC2 n=288 d0=17 A_sets=26*30 -> keep 128; B_sets=26*30 -> keep 128
[pilot] MEAS n=288 k=4 dx_ub=20 dz_ub=20 d_ub=20 steps=5000 id=C2xC2xC2_c00050
[saved] id=C2xC2xC2_c00050 -> results/c2xc2xc2_d16_20260120_150922/promising/C2xC2xC2_c00050 (reason: d>=sqrt(n))
[pilot] TARGET_REJECT d_ub=12 target=16 id=C2xC2xC2_c00073
[pilot] MEAS n=288 k=4 dx_ub=20 dz_ub=20 d_ub=20 steps=5000 id=C2xC2xC2_c00114
[saved] id=C2xC2xC2_c00114 -> results/c2xc2xc2_d16_20260120_150922/promising/C2xC2xC2_c00114 (reason: d>=sqrt(n))
[pilot] TARGET_REJECT d_ub=12 target=16 id=C2xC2xC2_c00142
[pilot] MEAS n=288 k=4 dx_ub=16 dz_ub=16 d_ub=16 steps=5000 id=C2xC2xC2_c00195
[pilot] MEAS n=288 k=4 dx_ub=16 dz_ub=16 d_ub=16 steps=5000 id=C2xC2xC2_c00197
[pilot] MEAS n=288 k=4 dx_ub=16 dz_ub=20 d_ub=16 steps=5000 id=C2xC2xC2_c00207
[pilot] MEAS n=288 k=4 dx_ub=19 dz_ub=20 d_ub=19 steps=5000 id=C2xC2xC2_c00221
[saved] id=C2xC2xC2_c00221 -> results/c2xc2xc2_d16_20260120_150922/promising/C2xC2xC2_c00221 (reason: d>=sqrt(n))
[pilot] MEAS n=288 k=4 dx_ub=19 dz_ub=20 d_ub=19 steps=5000 id=C2xC2xC2_c00231
[saved] id=C2xC2xC2_c00231 -> results/c2xc2xc2_d16_20260120_150922/promising/C2xC2xC2_c00231 (reason: d>=sqrt(n))
[pilot] TARGET_REJECT d_ub=12 target=16 id=C2xC2xC2_c00255
[pilot] MEAS n=288 k=4 dx_ub=19 dz_ub=20 d_ub=19 steps=5000 id=C2xC2xC2_c00258
[saved] id=C2xC2xC2_c00258 -> results/c2xc2xc2_d16_20260120_150922/promising/C2xC2xC2_c00258 (reason: d>=sqrt(n))
[pilot] MEAS n=288 k=8 dx_ub=16 dz_ub=16 d_ub=16 steps=5000 id=C2xC2xC2_c00261
[pilot] MEAS n=288 k=4 dx_ub=20 dz_ub=19 d_ub=19 steps=5000 id=C2xC2xC2_c00275
[saved] id=C2xC2xC2_c00275 -> results/c2xc2xc2_d16_20260120_150922/promising/C2xC2xC2_c00275 (reason: d>=sqrt(n))
[pilot] MEAS n=288 k=4 dx_ub=19 dz_ub=20 d_ub=19 steps=5000 id=C2xC2xC2_c00279
[saved] id=C2xC2xC2_c00279 -> results/c2xc2xc2_d16_20260120_150922/promising/C2xC2xC2_c00279 (reason: d>=sqrt(n))
[pilot] MEAS n=288 k=4 dx_ub=17 dz_ub=21 d_ub=17 steps=5000 id=C2xC2xC2_c00280
[saved] id=C2xC2xC2_c00280 -> results/c2xc2xc2_d16_20260120_150922/promising/C2xC2xC2_c00280 (reason: d>=sqrt(n))
[pilot] MEAS n=288 k=4 dx_ub=16 dz_ub=18 d_ub=16 steps=5000 id=C2xC2xC2_c00300
[pilot] TARGET_REJECT d_ub=14 target=16 id=C2xC2xC2_c00330
[pilot] MEAS n=288 k=4 dx_ub=20 dz_ub=20 d_ub=20 steps=5000 id=C2xC2xC2_c00342
[saved] id=C2xC2xC2_c00342 -> results/c2xc2xc2_d16_20260120_150922/promising/C2xC2xC2_c00342 (reason: d>=sqrt(n))
[pilot] MEAS n=288 k=4 dx_ub=16 dz_ub=16 d_ub=16 steps=5000 id=C2xC2xC2_c00362
[pilot] MEAS n=288 k=4 dx_ub=17 dz_ub=20 d_ub=17 steps=5000 id=C2xC2xC2_c00397
[saved] id=C2xC2xC2_c00397 -> results/c2xc2xc2_d16_20260120_150922/promising/C2xC2xC2_c00397 (reason: d>=sqrt(n))
[pilot] MEAS n=288 k=4 dx_ub=16 dz_ub=20 d_ub=16 steps=5000 id=C2xC2xC2_c00402
[pilot] MEAS n=288 k=4 dx_ub=16 dz_ub=17 d_ub=16 steps=5000 id=C2xC2xC2_c00409
[pilot] MEAS n=288 k=4 dx_ub=16 dz_ub=20 d_ub=16 steps=5000 id=C2xC2xC2_c00428
[pilot] TARGET_REJECT d_ub=12 target=16 id=C2xC2xC2_c00438
[pilot] MEAS n=288 k=4 dx_ub=18 dz_ub=20 d_ub=18 steps=5000 id=C2xC2xC2_c00444
[saved] id=C2xC2xC2_c00444 -> results/c2xc2xc2_d16_20260120_150922/promising/C2xC2xC2_c00444 (reason: d>=sqrt(n))
[pilot] MEAS n=288 k=4 dx_ub=20 dz_ub=18 d_ub=18 steps=5000 id=C2xC2xC2_c00455
[saved] id=C2xC2xC2_c00455 -> results/c2xc2xc2_d16_20260120_150922/promising/C2xC2xC2_c00455 (reason: d>=sqrt(n))
[best_by_k] group=C2xC2xC2 n=288
k  | d_ub | steps | dx_ub | dz_ub | id
 4 |   20 |  5000 |    20 |    20 | C2xC2xC2_c00050
 8 |   16 |  5000 |    16 |    16 | C2xC2xC2_c00261
[coverage] group=C2xC2xC2 A_sel=128 B_sel=128 Q_meas=26 ratio_ge_sqrt=0.000 ratio_sel=0.002
[coverage] run summary:
[coverage] group=C2xC2xC2 A_sel=128 B_sel=128 Q_meas=26 ratio_ge_sqrt=0.000 ratio_sel=0.002
[summary] best-by-k (measured; includes rejects):
  k=4 best_d_ub=20 count_measured=21 example_id=C2xC2xC2_c00050
  k=8 best_d_ub=16 count_measured=5 example_id=C2xC2xC2_c00261
[summary] best-by-k (survivors; target=16):
  k=4 best_d_ub=20 count_survivors=20 example_id=C2xC2xC2_c00050
  k=8 best_d_ub=16 count_survivors=1 example_id=C2xC2xC2_c00261
[pilot] top results:
  01 group=C2xC2xC2 n=288 k=4 d_ub=20 permA=8 permB=11 saved=True
  02 group=C2xC2xC2 n=288 k=4 d_ub=20 permA=7 permB=20 saved=True
  03 group=C2xC2xC2 n=288 k=4 d_ub=20 permA=12 permB=11 saved=True
  04 group=C2xC2xC2 n=288 k=4 d_ub=19 permA=27 permB=11 saved=True
  05 group=C2xC2xC2 n=288 k=4 d_ub=19 permA=7 permB=8 saved=True
  06 group=C2xC2xC2 n=288 k=4 d_ub=19 permA=12 permB=8 saved=True
  07 group=C2xC2xC2 n=288 k=4 d_ub=19 permA=20 permB=27 saved=True
  08 group=C2xC2xC2 n=288 k=4 d_ub=19 permA=20 permB=20 saved=True
  09 group=C2xC2xC2 n=288 k=4 d_ub=18 permA=11 permB=27 saved=True
  10 group=C2xC2xC2 n=288 k=4 d_ub=18 permA=12 permB=11 saved=True

