=== mar. 20 janv. 2026 15:35:50 CET steps=5000 batch=78 seed=1768922181 ===
[pilot] base k_table top pairs:
  k_base=18 permA=0 permB=0
  k_base=12 permA=29 permB=0
  k_base=12 permA=22 permB=0
  k_base=12 permA=13 permB=0
  k_base=12 permA=6 permB=0
[pilot] A multisets raw=792 (expected=792) enum_mode=multiset cayley_unique=26 perms=30 -> total scored = 780
[pilot] B multisets raw=792 (expected=792) enum_mode=multiset cayley_unique=26 perms=30 -> total scored = 780
[pilot] A frontier kept 128 candidates with points: (4,20), (0,49)
[pilot] B frontier kept 128 candidates with points: (4,20), (0,49)
[pilot] C2xC2xC2 n=288 d0=17 A_sets=26*30 -> keep 128; B_sets=26*30 -> keep 128
[pilot] MEAS n=288 k=4 dx_ub=20 dz_ub=20 d_ub=20 steps=5000 id=C2xC2xC2_c00007
[saved] id=C2xC2xC2_c00007 -> results/c2xc2xc2_d16_20260120_153550/promising/C2xC2xC2_c00007 (reason: d>=sqrt(n))
[pilot] MEAS n=288 k=4 dx_ub=20 dz_ub=16 d_ub=16 steps=5000 id=C2xC2xC2_c00010
[pilot] TARGET_REJECT d_ub=15 target=16 id=C2xC2xC2_c00023
[pilot] MEAS n=288 k=4 dx_ub=16 dz_ub=20 d_ub=16 steps=5000 id=C2xC2xC2_c00044
[pilot] TARGET_REJECT d_ub=14 target=16 id=C2xC2xC2_c00089
[pilot] TARGET_REJECT d_ub=12 target=16 id=C2xC2xC2_c00100
[pilot] MEAS n=288 k=4 dx_ub=17 dz_ub=20 d_ub=17 steps=5000 id=C2xC2xC2_c00116
[saved] id=C2xC2xC2_c00116 -> results/c2xc2xc2_d16_20260120_153550/promising/C2xC2xC2_c00116 (reason: d>=sqrt(n))
[pilot] TARGET_REJECT d_ub=12 target=16 id=C2xC2xC2_c00122
[pilot] MEAS n=288 k=4 dx_ub=16 dz_ub=16 d_ub=16 steps=5000 id=C2xC2xC2_c00159
[pilot] MEAS n=288 k=4 dx_ub=17 dz_ub=20 d_ub=17 steps=5000 id=C2xC2xC2_c00162
[saved] id=C2xC2xC2_c00162 -> results/c2xc2xc2_d16_20260120_153550/promising/C2xC2xC2_c00162 (reason: d>=sqrt(n))
[pilot] MEAS n=288 k=4 dx_ub=20 dz_ub=20 d_ub=20 steps=5000 id=C2xC2xC2_c00209
[saved] id=C2xC2xC2_c00209 -> results/c2xc2xc2_d16_20260120_153550/promising/C2xC2xC2_c00209 (reason: d>=sqrt(n))
[pilot] MEAS n=288 k=4 dx_ub=17 dz_ub=17 d_ub=17 steps=5000 id=C2xC2xC2_c00214
[saved] id=C2xC2xC2_c00214 -> results/c2xc2xc2_d16_20260120_153550/promising/C2xC2xC2_c00214 (reason: d>=sqrt(n))
[pilot] MEAS n=288 k=4 dx_ub=16 dz_ub=16 d_ub=16 steps=5000 id=C2xC2xC2_c00224
[pilot] MEAS n=288 k=4 dx_ub=17 dz_ub=16 d_ub=16 steps=5000 id=C2xC2xC2_c00240
[pilot] MEAS n=288 k=4 dx_ub=20 dz_ub=17 d_ub=17 steps=5000 id=C2xC2xC2_c00251
[saved] id=C2xC2xC2_c00251 -> results/c2xc2xc2_d16_20260120_153550/promising/C2xC2xC2_c00251 (reason: d>=sqrt(n))
[pilot] MEAS n=288 k=4 dx_ub=20 dz_ub=20 d_ub=20 steps=5000 id=C2xC2xC2_c00285
[saved] id=C2xC2xC2_c00285 -> results/c2xc2xc2_d16_20260120_153550/promising/C2xC2xC2_c00285 (reason: d>=sqrt(n))
[pilot] MEAS n=288 k=4 dx_ub=18 dz_ub=20 d_ub=18 steps=5000 id=C2xC2xC2_c00305
[saved] id=C2xC2xC2_c00305 -> results/c2xc2xc2_d16_20260120_153550/promising/C2xC2xC2_c00305 (reason: d>=sqrt(n))
[pilot] MEAS n=288 k=4 dx_ub=16 dz_ub=19 d_ub=16 steps=5000 id=C2xC2xC2_c00311
[pilot] TARGET_REJECT d_ub=13 target=16 id=C2xC2xC2_c00343
[pilot] MEAS n=288 k=4 dx_ub=20 dz_ub=19 d_ub=19 steps=5000 id=C2xC2xC2_c00347
[saved] id=C2xC2xC2_c00347 -> results/c2xc2xc2_d16_20260120_153550/promising/C2xC2xC2_c00347 (reason: d>=sqrt(n))
[pilot] MEAS n=288 k=4 dx_ub=20 dz_ub=16 d_ub=16 steps=5000 id=C2xC2xC2_c00369
[pilot] MEAS n=288 k=4 dx_ub=20 dz_ub=20 d_ub=20 steps=5000 id=C2xC2xC2_c00392
[saved] id=C2xC2xC2_c00392 -> results/c2xc2xc2_d16_20260120_153550/promising/C2xC2xC2_c00392 (reason: d>=sqrt(n))
[pilot] MEAS n=288 k=4 dx_ub=20 dz_ub=20 d_ub=20 steps=5000 id=C2xC2xC2_c00394
[saved] id=C2xC2xC2_c00394 -> results/c2xc2xc2_d16_20260120_153550/promising/C2xC2xC2_c00394 (reason: d>=sqrt(n))
[pilot] MEAS n=288 k=4 dx_ub=16 dz_ub=16 d_ub=16 steps=5000 id=C2xC2xC2_c00453
[pilot] MEAS n=288 k=4 dx_ub=19 dz_ub=20 d_ub=19 steps=5000 id=C2xC2xC2_c00458
[saved] id=C2xC2xC2_c00458 -> results/c2xc2xc2_d16_20260120_153550/promising/C2xC2xC2_c00458 (reason: d>=sqrt(n))
[pilot] MEAS n=288 k=4 dx_ub=20 dz_ub=16 d_ub=16 steps=5000 id=C2xC2xC2_c00473
[pilot] TARGET_REJECT d_ub=14 target=16 id=C2xC2xC2_c00484
[pilot] MEAS n=288 k=8 dx_ub=16 dz_ub=16 d_ub=16 steps=5000 id=C2xC2xC2_c00497
[best_by_k] group=C2xC2xC2 n=288
k  | d_ub | steps | dx_ub | dz_ub | id
 4 |   20 |  5000 |    20 |    20 | C2xC2xC2_c00007
 8 |   16 |  5000 |    16 |    16 | C2xC2xC2_c00497
[coverage] group=C2xC2xC2 A_sel=128 B_sel=128 Q_meas=28 ratio_ge_sqrt=0.001 ratio_sel=0.002
[coverage] run summary:
[coverage] group=C2xC2xC2 A_sel=128 B_sel=128 Q_meas=28 ratio_ge_sqrt=0.001 ratio_sel=0.002
[summary] best-by-k (measured; includes rejects):
  k=4 best_d_ub=20 count_measured=22 example_id=C2xC2xC2_c00007
  k=8 best_d_ub=16 count_measured=6 example_id=C2xC2xC2_c00497
[summary] best-by-k (survivors; target=16):
  k=4 best_d_ub=20 count_survivors=21 example_id=C2xC2xC2_c00007
  k=8 best_d_ub=16 count_survivors=1 example_id=C2xC2xC2_c00497
[pilot] top results:
  01 group=C2xC2xC2 n=288 k=4 d_ub=20 permA=11 permB=12 saved=True
  02 group=C2xC2xC2 n=288 k=4 d_ub=20 permA=27 permB=27 saved=True
  03 group=C2xC2xC2 n=288 k=4 d_ub=20 permA=20 permB=11 saved=True
  04 group=C2xC2xC2 n=288 k=4 d_ub=20 permA=11 permB=12 saved=True
  05 group=C2xC2xC2 n=288 k=4 d_ub=20 permA=12 permB=27 saved=True
  06 group=C2xC2xC2 n=288 k=4 d_ub=19 permA=20 permB=27 saved=True
  07 group=C2xC2xC2 n=288 k=4 d_ub=19 permA=12 permB=27 saved=True
  08 group=C2xC2xC2 n=288 k=4 d_ub=18 permA=8 permB=7 saved=True
  09 group=C2xC2xC2 n=288 k=4 d_ub=17 permA=12 permB=8 saved=True
  10 group=C2xC2xC2 n=288 k=4 d_ub=17 permA=20 permB=8 saved=True

