=== mar. 20 janv. 2026 17:41:11 CET steps=5000 batch=96 seed=1768922199 ===
[pilot] base k_table top pairs:
  k_base=18 permA=0 permB=0
  k_base=12 permA=29 permB=0
  k_base=12 permA=22 permB=0
  k_base=12 permA=13 permB=0
  k_base=12 permA=6 permB=0
[pilot] A multisets raw=792 (expected=792) enum_mode=multiset cayley_unique=26 perms=30 -> total scored = 780
[pilot] B multisets raw=792 (expected=792) enum_mode=multiset cayley_unique=26 perms=30 -> total scored = 780
[pilot] A frontier kept 128 candidates with points: (4,20), (0,49)
[pilot] B frontier kept 128 candidates with points: (4,20), (0,49)
[pilot] C2xC2xC2 n=288 d0=17 A_sets=26*30 -> keep 128; B_sets=26*30 -> keep 128
[pilot] MEAS n=288 k=4 dx_ub=18 dz_ub=20 d_ub=18 steps=5000 id=C2xC2xC2_c00004
[saved] id=C2xC2xC2_c00004 -> results/c2xc2xc2_d16_20260120_174111/promising/C2xC2xC2_c00004 (reason: d>=sqrt(n))
[pilot] TARGET_REJECT d_ub=12 target=16 id=C2xC2xC2_c00005
[pilot] MEAS n=288 k=4 dx_ub=20 dz_ub=16 d_ub=16 steps=5000 id=C2xC2xC2_c00027
[pilot] TARGET_REJECT d_ub=15 target=16 id=C2xC2xC2_c00063
[pilot] MEAS n=288 k=8 dx_ub=16 dz_ub=18 d_ub=16 steps=5000 id=C2xC2xC2_c00067
[pilot] MEAS n=288 k=4 dx_ub=16 dz_ub=20 d_ub=16 steps=5000 id=C2xC2xC2_c00075
[pilot] MEAS n=288 k=4 dx_ub=20 dz_ub=19 d_ub=19 steps=5000 id=C2xC2xC2_c00079
[saved] id=C2xC2xC2_c00079 -> results/c2xc2xc2_d16_20260120_174111/promising/C2xC2xC2_c00079 (reason: d>=sqrt(n))
[pilot] TARGET_REJECT d_ub=14 target=16 id=C2xC2xC2_c00151
[pilot] MEAS n=288 k=4 dx_ub=20 dz_ub=18 d_ub=18 steps=5000 id=C2xC2xC2_c00176
[saved] id=C2xC2xC2_c00176 -> results/c2xc2xc2_d16_20260120_174111/promising/C2xC2xC2_c00176 (reason: d>=sqrt(n))
[pilot] TARGET_REJECT d_ub=12 target=16 id=C2xC2xC2_c00201
[pilot] MEAS n=288 k=4 dx_ub=16 dz_ub=17 d_ub=16 steps=5000 id=C2xC2xC2_c00211
[pilot] TARGET_REJECT d_ub=14 target=16 id=C2xC2xC2_c00237
[pilot] MEAS n=288 k=4 dx_ub=19 dz_ub=20 d_ub=19 steps=5000 id=C2xC2xC2_c00238
[saved] id=C2xC2xC2_c00238 -> results/c2xc2xc2_d16_20260120_174111/promising/C2xC2xC2_c00238 (reason: d>=sqrt(n))
[pilot] MEAS n=288 k=4 dx_ub=20 dz_ub=21 d_ub=20 steps=5000 id=C2xC2xC2_c00297
[saved] id=C2xC2xC2_c00297 -> results/c2xc2xc2_d16_20260120_174111/promising/C2xC2xC2_c00297 (reason: d>=sqrt(n))
[pilot] MEAS n=288 k=4 dx_ub=17 dz_ub=17 d_ub=17 steps=5000 id=C2xC2xC2_c00301
[saved] id=C2xC2xC2_c00301 -> results/c2xc2xc2_d16_20260120_174111/promising/C2xC2xC2_c00301 (reason: d>=sqrt(n))
[pilot] MEAS n=288 k=4 dx_ub=20 dz_ub=20 d_ub=20 steps=5000 id=C2xC2xC2_c00321
[saved] id=C2xC2xC2_c00321 -> results/c2xc2xc2_d16_20260120_174111/promising/C2xC2xC2_c00321 (reason: d>=sqrt(n))
[pilot] TARGET_REJECT d_ub=15 target=16 id=C2xC2xC2_c00326
[pilot] MEAS n=288 k=4 dx_ub=18 dz_ub=16 d_ub=16 steps=5000 id=C2xC2xC2_c00329
[pilot] MEAS n=288 k=4 dx_ub=20 dz_ub=20 d_ub=20 steps=5000 id=C2xC2xC2_c00333
[saved] id=C2xC2xC2_c00333 -> results/c2xc2xc2_d16_20260120_174111/promising/C2xC2xC2_c00333 (reason: d>=sqrt(n))
[pilot] TARGET_REJECT d_ub=12 target=16 id=C2xC2xC2_c00352
[pilot] MEAS n=288 k=4 dx_ub=20 dz_ub=20 d_ub=20 steps=5000 id=C2xC2xC2_c00355
[saved] id=C2xC2xC2_c00355 -> results/c2xc2xc2_d16_20260120_174111/promising/C2xC2xC2_c00355 (reason: d>=sqrt(n))
[pilot] MEAS n=288 k=8 dx_ub=16 dz_ub=17 d_ub=16 steps=5000 id=C2xC2xC2_c00380
[pilot] MEAS n=288 k=4 dx_ub=18 dz_ub=20 d_ub=18 steps=5000 id=C2xC2xC2_c00389
[saved] id=C2xC2xC2_c00389 -> results/c2xc2xc2_d16_20260120_174111/promising/C2xC2xC2_c00389 (reason: d>=sqrt(n))
[pilot] MEAS n=288 k=4 dx_ub=19 dz_ub=20 d_ub=19 steps=5000 id=C2xC2xC2_c00401
[saved] id=C2xC2xC2_c00401 -> results/c2xc2xc2_d16_20260120_174111/promising/C2xC2xC2_c00401 (reason: d>=sqrt(n))
[pilot] MEAS n=288 k=4 dx_ub=20 dz_ub=18 d_ub=18 steps=5000 id=C2xC2xC2_c00403
[saved] id=C2xC2xC2_c00403 -> results/c2xc2xc2_d16_20260120_174111/promising/C2xC2xC2_c00403 (reason: d>=sqrt(n))
[pilot] MEAS n=288 k=4 dx_ub=16 dz_ub=18 d_ub=16 steps=5000 id=C2xC2xC2_c00409
[pilot] MEAS n=288 k=8 dx_ub=19 dz_ub=16 d_ub=16 steps=5000 id=C2xC2xC2_c00423
[pilot] MEAS n=288 k=4 dx_ub=19 dz_ub=19 d_ub=19 steps=5000 id=C2xC2xC2_c00427
[saved] id=C2xC2xC2_c00427 -> results/c2xc2xc2_d16_20260120_174111/promising/C2xC2xC2_c00427 (reason: d>=sqrt(n))
[best_by_k] group=C2xC2xC2 n=288
k  | d_ub | steps | dx_ub | dz_ub | id
 4 |   20 |  5000 |    20 |    21 | C2xC2xC2_c00297
 8 |   16 |  5000 |    16 |    18 | C2xC2xC2_c00067
[coverage] group=C2xC2xC2 A_sel=128 B_sel=128 Q_meas=28 ratio_ge_sqrt=0.001 ratio_sel=0.002
[coverage] run summary:
[coverage] group=C2xC2xC2 A_sel=128 B_sel=128 Q_meas=28 ratio_ge_sqrt=0.001 ratio_sel=0.002
[summary] best-by-k (measured; includes rejects):
  k=4 best_d_ub=20 count_measured=20 example_id=C2xC2xC2_c00297
  k=8 best_d_ub=16 count_measured=8 example_id=C2xC2xC2_c00067
[summary] best-by-k (survivors; target=16):
  k=4 best_d_ub=20 count_survivors=18 example_id=C2xC2xC2_c00297
  k=8 best_d_ub=16 count_survivors=3 example_id=C2xC2xC2_c00067
[pilot] top results:
  01 group=C2xC2xC2 n=288 k=4 d_ub=20 permA=27 permB=11 saved=True
  02 group=C2xC2xC2 n=288 k=4 d_ub=20 permA=12 permB=8 saved=True
  03 group=C2xC2xC2 n=288 k=4 d_ub=20 permA=11 permB=11 saved=True
  04 group=C2xC2xC2 n=288 k=4 d_ub=20 permA=20 permB=11 saved=True
  05 group=C2xC2xC2 n=288 k=4 d_ub=19 permA=27 permB=8 saved=True
  06 group=C2xC2xC2 n=288 k=4 d_ub=19 permA=11 permB=12 saved=True
  07 group=C2xC2xC2 n=288 k=4 d_ub=19 permA=12 permB=8 saved=True
  08 group=C2xC2xC2 n=288 k=4 d_ub=19 permA=12 permB=11 saved=True
  09 group=C2xC2xC2 n=288 k=4 d_ub=18 permA=8 permB=11 saved=True
  10 group=C2xC2xC2 n=288 k=4 d_ub=18 permA=20 permB=11 saved=True

