=== mar. 20 janv. 2026 17:22:21 CET steps=5000 batch=94 seed=1768922197 ===
[pilot] base k_table top pairs:
  k_base=18 permA=0 permB=0
  k_base=12 permA=29 permB=0
  k_base=12 permA=22 permB=0
  k_base=12 permA=13 permB=0
  k_base=12 permA=6 permB=0
[pilot] A multisets raw=792 (expected=792) enum_mode=multiset cayley_unique=26 perms=30 -> total scored = 780
[pilot] B multisets raw=792 (expected=792) enum_mode=multiset cayley_unique=26 perms=30 -> total scored = 780
[pilot] A frontier kept 128 candidates with points: (4,20), (0,49)
[pilot] B frontier kept 128 candidates with points: (4,20), (0,49)
[pilot] C2xC2xC2 n=288 d0=17 A_sets=26*30 -> keep 128; B_sets=26*30 -> keep 128
[pilot] TARGET_REJECT d_ub=12 target=16 id=C2xC2xC2_c00021
[pilot] TARGET_REJECT d_ub=12 target=16 id=C2xC2xC2_c00031
[pilot] MEAS n=288 k=4 dx_ub=16 dz_ub=20 d_ub=16 steps=5000 id=C2xC2xC2_c00033
[pilot] MEAS n=288 k=4 dx_ub=17 dz_ub=20 d_ub=17 steps=5000 id=C2xC2xC2_c00035
[saved] id=C2xC2xC2_c00035 -> results/c2xc2xc2_d16_20260120_172221/promising/C2xC2xC2_c00035 (reason: d>=sqrt(n))
[pilot] MEAS n=288 k=4 dx_ub=16 dz_ub=20 d_ub=16 steps=5000 id=C2xC2xC2_c00037
[pilot] MEAS n=288 k=4 dx_ub=16 dz_ub=16 d_ub=16 steps=5000 id=C2xC2xC2_c00054
[pilot] TARGET_REJECT d_ub=12 target=16 id=C2xC2xC2_c00060
[pilot] MEAS n=288 k=4 dx_ub=19 dz_ub=16 d_ub=16 steps=5000 id=C2xC2xC2_c00078
[pilot] MEAS n=288 k=4 dx_ub=21 dz_ub=20 d_ub=20 steps=5000 id=C2xC2xC2_c00093
[saved] id=C2xC2xC2_c00093 -> results/c2xc2xc2_d16_20260120_172221/promising/C2xC2xC2_c00093 (reason: d>=sqrt(n))
[pilot] MEAS n=288 k=4 dx_ub=16 dz_ub=16 d_ub=16 steps=5000 id=C2xC2xC2_c00105
[pilot] TARGET_REJECT d_ub=14 target=16 id=C2xC2xC2_c00126
[pilot] TARGET_REJECT d_ub=12 target=16 id=C2xC2xC2_c00134
[pilot] MEAS n=288 k=8 dx_ub=16 dz_ub=18 d_ub=16 steps=5000 id=C2xC2xC2_c00161
[pilot] TARGET_REJECT d_ub=12 target=16 id=C2xC2xC2_c00175
[pilot] MEAS n=288 k=4 dx_ub=16 dz_ub=16 d_ub=16 steps=5000 id=C2xC2xC2_c00179
[pilot] TARGET_REJECT d_ub=14 target=16 id=C2xC2xC2_c00193
[pilot] MEAS n=288 k=4 dx_ub=19 dz_ub=16 d_ub=16 steps=5000 id=C2xC2xC2_c00219
[pilot] MEAS n=288 k=4 dx_ub=16 dz_ub=20 d_ub=16 steps=5000 id=C2xC2xC2_c00233
[pilot] MEAS n=288 k=4 dx_ub=20 dz_ub=20 d_ub=20 steps=5000 id=C2xC2xC2_c00240
[saved] id=C2xC2xC2_c00240 -> results/c2xc2xc2_d16_20260120_172221/promising/C2xC2xC2_c00240 (reason: d>=sqrt(n))
[pilot] MEAS n=288 k=8 dx_ub=16 dz_ub=17 d_ub=16 steps=5000 id=C2xC2xC2_c00246
[pilot] MEAS n=288 k=8 dx_ub=16 dz_ub=16 d_ub=16 steps=5000 id=C2xC2xC2_c00247
[pilot] MEAS n=288 k=4 dx_ub=20 dz_ub=20 d_ub=20 steps=5000 id=C2xC2xC2_c00254
[saved] id=C2xC2xC2_c00254 -> results/c2xc2xc2_d16_20260120_172221/promising/C2xC2xC2_c00254 (reason: d>=sqrt(n))
[pilot] MEAS n=288 k=4 dx_ub=20 dz_ub=20 d_ub=20 steps=5000 id=C2xC2xC2_c00288
[saved] id=C2xC2xC2_c00288 -> results/c2xc2xc2_d16_20260120_172221/promising/C2xC2xC2_c00288 (reason: d>=sqrt(n))
[pilot] MEAS n=288 k=4 dx_ub=16 dz_ub=17 d_ub=16 steps=5000 id=C2xC2xC2_c00289
[pilot] TARGET_REJECT d_ub=12 target=16 id=C2xC2xC2_c00299
[pilot] MEAS n=288 k=4 dx_ub=18 dz_ub=20 d_ub=18 steps=5000 id=C2xC2xC2_c00339
[saved] id=C2xC2xC2_c00339 -> results/c2xc2xc2_d16_20260120_172221/promising/C2xC2xC2_c00339 (reason: d>=sqrt(n))
[pilot] TARGET_REJECT d_ub=12 target=16 id=C2xC2xC2_c00341
[pilot] MEAS n=288 k=4 dx_ub=20 dz_ub=18 d_ub=18 steps=5000 id=C2xC2xC2_c00366
[saved] id=C2xC2xC2_c00366 -> results/c2xc2xc2_d16_20260120_172221/promising/C2xC2xC2_c00366 (reason: d>=sqrt(n))
[pilot] MEAS n=288 k=4 dx_ub=20 dz_ub=20 d_ub=20 steps=5000 id=C2xC2xC2_c00407
[saved] id=C2xC2xC2_c00407 -> results/c2xc2xc2_d16_20260120_172221/promising/C2xC2xC2_c00407 (reason: d>=sqrt(n))
[pilot] MEAS n=288 k=4 dx_ub=20 dz_ub=17 d_ub=17 steps=5000 id=C2xC2xC2_c00453
[saved] id=C2xC2xC2_c00453 -> results/c2xc2xc2_d16_20260120_172221/promising/C2xC2xC2_c00453 (reason: d>=sqrt(n))
[pilot] MEAS n=288 k=8 dx_ub=16 dz_ub=16 d_ub=16 steps=5000 id=C2xC2xC2_c00460
[pilot] MEAS n=288 k=4 dx_ub=20 dz_ub=20 d_ub=20 steps=5000 id=C2xC2xC2_c00480
[saved] id=C2xC2xC2_c00480 -> results/c2xc2xc2_d16_20260120_172221/promising/C2xC2xC2_c00480 (reason: d>=sqrt(n))
[pilot] MEAS n=288 k=4 dx_ub=23 dz_ub=23 d_ub=23 steps=5000 id=C2xC2xC2_c00494
[saved] id=C2xC2xC2_c00494 -> results/c2xc2xc2_d16_20260120_172221/promising/C2xC2xC2_c00494 (reason: d>=sqrt(n))
[best_by_k] group=C2xC2xC2 n=288
k  | d_ub | steps | dx_ub | dz_ub | id
 4 |   23 |  5000 |    23 |    23 | C2xC2xC2_c00494
 8 |   16 |  5000 |    16 |    18 | C2xC2xC2_c00161
[coverage] group=C2xC2xC2 A_sel=128 B_sel=128 Q_meas=33 ratio_ge_sqrt=0.001 ratio_sel=0.002
[coverage] run summary:
[coverage] group=C2xC2xC2 A_sel=128 B_sel=128 Q_meas=33 ratio_ge_sqrt=0.001 ratio_sel=0.002
[summary] best-by-k (measured; includes rejects):
  k=4 best_d_ub=23 count_measured=24 example_id=C2xC2xC2_c00494
  k=8 best_d_ub=16 count_measured=9 example_id=C2xC2xC2_c00161
[summary] best-by-k (survivors; target=16):
  k=4 best_d_ub=23 count_survivors=20 example_id=C2xC2xC2_c00494
  k=8 best_d_ub=16 count_survivors=4 example_id=C2xC2xC2_c00161
[pilot] top results:
  01 group=C2xC2xC2 n=288 k=4 d_ub=23 permA=8 permB=20 saved=True
  02 group=C2xC2xC2 n=288 k=4 d_ub=20 permA=12 permB=27 saved=True
  03 group=C2xC2xC2 n=288 k=4 d_ub=20 permA=27 permB=11 saved=True
  04 group=C2xC2xC2 n=288 k=4 d_ub=20 permA=20 permB=27 saved=True
  05 group=C2xC2xC2 n=288 k=4 d_ub=20 permA=27 permB=12 saved=True
  06 group=C2xC2xC2 n=288 k=4 d_ub=20 permA=27 permB=7 saved=True
  07 group=C2xC2xC2 n=288 k=4 d_ub=20 permA=11 permB=11 saved=True
  08 group=C2xC2xC2 n=288 k=4 d_ub=18 permA=11 permB=27 saved=True
  09 group=C2xC2xC2 n=288 k=4 d_ub=18 permA=20 permB=11 saved=True
  10 group=C2xC2xC2 n=288 k=4 d_ub=17 permA=27 permB=20 saved=True

