=== mar. 20 janv. 2026 15:28:18 CET steps=5000 batch=70 seed=1768922173 ===
[pilot] base k_table top pairs:
  k_base=18 permA=0 permB=0
  k_base=12 permA=29 permB=0
  k_base=12 permA=22 permB=0
  k_base=12 permA=13 permB=0
  k_base=12 permA=6 permB=0
[pilot] A multisets raw=792 (expected=792) enum_mode=multiset cayley_unique=26 perms=30 -> total scored = 780
[pilot] B multisets raw=792 (expected=792) enum_mode=multiset cayley_unique=26 perms=30 -> total scored = 780
[pilot] A frontier kept 128 candidates with points: (4,20), (0,49)
[pilot] B frontier kept 128 candidates with points: (4,20), (0,49)
[pilot] C2xC2xC2 n=288 d0=17 A_sets=26*30 -> keep 128; B_sets=26*30 -> keep 128
[pilot] MEAS n=288 k=8 dx_ub=16 dz_ub=17 d_ub=16 steps=5000 id=C2xC2xC2_c00034
[pilot] MEAS n=288 k=4 dx_ub=17 dz_ub=20 d_ub=17 steps=5000 id=C2xC2xC2_c00053
[saved] id=C2xC2xC2_c00053 -> results/c2xc2xc2_d16_20260120_152818/promising/C2xC2xC2_c00053 (reason: d>=sqrt(n))
[pilot] MEAS n=288 k=4 dx_ub=17 dz_ub=20 d_ub=17 steps=5000 id=C2xC2xC2_c00075
[saved] id=C2xC2xC2_c00075 -> results/c2xc2xc2_d16_20260120_152818/promising/C2xC2xC2_c00075 (reason: d>=sqrt(n))
[pilot] MEAS n=288 k=8 dx_ub=17 dz_ub=16 d_ub=16 steps=5000 id=C2xC2xC2_c00092
[pilot] MEAS n=288 k=4 dx_ub=16 dz_ub=16 d_ub=16 steps=5000 id=C2xC2xC2_c00123
[pilot] TARGET_REJECT d_ub=12 target=16 id=C2xC2xC2_c00156
[pilot] TARGET_REJECT d_ub=12 target=16 id=C2xC2xC2_c00176
[pilot] MEAS n=288 k=4 dx_ub=20 dz_ub=18 d_ub=18 steps=5000 id=C2xC2xC2_c00200
[saved] id=C2xC2xC2_c00200 -> results/c2xc2xc2_d16_20260120_152818/promising/C2xC2xC2_c00200 (reason: d>=sqrt(n))
[pilot] MEAS n=288 k=4 dx_ub=21 dz_ub=17 d_ub=17 steps=5000 id=C2xC2xC2_c00205
[saved] id=C2xC2xC2_c00205 -> results/c2xc2xc2_d16_20260120_152818/promising/C2xC2xC2_c00205 (reason: d>=sqrt(n))
[pilot] MEAS n=288 k=4 dx_ub=17 dz_ub=17 d_ub=17 steps=5000 id=C2xC2xC2_c00210
[saved] id=C2xC2xC2_c00210 -> results/c2xc2xc2_d16_20260120_152818/promising/C2xC2xC2_c00210 (reason: d>=sqrt(n))
[pilot] TARGET_REJECT d_ub=14 target=16 id=C2xC2xC2_c00220
[pilot] MEAS n=288 k=4 dx_ub=20 dz_ub=19 d_ub=19 steps=5000 id=C2xC2xC2_c00252
[saved] id=C2xC2xC2_c00252 -> results/c2xc2xc2_d16_20260120_152818/promising/C2xC2xC2_c00252 (reason: d>=sqrt(n))
[pilot] MEAS n=288 k=4 dx_ub=16 dz_ub=20 d_ub=16 steps=5000 id=C2xC2xC2_c00278
[pilot] TARGET_REJECT d_ub=6 target=16 id=C2xC2xC2_c00288
[pilot] TARGET_REJECT d_ub=12 target=16 id=C2xC2xC2_c00289
[pilot] MEAS n=288 k=4 dx_ub=20 dz_ub=20 d_ub=20 steps=5000 id=C2xC2xC2_c00306
[saved] id=C2xC2xC2_c00306 -> results/c2xc2xc2_d16_20260120_152818/promising/C2xC2xC2_c00306 (reason: d>=sqrt(n))
[pilot] MEAS n=288 k=4 dx_ub=16 dz_ub=17 d_ub=16 steps=5000 id=C2xC2xC2_c00348
[pilot] MEAS n=288 k=4 dx_ub=20 dz_ub=16 d_ub=16 steps=5000 id=C2xC2xC2_c00359
[pilot] MEAS n=288 k=4 dx_ub=20 dz_ub=20 d_ub=20 steps=5000 id=C2xC2xC2_c00370
[saved] id=C2xC2xC2_c00370 -> results/c2xc2xc2_d16_20260120_152818/promising/C2xC2xC2_c00370 (reason: d>=sqrt(n))
[pilot] MEAS n=288 k=4 dx_ub=16 dz_ub=16 d_ub=16 steps=5000 id=C2xC2xC2_c00380
[pilot] MEAS n=288 k=8 dx_ub=18 dz_ub=16 d_ub=16 steps=5000 id=C2xC2xC2_c00385
[pilot] MEAS n=288 k=4 dx_ub=20 dz_ub=20 d_ub=20 steps=5000 id=C2xC2xC2_c00400
[saved] id=C2xC2xC2_c00400 -> results/c2xc2xc2_d16_20260120_152818/promising/C2xC2xC2_c00400 (reason: d>=sqrt(n))
[pilot] MEAS n=288 k=8 dx_ub=16 dz_ub=17 d_ub=16 steps=5000 id=C2xC2xC2_c00410
[pilot] MEAS n=288 k=4 dx_ub=20 dz_ub=20 d_ub=20 steps=5000 id=C2xC2xC2_c00412
[saved] id=C2xC2xC2_c00412 -> results/c2xc2xc2_d16_20260120_152818/promising/C2xC2xC2_c00412 (reason: d>=sqrt(n))
[pilot] MEAS n=288 k=4 dx_ub=17 dz_ub=17 d_ub=17 steps=5000 id=C2xC2xC2_c00435
[saved] id=C2xC2xC2_c00435 -> results/c2xc2xc2_d16_20260120_152818/promising/C2xC2xC2_c00435 (reason: d>=sqrt(n))
[pilot] MEAS n=288 k=4 dx_ub=20 dz_ub=20 d_ub=20 steps=5000 id=C2xC2xC2_c00441
[saved] id=C2xC2xC2_c00441 -> results/c2xc2xc2_d16_20260120_152818/promising/C2xC2xC2_c00441 (reason: d>=sqrt(n))
[pilot] MEAS n=288 k=4 dx_ub=17 dz_ub=16 d_ub=16 steps=5000 id=C2xC2xC2_c00471
[best_by_k] group=C2xC2xC2 n=288
k  | d_ub | steps | dx_ub | dz_ub | id
 4 |   20 |  5000 |    20 |    20 | C2xC2xC2_c00306
 8 |   16 |  5000 |    16 |    17 | C2xC2xC2_c00034
[coverage] group=C2xC2xC2 A_sel=128 B_sel=128 Q_meas=27 ratio_ge_sqrt=0.000 ratio_sel=0.002
[coverage] run summary:
[coverage] group=C2xC2xC2 A_sel=128 B_sel=128 Q_meas=27 ratio_ge_sqrt=0.000 ratio_sel=0.002
[summary] best-by-k (measured; includes rejects):
  k=4 best_d_ub=20 count_measured=18 example_id=C2xC2xC2_c00306
  k=8 best_d_ub=16 count_measured=9 example_id=C2xC2xC2_c00034
[summary] best-by-k (survivors; target=16):
  k=4 best_d_ub=20 count_survivors=18 example_id=C2xC2xC2_c00306
  k=8 best_d_ub=16 count_survivors=4 example_id=C2xC2xC2_c00034
[pilot] top results:
  01 group=C2xC2xC2 n=288 k=4 d_ub=20 permA=20 permB=11 saved=True
  02 group=C2xC2xC2 n=288 k=4 d_ub=20 permA=12 permB=8 saved=True
  03 group=C2xC2xC2 n=288 k=4 d_ub=20 permA=11 permB=8 saved=True
  04 group=C2xC2xC2 n=288 k=4 d_ub=20 permA=12 permB=20 saved=True
  05 group=C2xC2xC2 n=288 k=4 d_ub=20 permA=20 permB=7 saved=True
  06 group=C2xC2xC2 n=288 k=4 d_ub=19 permA=20 permB=12 saved=True
  07 group=C2xC2xC2 n=288 k=4 d_ub=18 permA=11 permB=27 saved=True
  08 group=C2xC2xC2 n=288 k=4 d_ub=17 permA=7 permB=11 saved=True
  09 group=C2xC2xC2 n=288 k=4 d_ub=17 permA=7 permB=27 saved=True
  10 group=C2xC2xC2 n=288 k=4 d_ub=17 permA=20 permB=20 saved=True

