=== mar. 20 janv. 2026 15:06:38 CET steps=5000 batch=29 seed=1768922132 ===
[pilot] base k_table top pairs:
  k_base=18 permA=0 permB=0
  k_base=12 permA=29 permB=0
  k_base=12 permA=22 permB=0
  k_base=12 permA=13 permB=0
  k_base=12 permA=6 permB=0
[pilot] A multisets raw=792 (expected=792) enum_mode=multiset cayley_unique=26 perms=30 -> total scored = 780
[pilot] B multisets raw=792 (expected=792) enum_mode=multiset cayley_unique=26 perms=30 -> total scored = 780
[pilot] A frontier kept 128 candidates with points: (4,20), (0,49)
[pilot] B frontier kept 128 candidates with points: (4,20), (0,49)
[pilot] C2xC2xC2 n=288 d0=17 A_sets=26*30 -> keep 128; B_sets=26*30 -> keep 128
[pilot] MEAS n=288 k=4 dx_ub=23 dz_ub=20 d_ub=20 steps=5000 id=C2xC2xC2_c00006
[saved] id=C2xC2xC2_c00006 -> results/c2xc2xc2_d16_20260120_150638/promising/C2xC2xC2_c00006 (reason: d>=sqrt(n))
[pilot] MEAS n=288 k=4 dx_ub=16 dz_ub=20 d_ub=16 steps=5000 id=C2xC2xC2_c00008
[pilot] TARGET_REJECT d_ub=13 target=16 id=C2xC2xC2_c00010
[pilot] TARGET_REJECT d_ub=12 target=16 id=C2xC2xC2_c00011
[pilot] MEAS n=288 k=4 dx_ub=19 dz_ub=20 d_ub=19 steps=5000 id=C2xC2xC2_c00040
[saved] id=C2xC2xC2_c00040 -> results/c2xc2xc2_d16_20260120_150638/promising/C2xC2xC2_c00040 (reason: d>=sqrt(n))
[pilot] TARGET_REJECT d_ub=14 target=16 id=C2xC2xC2_c00073
[pilot] MEAS n=288 k=4 dx_ub=17 dz_ub=21 d_ub=17 steps=5000 id=C2xC2xC2_c00076
[saved] id=C2xC2xC2_c00076 -> results/c2xc2xc2_d16_20260120_150638/promising/C2xC2xC2_c00076 (reason: d>=sqrt(n))
[pilot] MEAS n=288 k=4 dx_ub=22 dz_ub=20 d_ub=20 steps=5000 id=C2xC2xC2_c00082
[saved] id=C2xC2xC2_c00082 -> results/c2xc2xc2_d16_20260120_150638/promising/C2xC2xC2_c00082 (reason: d>=sqrt(n))
[pilot] MEAS n=288 k=4 dx_ub=17 dz_ub=20 d_ub=17 steps=5000 id=C2xC2xC2_c00142
[saved] id=C2xC2xC2_c00142 -> results/c2xc2xc2_d16_20260120_150638/promising/C2xC2xC2_c00142 (reason: d>=sqrt(n))
[pilot] TARGET_REJECT d_ub=12 target=16 id=C2xC2xC2_c00156
[pilot] TARGET_REJECT d_ub=12 target=16 id=C2xC2xC2_c00157
[pilot] MEAS n=288 k=8 dx_ub=17 dz_ub=16 d_ub=16 steps=5000 id=C2xC2xC2_c00159
[pilot] MEAS n=288 k=4 dx_ub=20 dz_ub=16 d_ub=16 steps=5000 id=C2xC2xC2_c00172
[pilot] TARGET_REJECT d_ub=12 target=16 id=C2xC2xC2_c00174
[pilot] TARGET_REJECT d_ub=14 target=16 id=C2xC2xC2_c00182
[pilot] TARGET_REJECT d_ub=13 target=16 id=C2xC2xC2_c00204
[pilot] MEAS n=288 k=8 dx_ub=16 dz_ub=17 d_ub=16 steps=5000 id=C2xC2xC2_c00209
[pilot] MEAS n=288 k=4 dx_ub=20 dz_ub=20 d_ub=20 steps=5000 id=C2xC2xC2_c00240
[saved] id=C2xC2xC2_c00240 -> results/c2xc2xc2_d16_20260120_150638/promising/C2xC2xC2_c00240 (reason: d>=sqrt(n))
[pilot] MEAS n=288 k=4 dx_ub=23 dz_ub=20 d_ub=20 steps=5000 id=C2xC2xC2_c00253
[saved] id=C2xC2xC2_c00253 -> results/c2xc2xc2_d16_20260120_150638/promising/C2xC2xC2_c00253 (reason: d>=sqrt(n))
[pilot] MEAS n=288 k=8 dx_ub=20 dz_ub=16 d_ub=16 steps=5000 id=C2xC2xC2_c00286
[pilot] MEAS n=288 k=4 dx_ub=23 dz_ub=18 d_ub=18 steps=5000 id=C2xC2xC2_c00338
[saved] id=C2xC2xC2_c00338 -> results/c2xc2xc2_d16_20260120_150638/promising/C2xC2xC2_c00338 (reason: d>=sqrt(n))
[pilot] MEAS n=288 k=4 dx_ub=16 dz_ub=16 d_ub=16 steps=5000 id=C2xC2xC2_c00342
[pilot] MEAS n=288 k=4 dx_ub=16 dz_ub=18 d_ub=16 steps=5000 id=C2xC2xC2_c00348
[pilot] MEAS n=288 k=4 dx_ub=16 dz_ub=20 d_ub=16 steps=5000 id=C2xC2xC2_c00371
[pilot] MEAS n=288 k=4 dx_ub=20 dz_ub=20 d_ub=20 steps=5000 id=C2xC2xC2_c00413
[saved] id=C2xC2xC2_c00413 -> results/c2xc2xc2_d16_20260120_150638/promising/C2xC2xC2_c00413 (reason: d>=sqrt(n))
[pilot] MEAS n=288 k=4 dx_ub=17 dz_ub=16 d_ub=16 steps=5000 id=C2xC2xC2_c00426
[pilot] MEAS n=288 k=4 dx_ub=20 dz_ub=17 d_ub=17 steps=5000 id=C2xC2xC2_c00429
[saved] id=C2xC2xC2_c00429 -> results/c2xc2xc2_d16_20260120_150638/promising/C2xC2xC2_c00429 (reason: d>=sqrt(n))
[pilot] TARGET_REJECT d_ub=12 target=16 id=C2xC2xC2_c00483
[pilot] MEAS n=288 k=4 dx_ub=17 dz_ub=20 d_ub=17 steps=5000 id=C2xC2xC2_c00499
[saved] id=C2xC2xC2_c00499 -> results/c2xc2xc2_d16_20260120_150638/promising/C2xC2xC2_c00499 (reason: d>=sqrt(n))
[best_by_k] group=C2xC2xC2 n=288
k  | d_ub | steps | dx_ub | dz_ub | id
 4 |   20 |  5000 |    23 |    20 | C2xC2xC2_c00006
 8 |   16 |  5000 |    17 |    16 | C2xC2xC2_c00159
[coverage] group=C2xC2xC2 A_sel=128 B_sel=128 Q_meas=29 ratio_ge_sqrt=0.001 ratio_sel=0.002
[coverage] run summary:
[coverage] group=C2xC2xC2 A_sel=128 B_sel=128 Q_meas=29 ratio_ge_sqrt=0.001 ratio_sel=0.002
[summary] best-by-k (measured; includes rejects):
  k=4 best_d_ub=20 count_measured=21 example_id=C2xC2xC2_c00006
  k=8 best_d_ub=16 count_measured=8 example_id=C2xC2xC2_c00159
[summary] best-by-k (survivors; target=16):
  k=4 best_d_ub=20 count_survivors=17 example_id=C2xC2xC2_c00006
  k=8 best_d_ub=16 count_survivors=3 example_id=C2xC2xC2_c00159
[pilot] top results:
  01 group=C2xC2xC2 n=288 k=4 d_ub=20 permA=27 permB=11 saved=True
  02 group=C2xC2xC2 n=288 k=4 d_ub=20 permA=11 permB=27 saved=True
  03 group=C2xC2xC2 n=288 k=4 d_ub=20 permA=8 permB=7 saved=True
  04 group=C2xC2xC2 n=288 k=4 d_ub=20 permA=11 permB=11 saved=True
  05 group=C2xC2xC2 n=288 k=4 d_ub=20 permA=11 permB=20 saved=True
  06 group=C2xC2xC2 n=288 k=4 d_ub=19 permA=8 permB=12 saved=True
  07 group=C2xC2xC2 n=288 k=4 d_ub=18 permA=11 permB=27 saved=True
  08 group=C2xC2xC2 n=288 k=4 d_ub=17 permA=7 permB=27 saved=True
  09 group=C2xC2xC2 n=288 k=4 d_ub=17 permA=8 permB=11 saved=True
  10 group=C2xC2xC2 n=288 k=4 d_ub=17 permA=27 permB=8 saved=True

