=== mar. 20 janv. 2026 15:04:58 CET steps=5000 batch=26 seed=1768922129 ===
[pilot] base k_table top pairs:
  k_base=18 permA=0 permB=0
  k_base=12 permA=29 permB=0
  k_base=12 permA=22 permB=0
  k_base=12 permA=13 permB=0
  k_base=12 permA=6 permB=0
[pilot] A multisets raw=792 (expected=792) enum_mode=multiset cayley_unique=26 perms=30 -> total scored = 780
[pilot] B multisets raw=792 (expected=792) enum_mode=multiset cayley_unique=26 perms=30 -> total scored = 780
[pilot] A frontier kept 128 candidates with points: (4,20), (0,49)
[pilot] B frontier kept 128 candidates with points: (4,20), (0,49)
[pilot] C2xC2xC2 n=288 d0=17 A_sets=26*30 -> keep 128; B_sets=26*30 -> keep 128
[pilot] MEAS n=288 k=4 dx_ub=19 dz_ub=20 d_ub=19 steps=5000 id=C2xC2xC2_c00039
[saved] id=C2xC2xC2_c00039 -> results/c2xc2xc2_d16_20260120_150458/promising/C2xC2xC2_c00039 (reason: d>=sqrt(n))
[pilot] MEAS n=288 k=4 dx_ub=16 dz_ub=16 d_ub=16 steps=5000 id=C2xC2xC2_c00043
[pilot] MEAS n=288 k=4 dx_ub=20 dz_ub=20 d_ub=20 steps=5000 id=C2xC2xC2_c00051
[saved] id=C2xC2xC2_c00051 -> results/c2xc2xc2_d16_20260120_150458/promising/C2xC2xC2_c00051 (reason: d>=sqrt(n))
[pilot] MEAS n=288 k=4 dx_ub=16 dz_ub=18 d_ub=16 steps=5000 id=C2xC2xC2_c00077
[pilot] MEAS n=288 k=8 dx_ub=16 dz_ub=16 d_ub=16 steps=5000 id=C2xC2xC2_c00083
[pilot] MEAS n=288 k=4 dx_ub=22 dz_ub=21 d_ub=21 steps=5000 id=C2xC2xC2_c00153
[saved] id=C2xC2xC2_c00153 -> results/c2xc2xc2_d16_20260120_150458/promising/C2xC2xC2_c00153 (reason: d>=sqrt(n))
[pilot] MEAS n=288 k=4 dx_ub=20 dz_ub=20 d_ub=20 steps=5000 id=C2xC2xC2_c00154
[saved] id=C2xC2xC2_c00154 -> results/c2xc2xc2_d16_20260120_150458/promising/C2xC2xC2_c00154 (reason: d>=sqrt(n))
[pilot] TARGET_REJECT d_ub=12 target=16 id=C2xC2xC2_c00165
[pilot] MEAS n=288 k=4 dx_ub=16 dz_ub=16 d_ub=16 steps=5000 id=C2xC2xC2_c00189
[pilot] MEAS n=288 k=4 dx_ub=16 dz_ub=20 d_ub=16 steps=5000 id=C2xC2xC2_c00208
[pilot] MEAS n=288 k=4 dx_ub=20 dz_ub=17 d_ub=17 steps=5000 id=C2xC2xC2_c00213
[saved] id=C2xC2xC2_c00213 -> results/c2xc2xc2_d16_20260120_150458/promising/C2xC2xC2_c00213 (reason: d>=sqrt(n))
[pilot] TARGET_REJECT d_ub=13 target=16 id=C2xC2xC2_c00215
[pilot] TARGET_REJECT d_ub=12 target=16 id=C2xC2xC2_c00227
[pilot] MEAS n=288 k=8 dx_ub=20 dz_ub=16 d_ub=16 steps=5000 id=C2xC2xC2_c00232
[pilot] MEAS n=288 k=4 dx_ub=17 dz_ub=20 d_ub=17 steps=5000 id=C2xC2xC2_c00242
[saved] id=C2xC2xC2_c00242 -> results/c2xc2xc2_d16_20260120_150458/promising/C2xC2xC2_c00242 (reason: d>=sqrt(n))
[pilot] MEAS n=288 k=4 dx_ub=20 dz_ub=21 d_ub=20 steps=5000 id=C2xC2xC2_c00261
[saved] id=C2xC2xC2_c00261 -> results/c2xc2xc2_d16_20260120_150458/promising/C2xC2xC2_c00261 (reason: d>=sqrt(n))
[pilot] MEAS n=288 k=4 dx_ub=16 dz_ub=16 d_ub=16 steps=5000 id=C2xC2xC2_c00340
[pilot] TARGET_REJECT d_ub=14 target=16 id=C2xC2xC2_c00362
[pilot] TARGET_REJECT d_ub=14 target=16 id=C2xC2xC2_c00374
[pilot] MEAS n=288 k=4 dx_ub=20 dz_ub=17 d_ub=17 steps=5000 id=C2xC2xC2_c00385
[saved] id=C2xC2xC2_c00385 -> results/c2xc2xc2_d16_20260120_150458/promising/C2xC2xC2_c00385 (reason: d>=sqrt(n))
[pilot] MEAS n=288 k=4 dx_ub=20 dz_ub=17 d_ub=17 steps=5000 id=C2xC2xC2_c00421
[saved] id=C2xC2xC2_c00421 -> results/c2xc2xc2_d16_20260120_150458/promising/C2xC2xC2_c00421 (reason: d>=sqrt(n))
[pilot] MEAS n=288 k=4 dx_ub=19 dz_ub=17 d_ub=17 steps=5000 id=C2xC2xC2_c00422
[saved] id=C2xC2xC2_c00422 -> results/c2xc2xc2_d16_20260120_150458/promising/C2xC2xC2_c00422 (reason: d>=sqrt(n))
[pilot] MEAS n=288 k=4 dx_ub=17 dz_ub=17 d_ub=17 steps=5000 id=C2xC2xC2_c00462
[saved] id=C2xC2xC2_c00462 -> results/c2xc2xc2_d16_20260120_150458/promising/C2xC2xC2_c00462 (reason: d>=sqrt(n))
[pilot] TARGET_REJECT d_ub=6 target=16 id=C2xC2xC2_c00478
[pilot] MEAS n=288 k=4 dx_ub=16 dz_ub=17 d_ub=16 steps=5000 id=C2xC2xC2_c00489
[best_by_k] group=C2xC2xC2 n=288
k  | d_ub | steps | dx_ub | dz_ub | id
 4 |   21 |  5000 |    22 |    21 | C2xC2xC2_c00153
 8 |   16 |  5000 |    16 |    16 | C2xC2xC2_c00083
[coverage] group=C2xC2xC2 A_sel=128 B_sel=128 Q_meas=25 ratio_ge_sqrt=0.000 ratio_sel=0.002
[coverage] run summary:
[coverage] group=C2xC2xC2 A_sel=128 B_sel=128 Q_meas=25 ratio_ge_sqrt=0.000 ratio_sel=0.002
[summary] best-by-k (measured; includes rejects):
  k=4 best_d_ub=21 count_measured=18 example_id=C2xC2xC2_c00153
  k=8 best_d_ub=16 count_measured=7 example_id=C2xC2xC2_c00083
[summary] best-by-k (survivors; target=16):
  k=4 best_d_ub=21 count_survivors=17 example_id=C2xC2xC2_c00153
  k=8 best_d_ub=16 count_survivors=2 example_id=C2xC2xC2_c00083
[pilot] top results:
  01 group=C2xC2xC2 n=288 k=4 d_ub=21 permA=7 permB=20 saved=True
  02 group=C2xC2xC2 n=288 k=4 d_ub=20 permA=11 permB=11 saved=True
  03 group=C2xC2xC2 n=288 k=4 d_ub=20 permA=20 permB=7 saved=True
  04 group=C2xC2xC2 n=288 k=4 d_ub=20 permA=27 permB=27 saved=True
  05 group=C2xC2xC2 n=288 k=4 d_ub=19 permA=8 permB=27 saved=True
  06 group=C2xC2xC2 n=288 k=4 d_ub=17 permA=11 permB=8 saved=True
  07 group=C2xC2xC2 n=288 k=4 d_ub=17 permA=11 permB=20 saved=True
  08 group=C2xC2xC2 n=288 k=4 d_ub=17 permA=20 permB=12 saved=True
  09 group=C2xC2xC2 n=288 k=4 d_ub=17 permA=20 permB=20 saved=True
  10 group=C2xC2xC2 n=288 k=4 d_ub=17 permA=11 permB=8 saved=True

