=== mar. 20 janv. 2026 14:53:15 CET steps=5000 batch=4 seed=1768922107 ===
[pilot] base k_table top pairs:
  k_base=18 permA=0 permB=0
  k_base=12 permA=29 permB=0
  k_base=12 permA=22 permB=0
  k_base=12 permA=13 permB=0
  k_base=12 permA=6 permB=0
[pilot] A multisets raw=792 (expected=792) enum_mode=multiset cayley_unique=26 perms=30 -> total scored = 780
[pilot] B multisets raw=792 (expected=792) enum_mode=multiset cayley_unique=26 perms=30 -> total scored = 780
[pilot] A frontier kept 128 candidates with points: (4,20), (0,49)
[pilot] B frontier kept 128 candidates with points: (4,20), (0,49)
[pilot] C2xC2xC2 n=288 d0=17 A_sets=26*30 -> keep 128; B_sets=26*30 -> keep 128
[pilot] MEAS n=288 k=4 dx_ub=20 dz_ub=20 d_ub=20 steps=5000 id=C2xC2xC2_c00016
[saved] id=C2xC2xC2_c00016 -> results/c2xc2xc2_d16_20260120_145315/promising/C2xC2xC2_c00016 (reason: d>=sqrt(n))
[pilot] MEAS n=288 k=4 dx_ub=16 dz_ub=16 d_ub=16 steps=5000 id=C2xC2xC2_c00029
[pilot] MEAS n=288 k=4 dx_ub=16 dz_ub=16 d_ub=16 steps=5000 id=C2xC2xC2_c00037
[pilot] MEAS n=288 k=8 dx_ub=16 dz_ub=18 d_ub=16 steps=5000 id=C2xC2xC2_c00048
[pilot] MEAS n=288 k=4 dx_ub=16 dz_ub=16 d_ub=16 steps=5000 id=C2xC2xC2_c00090
[pilot] MEAS n=288 k=4 dx_ub=20 dz_ub=19 d_ub=19 steps=5000 id=C2xC2xC2_c00111
[saved] id=C2xC2xC2_c00111 -> results/c2xc2xc2_d16_20260120_145315/promising/C2xC2xC2_c00111 (reason: d>=sqrt(n))
[pilot] TARGET_REJECT d_ub=12 target=16 id=C2xC2xC2_c00125
[pilot] MEAS n=288 k=4 dx_ub=16 dz_ub=18 d_ub=16 steps=5000 id=C2xC2xC2_c00141
[pilot] MEAS n=288 k=8 dx_ub=16 dz_ub=17 d_ub=16 steps=5000 id=C2xC2xC2_c00144
[pilot] MEAS n=288 k=4 dx_ub=20 dz_ub=20 d_ub=20 steps=5000 id=C2xC2xC2_c00159
[saved] id=C2xC2xC2_c00159 -> results/c2xc2xc2_d16_20260120_145315/promising/C2xC2xC2_c00159 (reason: d>=sqrt(n))
[pilot] MEAS n=288 k=4 dx_ub=16 dz_ub=18 d_ub=16 steps=5000 id=C2xC2xC2_c00160
[pilot] MEAS n=288 k=4 dx_ub=20 dz_ub=16 d_ub=16 steps=5000 id=C2xC2xC2_c00206
[pilot] TARGET_REJECT d_ub=15 target=16 id=C2xC2xC2_c00228
[pilot] MEAS n=288 k=4 dx_ub=20 dz_ub=20 d_ub=20 steps=5000 id=C2xC2xC2_c00231
[saved] id=C2xC2xC2_c00231 -> results/c2xc2xc2_d16_20260120_145315/promising/C2xC2xC2_c00231 (reason: d>=sqrt(n))
[pilot] TARGET_REJECT d_ub=12 target=16 id=C2xC2xC2_c00245
[pilot] TARGET_REJECT d_ub=12 target=16 id=C2xC2xC2_c00256
[pilot] TARGET_REJECT d_ub=6 target=16 id=C2xC2xC2_c00267
[pilot] TARGET_REJECT d_ub=12 target=16 id=C2xC2xC2_c00274
[pilot] MEAS n=288 k=4 dx_ub=20 dz_ub=17 d_ub=17 steps=5000 id=C2xC2xC2_c00283
[saved] id=C2xC2xC2_c00283 -> results/c2xc2xc2_d16_20260120_145315/promising/C2xC2xC2_c00283 (reason: d>=sqrt(n))
[pilot] MEAS n=288 k=4 dx_ub=16 dz_ub=20 d_ub=16 steps=5000 id=C2xC2xC2_c00315
[pilot] MEAS n=288 k=4 dx_ub=16 dz_ub=16 d_ub=16 steps=5000 id=C2xC2xC2_c00333
[pilot] MEAS n=288 k=4 dx_ub=20 dz_ub=16 d_ub=16 steps=5000 id=C2xC2xC2_c00340
[pilot] MEAS n=288 k=4 dx_ub=19 dz_ub=20 d_ub=19 steps=5000 id=C2xC2xC2_c00347
[saved] id=C2xC2xC2_c00347 -> results/c2xc2xc2_d16_20260120_145315/promising/C2xC2xC2_c00347 (reason: d>=sqrt(n))
[pilot] MEAS n=288 k=4 dx_ub=16 dz_ub=16 d_ub=16 steps=5000 id=C2xC2xC2_c00368
[pilot] TARGET_REJECT d_ub=12 target=16 id=C2xC2xC2_c00400
[pilot] MEAS n=288 k=4 dx_ub=20 dz_ub=20 d_ub=20 steps=5000 id=C2xC2xC2_c00429
[saved] id=C2xC2xC2_c00429 -> results/c2xc2xc2_d16_20260120_145315/promising/C2xC2xC2_c00429 (reason: d>=sqrt(n))
[pilot] MEAS n=288 k=4 dx_ub=22 dz_ub=20 d_ub=20 steps=5000 id=C2xC2xC2_c00458
[saved] id=C2xC2xC2_c00458 -> results/c2xc2xc2_d16_20260120_145315/promising/C2xC2xC2_c00458 (reason: d>=sqrt(n))
[pilot] MEAS n=288 k=4 dx_ub=16 dz_ub=16 d_ub=16 steps=5000 id=C2xC2xC2_c00483
[best_by_k] group=C2xC2xC2 n=288
k  | d_ub | steps | dx_ub | dz_ub | id
 4 |   20 |  5000 |    20 |    20 | C2xC2xC2_c00016
 8 |   16 |  5000 |    16 |    18 | C2xC2xC2_c00048
[coverage] group=C2xC2xC2 A_sel=128 B_sel=128 Q_meas=28 ratio_ge_sqrt=0.001 ratio_sel=0.002
[coverage] run summary:
[coverage] group=C2xC2xC2 A_sel=128 B_sel=128 Q_meas=28 ratio_ge_sqrt=0.001 ratio_sel=0.002
[summary] best-by-k (measured; includes rejects):
  k=4 best_d_ub=20 count_measured=22 example_id=C2xC2xC2_c00016
  k=8 best_d_ub=16 count_measured=6 example_id=C2xC2xC2_c00048
[summary] best-by-k (survivors; target=16):
  k=4 best_d_ub=20 count_survivors=19 example_id=C2xC2xC2_c00016
  k=8 best_d_ub=16 count_survivors=2 example_id=C2xC2xC2_c00048
[pilot] top results:
  01 group=C2xC2xC2 n=288 k=4 d_ub=20 permA=20 permB=11 saved=True
  02 group=C2xC2xC2 n=288 k=4 d_ub=20 permA=11 permB=12 saved=True
  03 group=C2xC2xC2 n=288 k=4 d_ub=20 permA=8 permB=27 saved=True
  04 group=C2xC2xC2 n=288 k=4 d_ub=20 permA=12 permB=20 saved=True
  05 group=C2xC2xC2 n=288 k=4 d_ub=20 permA=20 permB=27 saved=True
  06 group=C2xC2xC2 n=288 k=4 d_ub=19 permA=12 permB=8 saved=True
  07 group=C2xC2xC2 n=288 k=4 d_ub=19 permA=27 permB=20 saved=True
  08 group=C2xC2xC2 n=288 k=4 d_ub=17 permA=27 permB=8 saved=True
  09 group=C2xC2xC2 n=288 k=8 d_ub=16 permA=7 permB=8 saved=False
  10 group=C2xC2xC2 n=288 k=8 d_ub=16 permA=11 permB=20 saved=False

