=== mar. 20 janv. 2026 15:23:48 CET steps=5000 batch=61 seed=1768922164 ===
[pilot] base k_table top pairs:
  k_base=18 permA=0 permB=0
  k_base=12 permA=29 permB=0
  k_base=12 permA=22 permB=0
  k_base=12 permA=13 permB=0
  k_base=12 permA=6 permB=0
[pilot] A multisets raw=792 (expected=792) enum_mode=multiset cayley_unique=26 perms=30 -> total scored = 780
[pilot] B multisets raw=792 (expected=792) enum_mode=multiset cayley_unique=26 perms=30 -> total scored = 780
[pilot] A frontier kept 128 candidates with points: (4,20), (0,49)
[pilot] B frontier kept 128 candidates with points: (4,20), (0,49)
[pilot] C2xC2xC2 n=288 d0=17 A_sets=26*30 -> keep 128; B_sets=26*30 -> keep 128
[pilot] MEAS n=288 k=8 dx_ub=16 dz_ub=17 d_ub=16 steps=5000 id=C2xC2xC2_c00024
[pilot] MEAS n=288 k=4 dx_ub=16 dz_ub=20 d_ub=16 steps=5000 id=C2xC2xC2_c00025
[pilot] MEAS n=288 k=4 dx_ub=16 dz_ub=16 d_ub=16 steps=5000 id=C2xC2xC2_c00073
[pilot] MEAS n=288 k=4 dx_ub=19 dz_ub=20 d_ub=19 steps=5000 id=C2xC2xC2_c00077
[saved] id=C2xC2xC2_c00077 -> results/c2xc2xc2_d16_20260120_152348/promising/C2xC2xC2_c00077 (reason: d>=sqrt(n))
[pilot] MEAS n=288 k=4 dx_ub=16 dz_ub=20 d_ub=16 steps=5000 id=C2xC2xC2_c00099
[pilot] MEAS n=288 k=8 dx_ub=16 dz_ub=18 d_ub=16 steps=5000 id=C2xC2xC2_c00102
[pilot] MEAS n=288 k=8 dx_ub=16 dz_ub=17 d_ub=16 steps=5000 id=C2xC2xC2_c00116
[pilot] MEAS n=288 k=4 dx_ub=20 dz_ub=20 d_ub=20 steps=5000 id=C2xC2xC2_c00128
[saved] id=C2xC2xC2_c00128 -> results/c2xc2xc2_d16_20260120_152348/promising/C2xC2xC2_c00128 (reason: d>=sqrt(n))
[pilot] MEAS n=288 k=4 dx_ub=20 dz_ub=20 d_ub=20 steps=5000 id=C2xC2xC2_c00129
[saved] id=C2xC2xC2_c00129 -> results/c2xc2xc2_d16_20260120_152348/promising/C2xC2xC2_c00129 (reason: d>=sqrt(n))
[pilot] MEAS n=288 k=8 dx_ub=16 dz_ub=17 d_ub=16 steps=5000 id=C2xC2xC2_c00150
[pilot] MEAS n=288 k=4 dx_ub=20 dz_ub=20 d_ub=20 steps=5000 id=C2xC2xC2_c00193
[saved] id=C2xC2xC2_c00193 -> results/c2xc2xc2_d16_20260120_152348/promising/C2xC2xC2_c00193 (reason: d>=sqrt(n))
[pilot] TARGET_REJECT d_ub=12 target=16 id=C2xC2xC2_c00214
[pilot] MEAS n=288 k=4 dx_ub=20 dz_ub=16 d_ub=16 steps=5000 id=C2xC2xC2_c00236
[pilot] MEAS n=288 k=4 dx_ub=21 dz_ub=16 d_ub=16 steps=5000 id=C2xC2xC2_c00246
[pilot] MEAS n=288 k=4 dx_ub=16 dz_ub=17 d_ub=16 steps=5000 id=C2xC2xC2_c00266
[pilot] MEAS n=288 k=4 dx_ub=20 dz_ub=20 d_ub=20 steps=5000 id=C2xC2xC2_c00278
[saved] id=C2xC2xC2_c00278 -> results/c2xc2xc2_d16_20260120_152348/promising/C2xC2xC2_c00278 (reason: d>=sqrt(n))
[pilot] TARGET_REJECT d_ub=12 target=16 id=C2xC2xC2_c00299
[pilot] MEAS n=288 k=4 dx_ub=20 dz_ub=20 d_ub=20 steps=5000 id=C2xC2xC2_c00322
[saved] id=C2xC2xC2_c00322 -> results/c2xc2xc2_d16_20260120_152348/promising/C2xC2xC2_c00322 (reason: d>=sqrt(n))
[pilot] MEAS n=288 k=4 dx_ub=19 dz_ub=19 d_ub=19 steps=5000 id=C2xC2xC2_c00324
[saved] id=C2xC2xC2_c00324 -> results/c2xc2xc2_d16_20260120_152348/promising/C2xC2xC2_c00324 (reason: d>=sqrt(n))
[pilot] MEAS n=288 k=4 dx_ub=16 dz_ub=16 d_ub=16 steps=5000 id=C2xC2xC2_c00336
[pilot] MEAS n=288 k=4 dx_ub=16 dz_ub=20 d_ub=16 steps=5000 id=C2xC2xC2_c00348
[pilot] MEAS n=288 k=4 dx_ub=17 dz_ub=20 d_ub=17 steps=5000 id=C2xC2xC2_c00363
[saved] id=C2xC2xC2_c00363 -> results/c2xc2xc2_d16_20260120_152348/promising/C2xC2xC2_c00363 (reason: d>=sqrt(n))
[pilot] TARGET_REJECT d_ub=12 target=16 id=C2xC2xC2_c00376
[pilot] MEAS n=288 k=8 dx_ub=16 dz_ub=17 d_ub=16 steps=5000 id=C2xC2xC2_c00434
[pilot] MEAS n=288 k=4 dx_ub=20 dz_ub=20 d_ub=20 steps=5000 id=C2xC2xC2_c00486
[saved] id=C2xC2xC2_c00486 -> results/c2xc2xc2_d16_20260120_152348/promising/C2xC2xC2_c00486 (reason: d>=sqrt(n))
[best_by_k] group=C2xC2xC2 n=288
k  | d_ub | steps | dx_ub | dz_ub | id
 4 |   20 |  5000 |    20 |    20 | C2xC2xC2_c00128
 8 |   16 |  5000 |    16 |    17 | C2xC2xC2_c00024
[coverage] group=C2xC2xC2 A_sel=128 B_sel=128 Q_meas=25 ratio_ge_sqrt=0.000 ratio_sel=0.002
[coverage] run summary:
[coverage] group=C2xC2xC2 A_sel=128 B_sel=128 Q_meas=25 ratio_ge_sqrt=0.000 ratio_sel=0.002
[summary] best-by-k (measured; includes rejects):
  k=4 best_d_ub=20 count_measured=19 example_id=C2xC2xC2_c00128
  k=8 best_d_ub=16 count_measured=6 example_id=C2xC2xC2_c00024
[summary] best-by-k (survivors; target=16):
  k=4 best_d_ub=20 count_survivors=17 example_id=C2xC2xC2_c00128
  k=8 best_d_ub=16 count_survivors=5 example_id=C2xC2xC2_c00024
[pilot] top results:
  01 group=C2xC2xC2 n=288 k=4 d_ub=20 permA=20 permB=27 saved=True
  02 group=C2xC2xC2 n=288 k=4 d_ub=20 permA=20 permB=12 saved=True
  03 group=C2xC2xC2 n=288 k=4 d_ub=20 permA=11 permB=20 saved=True
  04 group=C2xC2xC2 n=288 k=4 d_ub=20 permA=7 permB=12 saved=True
  05 group=C2xC2xC2 n=288 k=4 d_ub=20 permA=12 permB=20 saved=True
  06 group=C2xC2xC2 n=288 k=4 d_ub=20 permA=7 permB=20 saved=True
  07 group=C2xC2xC2 n=288 k=4 d_ub=19 permA=11 permB=11 saved=True
  08 group=C2xC2xC2 n=288 k=4 d_ub=19 permA=11 permB=20 saved=True
  09 group=C2xC2xC2 n=288 k=4 d_ub=17 permA=27 permB=20 saved=True
  10 group=C2xC2xC2 n=288 k=8 d_ub=16 permA=20 permB=11 saved=False

