=== mar. 20 janv. 2026 15:17:56 CET steps=5000 batch=50 seed=1768922153 ===
[pilot] base k_table top pairs:
  k_base=18 permA=0 permB=0
  k_base=12 permA=29 permB=0
  k_base=12 permA=22 permB=0
  k_base=12 permA=13 permB=0
  k_base=12 permA=6 permB=0
[pilot] A multisets raw=792 (expected=792) enum_mode=multiset cayley_unique=26 perms=30 -> total scored = 780
[pilot] B multisets raw=792 (expected=792) enum_mode=multiset cayley_unique=26 perms=30 -> total scored = 780
[pilot] A frontier kept 128 candidates with points: (4,20), (0,49)
[pilot] B frontier kept 128 candidates with points: (4,20), (0,49)
[pilot] C2xC2xC2 n=288 d0=17 A_sets=26*30 -> keep 128; B_sets=26*30 -> keep 128
[pilot] MEAS n=288 k=4 dx_ub=20 dz_ub=20 d_ub=20 steps=5000 id=C2xC2xC2_c00013
[saved] id=C2xC2xC2_c00013 -> results/c2xc2xc2_d16_20260120_151756/promising/C2xC2xC2_c00013 (reason: d>=sqrt(n))
[pilot] MEAS n=288 k=4 dx_ub=17 dz_ub=17 d_ub=17 steps=5000 id=C2xC2xC2_c00024
[saved] id=C2xC2xC2_c00024 -> results/c2xc2xc2_d16_20260120_151756/promising/C2xC2xC2_c00024 (reason: d>=sqrt(n))
[pilot] MEAS n=288 k=4 dx_ub=19 dz_ub=19 d_ub=19 steps=5000 id=C2xC2xC2_c00086
[saved] id=C2xC2xC2_c00086 -> results/c2xc2xc2_d16_20260120_151756/promising/C2xC2xC2_c00086 (reason: d>=sqrt(n))
[pilot] MEAS n=288 k=4 dx_ub=20 dz_ub=16 d_ub=16 steps=5000 id=C2xC2xC2_c00102
[pilot] MEAS n=288 k=4 dx_ub=20 dz_ub=20 d_ub=20 steps=5000 id=C2xC2xC2_c00106
[saved] id=C2xC2xC2_c00106 -> results/c2xc2xc2_d16_20260120_151756/promising/C2xC2xC2_c00106 (reason: d>=sqrt(n))
[pilot] TARGET_REJECT d_ub=14 target=16 id=C2xC2xC2_c00121
[pilot] MEAS n=288 k=4 dx_ub=18 dz_ub=20 d_ub=18 steps=5000 id=C2xC2xC2_c00156
[saved] id=C2xC2xC2_c00156 -> results/c2xc2xc2_d16_20260120_151756/promising/C2xC2xC2_c00156 (reason: d>=sqrt(n))
[pilot] MEAS n=288 k=4 dx_ub=20 dz_ub=20 d_ub=20 steps=5000 id=C2xC2xC2_c00174
[saved] id=C2xC2xC2_c00174 -> results/c2xc2xc2_d16_20260120_151756/promising/C2xC2xC2_c00174 (reason: d>=sqrt(n))
[pilot] MEAS n=288 k=4 dx_ub=16 dz_ub=20 d_ub=16 steps=5000 id=C2xC2xC2_c00179
[pilot] MEAS n=288 k=4 dx_ub=16 dz_ub=16 d_ub=16 steps=5000 id=C2xC2xC2_c00205
[pilot] MEAS n=288 k=4 dx_ub=17 dz_ub=20 d_ub=17 steps=5000 id=C2xC2xC2_c00232
[saved] id=C2xC2xC2_c00232 -> results/c2xc2xc2_d16_20260120_151756/promising/C2xC2xC2_c00232 (reason: d>=sqrt(n))
[pilot] MEAS n=288 k=4 dx_ub=22 dz_ub=20 d_ub=20 steps=5000 id=C2xC2xC2_c00241
[saved] id=C2xC2xC2_c00241 -> results/c2xc2xc2_d16_20260120_151756/promising/C2xC2xC2_c00241 (reason: d>=sqrt(n))
[pilot] TARGET_REJECT d_ub=6 target=16 id=C2xC2xC2_c00255
[pilot] MEAS n=288 k=4 dx_ub=21 dz_ub=18 d_ub=18 steps=5000 id=C2xC2xC2_c00314
[saved] id=C2xC2xC2_c00314 -> results/c2xc2xc2_d16_20260120_151756/promising/C2xC2xC2_c00314 (reason: d>=sqrt(n))
[pilot] MEAS n=288 k=4 dx_ub=17 dz_ub=16 d_ub=16 steps=5000 id=C2xC2xC2_c00335
[pilot] MEAS n=288 k=4 dx_ub=20 dz_ub=19 d_ub=19 steps=5000 id=C2xC2xC2_c00374
[saved] id=C2xC2xC2_c00374 -> results/c2xc2xc2_d16_20260120_151756/promising/C2xC2xC2_c00374 (reason: d>=sqrt(n))
[pilot] MEAS n=288 k=4 dx_ub=16 dz_ub=18 d_ub=16 steps=5000 id=C2xC2xC2_c00378
[pilot] MEAS n=288 k=4 dx_ub=16 dz_ub=17 d_ub=16 steps=5000 id=C2xC2xC2_c00398
[pilot] MEAS n=288 k=4 dx_ub=16 dz_ub=21 d_ub=16 steps=5000 id=C2xC2xC2_c00415
[pilot] TARGET_REJECT d_ub=12 target=16 id=C2xC2xC2_c00442
[pilot] MEAS n=288 k=4 dx_ub=16 dz_ub=19 d_ub=16 steps=5000 id=C2xC2xC2_c00454
[pilot] MEAS n=288 k=4 dx_ub=20 dz_ub=16 d_ub=16 steps=5000 id=C2xC2xC2_c00472
[pilot] TARGET_REJECT d_ub=13 target=16 id=C2xC2xC2_c00483
[pilot] MEAS n=288 k=4 dx_ub=20 dz_ub=23 d_ub=20 steps=5000 id=C2xC2xC2_c00496
[saved] id=C2xC2xC2_c00496 -> results/c2xc2xc2_d16_20260120_151756/promising/C2xC2xC2_c00496 (reason: d>=sqrt(n))
[best_by_k] group=C2xC2xC2 n=288
k  | d_ub | steps | dx_ub | dz_ub | id
 4 |   20 |  5000 |    20 |    20 | C2xC2xC2_c00013
[coverage] group=C2xC2xC2 A_sel=128 B_sel=128 Q_meas=24 ratio_ge_sqrt=0.000 ratio_sel=0.001
[coverage] run summary:
[coverage] group=C2xC2xC2 A_sel=128 B_sel=128 Q_meas=24 ratio_ge_sqrt=0.000 ratio_sel=0.001
[summary] best-by-k (measured; includes rejects):
  k=4 best_d_ub=20 count_measured=21 example_id=C2xC2xC2_c00013
  k=8 best_d_ub=14 count_measured=3 example_id=C2xC2xC2_c00121
[summary] best-by-k (survivors; target=16):
  k=4 best_d_ub=20 count_survivors=20 example_id=C2xC2xC2_c00013
[pilot] top results:
  01 group=C2xC2xC2 n=288 k=4 d_ub=20 permA=11 permB=27 saved=True
  02 group=C2xC2xC2 n=288 k=4 d_ub=20 permA=27 permB=8 saved=True
  03 group=C2xC2xC2 n=288 k=4 d_ub=20 permA=20 permB=11 saved=True
  04 group=C2xC2xC2 n=288 k=4 d_ub=20 permA=7 permB=11 saved=True
  05 group=C2xC2xC2 n=288 k=4 d_ub=20 permA=27 permB=7 saved=True
  06 group=C2xC2xC2 n=288 k=4 d_ub=19 permA=27 permB=11 saved=True
  07 group=C2xC2xC2 n=288 k=4 d_ub=19 permA=12 permB=27 saved=True
  08 group=C2xC2xC2 n=288 k=4 d_ub=18 permA=8 permB=7 saved=True
  09 group=C2xC2xC2 n=288 k=4 d_ub=18 permA=27 permB=12 saved=True
  10 group=C2xC2xC2 n=288 k=4 d_ub=17 permA=20 permB=20 saved=True

