=== mar. 20 janv. 2026 15:15:29 CET steps=5000 batch=46 seed=1768922149 ===
[pilot] base k_table top pairs:
  k_base=18 permA=0 permB=0
  k_base=12 permA=29 permB=0
  k_base=12 permA=22 permB=0
  k_base=12 permA=13 permB=0
  k_base=12 permA=6 permB=0
[pilot] A multisets raw=792 (expected=792) enum_mode=multiset cayley_unique=26 perms=30 -> total scored = 780
[pilot] B multisets raw=792 (expected=792) enum_mode=multiset cayley_unique=26 perms=30 -> total scored = 780
[pilot] A frontier kept 128 candidates with points: (4,20), (0,49)
[pilot] B frontier kept 128 candidates with points: (4,20), (0,49)
[pilot] C2xC2xC2 n=288 d0=17 A_sets=26*30 -> keep 128; B_sets=26*30 -> keep 128
[pilot] TARGET_REJECT d_ub=15 target=16 id=C2xC2xC2_c00004
[pilot] MEAS n=288 k=4 dx_ub=16 dz_ub=17 d_ub=16 steps=5000 id=C2xC2xC2_c00051
[pilot] MEAS n=288 k=4 dx_ub=16 dz_ub=18 d_ub=16 steps=5000 id=C2xC2xC2_c00073
[pilot] TARGET_REJECT d_ub=14 target=16 id=C2xC2xC2_c00078
[pilot] TARGET_REJECT d_ub=14 target=16 id=C2xC2xC2_c00086
[pilot] MEAS n=288 k=8 dx_ub=17 dz_ub=16 d_ub=16 steps=5000 id=C2xC2xC2_c00091
[pilot] TARGET_REJECT d_ub=12 target=16 id=C2xC2xC2_c00099
[pilot] MEAS n=288 k=4 dx_ub=20 dz_ub=20 d_ub=20 steps=5000 id=C2xC2xC2_c00108
[saved] id=C2xC2xC2_c00108 -> results/c2xc2xc2_d16_20260120_151529/promising/C2xC2xC2_c00108 (reason: d>=sqrt(n))
[pilot] MEAS n=288 k=4 dx_ub=16 dz_ub=17 d_ub=16 steps=5000 id=C2xC2xC2_c00111
[pilot] MEAS n=288 k=8 dx_ub=16 dz_ub=16 d_ub=16 steps=5000 id=C2xC2xC2_c00143
[pilot] MEAS n=288 k=4 dx_ub=22 dz_ub=19 d_ub=19 steps=5000 id=C2xC2xC2_c00167
[saved] id=C2xC2xC2_c00167 -> results/c2xc2xc2_d16_20260120_151529/promising/C2xC2xC2_c00167 (reason: d>=sqrt(n))
[pilot] MEAS n=288 k=4 dx_ub=16 dz_ub=16 d_ub=16 steps=5000 id=C2xC2xC2_c00171
[pilot] MEAS n=288 k=4 dx_ub=20 dz_ub=18 d_ub=18 steps=5000 id=C2xC2xC2_c00180
[saved] id=C2xC2xC2_c00180 -> results/c2xc2xc2_d16_20260120_151529/promising/C2xC2xC2_c00180 (reason: d>=sqrt(n))
[pilot] MEAS n=288 k=4 dx_ub=19 dz_ub=20 d_ub=19 steps=5000 id=C2xC2xC2_c00197
[saved] id=C2xC2xC2_c00197 -> results/c2xc2xc2_d16_20260120_151529/promising/C2xC2xC2_c00197 (reason: d>=sqrt(n))
[pilot] MEAS n=288 k=4 dx_ub=20 dz_ub=23 d_ub=20 steps=5000 id=C2xC2xC2_c00198
[saved] id=C2xC2xC2_c00198 -> results/c2xc2xc2_d16_20260120_151529/promising/C2xC2xC2_c00198 (reason: d>=sqrt(n))
[pilot] MEAS n=288 k=4 dx_ub=16 dz_ub=16 d_ub=16 steps=5000 id=C2xC2xC2_c00207
[pilot] MEAS n=288 k=8 dx_ub=16 dz_ub=18 d_ub=16 steps=5000 id=C2xC2xC2_c00208
[pilot] MEAS n=288 k=4 dx_ub=16 dz_ub=16 d_ub=16 steps=5000 id=C2xC2xC2_c00274
[pilot] MEAS n=288 k=4 dx_ub=16 dz_ub=20 d_ub=16 steps=5000 id=C2xC2xC2_c00277
[pilot] MEAS n=288 k=4 dx_ub=20 dz_ub=17 d_ub=17 steps=5000 id=C2xC2xC2_c00303
[saved] id=C2xC2xC2_c00303 -> results/c2xc2xc2_d16_20260120_151529/promising/C2xC2xC2_c00303 (reason: d>=sqrt(n))
[pilot] MEAS n=288 k=4 dx_ub=16 dz_ub=20 d_ub=16 steps=5000 id=C2xC2xC2_c00308
[pilot] MEAS n=288 k=4 dx_ub=20 dz_ub=20 d_ub=20 steps=5000 id=C2xC2xC2_c00329
[saved] id=C2xC2xC2_c00329 -> results/c2xc2xc2_d16_20260120_151529/promising/C2xC2xC2_c00329 (reason: d>=sqrt(n))
[pilot] MEAS n=288 k=4 dx_ub=20 dz_ub=20 d_ub=20 steps=5000 id=C2xC2xC2_c00338
[saved] id=C2xC2xC2_c00338 -> results/c2xc2xc2_d16_20260120_151529/promising/C2xC2xC2_c00338 (reason: d>=sqrt(n))
[pilot] MEAS n=288 k=4 dx_ub=18 dz_ub=20 d_ub=18 steps=5000 id=C2xC2xC2_c00352
[saved] id=C2xC2xC2_c00352 -> results/c2xc2xc2_d16_20260120_151529/promising/C2xC2xC2_c00352 (reason: d>=sqrt(n))
[pilot] TARGET_REJECT d_ub=12 target=16 id=C2xC2xC2_c00385
[pilot] MEAS n=288 k=8 dx_ub=16 dz_ub=16 d_ub=16 steps=5000 id=C2xC2xC2_c00398
[pilot] MEAS n=288 k=8 dx_ub=16 dz_ub=18 d_ub=16 steps=5000 id=C2xC2xC2_c00401
[pilot] MEAS n=288 k=4 dx_ub=20 dz_ub=20 d_ub=20 steps=5000 id=C2xC2xC2_c00476
[saved] id=C2xC2xC2_c00476 -> results/c2xc2xc2_d16_20260120_151529/promising/C2xC2xC2_c00476 (reason: d>=sqrt(n))
[best_by_k] group=C2xC2xC2 n=288
k  | d_ub | steps | dx_ub | dz_ub | id
 4 |   20 |  5000 |    20 |    20 | C2xC2xC2_c00108
 8 |   16 |  5000 |    17 |    16 | C2xC2xC2_c00091
[coverage] group=C2xC2xC2 A_sel=128 B_sel=128 Q_meas=28 ratio_ge_sqrt=0.001 ratio_sel=0.002
[coverage] run summary:
[coverage] group=C2xC2xC2 A_sel=128 B_sel=128 Q_meas=28 ratio_ge_sqrt=0.001 ratio_sel=0.002
[summary] best-by-k (measured; includes rejects):
  k=4 best_d_ub=20 count_measured=19 example_id=C2xC2xC2_c00108
  k=8 best_d_ub=16 count_measured=9 example_id=C2xC2xC2_c00091
[summary] best-by-k (survivors; target=16):
  k=4 best_d_ub=20 count_survivors=18 example_id=C2xC2xC2_c00108
  k=8 best_d_ub=16 count_survivors=5 example_id=C2xC2xC2_c00091
[pilot] top results:
  01 group=C2xC2xC2 n=288 k=4 d_ub=20 permA=27 permB=7 saved=True
  02 group=C2xC2xC2 n=288 k=4 d_ub=20 permA=12 permB=20 saved=True
  03 group=C2xC2xC2 n=288 k=4 d_ub=20 permA=20 permB=11 saved=True
  04 group=C2xC2xC2 n=288 k=4 d_ub=20 permA=7 permB=20 saved=True
  05 group=C2xC2xC2 n=288 k=4 d_ub=20 permA=27 permB=11 saved=True
  06 group=C2xC2xC2 n=288 k=4 d_ub=19 permA=8 permB=11 saved=True
  07 group=C2xC2xC2 n=288 k=4 d_ub=19 permA=12 permB=20 saved=True
  08 group=C2xC2xC2 n=288 k=4 d_ub=18 permA=8 permB=11 saved=True
  09 group=C2xC2xC2 n=288 k=4 d_ub=18 permA=8 permB=7 saved=True
  10 group=C2xC2xC2 n=288 k=4 d_ub=17 permA=27 permB=8 saved=True

