=== mer. 21 janv. 2026 03:04:58 CET steps=20000 batch=26 seed=1768937129 ===
[pilot] base k_table top pairs:
  k_base=18 permA=0 permB=0
  k_base=12 permA=29 permB=0
  k_base=12 permA=22 permB=0
  k_base=12 permA=13 permB=0
  k_base=12 permA=6 permB=0
[pilot] A multisets raw=792 (expected=792) enum_mode=multiset cayley_unique=26 perms=30 -> total scored = 780
[pilot] B multisets raw=792 (expected=792) enum_mode=multiset cayley_unique=26 perms=30 -> total scored = 780
[pilot] A frontier kept 128 candidates with points: (4,20), (0,49)
[pilot] B frontier kept 128 candidates with points: (4,20), (0,49)
[pilot] C2xC2xC2 n=288 d0=17 A_sets=26*30 -> keep 128; B_sets=26*30 -> keep 128
[pilot] MEAS n=288 k=4 dx_ub=20 dz_ub=19 d_ub=19 steps=20000 id=C2xC2xC2_c00019
[saved] id=C2xC2xC2_c00019 -> results/c2xc2xc2_d16_20260121_030458/promising/C2xC2xC2_c00019 (reason: d>=sqrt(n))
[pilot] MEAS n=288 k=4 dx_ub=20 dz_ub=20 d_ub=20 steps=20000 id=C2xC2xC2_c00044
[saved] id=C2xC2xC2_c00044 -> results/c2xc2xc2_d16_20260121_030458/promising/C2xC2xC2_c00044 (reason: d>=sqrt(n))
[pilot] MEAS n=288 k=4 dx_ub=16 dz_ub=16 d_ub=16 steps=20000 id=C2xC2xC2_c00047
[pilot] MEAS n=288 k=4 dx_ub=16 dz_ub=17 d_ub=16 steps=20000 id=C2xC2xC2_c00051
[pilot] MEAS n=288 k=4 dx_ub=16 dz_ub=18 d_ub=16 steps=20000 id=C2xC2xC2_c00074
[pilot] TARGET_REJECT d_ub=12 target=16 id=C2xC2xC2_c00076
[pilot] MEAS n=288 k=4 dx_ub=20 dz_ub=20 d_ub=20 steps=20000 id=C2xC2xC2_c00096
[saved] id=C2xC2xC2_c00096 -> results/c2xc2xc2_d16_20260121_030458/promising/C2xC2xC2_c00096 (reason: d>=sqrt(n))
[pilot] MEAS n=288 k=4 dx_ub=19 dz_ub=20 d_ub=19 steps=20000 id=C2xC2xC2_c00122
[saved] id=C2xC2xC2_c00122 -> results/c2xc2xc2_d16_20260121_030458/promising/C2xC2xC2_c00122 (reason: d>=sqrt(n))
[pilot] MEAS n=288 k=4 dx_ub=19 dz_ub=20 d_ub=19 steps=20000 id=C2xC2xC2_c00144
[saved] id=C2xC2xC2_c00144 -> results/c2xc2xc2_d16_20260121_030458/promising/C2xC2xC2_c00144 (reason: d>=sqrt(n))
[pilot] MEAS n=288 k=8 dx_ub=18 dz_ub=18 d_ub=18 steps=20000 id=C2xC2xC2_c00156
[saved] id=C2xC2xC2_c00156 -> results/c2xc2xc2_d16_20260121_030458/promising/C2xC2xC2_c00156 (reason: d>=sqrt(n))
[pilot] MEAS n=288 k=4 dx_ub=19 dz_ub=20 d_ub=19 steps=20000 id=C2xC2xC2_c00169
[saved] id=C2xC2xC2_c00169 -> results/c2xc2xc2_d16_20260121_030458/promising/C2xC2xC2_c00169 (reason: d>=sqrt(n))
[pilot] TARGET_REJECT d_ub=14 target=16 id=C2xC2xC2_c00198
[pilot] TARGET_REJECT d_ub=12 target=16 id=C2xC2xC2_c00223
[pilot] MEAS n=288 k=4 dx_ub=20 dz_ub=18 d_ub=18 steps=20000 id=C2xC2xC2_c00229
[saved] id=C2xC2xC2_c00229 -> results/c2xc2xc2_d16_20260121_030458/promising/C2xC2xC2_c00229 (reason: d>=sqrt(n))
[pilot] MEAS n=288 k=8 dx_ub=16 dz_ub=16 d_ub=16 steps=20000 id=C2xC2xC2_c00242
[pilot] TARGET_REJECT d_ub=12 target=16 id=C2xC2xC2_c00249
[pilot] TARGET_REJECT d_ub=12 target=16 id=C2xC2xC2_c00261
[pilot] MEAS n=288 k=4 dx_ub=20 dz_ub=17 d_ub=17 steps=20000 id=C2xC2xC2_c00273
[saved] id=C2xC2xC2_c00273 -> results/c2xc2xc2_d16_20260121_030458/promising/C2xC2xC2_c00273 (reason: d>=sqrt(n))
[pilot] MEAS n=288 k=4 dx_ub=20 dz_ub=20 d_ub=20 steps=20000 id=C2xC2xC2_c00279
[saved] id=C2xC2xC2_c00279 -> results/c2xc2xc2_d16_20260121_030458/promising/C2xC2xC2_c00279 (reason: d>=sqrt(n))
[pilot] MEAS n=288 k=4 dx_ub=20 dz_ub=16 d_ub=16 steps=20000 id=C2xC2xC2_c00297
[pilot] MEAS n=288 k=4 dx_ub=19 dz_ub=20 d_ub=19 steps=20000 id=C2xC2xC2_c00331
[saved] id=C2xC2xC2_c00331 -> results/c2xc2xc2_d16_20260121_030458/promising/C2xC2xC2_c00331 (reason: d>=sqrt(n))
[pilot] MEAS n=288 k=8 dx_ub=16 dz_ub=17 d_ub=16 steps=20000 id=C2xC2xC2_c00340
[pilot] TARGET_REJECT d_ub=12 target=16 id=C2xC2xC2_c00344
[pilot] TARGET_REJECT d_ub=12 target=16 id=C2xC2xC2_c00351
[pilot] MEAS n=288 k=4 dx_ub=17 dz_ub=20 d_ub=17 steps=20000 id=C2xC2xC2_c00361
[saved] id=C2xC2xC2_c00361 -> results/c2xc2xc2_d16_20260121_030458/promising/C2xC2xC2_c00361 (reason: d>=sqrt(n))
[pilot] MEAS n=288 k=4 dx_ub=17 dz_ub=20 d_ub=17 steps=20000 id=C2xC2xC2_c00362
[saved] id=C2xC2xC2_c00362 -> results/c2xc2xc2_d16_20260121_030458/promising/C2xC2xC2_c00362 (reason: d>=sqrt(n))
[pilot] MEAS n=288 k=8 dx_ub=16 dz_ub=18 d_ub=16 steps=20000 id=C2xC2xC2_c00407
[pilot] MEAS n=288 k=4 dx_ub=20 dz_ub=20 d_ub=20 steps=20000 id=C2xC2xC2_c00409
[saved] id=C2xC2xC2_c00409 -> results/c2xc2xc2_d16_20260121_030458/promising/C2xC2xC2_c00409 (reason: d>=sqrt(n))
[best_by_k] group=C2xC2xC2 n=288
k  | d_ub | steps | dx_ub | dz_ub | id
 4 |   20 | 20000 |    20 |    20 | C2xC2xC2_c00044
 8 |   18 | 20000 |    18 |    18 | C2xC2xC2_c00156
[coverage] group=C2xC2xC2 A_sel=128 B_sel=128 Q_meas=28 ratio_ge_sqrt=0.001 ratio_sel=0.002
[coverage] run summary:
[coverage] group=C2xC2xC2 A_sel=128 B_sel=128 Q_meas=28 ratio_ge_sqrt=0.001 ratio_sel=0.002
[summary] best-by-k (measured; includes rejects):
  k=4 best_d_ub=20 count_measured=20 example_id=C2xC2xC2_c00044
  k=8 best_d_ub=18 count_measured=8 example_id=C2xC2xC2_c00156
[summary] best-by-k (survivors; target=16):
  k=4 best_d_ub=20 count_survivors=17 example_id=C2xC2xC2_c00044
  k=8 best_d_ub=18 count_survivors=4 example_id=C2xC2xC2_c00156
[pilot] top results:
  01 group=C2xC2xC2 n=288 k=4 d_ub=20 permA=11 permB=8 saved=True
  02 group=C2xC2xC2 n=288 k=4 d_ub=20 permA=20 permB=11 saved=True
  03 group=C2xC2xC2 n=288 k=4 d_ub=20 permA=8 permB=11 saved=True
  04 group=C2xC2xC2 n=288 k=4 d_ub=20 permA=27 permB=27 saved=True
  05 group=C2xC2xC2 n=288 k=4 d_ub=19 permA=27 permB=27 saved=True
  06 group=C2xC2xC2 n=288 k=4 d_ub=19 permA=11 permB=20 saved=True
  07 group=C2xC2xC2 n=288 k=4 d_ub=19 permA=12 permB=20 saved=True
  08 group=C2xC2xC2 n=288 k=4 d_ub=19 permA=12 permB=8 saved=True
  09 group=C2xC2xC2 n=288 k=4 d_ub=19 permA=27 permB=11 saved=True
  10 group=C2xC2xC2 n=288 k=8 d_ub=18 permA=7 permB=20 saved=True

