=== mar. 20 janv. 2026 14:54:26 CET steps=5000 batch=6 seed=1768922109 ===
[pilot] base k_table top pairs:
  k_base=18 permA=0 permB=0
  k_base=12 permA=29 permB=0
  k_base=12 permA=22 permB=0
  k_base=12 permA=13 permB=0
  k_base=12 permA=6 permB=0
[pilot] A multisets raw=792 (expected=792) enum_mode=multiset cayley_unique=26 perms=30 -> total scored = 780
[pilot] B multisets raw=792 (expected=792) enum_mode=multiset cayley_unique=26 perms=30 -> total scored = 780
[pilot] A frontier kept 128 candidates with points: (4,20), (0,49)
[pilot] B frontier kept 128 candidates with points: (4,20), (0,49)
[pilot] C2xC2xC2 n=288 d0=17 A_sets=26*30 -> keep 128; B_sets=26*30 -> keep 128
[pilot] TARGET_REJECT d_ub=14 target=16 id=C2xC2xC2_c00046
[pilot] MEAS n=288 k=4 dx_ub=19 dz_ub=20 d_ub=19 steps=5000 id=C2xC2xC2_c00071
[saved] id=C2xC2xC2_c00071 -> results/c2xc2xc2_d16_20260120_145426/promising/C2xC2xC2_c00071 (reason: d>=sqrt(n))
[pilot] MEAS n=288 k=4 dx_ub=20 dz_ub=20 d_ub=20 steps=5000 id=C2xC2xC2_c00090
[saved] id=C2xC2xC2_c00090 -> results/c2xc2xc2_d16_20260120_145426/promising/C2xC2xC2_c00090 (reason: d>=sqrt(n))
[pilot] MEAS n=288 k=8 dx_ub=16 dz_ub=17 d_ub=16 steps=5000 id=C2xC2xC2_c00095
[pilot] TARGET_REJECT d_ub=15 target=16 id=C2xC2xC2_c00123
[pilot] MEAS n=288 k=4 dx_ub=20 dz_ub=17 d_ub=17 steps=5000 id=C2xC2xC2_c00136
[saved] id=C2xC2xC2_c00136 -> results/c2xc2xc2_d16_20260120_145426/promising/C2xC2xC2_c00136 (reason: d>=sqrt(n))
[pilot] MEAS n=288 k=4 dx_ub=19 dz_ub=20 d_ub=19 steps=5000 id=C2xC2xC2_c00140
[saved] id=C2xC2xC2_c00140 -> results/c2xc2xc2_d16_20260120_145426/promising/C2xC2xC2_c00140 (reason: d>=sqrt(n))
[pilot] MEAS n=288 k=4 dx_ub=20 dz_ub=16 d_ub=16 steps=5000 id=C2xC2xC2_c00154
[pilot] MEAS n=288 k=4 dx_ub=19 dz_ub=20 d_ub=19 steps=5000 id=C2xC2xC2_c00170
[saved] id=C2xC2xC2_c00170 -> results/c2xc2xc2_d16_20260120_145426/promising/C2xC2xC2_c00170 (reason: d>=sqrt(n))
[pilot] MEAS n=288 k=4 dx_ub=20 dz_ub=20 d_ub=20 steps=5000 id=C2xC2xC2_c00180
[saved] id=C2xC2xC2_c00180 -> results/c2xc2xc2_d16_20260120_145426/promising/C2xC2xC2_c00180 (reason: d>=sqrt(n))
[pilot] MEAS n=288 k=8 dx_ub=18 dz_ub=18 d_ub=18 steps=5000 id=C2xC2xC2_c00192
[saved] id=C2xC2xC2_c00192 -> results/c2xc2xc2_d16_20260120_145426/promising/C2xC2xC2_c00192 (reason: d>=sqrt(n))
[pilot] MEAS n=288 k=4 dx_ub=16 dz_ub=20 d_ub=16 steps=5000 id=C2xC2xC2_c00217
[pilot] MEAS n=288 k=8 dx_ub=17 dz_ub=16 d_ub=16 steps=5000 id=C2xC2xC2_c00225
[pilot] TARGET_REJECT d_ub=13 target=16 id=C2xC2xC2_c00244
[pilot] TARGET_REJECT d_ub=15 target=16 id=C2xC2xC2_c00247
[pilot] MEAS n=288 k=4 dx_ub=17 dz_ub=18 d_ub=17 steps=5000 id=C2xC2xC2_c00252
[saved] id=C2xC2xC2_c00252 -> results/c2xc2xc2_d16_20260120_145426/promising/C2xC2xC2_c00252 (reason: d>=sqrt(n))
[pilot] TARGET_REJECT d_ub=12 target=16 id=C2xC2xC2_c00263
[pilot] MEAS n=288 k=4 dx_ub=18 dz_ub=16 d_ub=16 steps=5000 id=C2xC2xC2_c00319
[pilot] MEAS n=288 k=4 dx_ub=16 dz_ub=16 d_ub=16 steps=5000 id=C2xC2xC2_c00323
[pilot] MEAS n=288 k=4 dx_ub=16 dz_ub=17 d_ub=16 steps=5000 id=C2xC2xC2_c00326
[pilot] MEAS n=288 k=8 dx_ub=16 dz_ub=18 d_ub=16 steps=5000 id=C2xC2xC2_c00328
[pilot] MEAS n=288 k=4 dx_ub=19 dz_ub=20 d_ub=19 steps=5000 id=C2xC2xC2_c00335
[saved] id=C2xC2xC2_c00335 -> results/c2xc2xc2_d16_20260120_145426/promising/C2xC2xC2_c00335 (reason: d>=sqrt(n))
[pilot] MEAS n=288 k=4 dx_ub=20 dz_ub=20 d_ub=20 steps=5000 id=C2xC2xC2_c00341
[saved] id=C2xC2xC2_c00341 -> results/c2xc2xc2_d16_20260120_145426/promising/C2xC2xC2_c00341 (reason: d>=sqrt(n))
[pilot] TARGET_REJECT d_ub=15 target=16 id=C2xC2xC2_c00347
[pilot] MEAS n=288 k=4 dx_ub=19 dz_ub=16 d_ub=16 steps=5000 id=C2xC2xC2_c00410
[pilot] MEAS n=288 k=4 dx_ub=16 dz_ub=16 d_ub=16 steps=5000 id=C2xC2xC2_c00413
[pilot] MEAS n=288 k=4 dx_ub=20 dz_ub=16 d_ub=16 steps=5000 id=C2xC2xC2_c00428
[pilot] MEAS n=288 k=4 dx_ub=19 dz_ub=17 d_ub=17 steps=5000 id=C2xC2xC2_c00436
[saved] id=C2xC2xC2_c00436 -> results/c2xc2xc2_d16_20260120_145426/promising/C2xC2xC2_c00436 (reason: d>=sqrt(n))
[pilot] MEAS n=288 k=4 dx_ub=18 dz_ub=20 d_ub=18 steps=5000 id=C2xC2xC2_c00471
[saved] id=C2xC2xC2_c00471 -> results/c2xc2xc2_d16_20260120_145426/promising/C2xC2xC2_c00471 (reason: d>=sqrt(n))
[pilot] MEAS n=288 k=4 dx_ub=18 dz_ub=16 d_ub=16 steps=5000 id=C2xC2xC2_c00472
[pilot] MEAS n=288 k=4 dx_ub=20 dz_ub=16 d_ub=16 steps=5000 id=C2xC2xC2_c00480
[pilot] MEAS n=288 k=4 dx_ub=19 dz_ub=20 d_ub=19 steps=5000 id=C2xC2xC2_c00487
[saved] id=C2xC2xC2_c00487 -> results/c2xc2xc2_d16_20260120_145426/promising/C2xC2xC2_c00487 (reason: d>=sqrt(n))
[best_by_k] group=C2xC2xC2 n=288
k  | d_ub | steps | dx_ub | dz_ub | id
 4 |   20 |  5000 |    20 |    20 | C2xC2xC2_c00090
 8 |   18 |  5000 |    18 |    18 | C2xC2xC2_c00192
[coverage] group=C2xC2xC2 A_sel=128 B_sel=128 Q_meas=32 ratio_ge_sqrt=0.001 ratio_sel=0.002
[coverage] run summary:
[coverage] group=C2xC2xC2 A_sel=128 B_sel=128 Q_meas=32 ratio_ge_sqrt=0.001 ratio_sel=0.002
[summary] best-by-k (measured; includes rejects):
  k=4 best_d_ub=20 count_measured=23 example_id=C2xC2xC2_c00090
  k=8 best_d_ub=18 count_measured=9 example_id=C2xC2xC2_c00192
[summary] best-by-k (survivors; target=16):
  k=4 best_d_ub=20 count_survivors=22 example_id=C2xC2xC2_c00090
  k=8 best_d_ub=18 count_survivors=4 example_id=C2xC2xC2_c00192
[pilot] top results:
  01 group=C2xC2xC2 n=288 k=4 d_ub=20 permA=8 permB=27 saved=True
  02 group=C2xC2xC2 n=288 k=4 d_ub=20 permA=12 permB=27 saved=True
  03 group=C2xC2xC2 n=288 k=4 d_ub=20 permA=8 permB=11 saved=True
  04 group=C2xC2xC2 n=288 k=4 d_ub=19 permA=20 permB=11 saved=True
  05 group=C2xC2xC2 n=288 k=4 d_ub=19 permA=12 permB=27 saved=True
  06 group=C2xC2xC2 n=288 k=4 d_ub=19 permA=27 permB=27 saved=True
  07 group=C2xC2xC2 n=288 k=4 d_ub=19 permA=11 permB=27 saved=True
  08 group=C2xC2xC2 n=288 k=4 d_ub=19 permA=12 permB=27 saved=True
  09 group=C2xC2xC2 n=288 k=8 d_ub=18 permA=7 permB=20 saved=True
  10 group=C2xC2xC2 n=288 k=4 d_ub=18 permA=20 permB=27 saved=True

