=== mer. 21 janv. 2026 08:49:54 CET steps=20000 batch=43 seed=1768937146 ===
[pilot] base k_table top pairs:
  k_base=18 permA=0 permB=0
  k_base=12 permA=29 permB=0
  k_base=12 permA=22 permB=0
  k_base=12 permA=13 permB=0
  k_base=12 permA=6 permB=0
[pilot] A multisets raw=792 (expected=792) enum_mode=multiset cayley_unique=26 perms=30 -> total scored = 780
[pilot] B multisets raw=792 (expected=792) enum_mode=multiset cayley_unique=26 perms=30 -> total scored = 780
[pilot] A frontier kept 128 candidates with points: (4,20), (0,49)
[pilot] B frontier kept 128 candidates with points: (4,20), (0,49)
[pilot] C2xC2xC2 n=288 d0=17 A_sets=26*30 -> keep 128; B_sets=26*30 -> keep 128
[pilot] MEAS n=288 k=4 dx_ub=16 dz_ub=16 d_ub=16 steps=20000 id=C2xC2xC2_c00019
[pilot] MEAS n=288 k=4 dx_ub=20 dz_ub=20 d_ub=20 steps=20000 id=C2xC2xC2_c00021
[saved] id=C2xC2xC2_c00021 -> results/c2xc2xc2_d16_20260121_084954/promising/C2xC2xC2_c00021 (reason: d>=sqrt(n))
[pilot] MEAS n=288 k=4 dx_ub=17 dz_ub=20 d_ub=17 steps=20000 id=C2xC2xC2_c00048
[saved] id=C2xC2xC2_c00048 -> results/c2xc2xc2_d16_20260121_084954/promising/C2xC2xC2_c00048 (reason: d>=sqrt(n))
[pilot] TARGET_REJECT d_ub=14 target=16 id=C2xC2xC2_c00086
[pilot] TARGET_REJECT d_ub=12 target=16 id=C2xC2xC2_c00112
[pilot] MEAS n=288 k=4 dx_ub=20 dz_ub=20 d_ub=20 steps=20000 id=C2xC2xC2_c00117
[saved] id=C2xC2xC2_c00117 -> results/c2xc2xc2_d16_20260121_084954/promising/C2xC2xC2_c00117 (reason: d>=sqrt(n))
[pilot] MEAS n=288 k=4 dx_ub=20 dz_ub=16 d_ub=16 steps=20000 id=C2xC2xC2_c00123
[pilot] TARGET_REJECT d_ub=12 target=16 id=C2xC2xC2_c00163
[pilot] MEAS n=288 k=4 dx_ub=20 dz_ub=16 d_ub=16 steps=20000 id=C2xC2xC2_c00165
[pilot] MEAS n=288 k=4 dx_ub=19 dz_ub=16 d_ub=16 steps=20000 id=C2xC2xC2_c00185
[pilot] MEAS n=288 k=4 dx_ub=20 dz_ub=20 d_ub=20 steps=20000 id=C2xC2xC2_c00193
[saved] id=C2xC2xC2_c00193 -> results/c2xc2xc2_d16_20260121_084954/promising/C2xC2xC2_c00193 (reason: d>=sqrt(n))
[pilot] MEAS n=288 k=8 dx_ub=16 dz_ub=17 d_ub=16 steps=20000 id=C2xC2xC2_c00199
[pilot] TARGET_REJECT d_ub=14 target=16 id=C2xC2xC2_c00206
[pilot] MEAS n=288 k=4 dx_ub=17 dz_ub=17 d_ub=17 steps=20000 id=C2xC2xC2_c00240
[saved] id=C2xC2xC2_c00240 -> results/c2xc2xc2_d16_20260121_084954/promising/C2xC2xC2_c00240 (reason: d>=sqrt(n))
[pilot] MEAS n=288 k=4 dx_ub=16 dz_ub=20 d_ub=16 steps=20000 id=C2xC2xC2_c00281
[pilot] MEAS n=288 k=8 dx_ub=17 dz_ub=16 d_ub=16 steps=20000 id=C2xC2xC2_c00299
[pilot] MEAS n=288 k=4 dx_ub=16 dz_ub=17 d_ub=16 steps=20000 id=C2xC2xC2_c00303
[pilot] MEAS n=288 k=4 dx_ub=16 dz_ub=17 d_ub=16 steps=20000 id=C2xC2xC2_c00307
[pilot] TARGET_REJECT d_ub=12 target=16 id=C2xC2xC2_c00308
[pilot] MEAS n=288 k=4 dx_ub=20 dz_ub=17 d_ub=17 steps=20000 id=C2xC2xC2_c00376
[saved] id=C2xC2xC2_c00376 -> results/c2xc2xc2_d16_20260121_084954/promising/C2xC2xC2_c00376 (reason: d>=sqrt(n))
[pilot] MEAS n=288 k=4 dx_ub=20 dz_ub=20 d_ub=20 steps=20000 id=C2xC2xC2_c00390
[saved] id=C2xC2xC2_c00390 -> results/c2xc2xc2_d16_20260121_084954/promising/C2xC2xC2_c00390 (reason: d>=sqrt(n))
[pilot] MEAS n=288 k=4 dx_ub=19 dz_ub=20 d_ub=19 steps=20000 id=C2xC2xC2_c00403
[saved] id=C2xC2xC2_c00403 -> results/c2xc2xc2_d16_20260121_084954/promising/C2xC2xC2_c00403 (reason: d>=sqrt(n))
[pilot] TARGET_REJECT d_ub=13 target=16 id=C2xC2xC2_c00407
[pilot] MEAS n=288 k=4 dx_ub=16 dz_ub=19 d_ub=16 steps=20000 id=C2xC2xC2_c00418
[pilot] TARGET_REJECT d_ub=6 target=16 id=C2xC2xC2_c00444
[pilot] MEAS n=288 k=4 dx_ub=20 dz_ub=17 d_ub=17 steps=20000 id=C2xC2xC2_c00451
[saved] id=C2xC2xC2_c00451 -> results/c2xc2xc2_d16_20260121_084954/promising/C2xC2xC2_c00451 (reason: d>=sqrt(n))
[best_by_k] group=C2xC2xC2 n=288
k  | d_ub | steps | dx_ub | dz_ub | id
 4 |   20 | 20000 |    20 |    20 | C2xC2xC2_c00021
 8 |   16 | 20000 |    16 |    17 | C2xC2xC2_c00199
[coverage] group=C2xC2xC2 A_sel=128 B_sel=128 Q_meas=26 ratio_ge_sqrt=0.000 ratio_sel=0.002
[coverage] run summary:
[coverage] group=C2xC2xC2 A_sel=128 B_sel=128 Q_meas=26 ratio_ge_sqrt=0.000 ratio_sel=0.002
[summary] best-by-k (measured; includes rejects):
  k=4 best_d_ub=20 count_measured=19 example_id=C2xC2xC2_c00021
  k=8 best_d_ub=16 count_measured=7 example_id=C2xC2xC2_c00199
[summary] best-by-k (survivors; target=16):
  k=4 best_d_ub=20 count_survivors=17 example_id=C2xC2xC2_c00021
  k=8 best_d_ub=16 count_survivors=2 example_id=C2xC2xC2_c00199
[pilot] top results:
  01 group=C2xC2xC2 n=288 k=4 d_ub=20 permA=27 permB=11 saved=True
  02 group=C2xC2xC2 n=288 k=4 d_ub=20 permA=20 permB=11 saved=True
  03 group=C2xC2xC2 n=288 k=4 d_ub=20 permA=8 permB=11 saved=True
  04 group=C2xC2xC2 n=288 k=4 d_ub=20 permA=11 permB=11 saved=True
  05 group=C2xC2xC2 n=288 k=4 d_ub=19 permA=8 permB=12 saved=True
  06 group=C2xC2xC2 n=288 k=4 d_ub=17 permA=20 permB=8 saved=True
  07 group=C2xC2xC2 n=288 k=4 d_ub=17 permA=27 permB=11 saved=True
  08 group=C2xC2xC2 n=288 k=4 d_ub=17 permA=20 permB=7 saved=True
  09 group=C2xC2xC2 n=288 k=4 d_ub=17 permA=11 permB=8 saved=True
  10 group=C2xC2xC2 n=288 k=8 d_ub=16 permA=20 permB=7 saved=False

