=== mer. 21 janv. 2026 00:19:24 CET steps=20000 batch=15 seed=1768937118 ===
[pilot] base k_table top pairs:
  k_base=18 permA=0 permB=0
  k_base=12 permA=29 permB=0
  k_base=12 permA=22 permB=0
  k_base=12 permA=13 permB=0
  k_base=12 permA=6 permB=0
[pilot] A multisets raw=792 (expected=792) enum_mode=multiset cayley_unique=26 perms=30 -> total scored = 780
[pilot] B multisets raw=792 (expected=792) enum_mode=multiset cayley_unique=26 perms=30 -> total scored = 780
[pilot] A frontier kept 128 candidates with points: (4,20), (0,49)
[pilot] B frontier kept 128 candidates with points: (4,20), (0,49)
[pilot] C2xC2xC2 n=288 d0=17 A_sets=26*30 -> keep 128; B_sets=26*30 -> keep 128
[pilot] TARGET_REJECT d_ub=14 target=16 id=C2xC2xC2_c00005
[pilot] MEAS n=288 k=4 dx_ub=20 dz_ub=20 d_ub=20 steps=20000 id=C2xC2xC2_c00021
[saved] id=C2xC2xC2_c00021 -> results/c2xc2xc2_d16_20260121_001924/promising/C2xC2xC2_c00021 (reason: d>=sqrt(n))
[pilot] TARGET_REJECT d_ub=14 target=16 id=C2xC2xC2_c00041
[pilot] MEAS n=288 k=4 dx_ub=17 dz_ub=20 d_ub=17 steps=20000 id=C2xC2xC2_c00050
[saved] id=C2xC2xC2_c00050 -> results/c2xc2xc2_d16_20260121_001924/promising/C2xC2xC2_c00050 (reason: d>=sqrt(n))
[pilot] TARGET_REJECT d_ub=6 target=16 id=C2xC2xC2_c00065
[pilot] MEAS n=288 k=4 dx_ub=19 dz_ub=20 d_ub=19 steps=20000 id=C2xC2xC2_c00077
[saved] id=C2xC2xC2_c00077 -> results/c2xc2xc2_d16_20260121_001924/promising/C2xC2xC2_c00077 (reason: d>=sqrt(n))
[pilot] MEAS n=288 k=4 dx_ub=16 dz_ub=16 d_ub=16 steps=20000 id=C2xC2xC2_c00088
[pilot] MEAS n=288 k=8 dx_ub=16 dz_ub=17 d_ub=16 steps=20000 id=C2xC2xC2_c00089
[pilot] TARGET_REJECT d_ub=12 target=16 id=C2xC2xC2_c00113
[pilot] MEAS n=288 k=4 dx_ub=16 dz_ub=16 d_ub=16 steps=20000 id=C2xC2xC2_c00132
[pilot] TARGET_REJECT d_ub=12 target=16 id=C2xC2xC2_c00163
[pilot] TARGET_REJECT d_ub=12 target=16 id=C2xC2xC2_c00172
[pilot] TARGET_REJECT d_ub=13 target=16 id=C2xC2xC2_c00180
[pilot] MEAS n=288 k=4 dx_ub=19 dz_ub=17 d_ub=17 steps=20000 id=C2xC2xC2_c00204
[saved] id=C2xC2xC2_c00204 -> results/c2xc2xc2_d16_20260121_001924/promising/C2xC2xC2_c00204 (reason: d>=sqrt(n))
[pilot] MEAS n=288 k=4 dx_ub=19 dz_ub=20 d_ub=19 steps=20000 id=C2xC2xC2_c00229
[saved] id=C2xC2xC2_c00229 -> results/c2xc2xc2_d16_20260121_001924/promising/C2xC2xC2_c00229 (reason: d>=sqrt(n))
[pilot] TARGET_REJECT d_ub=12 target=16 id=C2xC2xC2_c00241
[pilot] MEAS n=288 k=4 dx_ub=16 dz_ub=16 d_ub=16 steps=20000 id=C2xC2xC2_c00282
[pilot] MEAS n=288 k=4 dx_ub=16 dz_ub=16 d_ub=16 steps=20000 id=C2xC2xC2_c00284
[pilot] MEAS n=288 k=4 dx_ub=20 dz_ub=20 d_ub=20 steps=20000 id=C2xC2xC2_c00354
[saved] id=C2xC2xC2_c00354 -> results/c2xc2xc2_d16_20260121_001924/promising/C2xC2xC2_c00354 (reason: d>=sqrt(n))
[pilot] MEAS n=288 k=4 dx_ub=16 dz_ub=16 d_ub=16 steps=20000 id=C2xC2xC2_c00373
[pilot] TARGET_REJECT d_ub=14 target=16 id=C2xC2xC2_c00376
[pilot] MEAS n=288 k=4 dx_ub=16 dz_ub=17 d_ub=16 steps=20000 id=C2xC2xC2_c00414
[pilot] MEAS n=288 k=4 dx_ub=18 dz_ub=18 d_ub=18 steps=20000 id=C2xC2xC2_c00418
[saved] id=C2xC2xC2_c00418 -> results/c2xc2xc2_d16_20260121_001924/promising/C2xC2xC2_c00418 (reason: d>=sqrt(n))
[pilot] MEAS n=288 k=4 dx_ub=20 dz_ub=20 d_ub=20 steps=20000 id=C2xC2xC2_c00422
[saved] id=C2xC2xC2_c00422 -> results/c2xc2xc2_d16_20260121_001924/promising/C2xC2xC2_c00422 (reason: d>=sqrt(n))
[pilot] TARGET_REJECT d_ub=14 target=16 id=C2xC2xC2_c00474
[pilot] MEAS n=288 k=4 dx_ub=19 dz_ub=19 d_ub=19 steps=20000 id=C2xC2xC2_c00477
[saved] id=C2xC2xC2_c00477 -> results/c2xc2xc2_d16_20260121_001924/promising/C2xC2xC2_c00477 (reason: d>=sqrt(n))
[best_by_k] group=C2xC2xC2 n=288
k  | d_ub | steps | dx_ub | dz_ub | id
 4 |   20 | 20000 |    20 |    20 | C2xC2xC2_c00021
 8 |   16 | 20000 |    16 |    17 | C2xC2xC2_c00089
[coverage] group=C2xC2xC2 A_sel=128 B_sel=128 Q_meas=26 ratio_ge_sqrt=0.000 ratio_sel=0.002
[coverage] run summary:
[coverage] group=C2xC2xC2 A_sel=128 B_sel=128 Q_meas=26 ratio_ge_sqrt=0.000 ratio_sel=0.002
[summary] best-by-k (measured; includes rejects):
  k=4 best_d_ub=20 count_measured=16 example_id=C2xC2xC2_c00021
  k=8 best_d_ub=16 count_measured=10 example_id=C2xC2xC2_c00089
[summary] best-by-k (survivors; target=16):
  k=4 best_d_ub=20 count_survivors=15 example_id=C2xC2xC2_c00021
  k=8 best_d_ub=16 count_survivors=1 example_id=C2xC2xC2_c00089
[pilot] top results:
  01 group=C2xC2xC2 n=288 k=4 d_ub=20 permA=20 permB=27 saved=True
  02 group=C2xC2xC2 n=288 k=4 d_ub=20 permA=8 permB=11 saved=True
  03 group=C2xC2xC2 n=288 k=4 d_ub=20 permA=27 permB=7 saved=True
  04 group=C2xC2xC2 n=288 k=4 d_ub=19 permA=11 permB=20 saved=True
  05 group=C2xC2xC2 n=288 k=4 d_ub=19 permA=8 permB=12 saved=True
  06 group=C2xC2xC2 n=288 k=4 d_ub=19 permA=27 permB=27 saved=True
  07 group=C2xC2xC2 n=288 k=4 d_ub=18 permA=7 permB=27 saved=True
  08 group=C2xC2xC2 n=288 k=4 d_ub=17 permA=8 permB=11 saved=True
  09 group=C2xC2xC2 n=288 k=4 d_ub=17 permA=20 permB=11 saved=True
  10 group=C2xC2xC2 n=288 k=8 d_ub=16 permA=12 permB=7 saved=False

