=== mar. 20 janv. 2026 15:02:10 CET steps=5000 batch=21 seed=1768922124 ===
[pilot] base k_table top pairs:
  k_base=18 permA=0 permB=0
  k_base=12 permA=29 permB=0
  k_base=12 permA=22 permB=0
  k_base=12 permA=13 permB=0
  k_base=12 permA=6 permB=0
[pilot] A multisets raw=792 (expected=792) enum_mode=multiset cayley_unique=26 perms=30 -> total scored = 780
[pilot] B multisets raw=792 (expected=792) enum_mode=multiset cayley_unique=26 perms=30 -> total scored = 780
[pilot] A frontier kept 128 candidates with points: (4,20), (0,49)
[pilot] B frontier kept 128 candidates with points: (4,20), (0,49)
[pilot] C2xC2xC2 n=288 d0=17 A_sets=26*30 -> keep 128; B_sets=26*30 -> keep 128
[pilot] MEAS n=288 k=4 dx_ub=20 dz_ub=20 d_ub=20 steps=5000 id=C2xC2xC2_c00050
[saved] id=C2xC2xC2_c00050 -> results/c2xc2xc2_d16_20260120_150210/promising/C2xC2xC2_c00050 (reason: d>=sqrt(n))
[pilot] MEAS n=288 k=8 dx_ub=18 dz_ub=16 d_ub=16 steps=5000 id=C2xC2xC2_c00055
[pilot] MEAS n=288 k=4 dx_ub=16 dz_ub=19 d_ub=16 steps=5000 id=C2xC2xC2_c00058
[pilot] MEAS n=288 k=8 dx_ub=17 dz_ub=20 d_ub=17 steps=5000 id=C2xC2xC2_c00066
[saved] id=C2xC2xC2_c00066 -> results/c2xc2xc2_d16_20260120_150210/promising/C2xC2xC2_c00066 (reason: d>=sqrt(n))
[pilot] MEAS n=288 k=4 dx_ub=16 dz_ub=20 d_ub=16 steps=5000 id=C2xC2xC2_c00070
[pilot] MEAS n=288 k=8 dx_ub=16 dz_ub=16 d_ub=16 steps=5000 id=C2xC2xC2_c00073
[pilot] MEAS n=288 k=4 dx_ub=20 dz_ub=20 d_ub=20 steps=5000 id=C2xC2xC2_c00089
[saved] id=C2xC2xC2_c00089 -> results/c2xc2xc2_d16_20260120_150210/promising/C2xC2xC2_c00089 (reason: d>=sqrt(n))
[pilot] TARGET_REJECT d_ub=12 target=16 id=C2xC2xC2_c00099
[pilot] MEAS n=288 k=4 dx_ub=20 dz_ub=22 d_ub=20 steps=5000 id=C2xC2xC2_c00130
[saved] id=C2xC2xC2_c00130 -> results/c2xc2xc2_d16_20260120_150210/promising/C2xC2xC2_c00130 (reason: d>=sqrt(n))
[pilot] MEAS n=288 k=4 dx_ub=19 dz_ub=17 d_ub=17 steps=5000 id=C2xC2xC2_c00138
[saved] id=C2xC2xC2_c00138 -> results/c2xc2xc2_d16_20260120_150210/promising/C2xC2xC2_c00138 (reason: d>=sqrt(n))
[pilot] MEAS n=288 k=8 dx_ub=16 dz_ub=16 d_ub=16 steps=5000 id=C2xC2xC2_c00187
[pilot] MEAS n=288 k=4 dx_ub=16 dz_ub=18 d_ub=16 steps=5000 id=C2xC2xC2_c00197
[pilot] MEAS n=288 k=4 dx_ub=17 dz_ub=16 d_ub=16 steps=5000 id=C2xC2xC2_c00232
[pilot] MEAS n=288 k=4 dx_ub=16 dz_ub=16 d_ub=16 steps=5000 id=C2xC2xC2_c00245
[pilot] MEAS n=288 k=4 dx_ub=16 dz_ub=17 d_ub=16 steps=5000 id=C2xC2xC2_c00251
[pilot] TARGET_REJECT d_ub=12 target=16 id=C2xC2xC2_c00284
[pilot] MEAS n=288 k=4 dx_ub=16 dz_ub=17 d_ub=16 steps=5000 id=C2xC2xC2_c00285
[pilot] MEAS n=288 k=4 dx_ub=20 dz_ub=21 d_ub=20 steps=5000 id=C2xC2xC2_c00303
[saved] id=C2xC2xC2_c00303 -> results/c2xc2xc2_d16_20260120_150210/promising/C2xC2xC2_c00303 (reason: d>=sqrt(n))
[pilot] MEAS n=288 k=4 dx_ub=20 dz_ub=22 d_ub=20 steps=5000 id=C2xC2xC2_c00312
[saved] id=C2xC2xC2_c00312 -> results/c2xc2xc2_d16_20260120_150210/promising/C2xC2xC2_c00312 (reason: d>=sqrt(n))
[pilot] TARGET_REJECT d_ub=14 target=16 id=C2xC2xC2_c00317
[pilot] TARGET_REJECT d_ub=12 target=16 id=C2xC2xC2_c00363
[pilot] MEAS n=288 k=4 dx_ub=20 dz_ub=20 d_ub=20 steps=5000 id=C2xC2xC2_c00367
[saved] id=C2xC2xC2_c00367 -> results/c2xc2xc2_d16_20260120_150210/promising/C2xC2xC2_c00367 (reason: d>=sqrt(n))
[pilot] MEAS n=288 k=4 dx_ub=20 dz_ub=20 d_ub=20 steps=5000 id=C2xC2xC2_c00387
[saved] id=C2xC2xC2_c00387 -> results/c2xc2xc2_d16_20260120_150210/promising/C2xC2xC2_c00387 (reason: d>=sqrt(n))
[pilot] TARGET_REJECT d_ub=12 target=16 id=C2xC2xC2_c00404
[pilot] TARGET_REJECT d_ub=15 target=16 id=C2xC2xC2_c00405
[pilot] MEAS n=288 k=4 dx_ub=21 dz_ub=20 d_ub=20 steps=5000 id=C2xC2xC2_c00409
[saved] id=C2xC2xC2_c00409 -> results/c2xc2xc2_d16_20260120_150210/promising/C2xC2xC2_c00409 (reason: d>=sqrt(n))
[pilot] MEAS n=288 k=4 dx_ub=23 dz_ub=20 d_ub=20 steps=5000 id=C2xC2xC2_c00460
[saved] id=C2xC2xC2_c00460 -> results/c2xc2xc2_d16_20260120_150210/promising/C2xC2xC2_c00460 (reason: d>=sqrt(n))
[pilot] MEAS n=288 k=4 dx_ub=16 dz_ub=18 d_ub=16 steps=5000 id=C2xC2xC2_c00470
[pilot] MEAS n=288 k=4 dx_ub=16 dz_ub=17 d_ub=16 steps=5000 id=C2xC2xC2_c00485
[best_by_k] group=C2xC2xC2 n=288
k  | d_ub | steps | dx_ub | dz_ub | id
 4 |   20 |  5000 |    20 |    20 | C2xC2xC2_c00050
 8 |   17 |  5000 |    17 |    20 | C2xC2xC2_c00066
[coverage] group=C2xC2xC2 A_sel=128 B_sel=128 Q_meas=29 ratio_ge_sqrt=0.001 ratio_sel=0.002
[coverage] run summary:
[coverage] group=C2xC2xC2 A_sel=128 B_sel=128 Q_meas=29 ratio_ge_sqrt=0.001 ratio_sel=0.002
[summary] best-by-k (measured; includes rejects):
  k=4 best_d_ub=20 count_measured=21 example_id=C2xC2xC2_c00050
  k=8 best_d_ub=17 count_measured=8 example_id=C2xC2xC2_c00066
[summary] best-by-k (survivors; target=16):
  k=4 best_d_ub=20 count_survivors=19 example_id=C2xC2xC2_c00050
  k=8 best_d_ub=17 count_survivors=4 example_id=C2xC2xC2_c00066
[pilot] top results:
  01 group=C2xC2xC2 n=288 k=4 d_ub=20 permA=12 permB=27 saved=True
  02 group=C2xC2xC2 n=288 k=4 d_ub=20 permA=11 permB=12 saved=True
  03 group=C2xC2xC2 n=288 k=4 d_ub=20 permA=20 permB=27 saved=True
  04 group=C2xC2xC2 n=288 k=4 d_ub=20 permA=20 permB=11 saved=True
  05 group=C2xC2xC2 n=288 k=4 d_ub=20 permA=11 permB=8 saved=True
  06 group=C2xC2xC2 n=288 k=4 d_ub=20 permA=11 permB=12 saved=True
  07 group=C2xC2xC2 n=288 k=4 d_ub=20 permA=20 permB=7 saved=True
  08 group=C2xC2xC2 n=288 k=4 d_ub=20 permA=11 permB=11 saved=True
  09 group=C2xC2xC2 n=288 k=4 d_ub=20 permA=11 permB=8 saved=True
  10 group=C2xC2xC2 n=288 k=8 d_ub=17 permA=20 permB=12 saved=True

