=== mar. 20 janv. 2026 21:35:17 CET steps=20000 batch=8 seed=1768937111 ===
[pilot] base k_table top pairs:
  k_base=18 permA=0 permB=0
  k_base=12 permA=29 permB=0
  k_base=12 permA=22 permB=0
  k_base=12 permA=13 permB=0
  k_base=12 permA=6 permB=0
[pilot] A multisets raw=792 (expected=792) enum_mode=multiset cayley_unique=26 perms=30 -> total scored = 780
[pilot] B multisets raw=792 (expected=792) enum_mode=multiset cayley_unique=26 perms=30 -> total scored = 780
[pilot] A frontier kept 128 candidates with points: (4,20), (0,49)
[pilot] B frontier kept 128 candidates with points: (4,20), (0,49)
[pilot] C2xC2xC2 n=288 d0=17 A_sets=26*30 -> keep 128; B_sets=26*30 -> keep 128
[pilot] TARGET_REJECT d_ub=14 target=16 id=C2xC2xC2_c00007
[pilot] MEAS n=288 k=4 dx_ub=16 dz_ub=20 d_ub=16 steps=20000 id=C2xC2xC2_c00016
[pilot] MEAS n=288 k=8 dx_ub=17 dz_ub=20 d_ub=17 steps=20000 id=C2xC2xC2_c00031
[saved] id=C2xC2xC2_c00031 -> results/c2xc2xc2_d16_20260120_213517/promising/C2xC2xC2_c00031 (reason: d>=sqrt(n))
[pilot] MEAS n=288 k=4 dx_ub=17 dz_ub=20 d_ub=17 steps=20000 id=C2xC2xC2_c00032
[saved] id=C2xC2xC2_c00032 -> results/c2xc2xc2_d16_20260120_213517/promising/C2xC2xC2_c00032 (reason: d>=sqrt(n))
[pilot] MEAS n=288 k=4 dx_ub=18 dz_ub=16 d_ub=16 steps=20000 id=C2xC2xC2_c00074
[pilot] MEAS n=288 k=4 dx_ub=20 dz_ub=20 d_ub=20 steps=20000 id=C2xC2xC2_c00088
[saved] id=C2xC2xC2_c00088 -> results/c2xc2xc2_d16_20260120_213517/promising/C2xC2xC2_c00088 (reason: d>=sqrt(n))
[pilot] MEAS n=288 k=4 dx_ub=20 dz_ub=20 d_ub=20 steps=20000 id=C2xC2xC2_c00103
[saved] id=C2xC2xC2_c00103 -> results/c2xc2xc2_d16_20260120_213517/promising/C2xC2xC2_c00103 (reason: d>=sqrt(n))
[pilot] MEAS n=288 k=4 dx_ub=20 dz_ub=20 d_ub=20 steps=20000 id=C2xC2xC2_c00113
[saved] id=C2xC2xC2_c00113 -> results/c2xc2xc2_d16_20260120_213517/promising/C2xC2xC2_c00113 (reason: d>=sqrt(n))
[pilot] MEAS n=288 k=8 dx_ub=16 dz_ub=18 d_ub=16 steps=20000 id=C2xC2xC2_c00199
[pilot] MEAS n=288 k=4 dx_ub=20 dz_ub=16 d_ub=16 steps=20000 id=C2xC2xC2_c00202
[pilot] MEAS n=288 k=4 dx_ub=20 dz_ub=19 d_ub=19 steps=20000 id=C2xC2xC2_c00215
[saved] id=C2xC2xC2_c00215 -> results/c2xc2xc2_d16_20260120_213517/promising/C2xC2xC2_c00215 (reason: d>=sqrt(n))
[pilot] MEAS n=288 k=4 dx_ub=20 dz_ub=16 d_ub=16 steps=20000 id=C2xC2xC2_c00238
[pilot] MEAS n=288 k=4 dx_ub=18 dz_ub=16 d_ub=16 steps=20000 id=C2xC2xC2_c00244
[pilot] MEAS n=288 k=4 dx_ub=20 dz_ub=18 d_ub=18 steps=20000 id=C2xC2xC2_c00246
[saved] id=C2xC2xC2_c00246 -> results/c2xc2xc2_d16_20260120_213517/promising/C2xC2xC2_c00246 (reason: d>=sqrt(n))
[pilot] MEAS n=288 k=4 dx_ub=16 dz_ub=17 d_ub=16 steps=20000 id=C2xC2xC2_c00260
[pilot] MEAS n=288 k=4 dx_ub=20 dz_ub=19 d_ub=19 steps=20000 id=C2xC2xC2_c00297
[saved] id=C2xC2xC2_c00297 -> results/c2xc2xc2_d16_20260120_213517/promising/C2xC2xC2_c00297 (reason: d>=sqrt(n))
[pilot] TARGET_REJECT d_ub=14 target=16 id=C2xC2xC2_c00310
[pilot] MEAS n=288 k=4 dx_ub=16 dz_ub=19 d_ub=16 steps=20000 id=C2xC2xC2_c00312
[pilot] MEAS n=288 k=4 dx_ub=20 dz_ub=20 d_ub=20 steps=20000 id=C2xC2xC2_c00313
[saved] id=C2xC2xC2_c00313 -> results/c2xc2xc2_d16_20260120_213517/promising/C2xC2xC2_c00313 (reason: d>=sqrt(n))
[pilot] TARGET_REJECT d_ub=15 target=16 id=C2xC2xC2_c00332
[pilot] MEAS n=288 k=4 dx_ub=19 dz_ub=20 d_ub=19 steps=20000 id=C2xC2xC2_c00352
[saved] id=C2xC2xC2_c00352 -> results/c2xc2xc2_d16_20260120_213517/promising/C2xC2xC2_c00352 (reason: d>=sqrt(n))
[pilot] MEAS n=288 k=8 dx_ub=16 dz_ub=16 d_ub=16 steps=20000 id=C2xC2xC2_c00385
[pilot] MEAS n=288 k=4 dx_ub=20 dz_ub=20 d_ub=20 steps=20000 id=C2xC2xC2_c00423
[saved] id=C2xC2xC2_c00423 -> results/c2xc2xc2_d16_20260120_213517/promising/C2xC2xC2_c00423 (reason: d>=sqrt(n))
[best_by_k] group=C2xC2xC2 n=288
k  | d_ub | steps | dx_ub | dz_ub | id
 4 |   20 | 20000 |    20 |    20 | C2xC2xC2_c00088
 8 |   17 | 20000 |    17 |    20 | C2xC2xC2_c00031
[coverage] group=C2xC2xC2 A_sel=128 B_sel=128 Q_meas=23 ratio_ge_sqrt=0.000 ratio_sel=0.001
[coverage] run summary:
[coverage] group=C2xC2xC2 A_sel=128 B_sel=128 Q_meas=23 ratio_ge_sqrt=0.000 ratio_sel=0.001
[summary] best-by-k (measured; includes rejects):
  k=4 best_d_ub=20 count_measured=18 example_id=C2xC2xC2_c00088
  k=8 best_d_ub=17 count_measured=5 example_id=C2xC2xC2_c00031
[summary] best-by-k (survivors; target=16):
  k=4 best_d_ub=20 count_survivors=17 example_id=C2xC2xC2_c00088
  k=8 best_d_ub=17 count_survivors=3 example_id=C2xC2xC2_c00031
[pilot] top results:
  01 group=C2xC2xC2 n=288 k=4 d_ub=20 permA=7 permB=8 saved=True
  02 group=C2xC2xC2 n=288 k=4 d_ub=20 permA=27 permB=11 saved=True
  03 group=C2xC2xC2 n=288 k=4 d_ub=20 permA=20 permB=27 saved=True
  04 group=C2xC2xC2 n=288 k=4 d_ub=20 permA=8 permB=11 saved=True
  05 group=C2xC2xC2 n=288 k=4 d_ub=20 permA=7 permB=20 saved=True
  06 group=C2xC2xC2 n=288 k=4 d_ub=19 permA=27 permB=27 saved=True
  07 group=C2xC2xC2 n=288 k=4 d_ub=19 permA=12 permB=11 saved=True
  08 group=C2xC2xC2 n=288 k=4 d_ub=19 permA=8 permB=12 saved=True
  09 group=C2xC2xC2 n=288 k=4 d_ub=18 permA=11 permB=20 saved=True
  10 group=C2xC2xC2 n=288 k=8 d_ub=17 permA=11 permB=11 saved=True

