=== mer. 21 janv. 2026 04:28:23 CET steps=20000 batch=30 seed=1768937133 ===
[pilot] base k_table top pairs:
  k_base=18 permA=0 permB=0
  k_base=12 permA=29 permB=0
  k_base=12 permA=22 permB=0
  k_base=12 permA=13 permB=0
  k_base=12 permA=6 permB=0
[pilot] A multisets raw=792 (expected=792) enum_mode=multiset cayley_unique=26 perms=30 -> total scored = 780
[pilot] B multisets raw=792 (expected=792) enum_mode=multiset cayley_unique=26 perms=30 -> total scored = 780
[pilot] A frontier kept 128 candidates with points: (4,20), (0,49)
[pilot] B frontier kept 128 candidates with points: (4,20), (0,49)
[pilot] C2xC2xC2 n=288 d0=17 A_sets=26*30 -> keep 128; B_sets=26*30 -> keep 128
[pilot] MEAS n=288 k=4 dx_ub=19 dz_ub=19 d_ub=19 steps=20000 id=C2xC2xC2_c00014
[saved] id=C2xC2xC2_c00014 -> results/c2xc2xc2_d16_20260121_042823/promising/C2xC2xC2_c00014 (reason: d>=sqrt(n))
[pilot] MEAS n=288 k=4 dx_ub=16 dz_ub=16 d_ub=16 steps=20000 id=C2xC2xC2_c00034
[pilot] MEAS n=288 k=4 dx_ub=17 dz_ub=20 d_ub=17 steps=20000 id=C2xC2xC2_c00062
[saved] id=C2xC2xC2_c00062 -> results/c2xc2xc2_d16_20260121_042823/promising/C2xC2xC2_c00062 (reason: d>=sqrt(n))
[pilot] MEAS n=288 k=4 dx_ub=20 dz_ub=20 d_ub=20 steps=20000 id=C2xC2xC2_c00076
[saved] id=C2xC2xC2_c00076 -> results/c2xc2xc2_d16_20260121_042823/promising/C2xC2xC2_c00076 (reason: d>=sqrt(n))
[pilot] TARGET_REJECT d_ub=12 target=16 id=C2xC2xC2_c00084
[pilot] MEAS n=288 k=8 dx_ub=16 dz_ub=18 d_ub=16 steps=20000 id=C2xC2xC2_c00109
[pilot] MEAS n=288 k=4 dx_ub=20 dz_ub=19 d_ub=19 steps=20000 id=C2xC2xC2_c00114
[saved] id=C2xC2xC2_c00114 -> results/c2xc2xc2_d16_20260121_042823/promising/C2xC2xC2_c00114 (reason: d>=sqrt(n))
[pilot] TARGET_REJECT d_ub=14 target=16 id=C2xC2xC2_c00117
[pilot] MEAS n=288 k=4 dx_ub=20 dz_ub=17 d_ub=17 steps=20000 id=C2xC2xC2_c00119
[saved] id=C2xC2xC2_c00119 -> results/c2xc2xc2_d16_20260121_042823/promising/C2xC2xC2_c00119 (reason: d>=sqrt(n))
[pilot] MEAS n=288 k=4 dx_ub=20 dz_ub=16 d_ub=16 steps=20000 id=C2xC2xC2_c00120
[pilot] MEAS n=288 k=4 dx_ub=20 dz_ub=18 d_ub=18 steps=20000 id=C2xC2xC2_c00124
[saved] id=C2xC2xC2_c00124 -> results/c2xc2xc2_d16_20260121_042823/promising/C2xC2xC2_c00124 (reason: d>=sqrt(n))
[pilot] MEAS n=288 k=8 dx_ub=20 dz_ub=17 d_ub=17 steps=20000 id=C2xC2xC2_c00143
[saved] id=C2xC2xC2_c00143 -> results/c2xc2xc2_d16_20260121_042823/promising/C2xC2xC2_c00143 (reason: d>=sqrt(n))
[pilot] MEAS n=288 k=8 dx_ub=16 dz_ub=17 d_ub=16 steps=20000 id=C2xC2xC2_c00181
[pilot] TARGET_REJECT d_ub=12 target=16 id=C2xC2xC2_c00197
[pilot] MEAS n=288 k=4 dx_ub=16 dz_ub=17 d_ub=16 steps=20000 id=C2xC2xC2_c00200
[pilot] MEAS n=288 k=4 dx_ub=17 dz_ub=16 d_ub=16 steps=20000 id=C2xC2xC2_c00223
[pilot] MEAS n=288 k=4 dx_ub=20 dz_ub=20 d_ub=20 steps=20000 id=C2xC2xC2_c00248
[saved] id=C2xC2xC2_c00248 -> results/c2xc2xc2_d16_20260121_042823/promising/C2xC2xC2_c00248 (reason: d>=sqrt(n))
[pilot] MEAS n=288 k=4 dx_ub=20 dz_ub=18 d_ub=18 steps=20000 id=C2xC2xC2_c00279
[saved] id=C2xC2xC2_c00279 -> results/c2xc2xc2_d16_20260121_042823/promising/C2xC2xC2_c00279 (reason: d>=sqrt(n))
[pilot] MEAS n=288 k=4 dx_ub=20 dz_ub=18 d_ub=18 steps=20000 id=C2xC2xC2_c00304
[saved] id=C2xC2xC2_c00304 -> results/c2xc2xc2_d16_20260121_042823/promising/C2xC2xC2_c00304 (reason: d>=sqrt(n))
[pilot] MEAS n=288 k=4 dx_ub=20 dz_ub=20 d_ub=20 steps=20000 id=C2xC2xC2_c00323
[saved] id=C2xC2xC2_c00323 -> results/c2xc2xc2_d16_20260121_042823/promising/C2xC2xC2_c00323 (reason: d>=sqrt(n))
[pilot] MEAS n=288 k=4 dx_ub=19 dz_ub=20 d_ub=19 steps=20000 id=C2xC2xC2_c00326
[saved] id=C2xC2xC2_c00326 -> results/c2xc2xc2_d16_20260121_042823/promising/C2xC2xC2_c00326 (reason: d>=sqrt(n))
[pilot] TARGET_REJECT d_ub=12 target=16 id=C2xC2xC2_c00329
[pilot] MEAS n=288 k=4 dx_ub=20 dz_ub=16 d_ub=16 steps=20000 id=C2xC2xC2_c00340
[pilot] MEAS n=288 k=4 dx_ub=20 dz_ub=20 d_ub=20 steps=20000 id=C2xC2xC2_c00360
[saved] id=C2xC2xC2_c00360 -> results/c2xc2xc2_d16_20260121_042823/promising/C2xC2xC2_c00360 (reason: d>=sqrt(n))
[pilot] MEAS n=288 k=4 dx_ub=20 dz_ub=19 d_ub=19 steps=20000 id=C2xC2xC2_c00365
[saved] id=C2xC2xC2_c00365 -> results/c2xc2xc2_d16_20260121_042823/promising/C2xC2xC2_c00365 (reason: d>=sqrt(n))
[pilot] MEAS n=288 k=4 dx_ub=16 dz_ub=16 d_ub=16 steps=20000 id=C2xC2xC2_c00380
[pilot] TARGET_REJECT d_ub=12 target=16 id=C2xC2xC2_c00383
[pilot] TARGET_REJECT d_ub=14 target=16 id=C2xC2xC2_c00386
[pilot] MEAS n=288 k=4 dx_ub=16 dz_ub=17 d_ub=16 steps=20000 id=C2xC2xC2_c00398
[pilot] MEAS n=288 k=4 dx_ub=18 dz_ub=17 d_ub=17 steps=20000 id=C2xC2xC2_c00399
[saved] id=C2xC2xC2_c00399 -> results/c2xc2xc2_d16_20260121_042823/promising/C2xC2xC2_c00399 (reason: d>=sqrt(n))
[pilot] MEAS n=288 k=4 dx_ub=19 dz_ub=16 d_ub=16 steps=20000 id=C2xC2xC2_c00403
[pilot] TARGET_REJECT d_ub=12 target=16 id=C2xC2xC2_c00412
[pilot] MEAS n=288 k=4 dx_ub=19 dz_ub=19 d_ub=19 steps=20000 id=C2xC2xC2_c00415
[saved] id=C2xC2xC2_c00415 -> results/c2xc2xc2_d16_20260121_042823/promising/C2xC2xC2_c00415 (reason: d>=sqrt(n))
[pilot] MEAS n=288 k=4 dx_ub=16 dz_ub=16 d_ub=16 steps=20000 id=C2xC2xC2_c00423
[pilot] TARGET_REJECT d_ub=15 target=16 id=C2xC2xC2_c00427
[pilot] MEAS n=288 k=4 dx_ub=16 dz_ub=19 d_ub=16 steps=20000 id=C2xC2xC2_c00440
[pilot] MEAS n=288 k=4 dx_ub=20 dz_ub=20 d_ub=20 steps=20000 id=C2xC2xC2_c00449
[saved] id=C2xC2xC2_c00449 -> results/c2xc2xc2_d16_20260121_042823/promising/C2xC2xC2_c00449 (reason: d>=sqrt(n))
[pilot] MEAS n=288 k=4 dx_ub=17 dz_ub=16 d_ub=16 steps=20000 id=C2xC2xC2_c00470
[pilot] MEAS n=288 k=4 dx_ub=16 dz_ub=17 d_ub=16 steps=20000 id=C2xC2xC2_c00471
[pilot] TARGET_REJECT d_ub=12 target=16 id=C2xC2xC2_c00476
[pilot] MEAS n=288 k=4 dx_ub=16 dz_ub=20 d_ub=16 steps=20000 id=C2xC2xC2_c00479
[best_by_k] group=C2xC2xC2 n=288
k  | d_ub | steps | dx_ub | dz_ub | id
 4 |   20 | 20000 |    20 |    20 | C2xC2xC2_c00076
 8 |   17 | 20000 |    20 |    17 | C2xC2xC2_c00143
[coverage] group=C2xC2xC2 A_sel=128 B_sel=128 Q_meas=41 ratio_ge_sqrt=0.001 ratio_sel=0.003
[coverage] run summary:
[coverage] group=C2xC2xC2 A_sel=128 B_sel=128 Q_meas=41 ratio_ge_sqrt=0.001 ratio_sel=0.003
[summary] best-by-k (measured; includes rejects):
  k=4 best_d_ub=20 count_measured=32 example_id=C2xC2xC2_c00076
  k=8 best_d_ub=17 count_measured=9 example_id=C2xC2xC2_c00143
[summary] best-by-k (survivors; target=16):
  k=4 best_d_ub=20 count_survivors=29 example_id=C2xC2xC2_c00076
  k=8 best_d_ub=17 count_survivors=3 example_id=C2xC2xC2_c00143
[pilot] top results:
  01 group=C2xC2xC2 n=288 k=4 d_ub=20 permA=8 permB=7 saved=True
  02 group=C2xC2xC2 n=288 k=4 d_ub=20 permA=27 permB=27 saved=True
  03 group=C2xC2xC2 n=288 k=4 d_ub=20 permA=27 permB=7 saved=True
  04 group=C2xC2xC2 n=288 k=4 d_ub=20 permA=7 permB=8 saved=True
  05 group=C2xC2xC2 n=288 k=4 d_ub=20 permA=20 permB=7 saved=True
  06 group=C2xC2xC2 n=288 k=4 d_ub=19 permA=20 permB=27 saved=True
  07 group=C2xC2xC2 n=288 k=4 d_ub=19 permA=27 permB=27 saved=True
  08 group=C2xC2xC2 n=288 k=4 d_ub=19 permA=27 permB=11 saved=True
  09 group=C2xC2xC2 n=288 k=4 d_ub=19 permA=11 permB=12 saved=True
  10 group=C2xC2xC2 n=288 k=4 d_ub=19 permA=8 permB=8 saved=True

