=== mar. 20 janv. 2026 15:29:55 CET steps=5000 batch=73 seed=1768922176 ===
[pilot] base k_table top pairs:
  k_base=18 permA=0 permB=0
  k_base=12 permA=29 permB=0
  k_base=12 permA=22 permB=0
  k_base=12 permA=13 permB=0
  k_base=12 permA=6 permB=0
[pilot] A multisets raw=792 (expected=792) enum_mode=multiset cayley_unique=26 perms=30 -> total scored = 780
[pilot] B multisets raw=792 (expected=792) enum_mode=multiset cayley_unique=26 perms=30 -> total scored = 780
[pilot] A frontier kept 128 candidates with points: (4,20), (0,49)
[pilot] B frontier kept 128 candidates with points: (4,20), (0,49)
[pilot] C2xC2xC2 n=288 d0=17 A_sets=26*30 -> keep 128; B_sets=26*30 -> keep 128
[pilot] MEAS n=288 k=4 dx_ub=17 dz_ub=16 d_ub=16 steps=5000 id=C2xC2xC2_c00003
[pilot] MEAS n=288 k=4 dx_ub=19 dz_ub=20 d_ub=19 steps=5000 id=C2xC2xC2_c00004
[saved] id=C2xC2xC2_c00004 -> results/c2xc2xc2_d16_20260120_152955/promising/C2xC2xC2_c00004 (reason: d>=sqrt(n))
[pilot] MEAS n=288 k=4 dx_ub=20 dz_ub=17 d_ub=17 steps=5000 id=C2xC2xC2_c00088
[saved] id=C2xC2xC2_c00088 -> results/c2xc2xc2_d16_20260120_152955/promising/C2xC2xC2_c00088 (reason: d>=sqrt(n))
[pilot] MEAS n=288 k=8 dx_ub=16 dz_ub=16 d_ub=16 steps=5000 id=C2xC2xC2_c00090
[pilot] MEAS n=288 k=4 dx_ub=16 dz_ub=16 d_ub=16 steps=5000 id=C2xC2xC2_c00097
[pilot] TARGET_REJECT d_ub=14 target=16 id=C2xC2xC2_c00122
[pilot] MEAS n=288 k=4 dx_ub=20 dz_ub=20 d_ub=20 steps=5000 id=C2xC2xC2_c00132
[saved] id=C2xC2xC2_c00132 -> results/c2xc2xc2_d16_20260120_152955/promising/C2xC2xC2_c00132 (reason: d>=sqrt(n))
[pilot] TARGET_REJECT d_ub=12 target=16 id=C2xC2xC2_c00147
[pilot] MEAS n=288 k=4 dx_ub=17 dz_ub=17 d_ub=17 steps=5000 id=C2xC2xC2_c00152
[saved] id=C2xC2xC2_c00152 -> results/c2xc2xc2_d16_20260120_152955/promising/C2xC2xC2_c00152 (reason: d>=sqrt(n))
[pilot] TARGET_REJECT d_ub=12 target=16 id=C2xC2xC2_c00162
[pilot] TARGET_REJECT d_ub=12 target=16 id=C2xC2xC2_c00173
[pilot] MEAS n=288 k=4 dx_ub=17 dz_ub=16 d_ub=16 steps=5000 id=C2xC2xC2_c00180
[pilot] TARGET_REJECT d_ub=15 target=16 id=C2xC2xC2_c00183
[pilot] MEAS n=288 k=4 dx_ub=16 dz_ub=18 d_ub=16 steps=5000 id=C2xC2xC2_c00191
[pilot] MEAS n=288 k=4 dx_ub=18 dz_ub=16 d_ub=16 steps=5000 id=C2xC2xC2_c00217
[pilot] MEAS n=288 k=4 dx_ub=20 dz_ub=20 d_ub=20 steps=5000 id=C2xC2xC2_c00229
[saved] id=C2xC2xC2_c00229 -> results/c2xc2xc2_d16_20260120_152955/promising/C2xC2xC2_c00229 (reason: d>=sqrt(n))
[pilot] TARGET_REJECT d_ub=15 target=16 id=C2xC2xC2_c00241
[pilot] TARGET_REJECT d_ub=6 target=16 id=C2xC2xC2_c00245
[pilot] MEAS n=288 k=4 dx_ub=20 dz_ub=20 d_ub=20 steps=5000 id=C2xC2xC2_c00258
[saved] id=C2xC2xC2_c00258 -> results/c2xc2xc2_d16_20260120_152955/promising/C2xC2xC2_c00258 (reason: d>=sqrt(n))
[pilot] MEAS n=288 k=4 dx_ub=16 dz_ub=16 d_ub=16 steps=5000 id=C2xC2xC2_c00268
[pilot] TARGET_REJECT d_ub=14 target=16 id=C2xC2xC2_c00289
[pilot] MEAS n=288 k=4 dx_ub=20 dz_ub=16 d_ub=16 steps=5000 id=C2xC2xC2_c00294
[pilot] MEAS n=288 k=4 dx_ub=20 dz_ub=20 d_ub=20 steps=5000 id=C2xC2xC2_c00295
[saved] id=C2xC2xC2_c00295 -> results/c2xc2xc2_d16_20260120_152955/promising/C2xC2xC2_c00295 (reason: d>=sqrt(n))
[pilot] MEAS n=288 k=4 dx_ub=22 dz_ub=20 d_ub=20 steps=5000 id=C2xC2xC2_c00306
[saved] id=C2xC2xC2_c00306 -> results/c2xc2xc2_d16_20260120_152955/promising/C2xC2xC2_c00306 (reason: d>=sqrt(n))
[pilot] TARGET_REJECT d_ub=12 target=16 id=C2xC2xC2_c00317
[pilot] TARGET_REJECT d_ub=12 target=16 id=C2xC2xC2_c00348
[pilot] MEAS n=288 k=4 dx_ub=20 dz_ub=20 d_ub=20 steps=5000 id=C2xC2xC2_c00350
[saved] id=C2xC2xC2_c00350 -> results/c2xc2xc2_d16_20260120_152955/promising/C2xC2xC2_c00350 (reason: d>=sqrt(n))
[pilot] MEAS n=288 k=4 dx_ub=20 dz_ub=20 d_ub=20 steps=5000 id=C2xC2xC2_c00365
[saved] id=C2xC2xC2_c00365 -> results/c2xc2xc2_d16_20260120_152955/promising/C2xC2xC2_c00365 (reason: d>=sqrt(n))
[pilot] MEAS n=288 k=4 dx_ub=18 dz_ub=20 d_ub=18 steps=5000 id=C2xC2xC2_c00372
[saved] id=C2xC2xC2_c00372 -> results/c2xc2xc2_d16_20260120_152955/promising/C2xC2xC2_c00372 (reason: d>=sqrt(n))
[pilot] MEAS n=288 k=4 dx_ub=16 dz_ub=16 d_ub=16 steps=5000 id=C2xC2xC2_c00395
[pilot] MEAS n=288 k=4 dx_ub=20 dz_ub=20 d_ub=20 steps=5000 id=C2xC2xC2_c00407
[saved] id=C2xC2xC2_c00407 -> results/c2xc2xc2_d16_20260120_152955/promising/C2xC2xC2_c00407 (reason: d>=sqrt(n))
[pilot] MEAS n=288 k=4 dx_ub=18 dz_ub=22 d_ub=18 steps=5000 id=C2xC2xC2_c00409
[saved] id=C2xC2xC2_c00409 -> results/c2xc2xc2_d16_20260120_152955/promising/C2xC2xC2_c00409 (reason: d>=sqrt(n))
[pilot] MEAS n=288 k=8 dx_ub=16 dz_ub=17 d_ub=16 steps=5000 id=C2xC2xC2_c00429
[pilot] MEAS n=288 k=4 dx_ub=20 dz_ub=17 d_ub=17 steps=5000 id=C2xC2xC2_c00494
[saved] id=C2xC2xC2_c00494 -> results/c2xc2xc2_d16_20260120_152955/promising/C2xC2xC2_c00494 (reason: d>=sqrt(n))
[pilot] TARGET_REJECT d_ub=12 target=16 id=C2xC2xC2_c00495
[best_by_k] group=C2xC2xC2 n=288
k  | d_ub | steps | dx_ub | dz_ub | id
 4 |   20 |  5000 |    20 |    20 | C2xC2xC2_c00132
 8 |   16 |  5000 |    16 |    16 | C2xC2xC2_c00090
[coverage] group=C2xC2xC2 A_sel=128 B_sel=128 Q_meas=35 ratio_ge_sqrt=0.001 ratio_sel=0.002
[coverage] run summary:
[coverage] group=C2xC2xC2 A_sel=128 B_sel=128 Q_meas=35 ratio_ge_sqrt=0.001 ratio_sel=0.002
[summary] best-by-k (measured; includes rejects):
  k=4 best_d_ub=20 count_measured=25 example_id=C2xC2xC2_c00132
  k=8 best_d_ub=16 count_measured=10 example_id=C2xC2xC2_c00090
[summary] best-by-k (survivors; target=16):
  k=4 best_d_ub=20 count_survivors=22 example_id=C2xC2xC2_c00132
  k=8 best_d_ub=16 count_survivors=2 example_id=C2xC2xC2_c00090
[pilot] top results:
  01 group=C2xC2xC2 n=288 k=4 d_ub=20 permA=8 permB=11 saved=True
  02 group=C2xC2xC2 n=288 k=4 d_ub=20 permA=27 permB=20 saved=True
  03 group=C2xC2xC2 n=288 k=4 d_ub=20 permA=11 permB=11 saved=True
  04 group=C2xC2xC2 n=288 k=4 d_ub=20 permA=27 permB=20 saved=True
  05 group=C2xC2xC2 n=288 k=4 d_ub=20 permA=20 permB=11 saved=True
  06 group=C2xC2xC2 n=288 k=4 d_ub=20 permA=7 permB=27 saved=True
  07 group=C2xC2xC2 n=288 k=4 d_ub=20 permA=11 permB=12 saved=True
  08 group=C2xC2xC2 n=288 k=4 d_ub=20 permA=11 permB=20 saved=True
  09 group=C2xC2xC2 n=288 k=4 d_ub=19 permA=20 permB=11 saved=True
  10 group=C2xC2xC2 n=288 k=4 d_ub=18 permA=27 permB=20 saved=True

