=== mar. 20 janv. 2026 15:11:31 CET steps=5000 batch=38 seed=1768922141 ===
[pilot] base k_table top pairs:
  k_base=18 permA=0 permB=0
  k_base=12 permA=29 permB=0
  k_base=12 permA=22 permB=0
  k_base=12 permA=13 permB=0
  k_base=12 permA=6 permB=0
[pilot] A multisets raw=792 (expected=792) enum_mode=multiset cayley_unique=26 perms=30 -> total scored = 780
[pilot] B multisets raw=792 (expected=792) enum_mode=multiset cayley_unique=26 perms=30 -> total scored = 780
[pilot] A frontier kept 128 candidates with points: (4,20), (0,49)
[pilot] B frontier kept 128 candidates with points: (4,20), (0,49)
[pilot] C2xC2xC2 n=288 d0=17 A_sets=26*30 -> keep 128; B_sets=26*30 -> keep 128
[pilot] MEAS n=288 k=4 dx_ub=20 dz_ub=20 d_ub=20 steps=5000 id=C2xC2xC2_c00013
[saved] id=C2xC2xC2_c00013 -> results/c2xc2xc2_d16_20260120_151131/promising/C2xC2xC2_c00013 (reason: d>=sqrt(n))
[pilot] TARGET_REJECT d_ub=12 target=16 id=C2xC2xC2_c00016
[pilot] MEAS n=288 k=4 dx_ub=20 dz_ub=20 d_ub=20 steps=5000 id=C2xC2xC2_c00029
[saved] id=C2xC2xC2_c00029 -> results/c2xc2xc2_d16_20260120_151131/promising/C2xC2xC2_c00029 (reason: d>=sqrt(n))
[pilot] TARGET_REJECT d_ub=15 target=16 id=C2xC2xC2_c00035
[pilot] MEAS n=288 k=8 dx_ub=16 dz_ub=18 d_ub=16 steps=5000 id=C2xC2xC2_c00041
[pilot] TARGET_REJECT d_ub=12 target=16 id=C2xC2xC2_c00087
[pilot] MEAS n=288 k=4 dx_ub=19 dz_ub=20 d_ub=19 steps=5000 id=C2xC2xC2_c00091
[saved] id=C2xC2xC2_c00091 -> results/c2xc2xc2_d16_20260120_151131/promising/C2xC2xC2_c00091 (reason: d>=sqrt(n))
[pilot] MEAS n=288 k=4 dx_ub=16 dz_ub=20 d_ub=16 steps=5000 id=C2xC2xC2_c00112
[pilot] MEAS n=288 k=4 dx_ub=20 dz_ub=20 d_ub=20 steps=5000 id=C2xC2xC2_c00115
[saved] id=C2xC2xC2_c00115 -> results/c2xc2xc2_d16_20260120_151131/promising/C2xC2xC2_c00115 (reason: d>=sqrt(n))
[pilot] MEAS n=288 k=8 dx_ub=16 dz_ub=17 d_ub=16 steps=5000 id=C2xC2xC2_c00117
[pilot] MEAS n=288 k=4 dx_ub=17 dz_ub=17 d_ub=17 steps=5000 id=C2xC2xC2_c00140
[saved] id=C2xC2xC2_c00140 -> results/c2xc2xc2_d16_20260120_151131/promising/C2xC2xC2_c00140 (reason: d>=sqrt(n))
[pilot] MEAS n=288 k=4 dx_ub=16 dz_ub=16 d_ub=16 steps=5000 id=C2xC2xC2_c00144
[pilot] MEAS n=288 k=4 dx_ub=16 dz_ub=16 d_ub=16 steps=5000 id=C2xC2xC2_c00180
[pilot] MEAS n=288 k=8 dx_ub=16 dz_ub=17 d_ub=16 steps=5000 id=C2xC2xC2_c00185
[pilot] MEAS n=288 k=4 dx_ub=20 dz_ub=19 d_ub=19 steps=5000 id=C2xC2xC2_c00189
[saved] id=C2xC2xC2_c00189 -> results/c2xc2xc2_d16_20260120_151131/promising/C2xC2xC2_c00189 (reason: d>=sqrt(n))
[pilot] MEAS n=288 k=8 dx_ub=16 dz_ub=18 d_ub=16 steps=5000 id=C2xC2xC2_c00198
[pilot] MEAS n=288 k=4 dx_ub=20 dz_ub=20 d_ub=20 steps=5000 id=C2xC2xC2_c00220
[saved] id=C2xC2xC2_c00220 -> results/c2xc2xc2_d16_20260120_151131/promising/C2xC2xC2_c00220 (reason: d>=sqrt(n))
[pilot] MEAS n=288 k=8 dx_ub=16 dz_ub=18 d_ub=16 steps=5000 id=C2xC2xC2_c00222
[pilot] MEAS n=288 k=4 dx_ub=18 dz_ub=18 d_ub=18 steps=5000 id=C2xC2xC2_c00258
[saved] id=C2xC2xC2_c00258 -> results/c2xc2xc2_d16_20260120_151131/promising/C2xC2xC2_c00258 (reason: d>=sqrt(n))
[pilot] TARGET_REJECT d_ub=12 target=16 id=C2xC2xC2_c00261
[pilot] MEAS n=288 k=4 dx_ub=16 dz_ub=16 d_ub=16 steps=5000 id=C2xC2xC2_c00275
[pilot] MEAS n=288 k=4 dx_ub=22 dz_ub=20 d_ub=20 steps=5000 id=C2xC2xC2_c00279
[saved] id=C2xC2xC2_c00279 -> results/c2xc2xc2_d16_20260120_151131/promising/C2xC2xC2_c00279 (reason: d>=sqrt(n))
[pilot] TARGET_REJECT d_ub=12 target=16 id=C2xC2xC2_c00286
[pilot] MEAS n=288 k=8 dx_ub=16 dz_ub=17 d_ub=16 steps=5000 id=C2xC2xC2_c00299
[pilot] MEAS n=288 k=4 dx_ub=16 dz_ub=16 d_ub=16 steps=5000 id=C2xC2xC2_c00313
[best_by_k] group=C2xC2xC2 n=288
k  | d_ub | steps | dx_ub | dz_ub | id
 4 |   20 |  5000 |    20 |    20 | C2xC2xC2_c00013
 8 |   16 |  5000 |    16 |    18 | C2xC2xC2_c00041
[coverage] group=C2xC2xC2 A_sel=128 B_sel=128 Q_meas=25 ratio_ge_sqrt=0.000 ratio_sel=0.002
[coverage] run summary:
[coverage] group=C2xC2xC2 A_sel=128 B_sel=128 Q_meas=25 ratio_ge_sqrt=0.000 ratio_sel=0.002
[summary] best-by-k (measured; includes rejects):
  k=4 best_d_ub=20 count_measured=17 example_id=C2xC2xC2_c00013
  k=8 best_d_ub=16 count_measured=8 example_id=C2xC2xC2_c00041
[summary] best-by-k (survivors; target=16):
  k=4 best_d_ub=20 count_survivors=14 example_id=C2xC2xC2_c00013
  k=8 best_d_ub=16 count_survivors=6 example_id=C2xC2xC2_c00041
[pilot] top results:
  01 group=C2xC2xC2 n=288 k=4 d_ub=20 permA=27 permB=20 saved=True
  02 group=C2xC2xC2 n=288 k=4 d_ub=20 permA=20 permB=11 saved=True
  03 group=C2xC2xC2 n=288 k=4 d_ub=20 permA=11 permB=8 saved=True
  04 group=C2xC2xC2 n=288 k=4 d_ub=20 permA=27 permB=7 saved=True
  05 group=C2xC2xC2 n=288 k=4 d_ub=20 permA=11 permB=12 saved=True
  06 group=C2xC2xC2 n=288 k=4 d_ub=19 permA=12 permB=11 saved=True
  07 group=C2xC2xC2 n=288 k=4 d_ub=19 permA=11 permB=27 saved=True
  08 group=C2xC2xC2 n=288 k=4 d_ub=18 permA=7 permB=27 saved=True
  09 group=C2xC2xC2 n=288 k=4 d_ub=17 permA=12 permB=27 saved=True
  10 group=C2xC2xC2 n=288 k=8 d_ub=16 permA=11 permB=20 saved=False

