=== mar. 20 janv. 2026 15:01:36 CET steps=5000 batch=20 seed=1768922123 ===
[pilot] base k_table top pairs:
  k_base=18 permA=0 permB=0
  k_base=12 permA=29 permB=0
  k_base=12 permA=22 permB=0
  k_base=12 permA=13 permB=0
  k_base=12 permA=6 permB=0
[pilot] A multisets raw=792 (expected=792) enum_mode=multiset cayley_unique=26 perms=30 -> total scored = 780
[pilot] B multisets raw=792 (expected=792) enum_mode=multiset cayley_unique=26 perms=30 -> total scored = 780
[pilot] A frontier kept 128 candidates with points: (4,20), (0,49)
[pilot] B frontier kept 128 candidates with points: (4,20), (0,49)
[pilot] C2xC2xC2 n=288 d0=17 A_sets=26*30 -> keep 128; B_sets=26*30 -> keep 128
[pilot] MEAS n=288 k=4 dx_ub=20 dz_ub=20 d_ub=20 steps=5000 id=C2xC2xC2_c00008
[saved] id=C2xC2xC2_c00008 -> results/c2xc2xc2_d16_20260120_150136/promising/C2xC2xC2_c00008 (reason: d>=sqrt(n))
[pilot] MEAS n=288 k=4 dx_ub=20 dz_ub=19 d_ub=19 steps=5000 id=C2xC2xC2_c00044
[saved] id=C2xC2xC2_c00044 -> results/c2xc2xc2_d16_20260120_150136/promising/C2xC2xC2_c00044 (reason: d>=sqrt(n))
[pilot] MEAS n=288 k=4 dx_ub=20 dz_ub=18 d_ub=18 steps=5000 id=C2xC2xC2_c00076
[saved] id=C2xC2xC2_c00076 -> results/c2xc2xc2_d16_20260120_150136/promising/C2xC2xC2_c00076 (reason: d>=sqrt(n))
[pilot] MEAS n=288 k=4 dx_ub=20 dz_ub=16 d_ub=16 steps=5000 id=C2xC2xC2_c00095
[pilot] TARGET_REJECT d_ub=12 target=16 id=C2xC2xC2_c00096
[pilot] MEAS n=288 k=4 dx_ub=18 dz_ub=16 d_ub=16 steps=5000 id=C2xC2xC2_c00101
[pilot] MEAS n=288 k=4 dx_ub=23 dz_ub=20 d_ub=20 steps=5000 id=C2xC2xC2_c00135
[saved] id=C2xC2xC2_c00135 -> results/c2xc2xc2_d16_20260120_150136/promising/C2xC2xC2_c00135 (reason: d>=sqrt(n))
[pilot] TARGET_REJECT d_ub=15 target=16 id=C2xC2xC2_c00164
[pilot] MEAS n=288 k=4 dx_ub=16 dz_ub=16 d_ub=16 steps=5000 id=C2xC2xC2_c00173
[pilot] MEAS n=288 k=4 dx_ub=20 dz_ub=17 d_ub=17 steps=5000 id=C2xC2xC2_c00225
[saved] id=C2xC2xC2_c00225 -> results/c2xc2xc2_d16_20260120_150136/promising/C2xC2xC2_c00225 (reason: d>=sqrt(n))
[pilot] MEAS n=288 k=4 dx_ub=20 dz_ub=20 d_ub=20 steps=5000 id=C2xC2xC2_c00250
[saved] id=C2xC2xC2_c00250 -> results/c2xc2xc2_d16_20260120_150136/promising/C2xC2xC2_c00250 (reason: d>=sqrt(n))
[pilot] MEAS n=288 k=4 dx_ub=22 dz_ub=20 d_ub=20 steps=5000 id=C2xC2xC2_c00251
[saved] id=C2xC2xC2_c00251 -> results/c2xc2xc2_d16_20260120_150136/promising/C2xC2xC2_c00251 (reason: d>=sqrt(n))
[pilot] TARGET_REJECT d_ub=6 target=16 id=C2xC2xC2_c00279
[pilot] MEAS n=288 k=4 dx_ub=20 dz_ub=17 d_ub=17 steps=5000 id=C2xC2xC2_c00286
[saved] id=C2xC2xC2_c00286 -> results/c2xc2xc2_d16_20260120_150136/promising/C2xC2xC2_c00286 (reason: d>=sqrt(n))
[pilot] MEAS n=288 k=4 dx_ub=20 dz_ub=17 d_ub=17 steps=5000 id=C2xC2xC2_c00362
[saved] id=C2xC2xC2_c00362 -> results/c2xc2xc2_d16_20260120_150136/promising/C2xC2xC2_c00362 (reason: d>=sqrt(n))
[pilot] TARGET_REJECT d_ub=12 target=16 id=C2xC2xC2_c00368
[pilot] MEAS n=288 k=8 dx_ub=16 dz_ub=16 d_ub=16 steps=5000 id=C2xC2xC2_c00369
[pilot] MEAS n=288 k=4 dx_ub=20 dz_ub=16 d_ub=16 steps=5000 id=C2xC2xC2_c00381
[pilot] TARGET_REJECT d_ub=12 target=16 id=C2xC2xC2_c00396
[pilot] MEAS n=288 k=4 dx_ub=17 dz_ub=16 d_ub=16 steps=5000 id=C2xC2xC2_c00428
[pilot] MEAS n=288 k=4 dx_ub=16 dz_ub=21 d_ub=16 steps=5000 id=C2xC2xC2_c00436
[pilot] TARGET_REJECT d_ub=12 target=16 id=C2xC2xC2_c00456
[pilot] MEAS n=288 k=4 dx_ub=19 dz_ub=20 d_ub=19 steps=5000 id=C2xC2xC2_c00461
[saved] id=C2xC2xC2_c00461 -> results/c2xc2xc2_d16_20260120_150136/promising/C2xC2xC2_c00461 (reason: d>=sqrt(n))
[pilot] MEAS n=288 k=4 dx_ub=16 dz_ub=16 d_ub=16 steps=5000 id=C2xC2xC2_c00484
[pilot] MEAS n=288 k=8 dx_ub=16 dz_ub=18 d_ub=16 steps=5000 id=C2xC2xC2_c00499
[best_by_k] group=C2xC2xC2 n=288
k  | d_ub | steps | dx_ub | dz_ub | id
 4 |   20 |  5000 |    20 |    20 | C2xC2xC2_c00008
 8 |   16 |  5000 |    16 |    16 | C2xC2xC2_c00369
[coverage] group=C2xC2xC2 A_sel=128 B_sel=128 Q_meas=25 ratio_ge_sqrt=0.000 ratio_sel=0.002
[coverage] run summary:
[coverage] group=C2xC2xC2 A_sel=128 B_sel=128 Q_meas=25 ratio_ge_sqrt=0.000 ratio_sel=0.002
[summary] best-by-k (measured; includes rejects):
  k=4 best_d_ub=20 count_measured=21 example_id=C2xC2xC2_c00008
  k=8 best_d_ub=16 count_measured=4 example_id=C2xC2xC2_c00369
[summary] best-by-k (survivors; target=16):
  k=4 best_d_ub=20 count_survivors=17 example_id=C2xC2xC2_c00008
  k=8 best_d_ub=16 count_survivors=2 example_id=C2xC2xC2_c00369
[pilot] top results:
  01 group=C2xC2xC2 n=288 k=4 d_ub=20 permA=7 permB=20 saved=True
  02 group=C2xC2xC2 n=288 k=4 d_ub=20 permA=8 permB=20 saved=True
  03 group=C2xC2xC2 n=288 k=4 d_ub=20 permA=11 permB=11 saved=True
  04 group=C2xC2xC2 n=288 k=4 d_ub=20 permA=11 permB=27 saved=True
  05 group=C2xC2xC2 n=288 k=4 d_ub=19 permA=11 permB=27 saved=True
  06 group=C2xC2xC2 n=288 k=4 d_ub=19 permA=27 permB=20 saved=True
  07 group=C2xC2xC2 n=288 k=4 d_ub=18 permA=7 permB=27 saved=True
  08 group=C2xC2xC2 n=288 k=4 d_ub=17 permA=8 permB=27 saved=True
  09 group=C2xC2xC2 n=288 k=4 d_ub=17 permA=20 permB=12 saved=True
  10 group=C2xC2xC2 n=288 k=4 d_ub=17 permA=20 permB=8 saved=True

