=== mar. 20 janv. 2026 14:52:43 CET steps=5000 batch=3 seed=1768922106 ===
[pilot] base k_table top pairs:
  k_base=18 permA=0 permB=0
  k_base=12 permA=29 permB=0
  k_base=12 permA=22 permB=0
  k_base=12 permA=13 permB=0
  k_base=12 permA=6 permB=0
[pilot] A multisets raw=792 (expected=792) enum_mode=multiset cayley_unique=26 perms=30 -> total scored = 780
[pilot] B multisets raw=792 (expected=792) enum_mode=multiset cayley_unique=26 perms=30 -> total scored = 780
[pilot] A frontier kept 128 candidates with points: (4,20), (0,49)
[pilot] B frontier kept 128 candidates with points: (4,20), (0,49)
[pilot] C2xC2xC2 n=288 d0=17 A_sets=26*30 -> keep 128; B_sets=26*30 -> keep 128
[pilot] MEAS n=288 k=4 dx_ub=20 dz_ub=17 d_ub=17 steps=5000 id=C2xC2xC2_c00001
[saved] id=C2xC2xC2_c00001 -> results/c2xc2xc2_d16_20260120_145243/promising/C2xC2xC2_c00001 (reason: d>=sqrt(n))
[pilot] MEAS n=288 k=8 dx_ub=16 dz_ub=17 d_ub=16 steps=5000 id=C2xC2xC2_c00009
[pilot] MEAS n=288 k=8 dx_ub=16 dz_ub=18 d_ub=16 steps=5000 id=C2xC2xC2_c00015
[pilot] TARGET_REJECT d_ub=13 target=16 id=C2xC2xC2_c00028
[pilot] TARGET_REJECT d_ub=13 target=16 id=C2xC2xC2_c00029
[pilot] TARGET_REJECT d_ub=14 target=16 id=C2xC2xC2_c00030
[pilot] TARGET_REJECT d_ub=12 target=16 id=C2xC2xC2_c00032
[pilot] MEAS n=288 k=8 dx_ub=16 dz_ub=16 d_ub=16 steps=5000 id=C2xC2xC2_c00060
[pilot] MEAS n=288 k=4 dx_ub=19 dz_ub=20 d_ub=19 steps=5000 id=C2xC2xC2_c00074
[saved] id=C2xC2xC2_c00074 -> results/c2xc2xc2_d16_20260120_145243/promising/C2xC2xC2_c00074 (reason: d>=sqrt(n))
[pilot] MEAS n=288 k=4 dx_ub=17 dz_ub=18 d_ub=17 steps=5000 id=C2xC2xC2_c00079
[saved] id=C2xC2xC2_c00079 -> results/c2xc2xc2_d16_20260120_145243/promising/C2xC2xC2_c00079 (reason: d>=sqrt(n))
[pilot] MEAS n=288 k=8 dx_ub=16 dz_ub=16 d_ub=16 steps=5000 id=C2xC2xC2_c00102
[pilot] TARGET_REJECT d_ub=12 target=16 id=C2xC2xC2_c00116
[pilot] MEAS n=288 k=4 dx_ub=21 dz_ub=22 d_ub=21 steps=5000 id=C2xC2xC2_c00123
[saved] id=C2xC2xC2_c00123 -> results/c2xc2xc2_d16_20260120_145243/promising/C2xC2xC2_c00123 (reason: d>=sqrt(n))
[pilot] MEAS n=288 k=4 dx_ub=16 dz_ub=16 d_ub=16 steps=5000 id=C2xC2xC2_c00152
[pilot] MEAS n=288 k=4 dx_ub=17 dz_ub=17 d_ub=17 steps=5000 id=C2xC2xC2_c00160
[saved] id=C2xC2xC2_c00160 -> results/c2xc2xc2_d16_20260120_145243/promising/C2xC2xC2_c00160 (reason: d>=sqrt(n))
[pilot] TARGET_REJECT d_ub=14 target=16 id=C2xC2xC2_c00171
[pilot] MEAS n=288 k=4 dx_ub=16 dz_ub=16 d_ub=16 steps=5000 id=C2xC2xC2_c00187
[pilot] MEAS n=288 k=4 dx_ub=17 dz_ub=20 d_ub=17 steps=5000 id=C2xC2xC2_c00221
[saved] id=C2xC2xC2_c00221 -> results/c2xc2xc2_d16_20260120_145243/promising/C2xC2xC2_c00221 (reason: d>=sqrt(n))
[pilot] MEAS n=288 k=4 dx_ub=23 dz_ub=20 d_ub=20 steps=5000 id=C2xC2xC2_c00227
[saved] id=C2xC2xC2_c00227 -> results/c2xc2xc2_d16_20260120_145243/promising/C2xC2xC2_c00227 (reason: d>=sqrt(n))
[pilot] MEAS n=288 k=4 dx_ub=20 dz_ub=17 d_ub=17 steps=5000 id=C2xC2xC2_c00267
[saved] id=C2xC2xC2_c00267 -> results/c2xc2xc2_d16_20260120_145243/promising/C2xC2xC2_c00267 (reason: d>=sqrt(n))
[pilot] MEAS n=288 k=4 dx_ub=21 dz_ub=17 d_ub=17 steps=5000 id=C2xC2xC2_c00276
[saved] id=C2xC2xC2_c00276 -> results/c2xc2xc2_d16_20260120_145243/promising/C2xC2xC2_c00276 (reason: d>=sqrt(n))
[pilot] MEAS n=288 k=4 dx_ub=20 dz_ub=19 d_ub=19 steps=5000 id=C2xC2xC2_c00279
[saved] id=C2xC2xC2_c00279 -> results/c2xc2xc2_d16_20260120_145243/promising/C2xC2xC2_c00279 (reason: d>=sqrt(n))
[pilot] TARGET_REJECT d_ub=12 target=16 id=C2xC2xC2_c00282
[pilot] MEAS n=288 k=4 dx_ub=16 dz_ub=17 d_ub=16 steps=5000 id=C2xC2xC2_c00303
[pilot] TARGET_REJECT d_ub=12 target=16 id=C2xC2xC2_c00388
[pilot] MEAS n=288 k=4 dx_ub=20 dz_ub=19 d_ub=19 steps=5000 id=C2xC2xC2_c00390
[saved] id=C2xC2xC2_c00390 -> results/c2xc2xc2_d16_20260120_145243/promising/C2xC2xC2_c00390 (reason: d>=sqrt(n))
[pilot] TARGET_REJECT d_ub=6 target=16 id=C2xC2xC2_c00402
[best_by_k] group=C2xC2xC2 n=288
k  | d_ub | steps | dx_ub | dz_ub | id
 4 |   21 |  5000 |    21 |    22 | C2xC2xC2_c00123
 8 |   16 |  5000 |    16 |    17 | C2xC2xC2_c00009
[coverage] group=C2xC2xC2 A_sel=128 B_sel=128 Q_meas=27 ratio_ge_sqrt=0.000 ratio_sel=0.002
[coverage] run summary:
[coverage] group=C2xC2xC2 A_sel=128 B_sel=128 Q_meas=27 ratio_ge_sqrt=0.000 ratio_sel=0.002
[summary] best-by-k (measured; includes rejects):
  k=4 best_d_ub=21 count_measured=16 example_id=C2xC2xC2_c00123
  k=8 best_d_ub=16 count_measured=11 example_id=C2xC2xC2_c00009
[summary] best-by-k (survivors; target=16):
  k=4 best_d_ub=21 count_survivors=14 example_id=C2xC2xC2_c00123
  k=8 best_d_ub=16 count_survivors=4 example_id=C2xC2xC2_c00009
[pilot] top results:
  01 group=C2xC2xC2 n=288 k=4 d_ub=21 permA=27 permB=11 saved=True
  02 group=C2xC2xC2 n=288 k=4 d_ub=20 permA=27 permB=11 saved=True
  03 group=C2xC2xC2 n=288 k=4 d_ub=19 permA=27 permB=20 saved=True
  04 group=C2xC2xC2 n=288 k=4 d_ub=19 permA=27 permB=20 saved=True
  05 group=C2xC2xC2 n=288 k=4 d_ub=19 permA=12 permB=27 saved=True
  06 group=C2xC2xC2 n=288 k=4 d_ub=17 permA=8 permB=27 saved=True
  07 group=C2xC2xC2 n=288 k=4 d_ub=17 permA=7 permB=11 saved=True
  08 group=C2xC2xC2 n=288 k=4 d_ub=17 permA=27 permB=12 saved=True
  09 group=C2xC2xC2 n=288 k=4 d_ub=17 permA=11 permB=12 saved=True
  10 group=C2xC2xC2 n=288 k=4 d_ub=17 permA=27 permB=20 saved=True

