=== mar. 20 janv. 2026 19:44:03 CET steps=20000 batch=3 seed=1768937106 ===
[pilot] base k_table top pairs:
  k_base=18 permA=0 permB=0
  k_base=12 permA=29 permB=0
  k_base=12 permA=22 permB=0
  k_base=12 permA=13 permB=0
  k_base=12 permA=6 permB=0
[pilot] A multisets raw=792 (expected=792) enum_mode=multiset cayley_unique=26 perms=30 -> total scored = 780
[pilot] B multisets raw=792 (expected=792) enum_mode=multiset cayley_unique=26 perms=30 -> total scored = 780
[pilot] A frontier kept 128 candidates with points: (4,20), (0,49)
[pilot] B frontier kept 128 candidates with points: (4,20), (0,49)
[pilot] C2xC2xC2 n=288 d0=17 A_sets=26*30 -> keep 128; B_sets=26*30 -> keep 128
[pilot] TARGET_REJECT d_ub=14 target=16 id=C2xC2xC2_c00006
[pilot] MEAS n=288 k=4 dx_ub=17 dz_ub=20 d_ub=17 steps=20000 id=C2xC2xC2_c00022
[saved] id=C2xC2xC2_c00022 -> results/c2xc2xc2_d16_20260120_194403/promising/C2xC2xC2_c00022 (reason: d>=sqrt(n))
[pilot] MEAS n=288 k=4 dx_ub=17 dz_ub=16 d_ub=16 steps=20000 id=C2xC2xC2_c00037
[pilot] MEAS n=288 k=4 dx_ub=20 dz_ub=20 d_ub=20 steps=20000 id=C2xC2xC2_c00061
[saved] id=C2xC2xC2_c00061 -> results/c2xc2xc2_d16_20260120_194403/promising/C2xC2xC2_c00061 (reason: d>=sqrt(n))
[pilot] MEAS n=288 k=4 dx_ub=20 dz_ub=17 d_ub=17 steps=20000 id=C2xC2xC2_c00063
[saved] id=C2xC2xC2_c00063 -> results/c2xc2xc2_d16_20260120_194403/promising/C2xC2xC2_c00063 (reason: d>=sqrt(n))
[pilot] MEAS n=288 k=8 dx_ub=16 dz_ub=16 d_ub=16 steps=20000 id=C2xC2xC2_c00066
[pilot] MEAS n=288 k=4 dx_ub=19 dz_ub=16 d_ub=16 steps=20000 id=C2xC2xC2_c00084
[pilot] TARGET_REJECT d_ub=12 target=16 id=C2xC2xC2_c00124
[pilot] MEAS n=288 k=4 dx_ub=16 dz_ub=16 d_ub=16 steps=20000 id=C2xC2xC2_c00145
[pilot] MEAS n=288 k=4 dx_ub=19 dz_ub=16 d_ub=16 steps=20000 id=C2xC2xC2_c00204
[pilot] MEAS n=288 k=4 dx_ub=20 dz_ub=20 d_ub=20 steps=20000 id=C2xC2xC2_c00218
[saved] id=C2xC2xC2_c00218 -> results/c2xc2xc2_d16_20260120_194403/promising/C2xC2xC2_c00218 (reason: d>=sqrt(n))
[pilot] MEAS n=288 k=4 dx_ub=20 dz_ub=16 d_ub=16 steps=20000 id=C2xC2xC2_c00262
[pilot] MEAS n=288 k=4 dx_ub=20 dz_ub=19 d_ub=19 steps=20000 id=C2xC2xC2_c00307
[saved] id=C2xC2xC2_c00307 -> results/c2xc2xc2_d16_20260120_194403/promising/C2xC2xC2_c00307 (reason: d>=sqrt(n))
[pilot] MEAS n=288 k=4 dx_ub=20 dz_ub=20 d_ub=20 steps=20000 id=C2xC2xC2_c00328
[saved] id=C2xC2xC2_c00328 -> results/c2xc2xc2_d16_20260120_194403/promising/C2xC2xC2_c00328 (reason: d>=sqrt(n))
[pilot] TARGET_REJECT d_ub=13 target=16 id=C2xC2xC2_c00340
[pilot] MEAS n=288 k=4 dx_ub=20 dz_ub=20 d_ub=20 steps=20000 id=C2xC2xC2_c00344
[saved] id=C2xC2xC2_c00344 -> results/c2xc2xc2_d16_20260120_194403/promising/C2xC2xC2_c00344 (reason: d>=sqrt(n))
[pilot] MEAS n=288 k=8 dx_ub=16 dz_ub=16 d_ub=16 steps=20000 id=C2xC2xC2_c00351
[pilot] MEAS n=288 k=4 dx_ub=16 dz_ub=16 d_ub=16 steps=20000 id=C2xC2xC2_c00368
[pilot] MEAS n=288 k=4 dx_ub=16 dz_ub=20 d_ub=16 steps=20000 id=C2xC2xC2_c00374
[pilot] MEAS n=288 k=4 dx_ub=16 dz_ub=16 d_ub=16 steps=20000 id=C2xC2xC2_c00443
[pilot] MEAS n=288 k=4 dx_ub=16 dz_ub=17 d_ub=16 steps=20000 id=C2xC2xC2_c00453
[pilot] MEAS n=288 k=4 dx_ub=17 dz_ub=20 d_ub=17 steps=20000 id=C2xC2xC2_c00456
[saved] id=C2xC2xC2_c00456 -> results/c2xc2xc2_d16_20260120_194403/promising/C2xC2xC2_c00456 (reason: d>=sqrt(n))
[pilot] MEAS n=288 k=4 dx_ub=18 dz_ub=16 d_ub=16 steps=20000 id=C2xC2xC2_c00476
[pilot] MEAS n=288 k=8 dx_ub=16 dz_ub=17 d_ub=16 steps=20000 id=C2xC2xC2_c00478
[pilot] MEAS n=288 k=4 dx_ub=20 dz_ub=20 d_ub=20 steps=20000 id=C2xC2xC2_c00489
[saved] id=C2xC2xC2_c00489 -> results/c2xc2xc2_d16_20260120_194403/promising/C2xC2xC2_c00489 (reason: d>=sqrt(n))
[pilot] MEAS n=288 k=8 dx_ub=16 dz_ub=17 d_ub=16 steps=20000 id=C2xC2xC2_c00494
[best_by_k] group=C2xC2xC2 n=288
k  | d_ub | steps | dx_ub | dz_ub | id
 4 |   20 | 20000 |    20 |    20 | C2xC2xC2_c00061
 8 |   16 | 20000 |    16 |    16 | C2xC2xC2_c00066
[coverage] group=C2xC2xC2 A_sel=128 B_sel=128 Q_meas=26 ratio_ge_sqrt=0.000 ratio_sel=0.002
[coverage] run summary:
[coverage] group=C2xC2xC2 A_sel=128 B_sel=128 Q_meas=26 ratio_ge_sqrt=0.000 ratio_sel=0.002
[summary] best-by-k (measured; includes rejects):
  k=4 best_d_ub=20 count_measured=19 example_id=C2xC2xC2_c00061
  k=8 best_d_ub=16 count_measured=7 example_id=C2xC2xC2_c00066
[summary] best-by-k (survivors; target=16):
  k=4 best_d_ub=20 count_survivors=19 example_id=C2xC2xC2_c00061
  k=8 best_d_ub=16 count_survivors=4 example_id=C2xC2xC2_c00066
[pilot] top results:
  01 group=C2xC2xC2 n=288 k=4 d_ub=20 permA=27 permB=11 saved=True
  02 group=C2xC2xC2 n=288 k=4 d_ub=20 permA=20 permB=7 saved=True
  03 group=C2xC2xC2 n=288 k=4 d_ub=20 permA=12 permB=12 saved=True
  04 group=C2xC2xC2 n=288 k=4 d_ub=20 permA=20 permB=11 saved=True
  05 group=C2xC2xC2 n=288 k=4 d_ub=20 permA=20 permB=11 saved=True
  06 group=C2xC2xC2 n=288 k=4 d_ub=19 permA=8 permB=11 saved=True
  07 group=C2xC2xC2 n=288 k=4 d_ub=17 permA=7 permB=11 saved=True
  08 group=C2xC2xC2 n=288 k=4 d_ub=17 permA=20 permB=7 saved=True
  09 group=C2xC2xC2 n=288 k=4 d_ub=17 permA=11 permB=12 saved=True
  10 group=C2xC2xC2 n=288 k=8 d_ub=16 permA=12 permB=20 saved=False

