=== mar. 20 janv. 2026 14:57:30 CET steps=5000 batch=11 seed=1768922114 ===
[pilot] base k_table top pairs:
  k_base=18 permA=0 permB=0
  k_base=12 permA=29 permB=0
  k_base=12 permA=22 permB=0
  k_base=12 permA=13 permB=0
  k_base=12 permA=6 permB=0
[pilot] A multisets raw=792 (expected=792) enum_mode=multiset cayley_unique=26 perms=30 -> total scored = 780
[pilot] B multisets raw=792 (expected=792) enum_mode=multiset cayley_unique=26 perms=30 -> total scored = 780
[pilot] A frontier kept 128 candidates with points: (4,20), (0,49)
[pilot] B frontier kept 128 candidates with points: (4,20), (0,49)
[pilot] C2xC2xC2 n=288 d0=17 A_sets=26*30 -> keep 128; B_sets=26*30 -> keep 128
[pilot] MEAS n=288 k=4 dx_ub=16 dz_ub=20 d_ub=16 steps=5000 id=C2xC2xC2_c00010
[pilot] TARGET_REJECT d_ub=13 target=16 id=C2xC2xC2_c00023
[pilot] MEAS n=288 k=4 dx_ub=16 dz_ub=17 d_ub=16 steps=5000 id=C2xC2xC2_c00040
[pilot] MEAS n=288 k=4 dx_ub=20 dz_ub=16 d_ub=16 steps=5000 id=C2xC2xC2_c00042
[pilot] MEAS n=288 k=4 dx_ub=16 dz_ub=16 d_ub=16 steps=5000 id=C2xC2xC2_c00045
[pilot] TARGET_REJECT d_ub=12 target=16 id=C2xC2xC2_c00075
[pilot] MEAS n=288 k=4 dx_ub=19 dz_ub=19 d_ub=19 steps=5000 id=C2xC2xC2_c00076
[saved] id=C2xC2xC2_c00076 -> results/c2xc2xc2_d16_20260120_145730/promising/C2xC2xC2_c00076 (reason: d>=sqrt(n))
[pilot] TARGET_REJECT d_ub=12 target=16 id=C2xC2xC2_c00077
[pilot] MEAS n=288 k=4 dx_ub=17 dz_ub=19 d_ub=17 steps=5000 id=C2xC2xC2_c00082
[saved] id=C2xC2xC2_c00082 -> results/c2xc2xc2_d16_20260120_145730/promising/C2xC2xC2_c00082 (reason: d>=sqrt(n))
[pilot] MEAS n=288 k=4 dx_ub=20 dz_ub=17 d_ub=17 steps=5000 id=C2xC2xC2_c00085
[saved] id=C2xC2xC2_c00085 -> results/c2xc2xc2_d16_20260120_145730/promising/C2xC2xC2_c00085 (reason: d>=sqrt(n))
[pilot] TARGET_REJECT d_ub=6 target=16 id=C2xC2xC2_c00106
[pilot] MEAS n=288 k=4 dx_ub=20 dz_ub=16 d_ub=16 steps=5000 id=C2xC2xC2_c00108
[pilot] MEAS n=288 k=4 dx_ub=20 dz_ub=18 d_ub=18 steps=5000 id=C2xC2xC2_c00122
[saved] id=C2xC2xC2_c00122 -> results/c2xc2xc2_d16_20260120_145730/promising/C2xC2xC2_c00122 (reason: d>=sqrt(n))
[pilot] TARGET_REJECT d_ub=14 target=16 id=C2xC2xC2_c00169
[pilot] MEAS n=288 k=8 dx_ub=17 dz_ub=16 d_ub=16 steps=5000 id=C2xC2xC2_c00180
[pilot] MEAS n=288 k=4 dx_ub=18 dz_ub=20 d_ub=18 steps=5000 id=C2xC2xC2_c00187
[saved] id=C2xC2xC2_c00187 -> results/c2xc2xc2_d16_20260120_145730/promising/C2xC2xC2_c00187 (reason: d>=sqrt(n))
[pilot] MEAS n=288 k=4 dx_ub=20 dz_ub=20 d_ub=20 steps=5000 id=C2xC2xC2_c00189
[saved] id=C2xC2xC2_c00189 -> results/c2xc2xc2_d16_20260120_145730/promising/C2xC2xC2_c00189 (reason: d>=sqrt(n))
[pilot] TARGET_REJECT d_ub=14 target=16 id=C2xC2xC2_c00203
[pilot] TARGET_REJECT d_ub=12 target=16 id=C2xC2xC2_c00250
[pilot] MEAS n=288 k=4 dx_ub=20 dz_ub=20 d_ub=20 steps=5000 id=C2xC2xC2_c00275
[saved] id=C2xC2xC2_c00275 -> results/c2xc2xc2_d16_20260120_145730/promising/C2xC2xC2_c00275 (reason: d>=sqrt(n))
[pilot] TARGET_REJECT d_ub=15 target=16 id=C2xC2xC2_c00291
[pilot] TARGET_REJECT d_ub=12 target=16 id=C2xC2xC2_c00295
[pilot] TARGET_REJECT d_ub=14 target=16 id=C2xC2xC2_c00315
[pilot] MEAS n=288 k=4 dx_ub=20 dz_ub=20 d_ub=20 steps=5000 id=C2xC2xC2_c00339
[saved] id=C2xC2xC2_c00339 -> results/c2xc2xc2_d16_20260120_145730/promising/C2xC2xC2_c00339 (reason: d>=sqrt(n))
[pilot] MEAS n=288 k=4 dx_ub=20 dz_ub=20 d_ub=20 steps=5000 id=C2xC2xC2_c00358
[saved] id=C2xC2xC2_c00358 -> results/c2xc2xc2_d16_20260120_145730/promising/C2xC2xC2_c00358 (reason: d>=sqrt(n))
[pilot] MEAS n=288 k=4 dx_ub=20 dz_ub=20 d_ub=20 steps=5000 id=C2xC2xC2_c00377
[saved] id=C2xC2xC2_c00377 -> results/c2xc2xc2_d16_20260120_145730/promising/C2xC2xC2_c00377 (reason: d>=sqrt(n))
[pilot] MEAS n=288 k=4 dx_ub=17 dz_ub=22 d_ub=17 steps=5000 id=C2xC2xC2_c00387
[saved] id=C2xC2xC2_c00387 -> results/c2xc2xc2_d16_20260120_145730/promising/C2xC2xC2_c00387 (reason: d>=sqrt(n))
[pilot] MEAS n=288 k=4 dx_ub=16 dz_ub=16 d_ub=16 steps=5000 id=C2xC2xC2_c00446
[pilot] TARGET_REJECT d_ub=15 target=16 id=C2xC2xC2_c00498
[best_by_k] group=C2xC2xC2 n=288
k  | d_ub | steps | dx_ub | dz_ub | id
 4 |   20 |  5000 |    20 |    20 | C2xC2xC2_c00189
 8 |   16 |  5000 |    17 |    16 | C2xC2xC2_c00180
[coverage] group=C2xC2xC2 A_sel=128 B_sel=128 Q_meas=29 ratio_ge_sqrt=0.001 ratio_sel=0.002
[coverage] run summary:
[coverage] group=C2xC2xC2 A_sel=128 B_sel=128 Q_meas=29 ratio_ge_sqrt=0.001 ratio_sel=0.002
[summary] best-by-k (measured; includes rejects):
  k=4 best_d_ub=20 count_measured=20 example_id=C2xC2xC2_c00189
  k=8 best_d_ub=16 count_measured=9 example_id=C2xC2xC2_c00180
[summary] best-by-k (survivors; target=16):
  k=4 best_d_ub=20 count_survivors=17 example_id=C2xC2xC2_c00189
  k=8 best_d_ub=16 count_survivors=1 example_id=C2xC2xC2_c00180
[pilot] top results:
  01 group=C2xC2xC2 n=288 k=4 d_ub=20 permA=8 permB=11 saved=True
  02 group=C2xC2xC2 n=288 k=4 d_ub=20 permA=27 permB=11 saved=True
  03 group=C2xC2xC2 n=288 k=4 d_ub=20 permA=11 permB=8 saved=True
  04 group=C2xC2xC2 n=288 k=4 d_ub=20 permA=27 permB=12 saved=True
  05 group=C2xC2xC2 n=288 k=4 d_ub=20 permA=11 permB=8 saved=True
  06 group=C2xC2xC2 n=288 k=4 d_ub=19 permA=27 permB=8 saved=True
  07 group=C2xC2xC2 n=288 k=4 d_ub=18 permA=11 permB=8 saved=True
  08 group=C2xC2xC2 n=288 k=4 d_ub=18 permA=7 permB=27 saved=True
  09 group=C2xC2xC2 n=288 k=4 d_ub=17 permA=27 permB=8 saved=True
  10 group=C2xC2xC2 n=288 k=4 d_ub=17 permA=11 permB=8 saved=True

