=== mer. 21 janv. 2026 00:59:04 CET steps=20000 batch=19 seed=1768937122 ===
[pilot] base k_table top pairs:
  k_base=18 permA=0 permB=0
  k_base=12 permA=29 permB=0
  k_base=12 permA=22 permB=0
  k_base=12 permA=13 permB=0
  k_base=12 permA=6 permB=0
[pilot] A multisets raw=792 (expected=792) enum_mode=multiset cayley_unique=26 perms=30 -> total scored = 780
[pilot] B multisets raw=792 (expected=792) enum_mode=multiset cayley_unique=26 perms=30 -> total scored = 780
[pilot] A frontier kept 128 candidates with points: (4,20), (0,49)
[pilot] B frontier kept 128 candidates with points: (4,20), (0,49)
[pilot] C2xC2xC2 n=288 d0=17 A_sets=26*30 -> keep 128; B_sets=26*30 -> keep 128
[pilot] MEAS n=288 k=4 dx_ub=19 dz_ub=19 d_ub=19 steps=20000 id=C2xC2xC2_c00007
[saved] id=C2xC2xC2_c00007 -> results/c2xc2xc2_d16_20260121_005904/promising/C2xC2xC2_c00007 (reason: d>=sqrt(n))
[pilot] MEAS n=288 k=8 dx_ub=17 dz_ub=16 d_ub=16 steps=20000 id=C2xC2xC2_c00018
[pilot] TARGET_REJECT d_ub=12 target=16 id=C2xC2xC2_c00029
[pilot] MEAS n=288 k=4 dx_ub=20 dz_ub=18 d_ub=18 steps=20000 id=C2xC2xC2_c00031
[saved] id=C2xC2xC2_c00031 -> results/c2xc2xc2_d16_20260121_005904/promising/C2xC2xC2_c00031 (reason: d>=sqrt(n))
[pilot] MEAS n=288 k=4 dx_ub=17 dz_ub=20 d_ub=17 steps=20000 id=C2xC2xC2_c00048
[saved] id=C2xC2xC2_c00048 -> results/c2xc2xc2_d16_20260121_005904/promising/C2xC2xC2_c00048 (reason: d>=sqrt(n))
[pilot] MEAS n=288 k=8 dx_ub=18 dz_ub=16 d_ub=16 steps=20000 id=C2xC2xC2_c00067
[pilot] MEAS n=288 k=4 dx_ub=16 dz_ub=20 d_ub=16 steps=20000 id=C2xC2xC2_c00099
[pilot] TARGET_REJECT d_ub=15 target=16 id=C2xC2xC2_c00120
[pilot] MEAS n=288 k=4 dx_ub=20 dz_ub=16 d_ub=16 steps=20000 id=C2xC2xC2_c00135
[pilot] MEAS n=288 k=4 dx_ub=20 dz_ub=18 d_ub=18 steps=20000 id=C2xC2xC2_c00142
[saved] id=C2xC2xC2_c00142 -> results/c2xc2xc2_d16_20260121_005904/promising/C2xC2xC2_c00142 (reason: d>=sqrt(n))
[pilot] TARGET_REJECT d_ub=14 target=16 id=C2xC2xC2_c00144
[pilot] MEAS n=288 k=4 dx_ub=20 dz_ub=19 d_ub=19 steps=20000 id=C2xC2xC2_c00185
[saved] id=C2xC2xC2_c00185 -> results/c2xc2xc2_d16_20260121_005904/promising/C2xC2xC2_c00185 (reason: d>=sqrt(n))
[pilot] MEAS n=288 k=4 dx_ub=17 dz_ub=20 d_ub=17 steps=20000 id=C2xC2xC2_c00216
[saved] id=C2xC2xC2_c00216 -> results/c2xc2xc2_d16_20260121_005904/promising/C2xC2xC2_c00216 (reason: d>=sqrt(n))
[pilot] MEAS n=288 k=4 dx_ub=20 dz_ub=20 d_ub=20 steps=20000 id=C2xC2xC2_c00224
[saved] id=C2xC2xC2_c00224 -> results/c2xc2xc2_d16_20260121_005904/promising/C2xC2xC2_c00224 (reason: d>=sqrt(n))
[pilot] MEAS n=288 k=4 dx_ub=20 dz_ub=20 d_ub=20 steps=20000 id=C2xC2xC2_c00230
[saved] id=C2xC2xC2_c00230 -> results/c2xc2xc2_d16_20260121_005904/promising/C2xC2xC2_c00230 (reason: d>=sqrt(n))
[pilot] MEAS n=288 k=4 dx_ub=19 dz_ub=20 d_ub=19 steps=20000 id=C2xC2xC2_c00249
[saved] id=C2xC2xC2_c00249 -> results/c2xc2xc2_d16_20260121_005904/promising/C2xC2xC2_c00249 (reason: d>=sqrt(n))
[pilot] TARGET_REJECT d_ub=15 target=16 id=C2xC2xC2_c00257
[pilot] MEAS n=288 k=4 dx_ub=19 dz_ub=17 d_ub=17 steps=20000 id=C2xC2xC2_c00262
[saved] id=C2xC2xC2_c00262 -> results/c2xc2xc2_d16_20260121_005904/promising/C2xC2xC2_c00262 (reason: d>=sqrt(n))
[pilot] MEAS n=288 k=4 dx_ub=17 dz_ub=16 d_ub=16 steps=20000 id=C2xC2xC2_c00265
[pilot] MEAS n=288 k=4 dx_ub=16 dz_ub=16 d_ub=16 steps=20000 id=C2xC2xC2_c00266
[pilot] MEAS n=288 k=4 dx_ub=20 dz_ub=19 d_ub=19 steps=20000 id=C2xC2xC2_c00277
[saved] id=C2xC2xC2_c00277 -> results/c2xc2xc2_d16_20260121_005904/promising/C2xC2xC2_c00277 (reason: d>=sqrt(n))
[pilot] MEAS n=288 k=4 dx_ub=20 dz_ub=20 d_ub=20 steps=20000 id=C2xC2xC2_c00340
[saved] id=C2xC2xC2_c00340 -> results/c2xc2xc2_d16_20260121_005904/promising/C2xC2xC2_c00340 (reason: d>=sqrt(n))
[pilot] MEAS n=288 k=4 dx_ub=19 dz_ub=16 d_ub=16 steps=20000 id=C2xC2xC2_c00354
[pilot] TARGET_REJECT d_ub=12 target=16 id=C2xC2xC2_c00398
[pilot] MEAS n=288 k=4 dx_ub=20 dz_ub=19 d_ub=19 steps=20000 id=C2xC2xC2_c00408
[saved] id=C2xC2xC2_c00408 -> results/c2xc2xc2_d16_20260121_005904/promising/C2xC2xC2_c00408 (reason: d>=sqrt(n))
[pilot] TARGET_REJECT d_ub=12 target=16 id=C2xC2xC2_c00432
[pilot] MEAS n=288 k=8 dx_ub=17 dz_ub=16 d_ub=16 steps=20000 id=C2xC2xC2_c00434
[pilot] TARGET_REJECT d_ub=14 target=16 id=C2xC2xC2_c00447
[pilot] TARGET_REJECT d_ub=12 target=16 id=C2xC2xC2_c00492
[best_by_k] group=C2xC2xC2 n=288
k  | d_ub | steps | dx_ub | dz_ub | id
 4 |   20 | 20000 |    20 |    20 | C2xC2xC2_c00224
 8 |   16 | 20000 |    17 |    16 | C2xC2xC2_c00018
[coverage] group=C2xC2xC2 A_sel=128 B_sel=128 Q_meas=29 ratio_ge_sqrt=0.001 ratio_sel=0.002
[coverage] run summary:
[coverage] group=C2xC2xC2 A_sel=128 B_sel=128 Q_meas=29 ratio_ge_sqrt=0.001 ratio_sel=0.002
[summary] best-by-k (measured; includes rejects):
  k=4 best_d_ub=20 count_measured=20 example_id=C2xC2xC2_c00224
  k=8 best_d_ub=16 count_measured=9 example_id=C2xC2xC2_c00018
[summary] best-by-k (survivors; target=16):
  k=4 best_d_ub=20 count_survivors=18 example_id=C2xC2xC2_c00224
  k=8 best_d_ub=16 count_survivors=3 example_id=C2xC2xC2_c00018
[pilot] top results:
  01 group=C2xC2xC2 n=288 k=4 d_ub=20 permA=12 permB=7 saved=True
  02 group=C2xC2xC2 n=288 k=4 d_ub=20 permA=27 permB=12 saved=True
  03 group=C2xC2xC2 n=288 k=4 d_ub=20 permA=20 permB=7 saved=True
  04 group=C2xC2xC2 n=288 k=4 d_ub=19 permA=12 permB=11 saved=True
  05 group=C2xC2xC2 n=288 k=4 d_ub=19 permA=11 permB=27 saved=True
  06 group=C2xC2xC2 n=288 k=4 d_ub=19 permA=27 permB=27 saved=True
  07 group=C2xC2xC2 n=288 k=4 d_ub=19 permA=8 permB=20 saved=True
  08 group=C2xC2xC2 n=288 k=4 d_ub=19 permA=27 permB=27 saved=True
  09 group=C2xC2xC2 n=288 k=4 d_ub=18 permA=27 permB=12 saved=True
  10 group=C2xC2xC2 n=288 k=4 d_ub=18 permA=11 permB=27 saved=True

