=== mar. 20 janv. 2026 18:33:07 CET steps=5000 batch=104 seed=1768922207 ===
[pilot] base k_table top pairs:
  k_base=18 permA=0 permB=0
  k_base=12 permA=29 permB=0
  k_base=12 permA=22 permB=0
  k_base=12 permA=13 permB=0
  k_base=12 permA=6 permB=0
[pilot] A multisets raw=792 (expected=792) enum_mode=multiset cayley_unique=26 perms=30 -> total scored = 780
[pilot] B multisets raw=792 (expected=792) enum_mode=multiset cayley_unique=26 perms=30 -> total scored = 780
[pilot] A frontier kept 128 candidates with points: (4,20), (0,49)
[pilot] B frontier kept 128 candidates with points: (4,20), (0,49)
[pilot] C2xC2xC2 n=288 d0=17 A_sets=26*30 -> keep 128; B_sets=26*30 -> keep 128
[pilot] MEAS n=288 k=4 dx_ub=20 dz_ub=22 d_ub=20 steps=5000 id=C2xC2xC2_c00009
[saved] id=C2xC2xC2_c00009 -> results/c2xc2xc2_d16_20260120_183307/promising/C2xC2xC2_c00009 (reason: d>=sqrt(n))
[pilot] MEAS n=288 k=4 dx_ub=20 dz_ub=19 d_ub=19 steps=5000 id=C2xC2xC2_c00010
[saved] id=C2xC2xC2_c00010 -> results/c2xc2xc2_d16_20260120_183307/promising/C2xC2xC2_c00010 (reason: d>=sqrt(n))
[pilot] MEAS n=288 k=4 dx_ub=20 dz_ub=17 d_ub=17 steps=5000 id=C2xC2xC2_c00025
[saved] id=C2xC2xC2_c00025 -> results/c2xc2xc2_d16_20260120_183307/promising/C2xC2xC2_c00025 (reason: d>=sqrt(n))
[pilot] TARGET_REJECT d_ub=15 target=16 id=C2xC2xC2_c00035
[pilot] MEAS n=288 k=8 dx_ub=16 dz_ub=17 d_ub=16 steps=5000 id=C2xC2xC2_c00047
[pilot] MEAS n=288 k=4 dx_ub=20 dz_ub=20 d_ub=20 steps=5000 id=C2xC2xC2_c00079
[saved] id=C2xC2xC2_c00079 -> results/c2xc2xc2_d16_20260120_183307/promising/C2xC2xC2_c00079 (reason: d>=sqrt(n))
[pilot] MEAS n=288 k=4 dx_ub=20 dz_ub=19 d_ub=19 steps=5000 id=C2xC2xC2_c00098
[saved] id=C2xC2xC2_c00098 -> results/c2xc2xc2_d16_20260120_183307/promising/C2xC2xC2_c00098 (reason: d>=sqrt(n))
[pilot] MEAS n=288 k=4 dx_ub=18 dz_ub=18 d_ub=18 steps=5000 id=C2xC2xC2_c00126
[saved] id=C2xC2xC2_c00126 -> results/c2xc2xc2_d16_20260120_183307/promising/C2xC2xC2_c00126 (reason: d>=sqrt(n))
[pilot] MEAS n=288 k=4 dx_ub=16 dz_ub=20 d_ub=16 steps=5000 id=C2xC2xC2_c00160
[pilot] MEAS n=288 k=4 dx_ub=20 dz_ub=16 d_ub=16 steps=5000 id=C2xC2xC2_c00163
[pilot] MEAS n=288 k=4 dx_ub=16 dz_ub=16 d_ub=16 steps=5000 id=C2xC2xC2_c00189
[pilot] TARGET_REJECT d_ub=15 target=16 id=C2xC2xC2_c00198
[pilot] MEAS n=288 k=8 dx_ub=18 dz_ub=16 d_ub=16 steps=5000 id=C2xC2xC2_c00200
[pilot] TARGET_REJECT d_ub=11 target=16 id=C2xC2xC2_c00248
[pilot] TARGET_REJECT d_ub=14 target=16 id=C2xC2xC2_c00265
[pilot] TARGET_REJECT d_ub=12 target=16 id=C2xC2xC2_c00274
[pilot] TARGET_REJECT d_ub=12 target=16 id=C2xC2xC2_c00284
[pilot] MEAS n=288 k=4 dx_ub=16 dz_ub=17 d_ub=16 steps=5000 id=C2xC2xC2_c00292
[pilot] TARGET_REJECT d_ub=15 target=16 id=C2xC2xC2_c00329
[pilot] MEAS n=288 k=4 dx_ub=19 dz_ub=17 d_ub=17 steps=5000 id=C2xC2xC2_c00362
[saved] id=C2xC2xC2_c00362 -> results/c2xc2xc2_d16_20260120_183307/promising/C2xC2xC2_c00362 (reason: d>=sqrt(n))
[pilot] MEAS n=288 k=4 dx_ub=16 dz_ub=16 d_ub=16 steps=5000 id=C2xC2xC2_c00381
[pilot] MEAS n=288 k=4 dx_ub=20 dz_ub=20 d_ub=20 steps=5000 id=C2xC2xC2_c00412
[saved] id=C2xC2xC2_c00412 -> results/c2xc2xc2_d16_20260120_183307/promising/C2xC2xC2_c00412 (reason: d>=sqrt(n))
[pilot] TARGET_REJECT d_ub=12 target=16 id=C2xC2xC2_c00428
[pilot] MEAS n=288 k=4 dx_ub=20 dz_ub=18 d_ub=18 steps=5000 id=C2xC2xC2_c00442
[saved] id=C2xC2xC2_c00442 -> results/c2xc2xc2_d16_20260120_183307/promising/C2xC2xC2_c00442 (reason: d>=sqrt(n))
[pilot] TARGET_REJECT d_ub=14 target=16 id=C2xC2xC2_c00458
[pilot] MEAS n=288 k=4 dx_ub=18 dz_ub=16 d_ub=16 steps=5000 id=C2xC2xC2_c00482
[pilot] MEAS n=288 k=4 dx_ub=16 dz_ub=20 d_ub=16 steps=5000 id=C2xC2xC2_c00484
[pilot] TARGET_REJECT d_ub=13 target=16 id=C2xC2xC2_c00487
[pilot] MEAS n=288 k=4 dx_ub=16 dz_ub=16 d_ub=16 steps=5000 id=C2xC2xC2_c00490
[pilot] MEAS n=288 k=4 dx_ub=19 dz_ub=16 d_ub=16 steps=5000 id=C2xC2xC2_c00492
[best_by_k] group=C2xC2xC2 n=288
k  | d_ub | steps | dx_ub | dz_ub | id
 4 |   20 |  5000 |    20 |    22 | C2xC2xC2_c00009
 8 |   16 |  5000 |    16 |    17 | C2xC2xC2_c00047
[coverage] group=C2xC2xC2 A_sel=128 B_sel=128 Q_meas=30 ratio_ge_sqrt=0.001 ratio_sel=0.002
[coverage] run summary:
[coverage] group=C2xC2xC2 A_sel=128 B_sel=128 Q_meas=30 ratio_ge_sqrt=0.001 ratio_sel=0.002
[summary] best-by-k (measured; includes rejects):
  k=4 best_d_ub=20 count_measured=19 example_id=C2xC2xC2_c00009
  k=8 best_d_ub=16 count_measured=11 example_id=C2xC2xC2_c00047
[summary] best-by-k (survivors; target=16):
  k=4 best_d_ub=20 count_survivors=18 example_id=C2xC2xC2_c00009
  k=8 best_d_ub=16 count_survivors=2 example_id=C2xC2xC2_c00047
[pilot] top results:
  01 group=C2xC2xC2 n=288 k=4 d_ub=20 permA=8 permB=27 saved=True
  02 group=C2xC2xC2 n=288 k=4 d_ub=20 permA=8 permB=12 saved=True
  03 group=C2xC2xC2 n=288 k=4 d_ub=20 permA=27 permB=27 saved=True
  04 group=C2xC2xC2 n=288 k=4 d_ub=19 permA=11 permB=20 saved=True
  05 group=C2xC2xC2 n=288 k=4 d_ub=19 permA=11 permB=27 saved=True
  06 group=C2xC2xC2 n=288 k=4 d_ub=18 permA=20 permB=27 saved=True
  07 group=C2xC2xC2 n=288 k=4 d_ub=18 permA=11 permB=20 saved=True
  08 group=C2xC2xC2 n=288 k=4 d_ub=17 permA=8 permB=7 saved=True
  09 group=C2xC2xC2 n=288 k=4 d_ub=17 permA=20 permB=12 saved=True
  10 group=C2xC2xC2 n=288 k=8 d_ub=16 permA=12 permB=11 saved=False

