=== mar. 20 janv. 2026 15:05:30 CET steps=5000 batch=27 seed=1768922130 ===
[pilot] base k_table top pairs:
  k_base=18 permA=0 permB=0
  k_base=12 permA=29 permB=0
  k_base=12 permA=22 permB=0
  k_base=12 permA=13 permB=0
  k_base=12 permA=6 permB=0
[pilot] A multisets raw=792 (expected=792) enum_mode=multiset cayley_unique=26 perms=30 -> total scored = 780
[pilot] B multisets raw=792 (expected=792) enum_mode=multiset cayley_unique=26 perms=30 -> total scored = 780
[pilot] A frontier kept 128 candidates with points: (4,20), (0,49)
[pilot] B frontier kept 128 candidates with points: (4,20), (0,49)
[pilot] C2xC2xC2 n=288 d0=17 A_sets=26*30 -> keep 128; B_sets=26*30 -> keep 128
[pilot] MEAS n=288 k=8 dx_ub=16 dz_ub=17 d_ub=16 steps=5000 id=C2xC2xC2_c00001
[pilot] MEAS n=288 k=4 dx_ub=19 dz_ub=19 d_ub=19 steps=5000 id=C2xC2xC2_c00037
[saved] id=C2xC2xC2_c00037 -> results/c2xc2xc2_d16_20260120_150530/promising/C2xC2xC2_c00037 (reason: d>=sqrt(n))
[pilot] MEAS n=288 k=4 dx_ub=20 dz_ub=19 d_ub=19 steps=5000 id=C2xC2xC2_c00039
[saved] id=C2xC2xC2_c00039 -> results/c2xc2xc2_d16_20260120_150530/promising/C2xC2xC2_c00039 (reason: d>=sqrt(n))
[pilot] MEAS n=288 k=4 dx_ub=16 dz_ub=20 d_ub=16 steps=5000 id=C2xC2xC2_c00117
[pilot] MEAS n=288 k=4 dx_ub=16 dz_ub=20 d_ub=16 steps=5000 id=C2xC2xC2_c00123
[pilot] TARGET_REJECT d_ub=12 target=16 id=C2xC2xC2_c00129
[pilot] MEAS n=288 k=4 dx_ub=20 dz_ub=16 d_ub=16 steps=5000 id=C2xC2xC2_c00144
[pilot] MEAS n=288 k=4 dx_ub=20 dz_ub=17 d_ub=17 steps=5000 id=C2xC2xC2_c00199
[saved] id=C2xC2xC2_c00199 -> results/c2xc2xc2_d16_20260120_150530/promising/C2xC2xC2_c00199 (reason: d>=sqrt(n))
[pilot] MEAS n=288 k=4 dx_ub=20 dz_ub=20 d_ub=20 steps=5000 id=C2xC2xC2_c00203
[saved] id=C2xC2xC2_c00203 -> results/c2xc2xc2_d16_20260120_150530/promising/C2xC2xC2_c00203 (reason: d>=sqrt(n))
[pilot] MEAS n=288 k=8 dx_ub=18 dz_ub=16 d_ub=16 steps=5000 id=C2xC2xC2_c00212
[pilot] MEAS n=288 k=4 dx_ub=20 dz_ub=20 d_ub=20 steps=5000 id=C2xC2xC2_c00213
[saved] id=C2xC2xC2_c00213 -> results/c2xc2xc2_d16_20260120_150530/promising/C2xC2xC2_c00213 (reason: d>=sqrt(n))
[pilot] MEAS n=288 k=4 dx_ub=19 dz_ub=20 d_ub=19 steps=5000 id=C2xC2xC2_c00226
[saved] id=C2xC2xC2_c00226 -> results/c2xc2xc2_d16_20260120_150530/promising/C2xC2xC2_c00226 (reason: d>=sqrt(n))
[pilot] MEAS n=288 k=4 dx_ub=20 dz_ub=20 d_ub=20 steps=5000 id=C2xC2xC2_c00239
[saved] id=C2xC2xC2_c00239 -> results/c2xc2xc2_d16_20260120_150530/promising/C2xC2xC2_c00239 (reason: d>=sqrt(n))
[pilot] MEAS n=288 k=4 dx_ub=20 dz_ub=20 d_ub=20 steps=5000 id=C2xC2xC2_c00258
[saved] id=C2xC2xC2_c00258 -> results/c2xc2xc2_d16_20260120_150530/promising/C2xC2xC2_c00258 (reason: d>=sqrt(n))
[pilot] MEAS n=288 k=4 dx_ub=20 dz_ub=20 d_ub=20 steps=5000 id=C2xC2xC2_c00284
[saved] id=C2xC2xC2_c00284 -> results/c2xc2xc2_d16_20260120_150530/promising/C2xC2xC2_c00284 (reason: d>=sqrt(n))
[pilot] MEAS n=288 k=4 dx_ub=20 dz_ub=20 d_ub=20 steps=5000 id=C2xC2xC2_c00301
[saved] id=C2xC2xC2_c00301 -> results/c2xc2xc2_d16_20260120_150530/promising/C2xC2xC2_c00301 (reason: d>=sqrt(n))
[pilot] TARGET_REJECT d_ub=15 target=16 id=C2xC2xC2_c00304
[pilot] MEAS n=288 k=4 dx_ub=22 dz_ub=20 d_ub=20 steps=5000 id=C2xC2xC2_c00367
[saved] id=C2xC2xC2_c00367 -> results/c2xc2xc2_d16_20260120_150530/promising/C2xC2xC2_c00367 (reason: d>=sqrt(n))
[pilot] TARGET_REJECT d_ub=15 target=16 id=C2xC2xC2_c00389
[pilot] TARGET_REJECT d_ub=12 target=16 id=C2xC2xC2_c00401
[pilot] MEAS n=288 k=4 dx_ub=20 dz_ub=21 d_ub=20 steps=5000 id=C2xC2xC2_c00444
[saved] id=C2xC2xC2_c00444 -> results/c2xc2xc2_d16_20260120_150530/promising/C2xC2xC2_c00444 (reason: d>=sqrt(n))
[pilot] TARGET_REJECT d_ub=12 target=16 id=C2xC2xC2_c00468
[best_by_k] group=C2xC2xC2 n=288
k  | d_ub | steps | dx_ub | dz_ub | id
 4 |   20 |  5000 |    20 |    20 | C2xC2xC2_c00203
 8 |   16 |  5000 |    16 |    17 | C2xC2xC2_c00001
[coverage] group=C2xC2xC2 A_sel=128 B_sel=128 Q_meas=22 ratio_ge_sqrt=0.000 ratio_sel=0.001
[coverage] run summary:
[coverage] group=C2xC2xC2 A_sel=128 B_sel=128 Q_meas=22 ratio_ge_sqrt=0.000 ratio_sel=0.001
[summary] best-by-k (measured; includes rejects):
  k=4 best_d_ub=20 count_measured=17 example_id=C2xC2xC2_c00203
  k=8 best_d_ub=16 count_measured=5 example_id=C2xC2xC2_c00001
[summary] best-by-k (survivors; target=16):
  k=4 best_d_ub=20 count_survivors=15 example_id=C2xC2xC2_c00203
  k=8 best_d_ub=16 count_survivors=2 example_id=C2xC2xC2_c00001
[pilot] top results:
  01 group=C2xC2xC2 n=288 k=4 d_ub=20 permA=27 permB=7 saved=True
  02 group=C2xC2xC2 n=288 k=4 d_ub=20 permA=20 permB=27 saved=True
  03 group=C2xC2xC2 n=288 k=4 d_ub=20 permA=27 permB=27 saved=True
  04 group=C2xC2xC2 n=288 k=4 d_ub=20 permA=20 permB=12 saved=True
  05 group=C2xC2xC2 n=288 k=4 d_ub=20 permA=27 permB=20 saved=True
  06 group=C2xC2xC2 n=288 k=4 d_ub=20 permA=8 permB=11 saved=True
  07 group=C2xC2xC2 n=288 k=4 d_ub=20 permA=20 permB=7 saved=True
  08 group=C2xC2xC2 n=288 k=4 d_ub=20 permA=27 permB=11 saved=True
  09 group=C2xC2xC2 n=288 k=4 d_ub=19 permA=27 permB=8 saved=True
  10 group=C2xC2xC2 n=288 k=4 d_ub=19 permA=20 permB=27 saved=True

