=== mar. 20 janv. 2026 18:10:09 CET steps=5000 batch=101 seed=1768922204 ===
[pilot] base k_table top pairs:
  k_base=18 permA=0 permB=0
  k_base=12 permA=29 permB=0
  k_base=12 permA=22 permB=0
  k_base=12 permA=13 permB=0
  k_base=12 permA=6 permB=0
[pilot] A multisets raw=792 (expected=792) enum_mode=multiset cayley_unique=26 perms=30 -> total scored = 780
[pilot] B multisets raw=792 (expected=792) enum_mode=multiset cayley_unique=26 perms=30 -> total scored = 780
[pilot] A frontier kept 128 candidates with points: (4,20), (0,49)
[pilot] B frontier kept 128 candidates with points: (4,20), (0,49)
[pilot] C2xC2xC2 n=288 d0=17 A_sets=26*30 -> keep 128; B_sets=26*30 -> keep 128
[pilot] MEAS n=288 k=4 dx_ub=20 dz_ub=20 d_ub=20 steps=5000 id=C2xC2xC2_c00002
[saved] id=C2xC2xC2_c00002 -> results/c2xc2xc2_d16_20260120_181009/promising/C2xC2xC2_c00002 (reason: d>=sqrt(n))
[pilot] MEAS n=288 k=4 dx_ub=17 dz_ub=16 d_ub=16 steps=5000 id=C2xC2xC2_c00027
[pilot] MEAS n=288 k=4 dx_ub=17 dz_ub=21 d_ub=17 steps=5000 id=C2xC2xC2_c00057
[saved] id=C2xC2xC2_c00057 -> results/c2xc2xc2_d16_20260120_181009/promising/C2xC2xC2_c00057 (reason: d>=sqrt(n))
[pilot] MEAS n=288 k=4 dx_ub=21 dz_ub=20 d_ub=20 steps=5000 id=C2xC2xC2_c00058
[saved] id=C2xC2xC2_c00058 -> results/c2xc2xc2_d16_20260120_181009/promising/C2xC2xC2_c00058 (reason: d>=sqrt(n))
[pilot] MEAS n=288 k=8 dx_ub=17 dz_ub=16 d_ub=16 steps=5000 id=C2xC2xC2_c00104
[pilot] MEAS n=288 k=4 dx_ub=20 dz_ub=20 d_ub=20 steps=5000 id=C2xC2xC2_c00167
[saved] id=C2xC2xC2_c00167 -> results/c2xc2xc2_d16_20260120_181009/promising/C2xC2xC2_c00167 (reason: d>=sqrt(n))
[pilot] TARGET_REJECT d_ub=14 target=16 id=C2xC2xC2_c00181
[pilot] MEAS n=288 k=8 dx_ub=17 dz_ub=20 d_ub=17 steps=5000 id=C2xC2xC2_c00196
[saved] id=C2xC2xC2_c00196 -> results/c2xc2xc2_d16_20260120_181009/promising/C2xC2xC2_c00196 (reason: d>=sqrt(n))
[pilot] TARGET_REJECT d_ub=12 target=16 id=C2xC2xC2_c00197
[pilot] MEAS n=288 k=4 dx_ub=20 dz_ub=20 d_ub=20 steps=5000 id=C2xC2xC2_c00207
[saved] id=C2xC2xC2_c00207 -> results/c2xc2xc2_d16_20260120_181009/promising/C2xC2xC2_c00207 (reason: d>=sqrt(n))
[pilot] TARGET_REJECT d_ub=12 target=16 id=C2xC2xC2_c00265
[pilot] MEAS n=288 k=4 dx_ub=18 dz_ub=20 d_ub=18 steps=5000 id=C2xC2xC2_c00279
[saved] id=C2xC2xC2_c00279 -> results/c2xc2xc2_d16_20260120_181009/promising/C2xC2xC2_c00279 (reason: d>=sqrt(n))
[pilot] MEAS n=288 k=8 dx_ub=16 dz_ub=18 d_ub=16 steps=5000 id=C2xC2xC2_c00288
[pilot] MEAS n=288 k=4 dx_ub=16 dz_ub=16 d_ub=16 steps=5000 id=C2xC2xC2_c00301
[pilot] MEAS n=288 k=4 dx_ub=16 dz_ub=18 d_ub=16 steps=5000 id=C2xC2xC2_c00333
[pilot] MEAS n=288 k=4 dx_ub=16 dz_ub=16 d_ub=16 steps=5000 id=C2xC2xC2_c00343
[pilot] MEAS n=288 k=4 dx_ub=17 dz_ub=16 d_ub=16 steps=5000 id=C2xC2xC2_c00344
[pilot] MEAS n=288 k=4 dx_ub=20 dz_ub=16 d_ub=16 steps=5000 id=C2xC2xC2_c00376
[pilot] MEAS n=288 k=4 dx_ub=20 dz_ub=22 d_ub=20 steps=5000 id=C2xC2xC2_c00386
[saved] id=C2xC2xC2_c00386 -> results/c2xc2xc2_d16_20260120_181009/promising/C2xC2xC2_c00386 (reason: d>=sqrt(n))
[pilot] TARGET_REJECT d_ub=12 target=16 id=C2xC2xC2_c00424
[pilot] MEAS n=288 k=4 dx_ub=20 dz_ub=20 d_ub=20 steps=5000 id=C2xC2xC2_c00428
[saved] id=C2xC2xC2_c00428 -> results/c2xc2xc2_d16_20260120_181009/promising/C2xC2xC2_c00428 (reason: d>=sqrt(n))
[pilot] MEAS n=288 k=4 dx_ub=20 dz_ub=20 d_ub=20 steps=5000 id=C2xC2xC2_c00453
[saved] id=C2xC2xC2_c00453 -> results/c2xc2xc2_d16_20260120_181009/promising/C2xC2xC2_c00453 (reason: d>=sqrt(n))
[pilot] TARGET_REJECT d_ub=14 target=16 id=C2xC2xC2_c00483
[pilot] MEAS n=288 k=4 dx_ub=16 dz_ub=16 d_ub=16 steps=5000 id=C2xC2xC2_c00498
[best_by_k] group=C2xC2xC2 n=288
k  | d_ub | steps | dx_ub | dz_ub | id
 4 |   20 |  5000 |    20 |    20 | C2xC2xC2_c00002
 8 |   17 |  5000 |    17 |    20 | C2xC2xC2_c00196
[coverage] group=C2xC2xC2 A_sel=128 B_sel=128 Q_meas=24 ratio_ge_sqrt=0.000 ratio_sel=0.001
[coverage] run summary:
[coverage] group=C2xC2xC2 A_sel=128 B_sel=128 Q_meas=24 ratio_ge_sqrt=0.000 ratio_sel=0.001
[summary] best-by-k (measured; includes rejects):
  k=4 best_d_ub=20 count_measured=17 example_id=C2xC2xC2_c00002
  k=8 best_d_ub=17 count_measured=7 example_id=C2xC2xC2_c00196
[summary] best-by-k (survivors; target=16):
  k=4 best_d_ub=20 count_survivors=16 example_id=C2xC2xC2_c00002
  k=8 best_d_ub=17 count_survivors=3 example_id=C2xC2xC2_c00196
[pilot] top results:
  01 group=C2xC2xC2 n=288 k=4 d_ub=20 permA=7 permB=12 saved=True
  02 group=C2xC2xC2 n=288 k=4 d_ub=20 permA=27 permB=11 saved=True
  03 group=C2xC2xC2 n=288 k=4 d_ub=20 permA=20 permB=7 saved=True
  04 group=C2xC2xC2 n=288 k=4 d_ub=20 permA=11 permB=11 saved=True
  05 group=C2xC2xC2 n=288 k=4 d_ub=20 permA=27 permB=27 saved=True
  06 group=C2xC2xC2 n=288 k=4 d_ub=20 permA=11 permB=8 saved=True
  07 group=C2xC2xC2 n=288 k=4 d_ub=20 permA=27 permB=11 saved=True
  08 group=C2xC2xC2 n=288 k=4 d_ub=18 permA=20 permB=11 saved=True
  09 group=C2xC2xC2 n=288 k=8 d_ub=17 permA=11 permB=12 saved=True
  10 group=C2xC2xC2 n=288 k=4 d_ub=17 permA=8 permB=7 saved=True

