=== mar. 20 janv. 2026 15:20:28 CET steps=5000 batch=55 seed=1768922158 ===
[pilot] base k_table top pairs:
  k_base=18 permA=0 permB=0
  k_base=12 permA=29 permB=0
  k_base=12 permA=22 permB=0
  k_base=12 permA=13 permB=0
  k_base=12 permA=6 permB=0
[pilot] A multisets raw=792 (expected=792) enum_mode=multiset cayley_unique=26 perms=30 -> total scored = 780
[pilot] B multisets raw=792 (expected=792) enum_mode=multiset cayley_unique=26 perms=30 -> total scored = 780
[pilot] A frontier kept 128 candidates with points: (4,20), (0,49)
[pilot] B frontier kept 128 candidates with points: (4,20), (0,49)
[pilot] C2xC2xC2 n=288 d0=17 A_sets=26*30 -> keep 128; B_sets=26*30 -> keep 128
[pilot] MEAS n=288 k=4 dx_ub=16 dz_ub=16 d_ub=16 steps=5000 id=C2xC2xC2_c00020
[pilot] TARGET_REJECT d_ub=12 target=16 id=C2xC2xC2_c00037
[pilot] MEAS n=288 k=4 dx_ub=20 dz_ub=20 d_ub=20 steps=5000 id=C2xC2xC2_c00049
[saved] id=C2xC2xC2_c00049 -> results/c2xc2xc2_d16_20260120_152028/promising/C2xC2xC2_c00049 (reason: d>=sqrt(n))
[pilot] MEAS n=288 k=8 dx_ub=16 dz_ub=17 d_ub=16 steps=5000 id=C2xC2xC2_c00087
[pilot] MEAS n=288 k=4 dx_ub=20 dz_ub=22 d_ub=20 steps=5000 id=C2xC2xC2_c00103
[saved] id=C2xC2xC2_c00103 -> results/c2xc2xc2_d16_20260120_152028/promising/C2xC2xC2_c00103 (reason: d>=sqrt(n))
[pilot] MEAS n=288 k=4 dx_ub=20 dz_ub=18 d_ub=18 steps=5000 id=C2xC2xC2_c00105
[saved] id=C2xC2xC2_c00105 -> results/c2xc2xc2_d16_20260120_152028/promising/C2xC2xC2_c00105 (reason: d>=sqrt(n))
[pilot] MEAS n=288 k=4 dx_ub=17 dz_ub=20 d_ub=17 steps=5000 id=C2xC2xC2_c00117
[saved] id=C2xC2xC2_c00117 -> results/c2xc2xc2_d16_20260120_152028/promising/C2xC2xC2_c00117 (reason: d>=sqrt(n))
[pilot] MEAS n=288 k=4 dx_ub=20 dz_ub=19 d_ub=19 steps=5000 id=C2xC2xC2_c00162
[saved] id=C2xC2xC2_c00162 -> results/c2xc2xc2_d16_20260120_152028/promising/C2xC2xC2_c00162 (reason: d>=sqrt(n))
[pilot] MEAS n=288 k=4 dx_ub=17 dz_ub=20 d_ub=17 steps=5000 id=C2xC2xC2_c00182
[saved] id=C2xC2xC2_c00182 -> results/c2xc2xc2_d16_20260120_152028/promising/C2xC2xC2_c00182 (reason: d>=sqrt(n))
[pilot] TARGET_REJECT d_ub=6 target=16 id=C2xC2xC2_c00221
[pilot] MEAS n=288 k=4 dx_ub=17 dz_ub=21 d_ub=17 steps=5000 id=C2xC2xC2_c00226
[saved] id=C2xC2xC2_c00226 -> results/c2xc2xc2_d16_20260120_152028/promising/C2xC2xC2_c00226 (reason: d>=sqrt(n))
[pilot] MEAS n=288 k=8 dx_ub=16 dz_ub=16 d_ub=16 steps=5000 id=C2xC2xC2_c00249
[pilot] MEAS n=288 k=8 dx_ub=17 dz_ub=18 d_ub=17 steps=5000 id=C2xC2xC2_c00347
[saved] id=C2xC2xC2_c00347 -> results/c2xc2xc2_d16_20260120_152028/promising/C2xC2xC2_c00347 (reason: d>=sqrt(n))
[pilot] MEAS n=288 k=8 dx_ub=18 dz_ub=16 d_ub=16 steps=5000 id=C2xC2xC2_c00351
[pilot] TARGET_REJECT d_ub=15 target=16 id=C2xC2xC2_c00368
[pilot] MEAS n=288 k=4 dx_ub=21 dz_ub=16 d_ub=16 steps=5000 id=C2xC2xC2_c00379
[pilot] MEAS n=288 k=4 dx_ub=21 dz_ub=20 d_ub=20 steps=5000 id=C2xC2xC2_c00394
[saved] id=C2xC2xC2_c00394 -> results/c2xc2xc2_d16_20260120_152028/promising/C2xC2xC2_c00394 (reason: d>=sqrt(n))
[pilot] MEAS n=288 k=4 dx_ub=16 dz_ub=16 d_ub=16 steps=5000 id=C2xC2xC2_c00406
[pilot] TARGET_REJECT d_ub=12 target=16 id=C2xC2xC2_c00428
[pilot] TARGET_REJECT d_ub=15 target=16 id=C2xC2xC2_c00430
[pilot] MEAS n=288 k=4 dx_ub=16 dz_ub=16 d_ub=16 steps=5000 id=C2xC2xC2_c00438
[pilot] MEAS n=288 k=4 dx_ub=17 dz_ub=20 d_ub=17 steps=5000 id=C2xC2xC2_c00456
[saved] id=C2xC2xC2_c00456 -> results/c2xc2xc2_d16_20260120_152028/promising/C2xC2xC2_c00456 (reason: d>=sqrt(n))
[pilot] MEAS n=288 k=8 dx_ub=16 dz_ub=17 d_ub=16 steps=5000 id=C2xC2xC2_c00462
[pilot] MEAS n=288 k=4 dx_ub=16 dz_ub=17 d_ub=16 steps=5000 id=C2xC2xC2_c00470
[pilot] MEAS n=288 k=8 dx_ub=16 dz_ub=18 d_ub=16 steps=5000 id=C2xC2xC2_c00491
[best_by_k] group=C2xC2xC2 n=288
k  | d_ub | steps | dx_ub | dz_ub | id
 4 |   20 |  5000 |    20 |    20 | C2xC2xC2_c00049
 8 |   17 |  5000 |    17 |    18 | C2xC2xC2_c00347
[coverage] group=C2xC2xC2 A_sel=128 B_sel=128 Q_meas=25 ratio_ge_sqrt=0.000 ratio_sel=0.002
[coverage] run summary:
[coverage] group=C2xC2xC2 A_sel=128 B_sel=128 Q_meas=25 ratio_ge_sqrt=0.000 ratio_sel=0.002
[summary] best-by-k (measured; includes rejects):
  k=4 best_d_ub=20 count_measured=16 example_id=C2xC2xC2_c00049
  k=8 best_d_ub=17 count_measured=9 example_id=C2xC2xC2_c00347
[summary] best-by-k (survivors; target=16):
  k=4 best_d_ub=20 count_survivors=14 example_id=C2xC2xC2_c00049
  k=8 best_d_ub=17 count_survivors=6 example_id=C2xC2xC2_c00347
[pilot] top results:
  01 group=C2xC2xC2 n=288 k=4 d_ub=20 permA=11 permB=20 saved=True
  02 group=C2xC2xC2 n=288 k=4 d_ub=20 permA=27 permB=8 saved=True
  03 group=C2xC2xC2 n=288 k=4 d_ub=20 permA=12 permB=7 saved=True
  04 group=C2xC2xC2 n=288 k=4 d_ub=19 permA=27 permB=20 saved=True
  05 group=C2xC2xC2 n=288 k=4 d_ub=18 permA=7 permB=8 saved=True
  06 group=C2xC2xC2 n=288 k=8 d_ub=17 permA=20 permB=7 saved=True
  07 group=C2xC2xC2 n=288 k=4 d_ub=17 permA=7 permB=27 saved=True
  08 group=C2xC2xC2 n=288 k=4 d_ub=17 permA=7 permB=11 saved=True
  09 group=C2xC2xC2 n=288 k=4 d_ub=17 permA=20 permB=27 saved=True
  10 group=C2xC2xC2 n=288 k=4 d_ub=17 permA=7 permB=7 saved=True

