=== mar. 20 janv. 2026 15:41:03 CET steps=5000 batch=85 seed=1768922188 ===
[pilot] base k_table top pairs:
  k_base=18 permA=0 permB=0
  k_base=12 permA=29 permB=0
  k_base=12 permA=22 permB=0
  k_base=12 permA=13 permB=0
  k_base=12 permA=6 permB=0
[pilot] A multisets raw=792 (expected=792) enum_mode=multiset cayley_unique=26 perms=30 -> total scored = 780
[pilot] B multisets raw=792 (expected=792) enum_mode=multiset cayley_unique=26 perms=30 -> total scored = 780
[pilot] A frontier kept 128 candidates with points: (4,20), (0,49)
[pilot] B frontier kept 128 candidates with points: (4,20), (0,49)
[pilot] C2xC2xC2 n=288 d0=17 A_sets=26*30 -> keep 128; B_sets=26*30 -> keep 128
[pilot] TARGET_REJECT d_ub=14 target=16 id=C2xC2xC2_c00030
[pilot] MEAS n=288 k=4 dx_ub=19 dz_ub=21 d_ub=19 steps=5000 id=C2xC2xC2_c00035
[saved] id=C2xC2xC2_c00035 -> results/c2xc2xc2_d16_20260120_154103/promising/C2xC2xC2_c00035 (reason: d>=sqrt(n))
[pilot] MEAS n=288 k=4 dx_ub=20 dz_ub=20 d_ub=20 steps=5000 id=C2xC2xC2_c00086
[saved] id=C2xC2xC2_c00086 -> results/c2xc2xc2_d16_20260120_154103/promising/C2xC2xC2_c00086 (reason: d>=sqrt(n))
[pilot] MEAS n=288 k=8 dx_ub=16 dz_ub=17 d_ub=16 steps=5000 id=C2xC2xC2_c00096
[pilot] TARGET_REJECT d_ub=15 target=16 id=C2xC2xC2_c00100
[pilot] MEAS n=288 k=4 dx_ub=18 dz_ub=16 d_ub=16 steps=5000 id=C2xC2xC2_c00103
[pilot] MEAS n=288 k=4 dx_ub=16 dz_ub=17 d_ub=16 steps=5000 id=C2xC2xC2_c00112
[pilot] MEAS n=288 k=4 dx_ub=20 dz_ub=20 d_ub=20 steps=5000 id=C2xC2xC2_c00114
[saved] id=C2xC2xC2_c00114 -> results/c2xc2xc2_d16_20260120_154103/promising/C2xC2xC2_c00114 (reason: d>=sqrt(n))
[pilot] TARGET_REJECT d_ub=14 target=16 id=C2xC2xC2_c00120
[pilot] TARGET_REJECT d_ub=12 target=16 id=C2xC2xC2_c00124
[pilot] MEAS n=288 k=4 dx_ub=20 dz_ub=21 d_ub=20 steps=5000 id=C2xC2xC2_c00135
[saved] id=C2xC2xC2_c00135 -> results/c2xc2xc2_d16_20260120_154103/promising/C2xC2xC2_c00135 (reason: d>=sqrt(n))
[pilot] TARGET_REJECT d_ub=6 target=16 id=C2xC2xC2_c00169
[pilot] TARGET_REJECT d_ub=15 target=16 id=C2xC2xC2_c00221
[pilot] MEAS n=288 k=4 dx_ub=16 dz_ub=20 d_ub=16 steps=5000 id=C2xC2xC2_c00222
[pilot] MEAS n=288 k=4 dx_ub=16 dz_ub=16 d_ub=16 steps=5000 id=C2xC2xC2_c00231
[pilot] MEAS n=288 k=4 dx_ub=17 dz_ub=16 d_ub=16 steps=5000 id=C2xC2xC2_c00250
[pilot] MEAS n=288 k=4 dx_ub=16 dz_ub=16 d_ub=16 steps=5000 id=C2xC2xC2_c00252
[pilot] MEAS n=288 k=4 dx_ub=22 dz_ub=23 d_ub=22 steps=5000 id=C2xC2xC2_c00259
[saved] id=C2xC2xC2_c00259 -> results/c2xc2xc2_d16_20260120_154103/promising/C2xC2xC2_c00259 (reason: d>=sqrt(n))
[pilot] MEAS n=288 k=4 dx_ub=20 dz_ub=20 d_ub=20 steps=5000 id=C2xC2xC2_c00260
[saved] id=C2xC2xC2_c00260 -> results/c2xc2xc2_d16_20260120_154103/promising/C2xC2xC2_c00260 (reason: d>=sqrt(n))
[pilot] MEAS n=288 k=4 dx_ub=18 dz_ub=16 d_ub=16 steps=5000 id=C2xC2xC2_c00270
[pilot] MEAS n=288 k=4 dx_ub=16 dz_ub=20 d_ub=16 steps=5000 id=C2xC2xC2_c00275
[pilot] TARGET_REJECT d_ub=12 target=16 id=C2xC2xC2_c00315
[pilot] TARGET_REJECT d_ub=12 target=16 id=C2xC2xC2_c00319
[pilot] MEAS n=288 k=4 dx_ub=18 dz_ub=16 d_ub=16 steps=5000 id=C2xC2xC2_c00335
[pilot] MEAS n=288 k=4 dx_ub=20 dz_ub=20 d_ub=20 steps=5000 id=C2xC2xC2_c00341
[saved] id=C2xC2xC2_c00341 -> results/c2xc2xc2_d16_20260120_154103/promising/C2xC2xC2_c00341 (reason: d>=sqrt(n))
[pilot] MEAS n=288 k=4 dx_ub=17 dz_ub=20 d_ub=17 steps=5000 id=C2xC2xC2_c00344
[saved] id=C2xC2xC2_c00344 -> results/c2xc2xc2_d16_20260120_154103/promising/C2xC2xC2_c00344 (reason: d>=sqrt(n))
[pilot] MEAS n=288 k=8 dx_ub=16 dz_ub=16 d_ub=16 steps=5000 id=C2xC2xC2_c00359
[pilot] MEAS n=288 k=4 dx_ub=20 dz_ub=19 d_ub=19 steps=5000 id=C2xC2xC2_c00386
[saved] id=C2xC2xC2_c00386 -> results/c2xc2xc2_d16_20260120_154103/promising/C2xC2xC2_c00386 (reason: d>=sqrt(n))
[pilot] MEAS n=288 k=4 dx_ub=20 dz_ub=19 d_ub=19 steps=5000 id=C2xC2xC2_c00399
[saved] id=C2xC2xC2_c00399 -> results/c2xc2xc2_d16_20260120_154103/promising/C2xC2xC2_c00399 (reason: d>=sqrt(n))
[pilot] MEAS n=288 k=4 dx_ub=20 dz_ub=16 d_ub=16 steps=5000 id=C2xC2xC2_c00406
[pilot] TARGET_REJECT d_ub=6 target=16 id=C2xC2xC2_c00447
[pilot] TARGET_REJECT d_ub=12 target=16 id=C2xC2xC2_c00449
[pilot] MEAS n=288 k=4 dx_ub=16 dz_ub=17 d_ub=16 steps=5000 id=C2xC2xC2_c00479
[best_by_k] group=C2xC2xC2 n=288
k  | d_ub | steps | dx_ub | dz_ub | id
 4 |   22 |  5000 |    22 |    23 | C2xC2xC2_c00259
 8 |   16 |  5000 |    16 |    17 | C2xC2xC2_c00096
[coverage] group=C2xC2xC2 A_sel=128 B_sel=128 Q_meas=33 ratio_ge_sqrt=0.001 ratio_sel=0.002
[coverage] run summary:
[coverage] group=C2xC2xC2 A_sel=128 B_sel=128 Q_meas=33 ratio_ge_sqrt=0.001 ratio_sel=0.002
[summary] best-by-k (measured; includes rejects):
  k=4 best_d_ub=22 count_measured=24 example_id=C2xC2xC2_c00259
  k=8 best_d_ub=16 count_measured=9 example_id=C2xC2xC2_c00096
[summary] best-by-k (survivors; target=16):
  k=4 best_d_ub=22 count_survivors=21 example_id=C2xC2xC2_c00259
  k=8 best_d_ub=16 count_survivors=2 example_id=C2xC2xC2_c00096
[pilot] top results:
  01 group=C2xC2xC2 n=288 k=4 d_ub=22 permA=12 permB=20 saved=True
  02 group=C2xC2xC2 n=288 k=4 d_ub=20 permA=11 permB=11 saved=True
  03 group=C2xC2xC2 n=288 k=4 d_ub=20 permA=8 permB=11 saved=True
  04 group=C2xC2xC2 n=288 k=4 d_ub=20 permA=12 permB=27 saved=True
  05 group=C2xC2xC2 n=288 k=4 d_ub=20 permA=27 permB=11 saved=True
  06 group=C2xC2xC2 n=288 k=4 d_ub=20 permA=11 permB=20 saved=True
  07 group=C2xC2xC2 n=288 k=4 d_ub=19 permA=27 permB=27 saved=True
  08 group=C2xC2xC2 n=288 k=4 d_ub=19 permA=8 permB=27 saved=True
  09 group=C2xC2xC2 n=288 k=4 d_ub=19 permA=11 permB=11 saved=True
  10 group=C2xC2xC2 n=288 k=4 d_ub=17 permA=8 permB=7 saved=True

