=== mar. 20 janv. 2026 20:04:35 CET steps=20000 batch=5 seed=1768937108 ===
[pilot] base k_table top pairs:
  k_base=18 permA=0 permB=0
  k_base=12 permA=29 permB=0
  k_base=12 permA=22 permB=0
  k_base=12 permA=13 permB=0
  k_base=12 permA=6 permB=0
[pilot] A multisets raw=792 (expected=792) enum_mode=multiset cayley_unique=26 perms=30 -> total scored = 780
[pilot] B multisets raw=792 (expected=792) enum_mode=multiset cayley_unique=26 perms=30 -> total scored = 780
[pilot] A frontier kept 128 candidates with points: (4,20), (0,49)
[pilot] B frontier kept 128 candidates with points: (4,20), (0,49)
[pilot] C2xC2xC2 n=288 d0=17 A_sets=26*30 -> keep 128; B_sets=26*30 -> keep 128
[pilot] MEAS n=288 k=4 dx_ub=16 dz_ub=16 d_ub=16 steps=20000 id=C2xC2xC2_c00002
[pilot] TARGET_REJECT d_ub=14 target=16 id=C2xC2xC2_c00012
[pilot] MEAS n=288 k=4 dx_ub=19 dz_ub=20 d_ub=19 steps=20000 id=C2xC2xC2_c00020
[saved] id=C2xC2xC2_c00020 -> results/c2xc2xc2_d16_20260120_200435/promising/C2xC2xC2_c00020 (reason: d>=sqrt(n))
[pilot] TARGET_REJECT d_ub=12 target=16 id=C2xC2xC2_c00044
[pilot] MEAS n=288 k=8 dx_ub=16 dz_ub=16 d_ub=16 steps=20000 id=C2xC2xC2_c00052
[pilot] MEAS n=288 k=4 dx_ub=20 dz_ub=20 d_ub=20 steps=20000 id=C2xC2xC2_c00074
[saved] id=C2xC2xC2_c00074 -> results/c2xc2xc2_d16_20260120_200435/promising/C2xC2xC2_c00074 (reason: d>=sqrt(n))
[pilot] MEAS n=288 k=4 dx_ub=19 dz_ub=19 d_ub=19 steps=20000 id=C2xC2xC2_c00097
[saved] id=C2xC2xC2_c00097 -> results/c2xc2xc2_d16_20260120_200435/promising/C2xC2xC2_c00097 (reason: d>=sqrt(n))
[pilot] MEAS n=288 k=4 dx_ub=20 dz_ub=18 d_ub=18 steps=20000 id=C2xC2xC2_c00133
[saved] id=C2xC2xC2_c00133 -> results/c2xc2xc2_d16_20260120_200435/promising/C2xC2xC2_c00133 (reason: d>=sqrt(n))
[pilot] MEAS n=288 k=4 dx_ub=20 dz_ub=20 d_ub=20 steps=20000 id=C2xC2xC2_c00134
[saved] id=C2xC2xC2_c00134 -> results/c2xc2xc2_d16_20260120_200435/promising/C2xC2xC2_c00134 (reason: d>=sqrt(n))
[pilot] MEAS n=288 k=8 dx_ub=16 dz_ub=18 d_ub=16 steps=20000 id=C2xC2xC2_c00141
[pilot] MEAS n=288 k=4 dx_ub=20 dz_ub=18 d_ub=18 steps=20000 id=C2xC2xC2_c00147
[saved] id=C2xC2xC2_c00147 -> results/c2xc2xc2_d16_20260120_200435/promising/C2xC2xC2_c00147 (reason: d>=sqrt(n))
[pilot] MEAS n=288 k=8 dx_ub=18 dz_ub=16 d_ub=16 steps=20000 id=C2xC2xC2_c00173
[pilot] TARGET_REJECT d_ub=12 target=16 id=C2xC2xC2_c00179
[pilot] TARGET_REJECT d_ub=14 target=16 id=C2xC2xC2_c00204
[pilot] TARGET_REJECT d_ub=15 target=16 id=C2xC2xC2_c00238
[pilot] MEAS n=288 k=4 dx_ub=18 dz_ub=18 d_ub=18 steps=20000 id=C2xC2xC2_c00248
[saved] id=C2xC2xC2_c00248 -> results/c2xc2xc2_d16_20260120_200435/promising/C2xC2xC2_c00248 (reason: d>=sqrt(n))
[pilot] MEAS n=288 k=4 dx_ub=20 dz_ub=20 d_ub=20 steps=20000 id=C2xC2xC2_c00285
[saved] id=C2xC2xC2_c00285 -> results/c2xc2xc2_d16_20260120_200435/promising/C2xC2xC2_c00285 (reason: d>=sqrt(n))
[pilot] MEAS n=288 k=4 dx_ub=20 dz_ub=19 d_ub=19 steps=20000 id=C2xC2xC2_c00309
[saved] id=C2xC2xC2_c00309 -> results/c2xc2xc2_d16_20260120_200435/promising/C2xC2xC2_c00309 (reason: d>=sqrt(n))
[pilot] TARGET_REJECT d_ub=15 target=16 id=C2xC2xC2_c00336
[pilot] TARGET_REJECT d_ub=12 target=16 id=C2xC2xC2_c00372
[pilot] TARGET_REJECT d_ub=15 target=16 id=C2xC2xC2_c00399
[pilot] TARGET_REJECT d_ub=15 target=16 id=C2xC2xC2_c00439
[pilot] MEAS n=288 k=4 dx_ub=19 dz_ub=20 d_ub=19 steps=20000 id=C2xC2xC2_c00442
[saved] id=C2xC2xC2_c00442 -> results/c2xc2xc2_d16_20260120_200435/promising/C2xC2xC2_c00442 (reason: d>=sqrt(n))
[pilot] MEAS n=288 k=4 dx_ub=19 dz_ub=17 d_ub=17 steps=20000 id=C2xC2xC2_c00444
[saved] id=C2xC2xC2_c00444 -> results/c2xc2xc2_d16_20260120_200435/promising/C2xC2xC2_c00444 (reason: d>=sqrt(n))
[pilot] MEAS n=288 k=4 dx_ub=20 dz_ub=20 d_ub=20 steps=20000 id=C2xC2xC2_c00453
[saved] id=C2xC2xC2_c00453 -> results/c2xc2xc2_d16_20260120_200435/promising/C2xC2xC2_c00453 (reason: d>=sqrt(n))
[pilot] TARGET_REJECT d_ub=12 target=16 id=C2xC2xC2_c00460
[pilot] MEAS n=288 k=4 dx_ub=20 dz_ub=19 d_ub=19 steps=20000 id=C2xC2xC2_c00485
[saved] id=C2xC2xC2_c00485 -> results/c2xc2xc2_d16_20260120_200435/promising/C2xC2xC2_c00485 (reason: d>=sqrt(n))
[best_by_k] group=C2xC2xC2 n=288
k  | d_ub | steps | dx_ub | dz_ub | id
 4 |   20 | 20000 |    20 |    20 | C2xC2xC2_c00074
 8 |   16 | 20000 |    16 |    16 | C2xC2xC2_c00052
[coverage] group=C2xC2xC2 A_sel=128 B_sel=128 Q_meas=27 ratio_ge_sqrt=0.000 ratio_sel=0.002
[coverage] run summary:
[coverage] group=C2xC2xC2 A_sel=128 B_sel=128 Q_meas=27 ratio_ge_sqrt=0.000 ratio_sel=0.002
[summary] best-by-k (measured; includes rejects):
  k=4 best_d_ub=20 count_measured=17 example_id=C2xC2xC2_c00074
  k=8 best_d_ub=16 count_measured=10 example_id=C2xC2xC2_c00052
[summary] best-by-k (survivors; target=16):
  k=4 best_d_ub=20 count_survivors=14 example_id=C2xC2xC2_c00074
  k=8 best_d_ub=16 count_survivors=3 example_id=C2xC2xC2_c00052
[pilot] top results:
  01 group=C2xC2xC2 n=288 k=4 d_ub=20 permA=12 permB=11 saved=True
  02 group=C2xC2xC2 n=288 k=4 d_ub=20 permA=20 permB=27 saved=True
  03 group=C2xC2xC2 n=288 k=4 d_ub=20 permA=11 permB=27 saved=True
  04 group=C2xC2xC2 n=288 k=4 d_ub=20 permA=20 permB=20 saved=True
  05 group=C2xC2xC2 n=288 k=4 d_ub=19 permA=27 permB=11 saved=True
  06 group=C2xC2xC2 n=288 k=4 d_ub=19 permA=27 permB=20 saved=True
  07 group=C2xC2xC2 n=288 k=4 d_ub=19 permA=11 permB=27 saved=True
  08 group=C2xC2xC2 n=288 k=4 d_ub=19 permA=20 permB=11 saved=True
  09 group=C2xC2xC2 n=288 k=4 d_ub=19 permA=11 permB=11 saved=True
  10 group=C2xC2xC2 n=288 k=4 d_ub=18 permA=11 permB=27 saved=True

