=== mar. 20 janv. 2026 16:15:40 CET steps=5000 batch=88 seed=1768922191 ===
[pilot] base k_table top pairs:
  k_base=18 permA=0 permB=0
  k_base=12 permA=29 permB=0
  k_base=12 permA=22 permB=0
  k_base=12 permA=13 permB=0
  k_base=12 permA=6 permB=0
[pilot] A multisets raw=792 (expected=792) enum_mode=multiset cayley_unique=26 perms=30 -> total scored = 780
[pilot] B multisets raw=792 (expected=792) enum_mode=multiset cayley_unique=26 perms=30 -> total scored = 780
[pilot] A frontier kept 128 candidates with points: (4,20), (0,49)
[pilot] B frontier kept 128 candidates with points: (4,20), (0,49)
[pilot] C2xC2xC2 n=288 d0=17 A_sets=26*30 -> keep 128; B_sets=26*30 -> keep 128
[pilot] MEAS n=288 k=4 dx_ub=16 dz_ub=19 d_ub=16 steps=5000 id=C2xC2xC2_c00016
[pilot] MEAS n=288 k=4 dx_ub=20 dz_ub=21 d_ub=20 steps=5000 id=C2xC2xC2_c00034
[saved] id=C2xC2xC2_c00034 -> results/c2xc2xc2_d16_20260120_161540/promising/C2xC2xC2_c00034 (reason: d>=sqrt(n))
[pilot] MEAS n=288 k=4 dx_ub=16 dz_ub=18 d_ub=16 steps=5000 id=C2xC2xC2_c00063
[pilot] MEAS n=288 k=4 dx_ub=17 dz_ub=20 d_ub=17 steps=5000 id=C2xC2xC2_c00073
[saved] id=C2xC2xC2_c00073 -> results/c2xc2xc2_d16_20260120_161540/promising/C2xC2xC2_c00073 (reason: d>=sqrt(n))
[pilot] MEAS n=288 k=4 dx_ub=20 dz_ub=20 d_ub=20 steps=5000 id=C2xC2xC2_c00099
[saved] id=C2xC2xC2_c00099 -> results/c2xc2xc2_d16_20260120_161540/promising/C2xC2xC2_c00099 (reason: d>=sqrt(n))
[pilot] MEAS n=288 k=4 dx_ub=20 dz_ub=19 d_ub=19 steps=5000 id=C2xC2xC2_c00109
[saved] id=C2xC2xC2_c00109 -> results/c2xc2xc2_d16_20260120_161540/promising/C2xC2xC2_c00109 (reason: d>=sqrt(n))
[pilot] MEAS n=288 k=4 dx_ub=21 dz_ub=19 d_ub=19 steps=5000 id=C2xC2xC2_c00140
[saved] id=C2xC2xC2_c00140 -> results/c2xc2xc2_d16_20260120_161540/promising/C2xC2xC2_c00140 (reason: d>=sqrt(n))
[pilot] TARGET_REJECT d_ub=15 target=16 id=C2xC2xC2_c00165
[pilot] MEAS n=288 k=4 dx_ub=17 dz_ub=20 d_ub=17 steps=5000 id=C2xC2xC2_c00171
[saved] id=C2xC2xC2_c00171 -> results/c2xc2xc2_d16_20260120_161540/promising/C2xC2xC2_c00171 (reason: d>=sqrt(n))
[pilot] TARGET_REJECT d_ub=12 target=16 id=C2xC2xC2_c00174
[pilot] MEAS n=288 k=4 dx_ub=17 dz_ub=22 d_ub=17 steps=5000 id=C2xC2xC2_c00184
[saved] id=C2xC2xC2_c00184 -> results/c2xc2xc2_d16_20260120_161540/promising/C2xC2xC2_c00184 (reason: d>=sqrt(n))
[pilot] MEAS n=288 k=4 dx_ub=20 dz_ub=20 d_ub=20 steps=5000 id=C2xC2xC2_c00195
[saved] id=C2xC2xC2_c00195 -> results/c2xc2xc2_d16_20260120_161540/promising/C2xC2xC2_c00195 (reason: d>=sqrt(n))
[pilot] MEAS n=288 k=4 dx_ub=20 dz_ub=16 d_ub=16 steps=5000 id=C2xC2xC2_c00207
[pilot] MEAS n=288 k=4 dx_ub=20 dz_ub=22 d_ub=20 steps=5000 id=C2xC2xC2_c00208
[saved] id=C2xC2xC2_c00208 -> results/c2xc2xc2_d16_20260120_161540/promising/C2xC2xC2_c00208 (reason: d>=sqrt(n))
[pilot] TARGET_REJECT d_ub=15 target=16 id=C2xC2xC2_c00220
[pilot] MEAS n=288 k=4 dx_ub=22 dz_ub=20 d_ub=20 steps=5000 id=C2xC2xC2_c00234
[saved] id=C2xC2xC2_c00234 -> results/c2xc2xc2_d16_20260120_161540/promising/C2xC2xC2_c00234 (reason: d>=sqrt(n))
[pilot] MEAS n=288 k=4 dx_ub=16 dz_ub=16 d_ub=16 steps=5000 id=C2xC2xC2_c00277
[pilot] MEAS n=288 k=8 dx_ub=17 dz_ub=16 d_ub=16 steps=5000 id=C2xC2xC2_c00315
[pilot] MEAS n=288 k=4 dx_ub=16 dz_ub=16 d_ub=16 steps=5000 id=C2xC2xC2_c00318
[pilot] TARGET_REJECT d_ub=14 target=16 id=C2xC2xC2_c00328
[pilot] MEAS n=288 k=4 dx_ub=17 dz_ub=16 d_ub=16 steps=5000 id=C2xC2xC2_c00345
[pilot] MEAS n=288 k=4 dx_ub=20 dz_ub=17 d_ub=17 steps=5000 id=C2xC2xC2_c00351
[saved] id=C2xC2xC2_c00351 -> results/c2xc2xc2_d16_20260120_161540/promising/C2xC2xC2_c00351 (reason: d>=sqrt(n))
[pilot] MEAS n=288 k=4 dx_ub=22 dz_ub=20 d_ub=20 steps=5000 id=C2xC2xC2_c00361
[saved] id=C2xC2xC2_c00361 -> results/c2xc2xc2_d16_20260120_161540/promising/C2xC2xC2_c00361 (reason: d>=sqrt(n))
[pilot] MEAS n=288 k=8 dx_ub=16 dz_ub=18 d_ub=16 steps=5000 id=C2xC2xC2_c00460
[pilot] TARGET_REJECT d_ub=13 target=16 id=C2xC2xC2_c00483
[pilot] TARGET_REJECT d_ub=12 target=16 id=C2xC2xC2_c00493
[best_by_k] group=C2xC2xC2 n=288
k  | d_ub | steps | dx_ub | dz_ub | id
 4 |   20 |  5000 |    20 |    21 | C2xC2xC2_c00034
 8 |   16 |  5000 |    17 |    16 | C2xC2xC2_c00315
[coverage] group=C2xC2xC2 A_sel=128 B_sel=128 Q_meas=26 ratio_ge_sqrt=0.000 ratio_sel=0.002
[coverage] run summary:
[coverage] group=C2xC2xC2 A_sel=128 B_sel=128 Q_meas=26 ratio_ge_sqrt=0.000 ratio_sel=0.002
[summary] best-by-k (measured; includes rejects):
  k=4 best_d_ub=20 count_measured=21 example_id=C2xC2xC2_c00034
  k=8 best_d_ub=16 count_measured=5 example_id=C2xC2xC2_c00315
[summary] best-by-k (survivors; target=16):
  k=4 best_d_ub=20 count_survivors=18 example_id=C2xC2xC2_c00034
  k=8 best_d_ub=16 count_survivors=2 example_id=C2xC2xC2_c00315
[pilot] top results:
  01 group=C2xC2xC2 n=288 k=4 d_ub=20 permA=8 permB=11 saved=True
  02 group=C2xC2xC2 n=288 k=4 d_ub=20 permA=8 permB=7 saved=True
  03 group=C2xC2xC2 n=288 k=4 d_ub=20 permA=11 permB=27 saved=True
  04 group=C2xC2xC2 n=288 k=4 d_ub=20 permA=8 permB=11 saved=True
  05 group=C2xC2xC2 n=288 k=4 d_ub=20 permA=11 permB=11 saved=True
  06 group=C2xC2xC2 n=288 k=4 d_ub=20 permA=27 permB=27 saved=True
  07 group=C2xC2xC2 n=288 k=4 d_ub=19 permA=12 permB=8 saved=True
  08 group=C2xC2xC2 n=288 k=4 d_ub=19 permA=8 permB=11 saved=True
  09 group=C2xC2xC2 n=288 k=4 d_ub=17 permA=20 permB=27 saved=True
  10 group=C2xC2xC2 n=288 k=4 d_ub=17 permA=20 permB=8 saved=True

