=== mer. 21 janv. 2026 08:33:59 CET steps=20000 batch=42 seed=1768937145 ===
[pilot] base k_table top pairs:
  k_base=18 permA=0 permB=0
  k_base=12 permA=29 permB=0
  k_base=12 permA=22 permB=0
  k_base=12 permA=13 permB=0
  k_base=12 permA=6 permB=0
[pilot] A multisets raw=792 (expected=792) enum_mode=multiset cayley_unique=26 perms=30 -> total scored = 780
[pilot] B multisets raw=792 (expected=792) enum_mode=multiset cayley_unique=26 perms=30 -> total scored = 780
[pilot] A frontier kept 128 candidates with points: (4,20), (0,49)
[pilot] B frontier kept 128 candidates with points: (4,20), (0,49)
[pilot] C2xC2xC2 n=288 d0=17 A_sets=26*30 -> keep 128; B_sets=26*30 -> keep 128
[pilot] MEAS n=288 k=4 dx_ub=20 dz_ub=20 d_ub=20 steps=20000 id=C2xC2xC2_c00015
[saved] id=C2xC2xC2_c00015 -> results/c2xc2xc2_d16_20260121_083359/promising/C2xC2xC2_c00015 (reason: d>=sqrt(n))
[pilot] MEAS n=288 k=4 dx_ub=20 dz_ub=20 d_ub=20 steps=20000 id=C2xC2xC2_c00034
[saved] id=C2xC2xC2_c00034 -> results/c2xc2xc2_d16_20260121_083359/promising/C2xC2xC2_c00034 (reason: d>=sqrt(n))
[pilot] MEAS n=288 k=4 dx_ub=19 dz_ub=20 d_ub=19 steps=20000 id=C2xC2xC2_c00036
[saved] id=C2xC2xC2_c00036 -> results/c2xc2xc2_d16_20260121_083359/promising/C2xC2xC2_c00036 (reason: d>=sqrt(n))
[pilot] TARGET_REJECT d_ub=14 target=16 id=C2xC2xC2_c00051
[pilot] TARGET_REJECT d_ub=12 target=16 id=C2xC2xC2_c00066
[pilot] MEAS n=288 k=4 dx_ub=20 dz_ub=19 d_ub=19 steps=20000 id=C2xC2xC2_c00076
[saved] id=C2xC2xC2_c00076 -> results/c2xc2xc2_d16_20260121_083359/promising/C2xC2xC2_c00076 (reason: d>=sqrt(n))
[pilot] MEAS n=288 k=4 dx_ub=16 dz_ub=17 d_ub=16 steps=20000 id=C2xC2xC2_c00090
[pilot] MEAS n=288 k=8 dx_ub=16 dz_ub=17 d_ub=16 steps=20000 id=C2xC2xC2_c00124
[pilot] MEAS n=288 k=4 dx_ub=20 dz_ub=16 d_ub=16 steps=20000 id=C2xC2xC2_c00125
[pilot] MEAS n=288 k=4 dx_ub=16 dz_ub=16 d_ub=16 steps=20000 id=C2xC2xC2_c00185
[pilot] MEAS n=288 k=4 dx_ub=20 dz_ub=17 d_ub=17 steps=20000 id=C2xC2xC2_c00195
[saved] id=C2xC2xC2_c00195 -> results/c2xc2xc2_d16_20260121_083359/promising/C2xC2xC2_c00195 (reason: d>=sqrt(n))
[pilot] MEAS n=288 k=4 dx_ub=16 dz_ub=16 d_ub=16 steps=20000 id=C2xC2xC2_c00220
[pilot] MEAS n=288 k=4 dx_ub=17 dz_ub=20 d_ub=17 steps=20000 id=C2xC2xC2_c00251
[saved] id=C2xC2xC2_c00251 -> results/c2xc2xc2_d16_20260121_083359/promising/C2xC2xC2_c00251 (reason: d>=sqrt(n))
[pilot] MEAS n=288 k=4 dx_ub=17 dz_ub=16 d_ub=16 steps=20000 id=C2xC2xC2_c00274
[pilot] TARGET_REJECT d_ub=13 target=16 id=C2xC2xC2_c00316
[pilot] MEAS n=288 k=4 dx_ub=20 dz_ub=20 d_ub=20 steps=20000 id=C2xC2xC2_c00319
[saved] id=C2xC2xC2_c00319 -> results/c2xc2xc2_d16_20260121_083359/promising/C2xC2xC2_c00319 (reason: d>=sqrt(n))
[pilot] MEAS n=288 k=8 dx_ub=17 dz_ub=19 d_ub=17 steps=20000 id=C2xC2xC2_c00326
[saved] id=C2xC2xC2_c00326 -> results/c2xc2xc2_d16_20260121_083359/promising/C2xC2xC2_c00326 (reason: d>=sqrt(n))
[pilot] MEAS n=288 k=8 dx_ub=17 dz_ub=16 d_ub=16 steps=20000 id=C2xC2xC2_c00327
[pilot] MEAS n=288 k=4 dx_ub=20 dz_ub=18 d_ub=18 steps=20000 id=C2xC2xC2_c00365
[saved] id=C2xC2xC2_c00365 -> results/c2xc2xc2_d16_20260121_083359/promising/C2xC2xC2_c00365 (reason: d>=sqrt(n))
[pilot] MEAS n=288 k=4 dx_ub=19 dz_ub=19 d_ub=19 steps=20000 id=C2xC2xC2_c00377
[saved] id=C2xC2xC2_c00377 -> results/c2xc2xc2_d16_20260121_083359/promising/C2xC2xC2_c00377 (reason: d>=sqrt(n))
[pilot] MEAS n=288 k=4 dx_ub=19 dz_ub=16 d_ub=16 steps=20000 id=C2xC2xC2_c00399
[pilot] MEAS n=288 k=4 dx_ub=20 dz_ub=20 d_ub=20 steps=20000 id=C2xC2xC2_c00402
[saved] id=C2xC2xC2_c00402 -> results/c2xc2xc2_d16_20260121_083359/promising/C2xC2xC2_c00402 (reason: d>=sqrt(n))
[pilot] MEAS n=288 k=4 dx_ub=17 dz_ub=20 d_ub=17 steps=20000 id=C2xC2xC2_c00425
[saved] id=C2xC2xC2_c00425 -> results/c2xc2xc2_d16_20260121_083359/promising/C2xC2xC2_c00425 (reason: d>=sqrt(n))
[pilot] MEAS n=288 k=4 dx_ub=17 dz_ub=20 d_ub=17 steps=20000 id=C2xC2xC2_c00460
[saved] id=C2xC2xC2_c00460 -> results/c2xc2xc2_d16_20260121_083359/promising/C2xC2xC2_c00460 (reason: d>=sqrt(n))
[best_by_k] group=C2xC2xC2 n=288
k  | d_ub | steps | dx_ub | dz_ub | id
 4 |   20 | 20000 |    20 |    20 | C2xC2xC2_c00015
 8 |   17 | 20000 |    17 |    19 | C2xC2xC2_c00326
[coverage] group=C2xC2xC2 A_sel=128 B_sel=128 Q_meas=24 ratio_ge_sqrt=0.000 ratio_sel=0.001
[coverage] run summary:
[coverage] group=C2xC2xC2 A_sel=128 B_sel=128 Q_meas=24 ratio_ge_sqrt=0.000 ratio_sel=0.001
[summary] best-by-k (measured; includes rejects):
  k=4 best_d_ub=20 count_measured=19 example_id=C2xC2xC2_c00015
  k=8 best_d_ub=17 count_measured=5 example_id=C2xC2xC2_c00326
[summary] best-by-k (survivors; target=16):
  k=4 best_d_ub=20 count_survivors=18 example_id=C2xC2xC2_c00015
  k=8 best_d_ub=17 count_survivors=3 example_id=C2xC2xC2_c00326
[pilot] top results:
  01 group=C2xC2xC2 n=288 k=4 d_ub=20 permA=7 permB=20 saved=True
  02 group=C2xC2xC2 n=288 k=4 d_ub=20 permA=7 permB=12 saved=True
  03 group=C2xC2xC2 n=288 k=4 d_ub=20 permA=27 permB=20 saved=True
  04 group=C2xC2xC2 n=288 k=4 d_ub=20 permA=27 permB=8 saved=True
  05 group=C2xC2xC2 n=288 k=4 d_ub=19 permA=7 permB=8 saved=True
  06 group=C2xC2xC2 n=288 k=4 d_ub=19 permA=8 permB=11 saved=True
  07 group=C2xC2xC2 n=288 k=4 d_ub=19 permA=27 permB=8 saved=True
  08 group=C2xC2xC2 n=288 k=4 d_ub=18 permA=27 permB=12 saved=True
  09 group=C2xC2xC2 n=288 k=8 d_ub=17 permA=11 permB=12 saved=True
  10 group=C2xC2xC2 n=288 k=4 d_ub=17 permA=11 permB=8 saved=True

