=== mer. 21 janv. 2026 03:35:28 CET steps=20000 batch=28 seed=1768937131 ===
[pilot] base k_table top pairs:
  k_base=18 permA=0 permB=0
  k_base=12 permA=29 permB=0
  k_base=12 permA=22 permB=0
  k_base=12 permA=13 permB=0
  k_base=12 permA=6 permB=0
[pilot] A multisets raw=792 (expected=792) enum_mode=multiset cayley_unique=26 perms=30 -> total scored = 780
[pilot] B multisets raw=792 (expected=792) enum_mode=multiset cayley_unique=26 perms=30 -> total scored = 780
[pilot] A frontier kept 128 candidates with points: (4,20), (0,49)
[pilot] B frontier kept 128 candidates with points: (4,20), (0,49)
[pilot] C2xC2xC2 n=288 d0=17 A_sets=26*30 -> keep 128; B_sets=26*30 -> keep 128
[pilot] MEAS n=288 k=4 dx_ub=20 dz_ub=20 d_ub=20 steps=20000 id=C2xC2xC2_c00084
[saved] id=C2xC2xC2_c00084 -> results/c2xc2xc2_d16_20260121_033528/promising/C2xC2xC2_c00084 (reason: d>=sqrt(n))
[pilot] TARGET_REJECT d_ub=12 target=16 id=C2xC2xC2_c00095
[pilot] TARGET_REJECT d_ub=12 target=16 id=C2xC2xC2_c00110
[pilot] MEAS n=288 k=4 dx_ub=16 dz_ub=16 d_ub=16 steps=20000 id=C2xC2xC2_c00123
[pilot] MEAS n=288 k=4 dx_ub=20 dz_ub=20 d_ub=20 steps=20000 id=C2xC2xC2_c00148
[saved] id=C2xC2xC2_c00148 -> results/c2xc2xc2_d16_20260121_033528/promising/C2xC2xC2_c00148 (reason: d>=sqrt(n))
[pilot] MEAS n=288 k=4 dx_ub=20 dz_ub=18 d_ub=18 steps=20000 id=C2xC2xC2_c00151
[saved] id=C2xC2xC2_c00151 -> results/c2xc2xc2_d16_20260121_033528/promising/C2xC2xC2_c00151 (reason: d>=sqrt(n))
[pilot] MEAS n=288 k=4 dx_ub=19 dz_ub=20 d_ub=19 steps=20000 id=C2xC2xC2_c00154
[saved] id=C2xC2xC2_c00154 -> results/c2xc2xc2_d16_20260121_033528/promising/C2xC2xC2_c00154 (reason: d>=sqrt(n))
[pilot] MEAS n=288 k=4 dx_ub=20 dz_ub=20 d_ub=20 steps=20000 id=C2xC2xC2_c00167
[saved] id=C2xC2xC2_c00167 -> results/c2xc2xc2_d16_20260121_033528/promising/C2xC2xC2_c00167 (reason: d>=sqrt(n))
[pilot] MEAS n=288 k=4 dx_ub=18 dz_ub=16 d_ub=16 steps=20000 id=C2xC2xC2_c00176
[pilot] TARGET_REJECT d_ub=12 target=16 id=C2xC2xC2_c00200
[pilot] MEAS n=288 k=4 dx_ub=17 dz_ub=16 d_ub=16 steps=20000 id=C2xC2xC2_c00208
[pilot] MEAS n=288 k=4 dx_ub=18 dz_ub=20 d_ub=18 steps=20000 id=C2xC2xC2_c00222
[saved] id=C2xC2xC2_c00222 -> results/c2xc2xc2_d16_20260121_033528/promising/C2xC2xC2_c00222 (reason: d>=sqrt(n))
[pilot] MEAS n=288 k=4 dx_ub=20 dz_ub=20 d_ub=20 steps=20000 id=C2xC2xC2_c00224
[saved] id=C2xC2xC2_c00224 -> results/c2xc2xc2_d16_20260121_033528/promising/C2xC2xC2_c00224 (reason: d>=sqrt(n))
[pilot] MEAS n=288 k=8 dx_ub=17 dz_ub=16 d_ub=16 steps=20000 id=C2xC2xC2_c00252
[pilot] MEAS n=288 k=4 dx_ub=16 dz_ub=19 d_ub=16 steps=20000 id=C2xC2xC2_c00295
[pilot] MEAS n=288 k=4 dx_ub=17 dz_ub=20 d_ub=17 steps=20000 id=C2xC2xC2_c00305
[saved] id=C2xC2xC2_c00305 -> results/c2xc2xc2_d16_20260121_033528/promising/C2xC2xC2_c00305 (reason: d>=sqrt(n))
[pilot] MEAS n=288 k=4 dx_ub=17 dz_ub=16 d_ub=16 steps=20000 id=C2xC2xC2_c00311
[pilot] MEAS n=288 k=8 dx_ub=16 dz_ub=18 d_ub=16 steps=20000 id=C2xC2xC2_c00322
[pilot] MEAS n=288 k=4 dx_ub=16 dz_ub=18 d_ub=16 steps=20000 id=C2xC2xC2_c00325
[pilot] MEAS n=288 k=4 dx_ub=16 dz_ub=20 d_ub=16 steps=20000 id=C2xC2xC2_c00370
[pilot] MEAS n=288 k=4 dx_ub=17 dz_ub=18 d_ub=17 steps=20000 id=C2xC2xC2_c00417
[saved] id=C2xC2xC2_c00417 -> results/c2xc2xc2_d16_20260121_033528/promising/C2xC2xC2_c00417 (reason: d>=sqrt(n))
[pilot] MEAS n=288 k=4 dx_ub=20 dz_ub=20 d_ub=20 steps=20000 id=C2xC2xC2_c00423
[saved] id=C2xC2xC2_c00423 -> results/c2xc2xc2_d16_20260121_033528/promising/C2xC2xC2_c00423 (reason: d>=sqrt(n))
[pilot] MEAS n=288 k=4 dx_ub=20 dz_ub=20 d_ub=20 steps=20000 id=C2xC2xC2_c00427
[saved] id=C2xC2xC2_c00427 -> results/c2xc2xc2_d16_20260121_033528/promising/C2xC2xC2_c00427 (reason: d>=sqrt(n))
[pilot] MEAS n=288 k=8 dx_ub=18 dz_ub=16 d_ub=16 steps=20000 id=C2xC2xC2_c00429
[pilot] MEAS n=288 k=4 dx_ub=16 dz_ub=16 d_ub=16 steps=20000 id=C2xC2xC2_c00445
[pilot] MEAS n=288 k=4 dx_ub=16 dz_ub=16 d_ub=16 steps=20000 id=C2xC2xC2_c00446
[pilot] MEAS n=288 k=4 dx_ub=20 dz_ub=20 d_ub=20 steps=20000 id=C2xC2xC2_c00449
[saved] id=C2xC2xC2_c00449 -> results/c2xc2xc2_d16_20260121_033528/promising/C2xC2xC2_c00449 (reason: d>=sqrt(n))
[best_by_k] group=C2xC2xC2 n=288
k  | d_ub | steps | dx_ub | dz_ub | id
 4 |   20 | 20000 |    20 |    20 | C2xC2xC2_c00084
 8 |   16 | 20000 |    17 |    16 | C2xC2xC2_c00252
[coverage] group=C2xC2xC2 A_sel=128 B_sel=128 Q_meas=27 ratio_ge_sqrt=0.000 ratio_sel=0.002
[coverage] run summary:
[coverage] group=C2xC2xC2 A_sel=128 B_sel=128 Q_meas=27 ratio_ge_sqrt=0.000 ratio_sel=0.002
[summary] best-by-k (measured; includes rejects):
  k=4 best_d_ub=20 count_measured=22 example_id=C2xC2xC2_c00084
  k=8 best_d_ub=16 count_measured=5 example_id=C2xC2xC2_c00252
[summary] best-by-k (survivors; target=16):
  k=4 best_d_ub=20 count_survivors=21 example_id=C2xC2xC2_c00084
  k=8 best_d_ub=16 count_survivors=3 example_id=C2xC2xC2_c00252
[pilot] top results:
  01 group=C2xC2xC2 n=288 k=4 d_ub=20 permA=8 permB=11 saved=True
  02 group=C2xC2xC2 n=288 k=4 d_ub=20 permA=27 permB=8 saved=True
  03 group=C2xC2xC2 n=288 k=4 d_ub=20 permA=27 permB=7 saved=True
  04 group=C2xC2xC2 n=288 k=4 d_ub=20 permA=27 permB=20 saved=True
  05 group=C2xC2xC2 n=288 k=4 d_ub=20 permA=27 permB=11 saved=True
  06 group=C2xC2xC2 n=288 k=4 d_ub=20 permA=8 permB=27 saved=True
  07 group=C2xC2xC2 n=288 k=4 d_ub=20 permA=11 permB=20 saved=True
  08 group=C2xC2xC2 n=288 k=4 d_ub=19 permA=11 permB=11 saved=True
  09 group=C2xC2xC2 n=288 k=4 d_ub=18 permA=20 permB=11 saved=True
  10 group=C2xC2xC2 n=288 k=4 d_ub=18 permA=12 permB=27 saved=True

