=== mar. 20 janv. 2026 18:10:57 CET steps=5000 batch=102 seed=1768922205 ===
[pilot] base k_table top pairs:
  k_base=18 permA=0 permB=0
  k_base=12 permA=29 permB=0
  k_base=12 permA=22 permB=0
  k_base=12 permA=13 permB=0
  k_base=12 permA=6 permB=0
[pilot] A multisets raw=792 (expected=792) enum_mode=multiset cayley_unique=26 perms=30 -> total scored = 780
[pilot] B multisets raw=792 (expected=792) enum_mode=multiset cayley_unique=26 perms=30 -> total scored = 780
[pilot] A frontier kept 128 candidates with points: (4,20), (0,49)
[pilot] B frontier kept 128 candidates with points: (4,20), (0,49)
[pilot] C2xC2xC2 n=288 d0=17 A_sets=26*30 -> keep 128; B_sets=26*30 -> keep 128
[pilot] TARGET_REJECT d_ub=13 target=16 id=C2xC2xC2_c00035
[pilot] TARGET_REJECT d_ub=14 target=16 id=C2xC2xC2_c00047
[pilot] MEAS n=288 k=4 dx_ub=19 dz_ub=17 d_ub=17 steps=5000 id=C2xC2xC2_c00059
[saved] id=C2xC2xC2_c00059 -> results/c2xc2xc2_d16_20260120_181057/promising/C2xC2xC2_c00059 (reason: d>=sqrt(n))
[pilot] MEAS n=288 k=4 dx_ub=20 dz_ub=20 d_ub=20 steps=5000 id=C2xC2xC2_c00069
[saved] id=C2xC2xC2_c00069 -> results/c2xc2xc2_d16_20260120_181057/promising/C2xC2xC2_c00069 (reason: d>=sqrt(n))
[pilot] TARGET_REJECT d_ub=12 target=16 id=C2xC2xC2_c00085
[pilot] TARGET_REJECT d_ub=12 target=16 id=C2xC2xC2_c00108
[pilot] MEAS n=288 k=8 dx_ub=16 dz_ub=17 d_ub=16 steps=5000 id=C2xC2xC2_c00122
[pilot] MEAS n=288 k=4 dx_ub=16 dz_ub=17 d_ub=16 steps=5000 id=C2xC2xC2_c00129
[pilot] MEAS n=288 k=4 dx_ub=23 dz_ub=20 d_ub=20 steps=5000 id=C2xC2xC2_c00146
[saved] id=C2xC2xC2_c00146 -> results/c2xc2xc2_d16_20260120_181057/promising/C2xC2xC2_c00146 (reason: d>=sqrt(n))
[pilot] MEAS n=288 k=4 dx_ub=16 dz_ub=20 d_ub=16 steps=5000 id=C2xC2xC2_c00151
[pilot] TARGET_REJECT d_ub=12 target=16 id=C2xC2xC2_c00156
[pilot] MEAS n=288 k=4 dx_ub=16 dz_ub=20 d_ub=16 steps=5000 id=C2xC2xC2_c00170
[pilot] TARGET_REJECT d_ub=14 target=16 id=C2xC2xC2_c00197
[pilot] MEAS n=288 k=4 dx_ub=17 dz_ub=20 d_ub=17 steps=5000 id=C2xC2xC2_c00205
[saved] id=C2xC2xC2_c00205 -> results/c2xc2xc2_d16_20260120_181057/promising/C2xC2xC2_c00205 (reason: d>=sqrt(n))
[pilot] MEAS n=288 k=4 dx_ub=20 dz_ub=20 d_ub=20 steps=5000 id=C2xC2xC2_c00215
[saved] id=C2xC2xC2_c00215 -> results/c2xc2xc2_d16_20260120_181057/promising/C2xC2xC2_c00215 (reason: d>=sqrt(n))
[pilot] TARGET_REJECT d_ub=14 target=16 id=C2xC2xC2_c00228
[pilot] TARGET_REJECT d_ub=12 target=16 id=C2xC2xC2_c00248
[pilot] MEAS n=288 k=4 dx_ub=20 dz_ub=20 d_ub=20 steps=5000 id=C2xC2xC2_c00250
[saved] id=C2xC2xC2_c00250 -> results/c2xc2xc2_d16_20260120_181057/promising/C2xC2xC2_c00250 (reason: d>=sqrt(n))
[pilot] MEAS n=288 k=4 dx_ub=20 dz_ub=20 d_ub=20 steps=5000 id=C2xC2xC2_c00265
[saved] id=C2xC2xC2_c00265 -> results/c2xc2xc2_d16_20260120_181057/promising/C2xC2xC2_c00265 (reason: d>=sqrt(n))
[pilot] TARGET_REJECT d_ub=12 target=16 id=C2xC2xC2_c00311
[pilot] MEAS n=288 k=4 dx_ub=16 dz_ub=17 d_ub=16 steps=5000 id=C2xC2xC2_c00342
[pilot] MEAS n=288 k=4 dx_ub=19 dz_ub=23 d_ub=19 steps=5000 id=C2xC2xC2_c00354
[saved] id=C2xC2xC2_c00354 -> results/c2xc2xc2_d16_20260120_181057/promising/C2xC2xC2_c00354 (reason: d>=sqrt(n))
[pilot] MEAS n=288 k=4 dx_ub=19 dz_ub=20 d_ub=19 steps=5000 id=C2xC2xC2_c00381
[saved] id=C2xC2xC2_c00381 -> results/c2xc2xc2_d16_20260120_181057/promising/C2xC2xC2_c00381 (reason: d>=sqrt(n))
[pilot] MEAS n=288 k=4 dx_ub=20 dz_ub=20 d_ub=20 steps=5000 id=C2xC2xC2_c00382
[saved] id=C2xC2xC2_c00382 -> results/c2xc2xc2_d16_20260120_181057/promising/C2xC2xC2_c00382 (reason: d>=sqrt(n))
[pilot] MEAS n=288 k=4 dx_ub=20 dz_ub=20 d_ub=20 steps=5000 id=C2xC2xC2_c00387
[saved] id=C2xC2xC2_c00387 -> results/c2xc2xc2_d16_20260120_181057/promising/C2xC2xC2_c00387 (reason: d>=sqrt(n))
[pilot] MEAS n=288 k=8 dx_ub=17 dz_ub=16 d_ub=16 steps=5000 id=C2xC2xC2_c00393
[pilot] MEAS n=288 k=8 dx_ub=20 dz_ub=16 d_ub=16 steps=5000 id=C2xC2xC2_c00428
[pilot] MEAS n=288 k=8 dx_ub=16 dz_ub=17 d_ub=16 steps=5000 id=C2xC2xC2_c00443
[pilot] MEAS n=288 k=4 dx_ub=20 dz_ub=20 d_ub=20 steps=5000 id=C2xC2xC2_c00445
[saved] id=C2xC2xC2_c00445 -> results/c2xc2xc2_d16_20260120_181057/promising/C2xC2xC2_c00445 (reason: d>=sqrt(n))
[pilot] MEAS n=288 k=4 dx_ub=17 dz_ub=20 d_ub=17 steps=5000 id=C2xC2xC2_c00493
[saved] id=C2xC2xC2_c00493 -> results/c2xc2xc2_d16_20260120_181057/promising/C2xC2xC2_c00493 (reason: d>=sqrt(n))
[pilot] MEAS n=288 k=4 dx_ub=20 dz_ub=20 d_ub=20 steps=5000 id=C2xC2xC2_c00497
[saved] id=C2xC2xC2_c00497 -> results/c2xc2xc2_d16_20260120_181057/promising/C2xC2xC2_c00497 (reason: d>=sqrt(n))
[best_by_k] group=C2xC2xC2 n=288
k  | d_ub | steps | dx_ub | dz_ub | id
 4 |   20 |  5000 |    20 |    20 | C2xC2xC2_c00069
 8 |   16 |  5000 |    16 |    17 | C2xC2xC2_c00122
[coverage] group=C2xC2xC2 A_sel=128 B_sel=128 Q_meas=31 ratio_ge_sqrt=0.001 ratio_sel=0.002
[coverage] run summary:
[coverage] group=C2xC2xC2 A_sel=128 B_sel=128 Q_meas=31 ratio_ge_sqrt=0.001 ratio_sel=0.002
[summary] best-by-k (measured; includes rejects):
  k=4 best_d_ub=20 count_measured=20 example_id=C2xC2xC2_c00069
  k=8 best_d_ub=16 count_measured=11 example_id=C2xC2xC2_c00122
[summary] best-by-k (survivors; target=16):
  k=4 best_d_ub=20 count_survivors=18 example_id=C2xC2xC2_c00069
  k=8 best_d_ub=16 count_survivors=4 example_id=C2xC2xC2_c00122
[pilot] top results:
  01 group=C2xC2xC2 n=288 k=4 d_ub=20 permA=11 permB=12 saved=True
  02 group=C2xC2xC2 n=288 k=4 d_ub=20 permA=11 permB=11 saved=True
  03 group=C2xC2xC2 n=288 k=4 d_ub=20 permA=8 permB=11 saved=True
  04 group=C2xC2xC2 n=288 k=4 d_ub=20 permA=7 permB=20 saved=True
  05 group=C2xC2xC2 n=288 k=4 d_ub=20 permA=27 permB=27 saved=True
  06 group=C2xC2xC2 n=288 k=4 d_ub=20 permA=11 permB=20 saved=True
  07 group=C2xC2xC2 n=288 k=4 d_ub=20 permA=11 permB=11 saved=True
  08 group=C2xC2xC2 n=288 k=4 d_ub=20 permA=12 permB=12 saved=True
  09 group=C2xC2xC2 n=288 k=4 d_ub=20 permA=12 permB=12 saved=True
  10 group=C2xC2xC2 n=288 k=4 d_ub=19 permA=20 permB=11 saved=True

