=== mer. 21 janv. 2026 06:17:42 CET steps=20000 batch=35 seed=1768937138 ===
[pilot] base k_table top pairs:
  k_base=18 permA=0 permB=0
  k_base=12 permA=29 permB=0
  k_base=12 permA=22 permB=0
  k_base=12 permA=13 permB=0
  k_base=12 permA=6 permB=0
[pilot] A multisets raw=792 (expected=792) enum_mode=multiset cayley_unique=26 perms=30 -> total scored = 780
[pilot] B multisets raw=792 (expected=792) enum_mode=multiset cayley_unique=26 perms=30 -> total scored = 780
[pilot] A frontier kept 128 candidates with points: (4,20), (0,49)
[pilot] B frontier kept 128 candidates with points: (4,20), (0,49)
[pilot] C2xC2xC2 n=288 d0=17 A_sets=26*30 -> keep 128; B_sets=26*30 -> keep 128
[pilot] TARGET_REJECT d_ub=12 target=16 id=C2xC2xC2_c00004
[pilot] TARGET_REJECT d_ub=14 target=16 id=C2xC2xC2_c00053
[pilot] MEAS n=288 k=4 dx_ub=20 dz_ub=17 d_ub=17 steps=20000 id=C2xC2xC2_c00056
[saved] id=C2xC2xC2_c00056 -> results/c2xc2xc2_d16_20260121_061742/promising/C2xC2xC2_c00056 (reason: d>=sqrt(n))
[pilot] MEAS n=288 k=4 dx_ub=17 dz_ub=17 d_ub=17 steps=20000 id=C2xC2xC2_c00077
[saved] id=C2xC2xC2_c00077 -> results/c2xc2xc2_d16_20260121_061742/promising/C2xC2xC2_c00077 (reason: d>=sqrt(n))
[pilot] MEAS n=288 k=4 dx_ub=17 dz_ub=20 d_ub=17 steps=20000 id=C2xC2xC2_c00099
[saved] id=C2xC2xC2_c00099 -> results/c2xc2xc2_d16_20260121_061742/promising/C2xC2xC2_c00099 (reason: d>=sqrt(n))
[pilot] TARGET_REJECT d_ub=12 target=16 id=C2xC2xC2_c00110
[pilot] MEAS n=288 k=4 dx_ub=16 dz_ub=16 d_ub=16 steps=20000 id=C2xC2xC2_c00139
[pilot] MEAS n=288 k=4 dx_ub=20 dz_ub=18 d_ub=18 steps=20000 id=C2xC2xC2_c00164
[saved] id=C2xC2xC2_c00164 -> results/c2xc2xc2_d16_20260121_061742/promising/C2xC2xC2_c00164 (reason: d>=sqrt(n))
[pilot] MEAS n=288 k=4 dx_ub=20 dz_ub=20 d_ub=20 steps=20000 id=C2xC2xC2_c00214
[saved] id=C2xC2xC2_c00214 -> results/c2xc2xc2_d16_20260121_061742/promising/C2xC2xC2_c00214 (reason: d>=sqrt(n))
[pilot] TARGET_REJECT d_ub=12 target=16 id=C2xC2xC2_c00224
[pilot] MEAS n=288 k=4 dx_ub=16 dz_ub=17 d_ub=16 steps=20000 id=C2xC2xC2_c00225
[pilot] TARGET_REJECT d_ub=12 target=16 id=C2xC2xC2_c00266
[pilot] MEAS n=288 k=8 dx_ub=16 dz_ub=18 d_ub=16 steps=20000 id=C2xC2xC2_c00291
[pilot] MEAS n=288 k=4 dx_ub=20 dz_ub=20 d_ub=20 steps=20000 id=C2xC2xC2_c00293
[saved] id=C2xC2xC2_c00293 -> results/c2xc2xc2_d16_20260121_061742/promising/C2xC2xC2_c00293 (reason: d>=sqrt(n))
[pilot] MEAS n=288 k=4 dx_ub=16 dz_ub=17 d_ub=16 steps=20000 id=C2xC2xC2_c00295
[pilot] MEAS n=288 k=4 dx_ub=20 dz_ub=20 d_ub=20 steps=20000 id=C2xC2xC2_c00300
[saved] id=C2xC2xC2_c00300 -> results/c2xc2xc2_d16_20260121_061742/promising/C2xC2xC2_c00300 (reason: d>=sqrt(n))
[pilot] MEAS n=288 k=4 dx_ub=20 dz_ub=20 d_ub=20 steps=20000 id=C2xC2xC2_c00308
[saved] id=C2xC2xC2_c00308 -> results/c2xc2xc2_d16_20260121_061742/promising/C2xC2xC2_c00308 (reason: d>=sqrt(n))
[pilot] MEAS n=288 k=8 dx_ub=16 dz_ub=17 d_ub=16 steps=20000 id=C2xC2xC2_c00324
[pilot] MEAS n=288 k=4 dx_ub=20 dz_ub=20 d_ub=20 steps=20000 id=C2xC2xC2_c00342
[saved] id=C2xC2xC2_c00342 -> results/c2xc2xc2_d16_20260121_061742/promising/C2xC2xC2_c00342 (reason: d>=sqrt(n))
[pilot] MEAS n=288 k=4 dx_ub=19 dz_ub=20 d_ub=19 steps=20000 id=C2xC2xC2_c00361
[saved] id=C2xC2xC2_c00361 -> results/c2xc2xc2_d16_20260121_061742/promising/C2xC2xC2_c00361 (reason: d>=sqrt(n))
[pilot] MEAS n=288 k=4 dx_ub=20 dz_ub=20 d_ub=20 steps=20000 id=C2xC2xC2_c00427
[saved] id=C2xC2xC2_c00427 -> results/c2xc2xc2_d16_20260121_061742/promising/C2xC2xC2_c00427 (reason: d>=sqrt(n))
[pilot] MEAS n=288 k=8 dx_ub=16 dz_ub=16 d_ub=16 steps=20000 id=C2xC2xC2_c00434
[pilot] TARGET_REJECT d_ub=12 target=16 id=C2xC2xC2_c00435
[pilot] MEAS n=288 k=4 dx_ub=20 dz_ub=20 d_ub=20 steps=20000 id=C2xC2xC2_c00492
[saved] id=C2xC2xC2_c00492 -> results/c2xc2xc2_d16_20260121_061742/promising/C2xC2xC2_c00492 (reason: d>=sqrt(n))
[pilot] MEAS n=288 k=4 dx_ub=20 dz_ub=20 d_ub=20 steps=20000 id=C2xC2xC2_c00495
[saved] id=C2xC2xC2_c00495 -> results/c2xc2xc2_d16_20260121_061742/promising/C2xC2xC2_c00495 (reason: d>=sqrt(n))
[best_by_k] group=C2xC2xC2 n=288
k  | d_ub | steps | dx_ub | dz_ub | id
 4 |   20 | 20000 |    20 |    20 | C2xC2xC2_c00214
 8 |   16 | 20000 |    16 |    18 | C2xC2xC2_c00291
[coverage] group=C2xC2xC2 A_sel=128 B_sel=128 Q_meas=25 ratio_ge_sqrt=0.000 ratio_sel=0.002
[coverage] run summary:
[coverage] group=C2xC2xC2 A_sel=128 B_sel=128 Q_meas=25 ratio_ge_sqrt=0.000 ratio_sel=0.002
[summary] best-by-k (measured; includes rejects):
  k=4 best_d_ub=20 count_measured=20 example_id=C2xC2xC2_c00214
  k=8 best_d_ub=16 count_measured=5 example_id=C2xC2xC2_c00291
[summary] best-by-k (survivors; target=16):
  k=4 best_d_ub=20 count_survivors=16 example_id=C2xC2xC2_c00214
  k=8 best_d_ub=16 count_survivors=3 example_id=C2xC2xC2_c00291
[pilot] top results:
  01 group=C2xC2xC2 n=288 k=4 d_ub=20 permA=8 permB=11 saved=True
  02 group=C2xC2xC2 n=288 k=4 d_ub=20 permA=27 permB=11 saved=True
  03 group=C2xC2xC2 n=288 k=4 d_ub=20 permA=11 permB=11 saved=True
  04 group=C2xC2xC2 n=288 k=4 d_ub=20 permA=27 permB=20 saved=True
  05 group=C2xC2xC2 n=288 k=4 d_ub=20 permA=11 permB=27 saved=True
  06 group=C2xC2xC2 n=288 k=4 d_ub=20 permA=27 permB=20 saved=True
  07 group=C2xC2xC2 n=288 k=4 d_ub=20 permA=7 permB=27 saved=True
  08 group=C2xC2xC2 n=288 k=4 d_ub=20 permA=7 permB=11 saved=True
  09 group=C2xC2xC2 n=288 k=4 d_ub=19 permA=27 permB=27 saved=True
  10 group=C2xC2xC2 n=288 k=4 d_ub=18 permA=20 permB=11 saved=True

