=== mar. 20 janv. 2026 19:16:56 CET steps=20000 batch=2 seed=1768937105 ===
[pilot] base k_table top pairs:
  k_base=18 permA=0 permB=0
  k_base=12 permA=29 permB=0
  k_base=12 permA=22 permB=0
  k_base=12 permA=13 permB=0
  k_base=12 permA=6 permB=0
[pilot] A multisets raw=792 (expected=792) enum_mode=multiset cayley_unique=26 perms=30 -> total scored = 780
[pilot] B multisets raw=792 (expected=792) enum_mode=multiset cayley_unique=26 perms=30 -> total scored = 780
[pilot] A frontier kept 128 candidates with points: (4,20), (0,49)
[pilot] B frontier kept 128 candidates with points: (4,20), (0,49)
[pilot] C2xC2xC2 n=288 d0=17 A_sets=26*30 -> keep 128; B_sets=26*30 -> keep 128
[pilot] TARGET_REJECT d_ub=13 target=16 id=C2xC2xC2_c00019
[pilot] MEAS n=288 k=4 dx_ub=20 dz_ub=19 d_ub=19 steps=20000 id=C2xC2xC2_c00023
[saved] id=C2xC2xC2_c00023 -> results/c2xc2xc2_d16_20260120_191656/promising/C2xC2xC2_c00023 (reason: d>=sqrt(n))
[pilot] MEAS n=288 k=4 dx_ub=20 dz_ub=20 d_ub=20 steps=20000 id=C2xC2xC2_c00024
[saved] id=C2xC2xC2_c00024 -> results/c2xc2xc2_d16_20260120_191656/promising/C2xC2xC2_c00024 (reason: d>=sqrt(n))
[pilot] MEAS n=288 k=8 dx_ub=17 dz_ub=16 d_ub=16 steps=20000 id=C2xC2xC2_c00038
[pilot] MEAS n=288 k=4 dx_ub=17 dz_ub=16 d_ub=16 steps=20000 id=C2xC2xC2_c00061
[pilot] TARGET_REJECT d_ub=12 target=16 id=C2xC2xC2_c00084
[pilot] MEAS n=288 k=4 dx_ub=19 dz_ub=20 d_ub=19 steps=20000 id=C2xC2xC2_c00094
[saved] id=C2xC2xC2_c00094 -> results/c2xc2xc2_d16_20260120_191656/promising/C2xC2xC2_c00094 (reason: d>=sqrt(n))
[pilot] MEAS n=288 k=4 dx_ub=16 dz_ub=16 d_ub=16 steps=20000 id=C2xC2xC2_c00143
[pilot] TARGET_REJECT d_ub=14 target=16 id=C2xC2xC2_c00145
[pilot] MEAS n=288 k=8 dx_ub=16 dz_ub=18 d_ub=16 steps=20000 id=C2xC2xC2_c00152
[pilot] TARGET_REJECT d_ub=12 target=16 id=C2xC2xC2_c00153
[pilot] MEAS n=288 k=4 dx_ub=17 dz_ub=20 d_ub=17 steps=20000 id=C2xC2xC2_c00155
[saved] id=C2xC2xC2_c00155 -> results/c2xc2xc2_d16_20260120_191656/promising/C2xC2xC2_c00155 (reason: d>=sqrt(n))
[pilot] TARGET_REJECT d_ub=12 target=16 id=C2xC2xC2_c00165
[pilot] MEAS n=288 k=4 dx_ub=17 dz_ub=16 d_ub=16 steps=20000 id=C2xC2xC2_c00176
[pilot] MEAS n=288 k=4 dx_ub=20 dz_ub=20 d_ub=20 steps=20000 id=C2xC2xC2_c00199
[saved] id=C2xC2xC2_c00199 -> results/c2xc2xc2_d16_20260120_191656/promising/C2xC2xC2_c00199 (reason: d>=sqrt(n))
[pilot] MEAS n=288 k=4 dx_ub=19 dz_ub=20 d_ub=19 steps=20000 id=C2xC2xC2_c00211
[saved] id=C2xC2xC2_c00211 -> results/c2xc2xc2_d16_20260120_191656/promising/C2xC2xC2_c00211 (reason: d>=sqrt(n))
[pilot] MEAS n=288 k=4 dx_ub=19 dz_ub=20 d_ub=19 steps=20000 id=C2xC2xC2_c00237
[saved] id=C2xC2xC2_c00237 -> results/c2xc2xc2_d16_20260120_191656/promising/C2xC2xC2_c00237 (reason: d>=sqrt(n))
[pilot] MEAS n=288 k=4 dx_ub=20 dz_ub=17 d_ub=17 steps=20000 id=C2xC2xC2_c00280
[saved] id=C2xC2xC2_c00280 -> results/c2xc2xc2_d16_20260120_191656/promising/C2xC2xC2_c00280 (reason: d>=sqrt(n))
[pilot] MEAS n=288 k=4 dx_ub=16 dz_ub=16 d_ub=16 steps=20000 id=C2xC2xC2_c00301
[pilot] MEAS n=288 k=4 dx_ub=20 dz_ub=20 d_ub=20 steps=20000 id=C2xC2xC2_c00341
[saved] id=C2xC2xC2_c00341 -> results/c2xc2xc2_d16_20260120_191656/promising/C2xC2xC2_c00341 (reason: d>=sqrt(n))
[pilot] MEAS n=288 k=4 dx_ub=17 dz_ub=16 d_ub=16 steps=20000 id=C2xC2xC2_c00370
[pilot] MEAS n=288 k=4 dx_ub=20 dz_ub=20 d_ub=20 steps=20000 id=C2xC2xC2_c00379
[saved] id=C2xC2xC2_c00379 -> results/c2xc2xc2_d16_20260120_191656/promising/C2xC2xC2_c00379 (reason: d>=sqrt(n))
[pilot] MEAS n=288 k=8 dx_ub=16 dz_ub=17 d_ub=16 steps=20000 id=C2xC2xC2_c00409
[pilot] TARGET_REJECT d_ub=12 target=16 id=C2xC2xC2_c00412
[pilot] TARGET_REJECT d_ub=12 target=16 id=C2xC2xC2_c00435
[pilot] MEAS n=288 k=4 dx_ub=20 dz_ub=16 d_ub=16 steps=20000 id=C2xC2xC2_c00448
[pilot] MEAS n=288 k=4 dx_ub=18 dz_ub=20 d_ub=18 steps=20000 id=C2xC2xC2_c00486
[saved] id=C2xC2xC2_c00486 -> results/c2xc2xc2_d16_20260120_191656/promising/C2xC2xC2_c00486 (reason: d>=sqrt(n))
[best_by_k] group=C2xC2xC2 n=288
k  | d_ub | steps | dx_ub | dz_ub | id
 4 |   20 | 20000 |    20 |    20 | C2xC2xC2_c00024
 8 |   16 | 20000 |    17 |    16 | C2xC2xC2_c00038
[coverage] group=C2xC2xC2 A_sel=128 B_sel=128 Q_meas=27 ratio_ge_sqrt=0.000 ratio_sel=0.002
[coverage] run summary:
[coverage] group=C2xC2xC2 A_sel=128 B_sel=128 Q_meas=27 ratio_ge_sqrt=0.000 ratio_sel=0.002
[summary] best-by-k (measured; includes rejects):
  k=4 best_d_ub=20 count_measured=19 example_id=C2xC2xC2_c00024
  k=8 best_d_ub=16 count_measured=8 example_id=C2xC2xC2_c00038
[summary] best-by-k (survivors; target=16):
  k=4 best_d_ub=20 count_survivors=17 example_id=C2xC2xC2_c00024
  k=8 best_d_ub=16 count_survivors=3 example_id=C2xC2xC2_c00038
[pilot] top results:
  01 group=C2xC2xC2 n=288 k=4 d_ub=20 permA=7 permB=8 saved=True
  02 group=C2xC2xC2 n=288 k=4 d_ub=20 permA=20 permB=12 saved=True
  03 group=C2xC2xC2 n=288 k=4 d_ub=20 permA=20 permB=7 saved=True
  04 group=C2xC2xC2 n=288 k=4 d_ub=20 permA=27 permB=7 saved=True
  05 group=C2xC2xC2 n=288 k=4 d_ub=19 permA=11 permB=8 saved=True
  06 group=C2xC2xC2 n=288 k=4 d_ub=19 permA=27 permB=11 saved=True
  07 group=C2xC2xC2 n=288 k=4 d_ub=19 permA=20 permB=11 saved=True
  08 group=C2xC2xC2 n=288 k=4 d_ub=19 permA=27 permB=20 saved=True
  09 group=C2xC2xC2 n=288 k=4 d_ub=18 permA=8 permB=7 saved=True
  10 group=C2xC2xC2 n=288 k=4 d_ub=17 permA=7 permB=11 saved=True

