=== mar. 20 janv. 2026 15:13:25 CET steps=5000 batch=42 seed=1768922145 ===
[pilot] base k_table top pairs:
  k_base=18 permA=0 permB=0
  k_base=12 permA=29 permB=0
  k_base=12 permA=22 permB=0
  k_base=12 permA=13 permB=0
  k_base=12 permA=6 permB=0
[pilot] A multisets raw=792 (expected=792) enum_mode=multiset cayley_unique=26 perms=30 -> total scored = 780
[pilot] B multisets raw=792 (expected=792) enum_mode=multiset cayley_unique=26 perms=30 -> total scored = 780
[pilot] A frontier kept 128 candidates with points: (4,20), (0,49)
[pilot] B frontier kept 128 candidates with points: (4,20), (0,49)
[pilot] C2xC2xC2 n=288 d0=17 A_sets=26*30 -> keep 128; B_sets=26*30 -> keep 128
[pilot] MEAS n=288 k=4 dx_ub=16 dz_ub=16 d_ub=16 steps=5000 id=C2xC2xC2_c00007
[pilot] TARGET_REJECT d_ub=12 target=16 id=C2xC2xC2_c00022
[pilot] MEAS n=288 k=4 dx_ub=20 dz_ub=20 d_ub=20 steps=5000 id=C2xC2xC2_c00048
[saved] id=C2xC2xC2_c00048 -> results/c2xc2xc2_d16_20260120_151325/promising/C2xC2xC2_c00048 (reason: d>=sqrt(n))
[pilot] TARGET_REJECT d_ub=12 target=16 id=C2xC2xC2_c00060
[pilot] MEAS n=288 k=4 dx_ub=16 dz_ub=16 d_ub=16 steps=5000 id=C2xC2xC2_c00061
[pilot] MEAS n=288 k=4 dx_ub=20 dz_ub=20 d_ub=20 steps=5000 id=C2xC2xC2_c00099
[saved] id=C2xC2xC2_c00099 -> results/c2xc2xc2_d16_20260120_151325/promising/C2xC2xC2_c00099 (reason: d>=sqrt(n))
[pilot] TARGET_REJECT d_ub=15 target=16 id=C2xC2xC2_c00109
[pilot] MEAS n=288 k=4 dx_ub=19 dz_ub=20 d_ub=19 steps=5000 id=C2xC2xC2_c00121
[saved] id=C2xC2xC2_c00121 -> results/c2xc2xc2_d16_20260120_151325/promising/C2xC2xC2_c00121 (reason: d>=sqrt(n))
[pilot] MEAS n=288 k=4 dx_ub=17 dz_ub=20 d_ub=17 steps=5000 id=C2xC2xC2_c00124
[saved] id=C2xC2xC2_c00124 -> results/c2xc2xc2_d16_20260120_151325/promising/C2xC2xC2_c00124 (reason: d>=sqrt(n))
[pilot] MEAS n=288 k=4 dx_ub=17 dz_ub=17 d_ub=17 steps=5000 id=C2xC2xC2_c00141
[saved] id=C2xC2xC2_c00141 -> results/c2xc2xc2_d16_20260120_151325/promising/C2xC2xC2_c00141 (reason: d>=sqrt(n))
[pilot] MEAS n=288 k=4 dx_ub=20 dz_ub=21 d_ub=20 steps=5000 id=C2xC2xC2_c00152
[saved] id=C2xC2xC2_c00152 -> results/c2xc2xc2_d16_20260120_151325/promising/C2xC2xC2_c00152 (reason: d>=sqrt(n))
[pilot] TARGET_REJECT d_ub=6 target=16 id=C2xC2xC2_c00153
[pilot] MEAS n=288 k=4 dx_ub=20 dz_ub=20 d_ub=20 steps=5000 id=C2xC2xC2_c00159
[saved] id=C2xC2xC2_c00159 -> results/c2xc2xc2_d16_20260120_151325/promising/C2xC2xC2_c00159 (reason: d>=sqrt(n))
[pilot] MEAS n=288 k=4 dx_ub=20 dz_ub=19 d_ub=19 steps=5000 id=C2xC2xC2_c00166
[saved] id=C2xC2xC2_c00166 -> results/c2xc2xc2_d16_20260120_151325/promising/C2xC2xC2_c00166 (reason: d>=sqrt(n))
[pilot] TARGET_REJECT d_ub=12 target=16 id=C2xC2xC2_c00186
[pilot] TARGET_REJECT d_ub=6 target=16 id=C2xC2xC2_c00191
[pilot] MEAS n=288 k=4 dx_ub=20 dz_ub=17 d_ub=17 steps=5000 id=C2xC2xC2_c00206
[saved] id=C2xC2xC2_c00206 -> results/c2xc2xc2_d16_20260120_151325/promising/C2xC2xC2_c00206 (reason: d>=sqrt(n))
[pilot] MEAS n=288 k=4 dx_ub=20 dz_ub=22 d_ub=20 steps=5000 id=C2xC2xC2_c00267
[saved] id=C2xC2xC2_c00267 -> results/c2xc2xc2_d16_20260120_151325/promising/C2xC2xC2_c00267 (reason: d>=sqrt(n))
[pilot] MEAS n=288 k=4 dx_ub=20 dz_ub=20 d_ub=20 steps=5000 id=C2xC2xC2_c00288
[saved] id=C2xC2xC2_c00288 -> results/c2xc2xc2_d16_20260120_151325/promising/C2xC2xC2_c00288 (reason: d>=sqrt(n))
[pilot] TARGET_REJECT d_ub=13 target=16 id=C2xC2xC2_c00367
[pilot] MEAS n=288 k=8 dx_ub=16 dz_ub=18 d_ub=16 steps=5000 id=C2xC2xC2_c00390
[pilot] MEAS n=288 k=4 dx_ub=16 dz_ub=16 d_ub=16 steps=5000 id=C2xC2xC2_c00407
[pilot] TARGET_REJECT d_ub=12 target=16 id=C2xC2xC2_c00478
[pilot] MEAS n=288 k=4 dx_ub=16 dz_ub=17 d_ub=16 steps=5000 id=C2xC2xC2_c00491
[best_by_k] group=C2xC2xC2 n=288
k  | d_ub | steps | dx_ub | dz_ub | id
 4 |   20 |  5000 |    20 |    20 | C2xC2xC2_c00048
 8 |   16 |  5000 |    16 |    18 | C2xC2xC2_c00390
[coverage] group=C2xC2xC2 A_sel=128 B_sel=128 Q_meas=24 ratio_ge_sqrt=0.000 ratio_sel=0.001
[coverage] run summary:
[coverage] group=C2xC2xC2 A_sel=128 B_sel=128 Q_meas=24 ratio_ge_sqrt=0.000 ratio_sel=0.001
[summary] best-by-k (measured; includes rejects):
  k=4 best_d_ub=20 count_measured=17 example_id=C2xC2xC2_c00048
  k=8 best_d_ub=16 count_measured=7 example_id=C2xC2xC2_c00390
[summary] best-by-k (survivors; target=16):
  k=4 best_d_ub=20 count_survivors=15 example_id=C2xC2xC2_c00048
  k=8 best_d_ub=16 count_survivors=1 example_id=C2xC2xC2_c00390
[pilot] top results:
  01 group=C2xC2xC2 n=288 k=4 d_ub=20 permA=27 permB=12 saved=True
  02 group=C2xC2xC2 n=288 k=4 d_ub=20 permA=27 permB=11 saved=True
  03 group=C2xC2xC2 n=288 k=4 d_ub=20 permA=11 permB=12 saved=True
  04 group=C2xC2xC2 n=288 k=4 d_ub=20 permA=8 permB=11 saved=True
  05 group=C2xC2xC2 n=288 k=4 d_ub=20 permA=8 permB=27 saved=True
  06 group=C2xC2xC2 n=288 k=4 d_ub=20 permA=11 permB=12 saved=True
  07 group=C2xC2xC2 n=288 k=4 d_ub=19 permA=27 permB=20 saved=True
  08 group=C2xC2xC2 n=288 k=4 d_ub=19 permA=27 permB=8 saved=True
  09 group=C2xC2xC2 n=288 k=4 d_ub=17 permA=7 permB=11 saved=True
  10 group=C2xC2xC2 n=288 k=4 d_ub=17 permA=11 permB=27 saved=True

