=== mar. 20 janv. 2026 14:56:50 CET steps=5000 batch=10 seed=1768922113 ===
[pilot] base k_table top pairs:
  k_base=18 permA=0 permB=0
  k_base=12 permA=29 permB=0
  k_base=12 permA=22 permB=0
  k_base=12 permA=13 permB=0
  k_base=12 permA=6 permB=0
[pilot] A multisets raw=792 (expected=792) enum_mode=multiset cayley_unique=26 perms=30 -> total scored = 780
[pilot] B multisets raw=792 (expected=792) enum_mode=multiset cayley_unique=26 perms=30 -> total scored = 780
[pilot] A frontier kept 128 candidates with points: (4,20), (0,49)
[pilot] B frontier kept 128 candidates with points: (4,20), (0,49)
[pilot] C2xC2xC2 n=288 d0=17 A_sets=26*30 -> keep 128; B_sets=26*30 -> keep 128
[pilot] TARGET_REJECT d_ub=14 target=16 id=C2xC2xC2_c00041
[pilot] MEAS n=288 k=4 dx_ub=17 dz_ub=16 d_ub=16 steps=5000 id=C2xC2xC2_c00047
[pilot] MEAS n=288 k=4 dx_ub=20 dz_ub=19 d_ub=19 steps=5000 id=C2xC2xC2_c00052
[saved] id=C2xC2xC2_c00052 -> results/c2xc2xc2_d16_20260120_145650/promising/C2xC2xC2_c00052 (reason: d>=sqrt(n))
[pilot] TARGET_REJECT d_ub=12 target=16 id=C2xC2xC2_c00092
[pilot] TARGET_REJECT d_ub=12 target=16 id=C2xC2xC2_c00104
[pilot] MEAS n=288 k=4 dx_ub=16 dz_ub=16 d_ub=16 steps=5000 id=C2xC2xC2_c00116
[pilot] MEAS n=288 k=4 dx_ub=16 dz_ub=20 d_ub=16 steps=5000 id=C2xC2xC2_c00124
[pilot] MEAS n=288 k=8 dx_ub=16 dz_ub=17 d_ub=16 steps=5000 id=C2xC2xC2_c00165
[pilot] MEAS n=288 k=8 dx_ub=17 dz_ub=16 d_ub=16 steps=5000 id=C2xC2xC2_c00189
[pilot] MEAS n=288 k=4 dx_ub=20 dz_ub=23 d_ub=20 steps=5000 id=C2xC2xC2_c00214
[saved] id=C2xC2xC2_c00214 -> results/c2xc2xc2_d16_20260120_145650/promising/C2xC2xC2_c00214 (reason: d>=sqrt(n))
[pilot] TARGET_REJECT d_ub=14 target=16 id=C2xC2xC2_c00218
[pilot] TARGET_REJECT d_ub=14 target=16 id=C2xC2xC2_c00243
[pilot] MEAS n=288 k=4 dx_ub=23 dz_ub=22 d_ub=22 steps=5000 id=C2xC2xC2_c00244
[saved] id=C2xC2xC2_c00244 -> results/c2xc2xc2_d16_20260120_145650/promising/C2xC2xC2_c00244 (reason: d>=sqrt(n))
[pilot] MEAS n=288 k=4 dx_ub=20 dz_ub=20 d_ub=20 steps=5000 id=C2xC2xC2_c00255
[saved] id=C2xC2xC2_c00255 -> results/c2xc2xc2_d16_20260120_145650/promising/C2xC2xC2_c00255 (reason: d>=sqrt(n))
[pilot] MEAS n=288 k=4 dx_ub=20 dz_ub=20 d_ub=20 steps=5000 id=C2xC2xC2_c00267
[saved] id=C2xC2xC2_c00267 -> results/c2xc2xc2_d16_20260120_145650/promising/C2xC2xC2_c00267 (reason: d>=sqrt(n))
[pilot] MEAS n=288 k=8 dx_ub=16 dz_ub=17 d_ub=16 steps=5000 id=C2xC2xC2_c00279
[pilot] MEAS n=288 k=4 dx_ub=19 dz_ub=20 d_ub=19 steps=5000 id=C2xC2xC2_c00282
[saved] id=C2xC2xC2_c00282 -> results/c2xc2xc2_d16_20260120_145650/promising/C2xC2xC2_c00282 (reason: d>=sqrt(n))
[pilot] MEAS n=288 k=4 dx_ub=16 dz_ub=16 d_ub=16 steps=5000 id=C2xC2xC2_c00286
[pilot] MEAS n=288 k=8 dx_ub=17 dz_ub=16 d_ub=16 steps=5000 id=C2xC2xC2_c00298
[pilot] MEAS n=288 k=4 dx_ub=20 dz_ub=20 d_ub=20 steps=5000 id=C2xC2xC2_c00315
[saved] id=C2xC2xC2_c00315 -> results/c2xc2xc2_d16_20260120_145650/promising/C2xC2xC2_c00315 (reason: d>=sqrt(n))
[pilot] MEAS n=288 k=4 dx_ub=17 dz_ub=20 d_ub=17 steps=5000 id=C2xC2xC2_c00337
[saved] id=C2xC2xC2_c00337 -> results/c2xc2xc2_d16_20260120_145650/promising/C2xC2xC2_c00337 (reason: d>=sqrt(n))
[pilot] MEAS n=288 k=4 dx_ub=20 dz_ub=23 d_ub=20 steps=5000 id=C2xC2xC2_c00340
[saved] id=C2xC2xC2_c00340 -> results/c2xc2xc2_d16_20260120_145650/promising/C2xC2xC2_c00340 (reason: d>=sqrt(n))
[pilot] TARGET_REJECT d_ub=13 target=16 id=C2xC2xC2_c00347
[pilot] TARGET_REJECT d_ub=15 target=16 id=C2xC2xC2_c00351
[pilot] MEAS n=288 k=4 dx_ub=20 dz_ub=22 d_ub=20 steps=5000 id=C2xC2xC2_c00353
[saved] id=C2xC2xC2_c00353 -> results/c2xc2xc2_d16_20260120_145650/promising/C2xC2xC2_c00353 (reason: d>=sqrt(n))
[pilot] MEAS n=288 k=4 dx_ub=16 dz_ub=20 d_ub=16 steps=5000 id=C2xC2xC2_c00369
[pilot] TARGET_REJECT d_ub=15 target=16 id=C2xC2xC2_c00376
[pilot] MEAS n=288 k=4 dx_ub=20 dz_ub=17 d_ub=17 steps=5000 id=C2xC2xC2_c00378
[saved] id=C2xC2xC2_c00378 -> results/c2xc2xc2_d16_20260120_145650/promising/C2xC2xC2_c00378 (reason: d>=sqrt(n))
[pilot] MEAS n=288 k=4 dx_ub=20 dz_ub=20 d_ub=20 steps=5000 id=C2xC2xC2_c00391
[saved] id=C2xC2xC2_c00391 -> results/c2xc2xc2_d16_20260120_145650/promising/C2xC2xC2_c00391 (reason: d>=sqrt(n))
[pilot] MEAS n=288 k=4 dx_ub=16 dz_ub=20 d_ub=16 steps=5000 id=C2xC2xC2_c00401
[pilot] MEAS n=288 k=4 dx_ub=17 dz_ub=17 d_ub=17 steps=5000 id=C2xC2xC2_c00412
[saved] id=C2xC2xC2_c00412 -> results/c2xc2xc2_d16_20260120_145650/promising/C2xC2xC2_c00412 (reason: d>=sqrt(n))
[pilot] TARGET_REJECT d_ub=12 target=16 id=C2xC2xC2_c00423
[pilot] MEAS n=288 k=4 dx_ub=20 dz_ub=22 d_ub=20 steps=5000 id=C2xC2xC2_c00479
[saved] id=C2xC2xC2_c00479 -> results/c2xc2xc2_d16_20260120_145650/promising/C2xC2xC2_c00479 (reason: d>=sqrt(n))
[best_by_k] group=C2xC2xC2 n=288
k  | d_ub | steps | dx_ub | dz_ub | id
 4 |   22 |  5000 |    23 |    22 | C2xC2xC2_c00244
 8 |   16 |  5000 |    16 |    17 | C2xC2xC2_c00165
[coverage] group=C2xC2xC2 A_sel=128 B_sel=128 Q_meas=33 ratio_ge_sqrt=0.001 ratio_sel=0.002
[coverage] run summary:
[coverage] group=C2xC2xC2 A_sel=128 B_sel=128 Q_meas=33 ratio_ge_sqrt=0.001 ratio_sel=0.002
[summary] best-by-k (measured; includes rejects):
  k=4 best_d_ub=22 count_measured=23 example_id=C2xC2xC2_c00244
  k=8 best_d_ub=16 count_measured=10 example_id=C2xC2xC2_c00165
[summary] best-by-k (survivors; target=16):
  k=4 best_d_ub=22 count_survivors=20 example_id=C2xC2xC2_c00244
  k=8 best_d_ub=16 count_survivors=4 example_id=C2xC2xC2_c00165
[pilot] top results:
  01 group=C2xC2xC2 n=288 k=4 d_ub=22 permA=7 permB=11 saved=True
  02 group=C2xC2xC2 n=288 k=4 d_ub=20 permA=20 permB=27 saved=True
  03 group=C2xC2xC2 n=288 k=4 d_ub=20 permA=27 permB=27 saved=True
  04 group=C2xC2xC2 n=288 k=4 d_ub=20 permA=7 permB=12 saved=True
  05 group=C2xC2xC2 n=288 k=4 d_ub=20 permA=20 permB=27 saved=True
  06 group=C2xC2xC2 n=288 k=4 d_ub=20 permA=20 permB=8 saved=True
  07 group=C2xC2xC2 n=288 k=4 d_ub=20 permA=11 permB=20 saved=True
  08 group=C2xC2xC2 n=288 k=4 d_ub=20 permA=12 permB=11 saved=True
  09 group=C2xC2xC2 n=288 k=4 d_ub=20 permA=8 permB=12 saved=True
  10 group=C2xC2xC2 n=288 k=4 d_ub=19 permA=11 permB=20 saved=True

