=== mer. 21 janv. 2026 09:55:55 CET steps=20000 batch=45 seed=1768937148 ===
[pilot] base k_table top pairs:
  k_base=18 permA=0 permB=0
  k_base=12 permA=29 permB=0
  k_base=12 permA=22 permB=0
  k_base=12 permA=13 permB=0
  k_base=12 permA=6 permB=0
[pilot] A multisets raw=792 (expected=792) enum_mode=multiset cayley_unique=26 perms=30 -> total scored = 780
[pilot] B multisets raw=792 (expected=792) enum_mode=multiset cayley_unique=26 perms=30 -> total scored = 780
[pilot] A frontier kept 128 candidates with points: (4,20), (0,49)
[pilot] B frontier kept 128 candidates with points: (4,20), (0,49)
[pilot] C2xC2xC2 n=288 d0=17 A_sets=26*30 -> keep 128; B_sets=26*30 -> keep 128
[pilot] MEAS n=288 k=4 dx_ub=16 dz_ub=16 d_ub=16 steps=20000 id=C2xC2xC2_c00003
[pilot] MEAS n=288 k=4 dx_ub=20 dz_ub=20 d_ub=20 steps=20000 id=C2xC2xC2_c00070
[saved] id=C2xC2xC2_c00070 -> results/c2xc2xc2_d16_20260121_095555/promising/C2xC2xC2_c00070 (reason: d>=sqrt(n))
[pilot] MEAS n=288 k=4 dx_ub=16 dz_ub=16 d_ub=16 steps=20000 id=C2xC2xC2_c00072
[pilot] MEAS n=288 k=4 dx_ub=20 dz_ub=18 d_ub=18 steps=20000 id=C2xC2xC2_c00078
[saved] id=C2xC2xC2_c00078 -> results/c2xc2xc2_d16_20260121_095555/promising/C2xC2xC2_c00078 (reason: d>=sqrt(n))
[pilot] MEAS n=288 k=4 dx_ub=20 dz_ub=20 d_ub=20 steps=20000 id=C2xC2xC2_c00102
[saved] id=C2xC2xC2_c00102 -> results/c2xc2xc2_d16_20260121_095555/promising/C2xC2xC2_c00102 (reason: d>=sqrt(n))
[pilot] TARGET_REJECT d_ub=12 target=16 id=C2xC2xC2_c00141
[pilot] MEAS n=288 k=4 dx_ub=20 dz_ub=20 d_ub=20 steps=20000 id=C2xC2xC2_c00146
[saved] id=C2xC2xC2_c00146 -> results/c2xc2xc2_d16_20260121_095555/promising/C2xC2xC2_c00146 (reason: d>=sqrt(n))
[pilot] TARGET_REJECT d_ub=12 target=16 id=C2xC2xC2_c00162
[pilot] MEAS n=288 k=4 dx_ub=16 dz_ub=18 d_ub=16 steps=20000 id=C2xC2xC2_c00212
[pilot] MEAS n=288 k=4 dx_ub=20 dz_ub=20 d_ub=20 steps=20000 id=C2xC2xC2_c00214
[saved] id=C2xC2xC2_c00214 -> results/c2xc2xc2_d16_20260121_095555/promising/C2xC2xC2_c00214 (reason: d>=sqrt(n))
[pilot] TARGET_REJECT d_ub=14 target=16 id=C2xC2xC2_c00225
[pilot] MEAS n=288 k=8 dx_ub=16 dz_ub=17 d_ub=16 steps=20000 id=C2xC2xC2_c00236
[pilot] TARGET_REJECT d_ub=6 target=16 id=C2xC2xC2_c00247
[pilot] MEAS n=288 k=4 dx_ub=20 dz_ub=20 d_ub=20 steps=20000 id=C2xC2xC2_c00249
[saved] id=C2xC2xC2_c00249 -> results/c2xc2xc2_d16_20260121_095555/promising/C2xC2xC2_c00249 (reason: d>=sqrt(n))
[pilot] MEAS n=288 k=4 dx_ub=16 dz_ub=16 d_ub=16 steps=20000 id=C2xC2xC2_c00299
[pilot] MEAS n=288 k=4 dx_ub=20 dz_ub=18 d_ub=18 steps=20000 id=C2xC2xC2_c00313
[saved] id=C2xC2xC2_c00313 -> results/c2xc2xc2_d16_20260121_095555/promising/C2xC2xC2_c00313 (reason: d>=sqrt(n))
[pilot] MEAS n=288 k=4 dx_ub=17 dz_ub=16 d_ub=16 steps=20000 id=C2xC2xC2_c00327
[pilot] MEAS n=288 k=8 dx_ub=16 dz_ub=17 d_ub=16 steps=20000 id=C2xC2xC2_c00343
[pilot] MEAS n=288 k=4 dx_ub=20 dz_ub=17 d_ub=17 steps=20000 id=C2xC2xC2_c00355
[saved] id=C2xC2xC2_c00355 -> results/c2xc2xc2_d16_20260121_095555/promising/C2xC2xC2_c00355 (reason: d>=sqrt(n))
[pilot] TARGET_REJECT d_ub=6 target=16 id=C2xC2xC2_c00392
[pilot] MEAS n=288 k=4 dx_ub=16 dz_ub=18 d_ub=16 steps=20000 id=C2xC2xC2_c00402
[pilot] MEAS n=288 k=4 dx_ub=17 dz_ub=20 d_ub=17 steps=20000 id=C2xC2xC2_c00406
[saved] id=C2xC2xC2_c00406 -> results/c2xc2xc2_d16_20260121_095555/promising/C2xC2xC2_c00406 (reason: d>=sqrt(n))
[pilot] MEAS n=288 k=4 dx_ub=16 dz_ub=17 d_ub=16 steps=20000 id=C2xC2xC2_c00415
[pilot] MEAS n=288 k=4 dx_ub=20 dz_ub=20 d_ub=20 steps=20000 id=C2xC2xC2_c00431
[saved] id=C2xC2xC2_c00431 -> results/c2xc2xc2_d16_20260121_095555/promising/C2xC2xC2_c00431 (reason: d>=sqrt(n))
[pilot] MEAS n=288 k=4 dx_ub=16 dz_ub=16 d_ub=16 steps=20000 id=C2xC2xC2_c00459
[best_by_k] group=C2xC2xC2 n=288
k  | d_ub | steps | dx_ub | dz_ub | id
 4 |   20 | 20000 |    20 |    20 | C2xC2xC2_c00070
 8 |   16 | 20000 |    16 |    17 | C2xC2xC2_c00236
[coverage] group=C2xC2xC2 A_sel=128 B_sel=128 Q_meas=25 ratio_ge_sqrt=0.000 ratio_sel=0.002
[coverage] run summary:
[coverage] group=C2xC2xC2 A_sel=128 B_sel=128 Q_meas=25 ratio_ge_sqrt=0.000 ratio_sel=0.002
[summary] best-by-k (measured; includes rejects):
  k=4 best_d_ub=20 count_measured=19 example_id=C2xC2xC2_c00070
  k=8 best_d_ub=16 count_measured=6 example_id=C2xC2xC2_c00236
[summary] best-by-k (survivors; target=16):
  k=4 best_d_ub=20 count_survivors=18 example_id=C2xC2xC2_c00070
  k=8 best_d_ub=16 count_survivors=2 example_id=C2xC2xC2_c00236
[pilot] top results:
  01 group=C2xC2xC2 n=288 k=4 d_ub=20 permA=11 permB=12 saved=True
  02 group=C2xC2xC2 n=288 k=4 d_ub=20 permA=8 permB=7 saved=True
  03 group=C2xC2xC2 n=288 k=4 d_ub=20 permA=11 permB=20 saved=True
  04 group=C2xC2xC2 n=288 k=4 d_ub=20 permA=11 permB=11 saved=True
  05 group=C2xC2xC2 n=288 k=4 d_ub=20 permA=20 permB=7 saved=True
  06 group=C2xC2xC2 n=288 k=4 d_ub=20 permA=11 permB=11 saved=True
  07 group=C2xC2xC2 n=288 k=4 d_ub=18 permA=20 permB=7 saved=True
  08 group=C2xC2xC2 n=288 k=4 d_ub=18 permA=27 permB=12 saved=True
  09 group=C2xC2xC2 n=288 k=4 d_ub=17 permA=8 permB=7 saved=True
  10 group=C2xC2xC2 n=288 k=4 d_ub=17 permA=7 permB=11 saved=True

