=== mar. 20 janv. 2026 17:58:03 CET steps=5000 batch=97 seed=1768922200 ===
[pilot] base k_table top pairs:
  k_base=18 permA=0 permB=0
  k_base=12 permA=29 permB=0
  k_base=12 permA=22 permB=0
  k_base=12 permA=13 permB=0
  k_base=12 permA=6 permB=0
[pilot] A multisets raw=792 (expected=792) enum_mode=multiset cayley_unique=26 perms=30 -> total scored = 780
[pilot] B multisets raw=792 (expected=792) enum_mode=multiset cayley_unique=26 perms=30 -> total scored = 780
[pilot] A frontier kept 128 candidates with points: (4,20), (0,49)
[pilot] B frontier kept 128 candidates with points: (4,20), (0,49)
[pilot] C2xC2xC2 n=288 d0=17 A_sets=26*30 -> keep 128; B_sets=26*30 -> keep 128
[pilot] MEAS n=288 k=4 dx_ub=20 dz_ub=16 d_ub=16 steps=5000 id=C2xC2xC2_c00015
[pilot] MEAS n=288 k=8 dx_ub=16 dz_ub=18 d_ub=16 steps=5000 id=C2xC2xC2_c00032
[pilot] TARGET_REJECT d_ub=12 target=16 id=C2xC2xC2_c00045
[pilot] MEAS n=288 k=4 dx_ub=20 dz_ub=16 d_ub=16 steps=5000 id=C2xC2xC2_c00062
[pilot] MEAS n=288 k=4 dx_ub=17 dz_ub=17 d_ub=17 steps=5000 id=C2xC2xC2_c00065
[saved] id=C2xC2xC2_c00065 -> results/c2xc2xc2_d16_20260120_175803/promising/C2xC2xC2_c00065 (reason: d>=sqrt(n))
[pilot] MEAS n=288 k=4 dx_ub=20 dz_ub=20 d_ub=20 steps=5000 id=C2xC2xC2_c00081
[saved] id=C2xC2xC2_c00081 -> results/c2xc2xc2_d16_20260120_175803/promising/C2xC2xC2_c00081 (reason: d>=sqrt(n))
[pilot] MEAS n=288 k=4 dx_ub=20 dz_ub=17 d_ub=17 steps=5000 id=C2xC2xC2_c00131
[saved] id=C2xC2xC2_c00131 -> results/c2xc2xc2_d16_20260120_175803/promising/C2xC2xC2_c00131 (reason: d>=sqrt(n))
[pilot] MEAS n=288 k=4 dx_ub=16 dz_ub=20 d_ub=16 steps=5000 id=C2xC2xC2_c00162
[pilot] MEAS n=288 k=4 dx_ub=20 dz_ub=19 d_ub=19 steps=5000 id=C2xC2xC2_c00165
[saved] id=C2xC2xC2_c00165 -> results/c2xc2xc2_d16_20260120_175803/promising/C2xC2xC2_c00165 (reason: d>=sqrt(n))
[pilot] MEAS n=288 k=4 dx_ub=16 dz_ub=16 d_ub=16 steps=5000 id=C2xC2xC2_c00209
[pilot] MEAS n=288 k=4 dx_ub=20 dz_ub=20 d_ub=20 steps=5000 id=C2xC2xC2_c00221
[saved] id=C2xC2xC2_c00221 -> results/c2xc2xc2_d16_20260120_175803/promising/C2xC2xC2_c00221 (reason: d>=sqrt(n))
[pilot] MEAS n=288 k=4 dx_ub=19 dz_ub=21 d_ub=19 steps=5000 id=C2xC2xC2_c00226
[saved] id=C2xC2xC2_c00226 -> results/c2xc2xc2_d16_20260120_175803/promising/C2xC2xC2_c00226 (reason: d>=sqrt(n))
[pilot] MEAS n=288 k=4 dx_ub=17 dz_ub=16 d_ub=16 steps=5000 id=C2xC2xC2_c00292
[pilot] MEAS n=288 k=4 dx_ub=17 dz_ub=16 d_ub=16 steps=5000 id=C2xC2xC2_c00306
[pilot] MEAS n=288 k=4 dx_ub=20 dz_ub=17 d_ub=17 steps=5000 id=C2xC2xC2_c00321
[saved] id=C2xC2xC2_c00321 -> results/c2xc2xc2_d16_20260120_175803/promising/C2xC2xC2_c00321 (reason: d>=sqrt(n))
[pilot] MEAS n=288 k=4 dx_ub=20 dz_ub=21 d_ub=20 steps=5000 id=C2xC2xC2_c00330
[saved] id=C2xC2xC2_c00330 -> results/c2xc2xc2_d16_20260120_175803/promising/C2xC2xC2_c00330 (reason: d>=sqrt(n))
[pilot] TARGET_REJECT d_ub=12 target=16 id=C2xC2xC2_c00402
[pilot] TARGET_REJECT d_ub=12 target=16 id=C2xC2xC2_c00404
[pilot] MEAS n=288 k=4 dx_ub=20 dz_ub=17 d_ub=17 steps=5000 id=C2xC2xC2_c00425
[saved] id=C2xC2xC2_c00425 -> results/c2xc2xc2_d16_20260120_175803/promising/C2xC2xC2_c00425 (reason: d>=sqrt(n))
[pilot] MEAS n=288 k=4 dx_ub=16 dz_ub=19 d_ub=16 steps=5000 id=C2xC2xC2_c00428
[pilot] TARGET_REJECT d_ub=12 target=16 id=C2xC2xC2_c00442
[pilot] MEAS n=288 k=4 dx_ub=19 dz_ub=17 d_ub=17 steps=5000 id=C2xC2xC2_c00460
[saved] id=C2xC2xC2_c00460 -> results/c2xc2xc2_d16_20260120_175803/promising/C2xC2xC2_c00460 (reason: d>=sqrt(n))
[pilot] MEAS n=288 k=8 dx_ub=16 dz_ub=16 d_ub=16 steps=5000 id=C2xC2xC2_c00476
[pilot] TARGET_REJECT d_ub=12 target=16 id=C2xC2xC2_c00482
[best_by_k] group=C2xC2xC2 n=288
k  | d_ub | steps | dx_ub | dz_ub | id
 4 |   20 |  5000 |    20 |    20 | C2xC2xC2_c00081
 8 |   16 |  5000 |    16 |    18 | C2xC2xC2_c00032
[coverage] group=C2xC2xC2 A_sel=128 B_sel=128 Q_meas=24 ratio_ge_sqrt=0.000 ratio_sel=0.001
[coverage] run summary:
[coverage] group=C2xC2xC2 A_sel=128 B_sel=128 Q_meas=24 ratio_ge_sqrt=0.000 ratio_sel=0.001
[summary] best-by-k (measured; includes rejects):
  k=4 best_d_ub=20 count_measured=19 example_id=C2xC2xC2_c00081
  k=8 best_d_ub=16 count_measured=5 example_id=C2xC2xC2_c00032
[summary] best-by-k (survivors; target=16):
  k=4 best_d_ub=20 count_survivors=17 example_id=C2xC2xC2_c00081
  k=8 best_d_ub=16 count_survivors=2 example_id=C2xC2xC2_c00032
[pilot] top results:
  01 group=C2xC2xC2 n=288 k=4 d_ub=20 permA=27 permB=8 saved=True
  02 group=C2xC2xC2 n=288 k=4 d_ub=20 permA=8 permB=11 saved=True
  03 group=C2xC2xC2 n=288 k=4 d_ub=20 permA=27 permB=8 saved=True
  04 group=C2xC2xC2 n=288 k=4 d_ub=19 permA=20 permB=11 saved=True
  05 group=C2xC2xC2 n=288 k=4 d_ub=19 permA=7 permB=8 saved=True
  06 group=C2xC2xC2 n=288 k=4 d_ub=17 permA=20 permB=20 saved=True
  07 group=C2xC2xC2 n=288 k=4 d_ub=17 permA=11 permB=8 saved=True
  08 group=C2xC2xC2 n=288 k=4 d_ub=17 permA=20 permB=7 saved=True
  09 group=C2xC2xC2 n=288 k=4 d_ub=17 permA=20 permB=20 saved=True
  10 group=C2xC2xC2 n=288 k=4 d_ub=17 permA=20 permB=12 saved=True

