=== mar. 20 janv. 2026 15:07:35 CET steps=5000 batch=31 seed=1768922134 ===
[pilot] base k_table top pairs:
  k_base=18 permA=0 permB=0
  k_base=12 permA=29 permB=0
  k_base=12 permA=22 permB=0
  k_base=12 permA=13 permB=0
  k_base=12 permA=6 permB=0
[pilot] A multisets raw=792 (expected=792) enum_mode=multiset cayley_unique=26 perms=30 -> total scored = 780
[pilot] B multisets raw=792 (expected=792) enum_mode=multiset cayley_unique=26 perms=30 -> total scored = 780
[pilot] A frontier kept 128 candidates with points: (4,20), (0,49)
[pilot] B frontier kept 128 candidates with points: (4,20), (0,49)
[pilot] C2xC2xC2 n=288 d0=17 A_sets=26*30 -> keep 128; B_sets=26*30 -> keep 128
[pilot] TARGET_REJECT d_ub=14 target=16 id=C2xC2xC2_c00048
[pilot] MEAS n=288 k=4 dx_ub=20 dz_ub=20 d_ub=20 steps=5000 id=C2xC2xC2_c00060
[saved] id=C2xC2xC2_c00060 -> results/c2xc2xc2_d16_20260120_150735/promising/C2xC2xC2_c00060 (reason: d>=sqrt(n))
[pilot] MEAS n=288 k=4 dx_ub=22 dz_ub=20 d_ub=20 steps=5000 id=C2xC2xC2_c00083
[saved] id=C2xC2xC2_c00083 -> results/c2xc2xc2_d16_20260120_150735/promising/C2xC2xC2_c00083 (reason: d>=sqrt(n))
[pilot] MEAS n=288 k=8 dx_ub=20 dz_ub=16 d_ub=16 steps=5000 id=C2xC2xC2_c00106
[pilot] MEAS n=288 k=4 dx_ub=20 dz_ub=20 d_ub=20 steps=5000 id=C2xC2xC2_c00114
[saved] id=C2xC2xC2_c00114 -> results/c2xc2xc2_d16_20260120_150735/promising/C2xC2xC2_c00114 (reason: d>=sqrt(n))
[pilot] MEAS n=288 k=4 dx_ub=20 dz_ub=20 d_ub=20 steps=5000 id=C2xC2xC2_c00118
[saved] id=C2xC2xC2_c00118 -> results/c2xc2xc2_d16_20260120_150735/promising/C2xC2xC2_c00118 (reason: d>=sqrt(n))
[pilot] TARGET_REJECT d_ub=13 target=16 id=C2xC2xC2_c00139
[pilot] MEAS n=288 k=4 dx_ub=16 dz_ub=17 d_ub=16 steps=5000 id=C2xC2xC2_c00161
[pilot] MEAS n=288 k=4 dx_ub=20 dz_ub=18 d_ub=18 steps=5000 id=C2xC2xC2_c00165
[saved] id=C2xC2xC2_c00165 -> results/c2xc2xc2_d16_20260120_150735/promising/C2xC2xC2_c00165 (reason: d>=sqrt(n))
[pilot] MEAS n=288 k=4 dx_ub=20 dz_ub=16 d_ub=16 steps=5000 id=C2xC2xC2_c00187
[pilot] MEAS n=288 k=4 dx_ub=16 dz_ub=16 d_ub=16 steps=5000 id=C2xC2xC2_c00189
[pilot] MEAS n=288 k=8 dx_ub=16 dz_ub=18 d_ub=16 steps=5000 id=C2xC2xC2_c00200
[pilot] MEAS n=288 k=4 dx_ub=20 dz_ub=19 d_ub=19 steps=5000 id=C2xC2xC2_c00205
[saved] id=C2xC2xC2_c00205 -> results/c2xc2xc2_d16_20260120_150735/promising/C2xC2xC2_c00205 (reason: d>=sqrt(n))
[pilot] TARGET_REJECT d_ub=15 target=16 id=C2xC2xC2_c00210
[pilot] MEAS n=288 k=4 dx_ub=16 dz_ub=16 d_ub=16 steps=5000 id=C2xC2xC2_c00215
[pilot] MEAS n=288 k=8 dx_ub=16 dz_ub=17 d_ub=16 steps=5000 id=C2xC2xC2_c00233
[pilot] MEAS n=288 k=4 dx_ub=20 dz_ub=20 d_ub=20 steps=5000 id=C2xC2xC2_c00281
[saved] id=C2xC2xC2_c00281 -> results/c2xc2xc2_d16_20260120_150735/promising/C2xC2xC2_c00281 (reason: d>=sqrt(n))
[pilot] TARGET_REJECT d_ub=14 target=16 id=C2xC2xC2_c00294
[pilot] MEAS n=288 k=4 dx_ub=16 dz_ub=20 d_ub=16 steps=5000 id=C2xC2xC2_c00304
[pilot] TARGET_REJECT d_ub=11 target=16 id=C2xC2xC2_c00323
[pilot] MEAS n=288 k=4 dx_ub=20 dz_ub=20 d_ub=20 steps=5000 id=C2xC2xC2_c00338
[saved] id=C2xC2xC2_c00338 -> results/c2xc2xc2_d16_20260120_150735/promising/C2xC2xC2_c00338 (reason: d>=sqrt(n))
[pilot] MEAS n=288 k=4 dx_ub=17 dz_ub=20 d_ub=17 steps=5000 id=C2xC2xC2_c00350
[saved] id=C2xC2xC2_c00350 -> results/c2xc2xc2_d16_20260120_150735/promising/C2xC2xC2_c00350 (reason: d>=sqrt(n))
[pilot] MEAS n=288 k=4 dx_ub=20 dz_ub=20 d_ub=20 steps=5000 id=C2xC2xC2_c00351
[saved] id=C2xC2xC2_c00351 -> results/c2xc2xc2_d16_20260120_150735/promising/C2xC2xC2_c00351 (reason: d>=sqrt(n))
[pilot] MEAS n=288 k=8 dx_ub=16 dz_ub=17 d_ub=16 steps=5000 id=C2xC2xC2_c00375
[pilot] TARGET_REJECT d_ub=12 target=16 id=C2xC2xC2_c00380
[pilot] MEAS n=288 k=4 dx_ub=16 dz_ub=16 d_ub=16 steps=5000 id=C2xC2xC2_c00398
[pilot] TARGET_REJECT d_ub=14 target=16 id=C2xC2xC2_c00435
[pilot] MEAS n=288 k=8 dx_ub=16 dz_ub=18 d_ub=16 steps=5000 id=C2xC2xC2_c00457
[best_by_k] group=C2xC2xC2 n=288
k  | d_ub | steps | dx_ub | dz_ub | id
 4 |   20 |  5000 |    20 |    20 | C2xC2xC2_c00060
 8 |   16 |  5000 |    20 |    16 | C2xC2xC2_c00106
[coverage] group=C2xC2xC2 A_sel=128 B_sel=128 Q_meas=28 ratio_ge_sqrt=0.001 ratio_sel=0.002
[coverage] run summary:
[coverage] group=C2xC2xC2 A_sel=128 B_sel=128 Q_meas=28 ratio_ge_sqrt=0.001 ratio_sel=0.002
[summary] best-by-k (measured; includes rejects):
  k=4 best_d_ub=20 count_measured=17 example_id=C2xC2xC2_c00060
  k=8 best_d_ub=16 count_measured=11 example_id=C2xC2xC2_c00106
[summary] best-by-k (survivors; target=16):
  k=4 best_d_ub=20 count_survivors=16 example_id=C2xC2xC2_c00060
  k=8 best_d_ub=16 count_survivors=5 example_id=C2xC2xC2_c00106
[pilot] top results:
  01 group=C2xC2xC2 n=288 k=4 d_ub=20 permA=11 permB=12 saved=True
  02 group=C2xC2xC2 n=288 k=4 d_ub=20 permA=27 permB=11 saved=True
  03 group=C2xC2xC2 n=288 k=4 d_ub=20 permA=8 permB=11 saved=True
  04 group=C2xC2xC2 n=288 k=4 d_ub=20 permA=20 permB=27 saved=True
  05 group=C2xC2xC2 n=288 k=4 d_ub=20 permA=27 permB=8 saved=True
  06 group=C2xC2xC2 n=288 k=4 d_ub=20 permA=20 permB=7 saved=True
  07 group=C2xC2xC2 n=288 k=4 d_ub=20 permA=27 permB=11 saved=True
  08 group=C2xC2xC2 n=288 k=4 d_ub=19 permA=7 permB=8 saved=True
  09 group=C2xC2xC2 n=288 k=4 d_ub=18 permA=11 permB=27 saved=True
  10 group=C2xC2xC2 n=288 k=4 d_ub=17 permA=8 permB=20 saved=True

