=== mar. 20 janv. 2026 14:55:09 CET steps=5000 batch=7 seed=1768922110 ===
[pilot] base k_table top pairs:
  k_base=18 permA=0 permB=0
  k_base=12 permA=29 permB=0
  k_base=12 permA=22 permB=0
  k_base=12 permA=13 permB=0
  k_base=12 permA=6 permB=0
[pilot] A multisets raw=792 (expected=792) enum_mode=multiset cayley_unique=26 perms=30 -> total scored = 780
[pilot] B multisets raw=792 (expected=792) enum_mode=multiset cayley_unique=26 perms=30 -> total scored = 780
[pilot] A frontier kept 128 candidates with points: (4,20), (0,49)
[pilot] B frontier kept 128 candidates with points: (4,20), (0,49)
[pilot] C2xC2xC2 n=288 d0=17 A_sets=26*30 -> keep 128; B_sets=26*30 -> keep 128
[pilot] MEAS n=288 k=8 dx_ub=16 dz_ub=16 d_ub=16 steps=5000 id=C2xC2xC2_c00056
[pilot] MEAS n=288 k=4 dx_ub=16 dz_ub=16 d_ub=16 steps=5000 id=C2xC2xC2_c00071
[pilot] MEAS n=288 k=8 dx_ub=16 dz_ub=18 d_ub=16 steps=5000 id=C2xC2xC2_c00078
[pilot] TARGET_REJECT d_ub=13 target=16 id=C2xC2xC2_c00084
[pilot] MEAS n=288 k=8 dx_ub=16 dz_ub=17 d_ub=16 steps=5000 id=C2xC2xC2_c00126
[pilot] MEAS n=288 k=4 dx_ub=20 dz_ub=20 d_ub=20 steps=5000 id=C2xC2xC2_c00175
[saved] id=C2xC2xC2_c00175 -> results/c2xc2xc2_d16_20260120_145509/promising/C2xC2xC2_c00175 (reason: d>=sqrt(n))
[pilot] MEAS n=288 k=4 dx_ub=20 dz_ub=20 d_ub=20 steps=5000 id=C2xC2xC2_c00193
[saved] id=C2xC2xC2_c00193 -> results/c2xc2xc2_d16_20260120_145509/promising/C2xC2xC2_c00193 (reason: d>=sqrt(n))
[pilot] MEAS n=288 k=4 dx_ub=16 dz_ub=16 d_ub=16 steps=5000 id=C2xC2xC2_c00206
[pilot] MEAS n=288 k=4 dx_ub=19 dz_ub=19 d_ub=19 steps=5000 id=C2xC2xC2_c00216
[saved] id=C2xC2xC2_c00216 -> results/c2xc2xc2_d16_20260120_145509/promising/C2xC2xC2_c00216 (reason: d>=sqrt(n))
[pilot] TARGET_REJECT d_ub=12 target=16 id=C2xC2xC2_c00249
[pilot] MEAS n=288 k=4 dx_ub=20 dz_ub=20 d_ub=20 steps=5000 id=C2xC2xC2_c00271
[saved] id=C2xC2xC2_c00271 -> results/c2xc2xc2_d16_20260120_145509/promising/C2xC2xC2_c00271 (reason: d>=sqrt(n))
[pilot] MEAS n=288 k=4 dx_ub=20 dz_ub=20 d_ub=20 steps=5000 id=C2xC2xC2_c00282
[saved] id=C2xC2xC2_c00282 -> results/c2xc2xc2_d16_20260120_145509/promising/C2xC2xC2_c00282 (reason: d>=sqrt(n))
[pilot] MEAS n=288 k=4 dx_ub=19 dz_ub=20 d_ub=19 steps=5000 id=C2xC2xC2_c00283
[saved] id=C2xC2xC2_c00283 -> results/c2xc2xc2_d16_20260120_145509/promising/C2xC2xC2_c00283 (reason: d>=sqrt(n))
[pilot] TARGET_REJECT d_ub=14 target=16 id=C2xC2xC2_c00346
[pilot] MEAS n=288 k=4 dx_ub=20 dz_ub=18 d_ub=18 steps=5000 id=C2xC2xC2_c00364
[saved] id=C2xC2xC2_c00364 -> results/c2xc2xc2_d16_20260120_145509/promising/C2xC2xC2_c00364 (reason: d>=sqrt(n))
[pilot] TARGET_REJECT d_ub=12 target=16 id=C2xC2xC2_c00377
[pilot] MEAS n=288 k=4 dx_ub=22 dz_ub=20 d_ub=20 steps=5000 id=C2xC2xC2_c00402
[saved] id=C2xC2xC2_c00402 -> results/c2xc2xc2_d16_20260120_145509/promising/C2xC2xC2_c00402 (reason: d>=sqrt(n))
[pilot] MEAS n=288 k=4 dx_ub=19 dz_ub=20 d_ub=19 steps=5000 id=C2xC2xC2_c00411
[saved] id=C2xC2xC2_c00411 -> results/c2xc2xc2_d16_20260120_145509/promising/C2xC2xC2_c00411 (reason: d>=sqrt(n))
[pilot] MEAS n=288 k=4 dx_ub=19 dz_ub=22 d_ub=19 steps=5000 id=C2xC2xC2_c00421
[saved] id=C2xC2xC2_c00421 -> results/c2xc2xc2_d16_20260120_145509/promising/C2xC2xC2_c00421 (reason: d>=sqrt(n))
[pilot] MEAS n=288 k=4 dx_ub=20 dz_ub=20 d_ub=20 steps=5000 id=C2xC2xC2_c00440
[saved] id=C2xC2xC2_c00440 -> results/c2xc2xc2_d16_20260120_145509/promising/C2xC2xC2_c00440 (reason: d>=sqrt(n))
[pilot] TARGET_REJECT d_ub=14 target=16 id=C2xC2xC2_c00446
[pilot] MEAS n=288 k=4 dx_ub=22 dz_ub=20 d_ub=20 steps=5000 id=C2xC2xC2_c00451
[saved] id=C2xC2xC2_c00451 -> results/c2xc2xc2_d16_20260120_145509/promising/C2xC2xC2_c00451 (reason: d>=sqrt(n))
[pilot] TARGET_REJECT d_ub=12 target=16 id=C2xC2xC2_c00499
[best_by_k] group=C2xC2xC2 n=288
k  | d_ub | steps | dx_ub | dz_ub | id
 4 |   20 |  5000 |    20 |    20 | C2xC2xC2_c00175
 8 |   16 |  5000 |    16 |    16 | C2xC2xC2_c00056
[coverage] group=C2xC2xC2 A_sel=128 B_sel=128 Q_meas=23 ratio_ge_sqrt=0.000 ratio_sel=0.001
[coverage] run summary:
[coverage] group=C2xC2xC2 A_sel=128 B_sel=128 Q_meas=23 ratio_ge_sqrt=0.000 ratio_sel=0.001
[summary] best-by-k (measured; includes rejects):
  k=4 best_d_ub=20 count_measured=17 example_id=C2xC2xC2_c00175
  k=8 best_d_ub=16 count_measured=6 example_id=C2xC2xC2_c00056
[summary] best-by-k (survivors; target=16):
  k=4 best_d_ub=20 count_survivors=14 example_id=C2xC2xC2_c00175
  k=8 best_d_ub=16 count_survivors=3 example_id=C2xC2xC2_c00056
[pilot] top results:
  01 group=C2xC2xC2 n=288 k=4 d_ub=20 permA=27 permB=11 saved=True
  02 group=C2xC2xC2 n=288 k=4 d_ub=20 permA=7 permB=27 saved=True
  03 group=C2xC2xC2 n=288 k=4 d_ub=20 permA=11 permB=12 saved=True
  04 group=C2xC2xC2 n=288 k=4 d_ub=20 permA=27 permB=20 saved=True
  05 group=C2xC2xC2 n=288 k=4 d_ub=20 permA=27 permB=20 saved=True
  06 group=C2xC2xC2 n=288 k=4 d_ub=20 permA=7 permB=27 saved=True
  07 group=C2xC2xC2 n=288 k=4 d_ub=20 permA=8 permB=11 saved=True
  08 group=C2xC2xC2 n=288 k=4 d_ub=19 permA=27 permB=11 saved=True
  09 group=C2xC2xC2 n=288 k=4 d_ub=19 permA=7 permB=20 saved=True
  10 group=C2xC2xC2 n=288 k=4 d_ub=19 permA=11 permB=11 saved=True

