=== mar. 20 janv. 2026 14:56:17 CET steps=5000 batch=9 seed=1768922112 ===
[pilot] base k_table top pairs:
  k_base=18 permA=0 permB=0
  k_base=12 permA=29 permB=0
  k_base=12 permA=22 permB=0
  k_base=12 permA=13 permB=0
  k_base=12 permA=6 permB=0
[pilot] A multisets raw=792 (expected=792) enum_mode=multiset cayley_unique=26 perms=30 -> total scored = 780
[pilot] B multisets raw=792 (expected=792) enum_mode=multiset cayley_unique=26 perms=30 -> total scored = 780
[pilot] A frontier kept 128 candidates with points: (4,20), (0,49)
[pilot] B frontier kept 128 candidates with points: (4,20), (0,49)
[pilot] C2xC2xC2 n=288 d0=17 A_sets=26*30 -> keep 128; B_sets=26*30 -> keep 128
[pilot] MEAS n=288 k=4 dx_ub=16 dz_ub=20 d_ub=16 steps=5000 id=C2xC2xC2_c00003
[pilot] MEAS n=288 k=4 dx_ub=20 dz_ub=18 d_ub=18 steps=5000 id=C2xC2xC2_c00029
[saved] id=C2xC2xC2_c00029 -> results/c2xc2xc2_d16_20260120_145617/promising/C2xC2xC2_c00029 (reason: d>=sqrt(n))
[pilot] MEAS n=288 k=4 dx_ub=20 dz_ub=20 d_ub=20 steps=5000 id=C2xC2xC2_c00052
[saved] id=C2xC2xC2_c00052 -> results/c2xc2xc2_d16_20260120_145617/promising/C2xC2xC2_c00052 (reason: d>=sqrt(n))
[pilot] TARGET_REJECT d_ub=12 target=16 id=C2xC2xC2_c00060
[pilot] TARGET_REJECT d_ub=12 target=16 id=C2xC2xC2_c00076
[pilot] TARGET_REJECT d_ub=12 target=16 id=C2xC2xC2_c00083
[pilot] MEAS n=288 k=4 dx_ub=19 dz_ub=17 d_ub=17 steps=5000 id=C2xC2xC2_c00090
[saved] id=C2xC2xC2_c00090 -> results/c2xc2xc2_d16_20260120_145617/promising/C2xC2xC2_c00090 (reason: d>=sqrt(n))
[pilot] MEAS n=288 k=8 dx_ub=17 dz_ub=16 d_ub=16 steps=5000 id=C2xC2xC2_c00094
[pilot] TARGET_REJECT d_ub=6 target=16 id=C2xC2xC2_c00100
[pilot] TARGET_REJECT d_ub=15 target=16 id=C2xC2xC2_c00128
[pilot] TARGET_REJECT d_ub=15 target=16 id=C2xC2xC2_c00131
[pilot] MEAS n=288 k=4 dx_ub=20 dz_ub=20 d_ub=20 steps=5000 id=C2xC2xC2_c00167
[saved] id=C2xC2xC2_c00167 -> results/c2xc2xc2_d16_20260120_145617/promising/C2xC2xC2_c00167 (reason: d>=sqrt(n))
[pilot] MEAS n=288 k=4 dx_ub=19 dz_ub=19 d_ub=19 steps=5000 id=C2xC2xC2_c00183
[saved] id=C2xC2xC2_c00183 -> results/c2xc2xc2_d16_20260120_145617/promising/C2xC2xC2_c00183 (reason: d>=sqrt(n))
[pilot] TARGET_REJECT d_ub=13 target=16 id=C2xC2xC2_c00199
[pilot] TARGET_REJECT d_ub=14 target=16 id=C2xC2xC2_c00200
[pilot] MEAS n=288 k=4 dx_ub=17 dz_ub=20 d_ub=17 steps=5000 id=C2xC2xC2_c00201
[saved] id=C2xC2xC2_c00201 -> results/c2xc2xc2_d16_20260120_145617/promising/C2xC2xC2_c00201 (reason: d>=sqrt(n))
[pilot] MEAS n=288 k=4 dx_ub=20 dz_ub=22 d_ub=20 steps=5000 id=C2xC2xC2_c00220
[saved] id=C2xC2xC2_c00220 -> results/c2xc2xc2_d16_20260120_145617/promising/C2xC2xC2_c00220 (reason: d>=sqrt(n))
[pilot] MEAS n=288 k=4 dx_ub=16 dz_ub=17 d_ub=16 steps=5000 id=C2xC2xC2_c00259
[pilot] MEAS n=288 k=4 dx_ub=17 dz_ub=16 d_ub=16 steps=5000 id=C2xC2xC2_c00278
[pilot] MEAS n=288 k=4 dx_ub=16 dz_ub=20 d_ub=16 steps=5000 id=C2xC2xC2_c00304
[pilot] MEAS n=288 k=4 dx_ub=20 dz_ub=20 d_ub=20 steps=5000 id=C2xC2xC2_c00319
[saved] id=C2xC2xC2_c00319 -> results/c2xc2xc2_d16_20260120_145617/promising/C2xC2xC2_c00319 (reason: d>=sqrt(n))
[pilot] MEAS n=288 k=4 dx_ub=20 dz_ub=20 d_ub=20 steps=5000 id=C2xC2xC2_c00352
[saved] id=C2xC2xC2_c00352 -> results/c2xc2xc2_d16_20260120_145617/promising/C2xC2xC2_c00352 (reason: d>=sqrt(n))
[pilot] TARGET_REJECT d_ub=12 target=16 id=C2xC2xC2_c00372
[pilot] TARGET_REJECT d_ub=12 target=16 id=C2xC2xC2_c00389
[pilot] MEAS n=288 k=4 dx_ub=20 dz_ub=19 d_ub=19 steps=5000 id=C2xC2xC2_c00400
[saved] id=C2xC2xC2_c00400 -> results/c2xc2xc2_d16_20260120_145617/promising/C2xC2xC2_c00400 (reason: d>=sqrt(n))
[pilot] MEAS n=288 k=4 dx_ub=20 dz_ub=16 d_ub=16 steps=5000 id=C2xC2xC2_c00425
[pilot] MEAS n=288 k=4 dx_ub=20 dz_ub=20 d_ub=20 steps=5000 id=C2xC2xC2_c00448
[saved] id=C2xC2xC2_c00448 -> results/c2xc2xc2_d16_20260120_145617/promising/C2xC2xC2_c00448 (reason: d>=sqrt(n))
[pilot] MEAS n=288 k=4 dx_ub=20 dz_ub=20 d_ub=20 steps=5000 id=C2xC2xC2_c00457
[saved] id=C2xC2xC2_c00457 -> results/c2xc2xc2_d16_20260120_145617/promising/C2xC2xC2_c00457 (reason: d>=sqrt(n))
[pilot] TARGET_REJECT d_ub=12 target=16 id=C2xC2xC2_c00480
[best_by_k] group=C2xC2xC2 n=288
k  | d_ub | steps | dx_ub | dz_ub | id
 4 |   20 |  5000 |    20 |    20 | C2xC2xC2_c00052
 8 |   16 |  5000 |    17 |    16 | C2xC2xC2_c00094
[coverage] group=C2xC2xC2 A_sel=128 B_sel=128 Q_meas=29 ratio_ge_sqrt=0.001 ratio_sel=0.002
[coverage] run summary:
[coverage] group=C2xC2xC2 A_sel=128 B_sel=128 Q_meas=29 ratio_ge_sqrt=0.001 ratio_sel=0.002
[summary] best-by-k (measured; includes rejects):
  k=4 best_d_ub=20 count_measured=19 example_id=C2xC2xC2_c00052
  k=8 best_d_ub=16 count_measured=10 example_id=C2xC2xC2_c00094
[summary] best-by-k (survivors; target=16):
  k=4 best_d_ub=20 count_survivors=17 example_id=C2xC2xC2_c00052
  k=8 best_d_ub=16 count_survivors=1 example_id=C2xC2xC2_c00094
[pilot] top results:
  01 group=C2xC2xC2 n=288 k=4 d_ub=20 permA=8 permB=27 saved=True
  02 group=C2xC2xC2 n=288 k=4 d_ub=20 permA=27 permB=11 saved=True
  03 group=C2xC2xC2 n=288 k=4 d_ub=20 permA=20 permB=27 saved=True
  04 group=C2xC2xC2 n=288 k=4 d_ub=20 permA=12 permB=7 saved=True
  05 group=C2xC2xC2 n=288 k=4 d_ub=20 permA=11 permB=7 saved=True
  06 group=C2xC2xC2 n=288 k=4 d_ub=20 permA=11 permB=27 saved=True
  07 group=C2xC2xC2 n=288 k=4 d_ub=20 permA=11 permB=20 saved=True
  08 group=C2xC2xC2 n=288 k=4 d_ub=19 permA=12 permB=11 saved=True
  09 group=C2xC2xC2 n=288 k=4 d_ub=19 permA=8 permB=11 saved=True
  10 group=C2xC2xC2 n=288 k=4 d_ub=18 permA=20 permB=27 saved=True

