=== mar. 20 janv. 2026 22:46:49 CET steps=20000 batch=12 seed=1768937115 ===
[pilot] base k_table top pairs:
  k_base=18 permA=0 permB=0
  k_base=12 permA=29 permB=0
  k_base=12 permA=22 permB=0
  k_base=12 permA=13 permB=0
  k_base=12 permA=6 permB=0
[pilot] A multisets raw=792 (expected=792) enum_mode=multiset cayley_unique=26 perms=30 -> total scored = 780
[pilot] B multisets raw=792 (expected=792) enum_mode=multiset cayley_unique=26 perms=30 -> total scored = 780
[pilot] A frontier kept 128 candidates with points: (4,20), (0,49)
[pilot] B frontier kept 128 candidates with points: (4,20), (0,49)
[pilot] C2xC2xC2 n=288 d0=17 A_sets=26*30 -> keep 128; B_sets=26*30 -> keep 128
[pilot] MEAS n=288 k=4 dx_ub=19 dz_ub=20 d_ub=19 steps=20000 id=C2xC2xC2_c00008
[saved] id=C2xC2xC2_c00008 -> results/c2xc2xc2_d16_20260120_224649/promising/C2xC2xC2_c00008 (reason: d>=sqrt(n))
[pilot] MEAS n=288 k=4 dx_ub=16 dz_ub=20 d_ub=16 steps=20000 id=C2xC2xC2_c00017
[pilot] TARGET_REJECT d_ub=14 target=16 id=C2xC2xC2_c00038
[pilot] MEAS n=288 k=4 dx_ub=20 dz_ub=20 d_ub=20 steps=20000 id=C2xC2xC2_c00060
[saved] id=C2xC2xC2_c00060 -> results/c2xc2xc2_d16_20260120_224649/promising/C2xC2xC2_c00060 (reason: d>=sqrt(n))
[pilot] MEAS n=288 k=4 dx_ub=16 dz_ub=18 d_ub=16 steps=20000 id=C2xC2xC2_c00073
[pilot] TARGET_REJECT d_ub=12 target=16 id=C2xC2xC2_c00081
[pilot] MEAS n=288 k=4 dx_ub=16 dz_ub=17 d_ub=16 steps=20000 id=C2xC2xC2_c00111
[pilot] TARGET_REJECT d_ub=14 target=16 id=C2xC2xC2_c00114
[pilot] MEAS n=288 k=4 dx_ub=16 dz_ub=20 d_ub=16 steps=20000 id=C2xC2xC2_c00167
[pilot] MEAS n=288 k=4 dx_ub=20 dz_ub=18 d_ub=18 steps=20000 id=C2xC2xC2_c00170
[saved] id=C2xC2xC2_c00170 -> results/c2xc2xc2_d16_20260120_224649/promising/C2xC2xC2_c00170 (reason: d>=sqrt(n))
[pilot] MEAS n=288 k=4 dx_ub=19 dz_ub=16 d_ub=16 steps=20000 id=C2xC2xC2_c00174
[pilot] MEAS n=288 k=8 dx_ub=16 dz_ub=17 d_ub=16 steps=20000 id=C2xC2xC2_c00218
[pilot] MEAS n=288 k=4 dx_ub=20 dz_ub=20 d_ub=20 steps=20000 id=C2xC2xC2_c00225
[saved] id=C2xC2xC2_c00225 -> results/c2xc2xc2_d16_20260120_224649/promising/C2xC2xC2_c00225 (reason: d>=sqrt(n))
[pilot] MEAS n=288 k=4 dx_ub=16 dz_ub=16 d_ub=16 steps=20000 id=C2xC2xC2_c00233
[pilot] MEAS n=288 k=4 dx_ub=20 dz_ub=20 d_ub=20 steps=20000 id=C2xC2xC2_c00247
[saved] id=C2xC2xC2_c00247 -> results/c2xc2xc2_d16_20260120_224649/promising/C2xC2xC2_c00247 (reason: d>=sqrt(n))
[pilot] MEAS n=288 k=4 dx_ub=20 dz_ub=20 d_ub=20 steps=20000 id=C2xC2xC2_c00284
[saved] id=C2xC2xC2_c00284 -> results/c2xc2xc2_d16_20260120_224649/promising/C2xC2xC2_c00284 (reason: d>=sqrt(n))
[pilot] TARGET_REJECT d_ub=15 target=16 id=C2xC2xC2_c00309
[pilot] MEAS n=288 k=4 dx_ub=20 dz_ub=20 d_ub=20 steps=20000 id=C2xC2xC2_c00314
[saved] id=C2xC2xC2_c00314 -> results/c2xc2xc2_d16_20260120_224649/promising/C2xC2xC2_c00314 (reason: d>=sqrt(n))
[pilot] MEAS n=288 k=4 dx_ub=20 dz_ub=20 d_ub=20 steps=20000 id=C2xC2xC2_c00329
[saved] id=C2xC2xC2_c00329 -> results/c2xc2xc2_d16_20260120_224649/promising/C2xC2xC2_c00329 (reason: d>=sqrt(n))
[pilot] MEAS n=288 k=4 dx_ub=16 dz_ub=20 d_ub=16 steps=20000 id=C2xC2xC2_c00345
[pilot] MEAS n=288 k=4 dx_ub=20 dz_ub=20 d_ub=20 steps=20000 id=C2xC2xC2_c00348
[saved] id=C2xC2xC2_c00348 -> results/c2xc2xc2_d16_20260120_224649/promising/C2xC2xC2_c00348 (reason: d>=sqrt(n))
[pilot] TARGET_REJECT d_ub=13 target=16 id=C2xC2xC2_c00350
[pilot] MEAS n=288 k=4 dx_ub=20 dz_ub=20 d_ub=20 steps=20000 id=C2xC2xC2_c00387
[saved] id=C2xC2xC2_c00387 -> results/c2xc2xc2_d16_20260120_224649/promising/C2xC2xC2_c00387 (reason: d>=sqrt(n))
[pilot] MEAS n=288 k=8 dx_ub=17 dz_ub=16 d_ub=16 steps=20000 id=C2xC2xC2_c00437
[pilot] TARGET_REJECT d_ub=12 target=16 id=C2xC2xC2_c00452
[pilot] TARGET_REJECT d_ub=12 target=16 id=C2xC2xC2_c00458
[pilot] MEAS n=288 k=4 dx_ub=17 dz_ub=16 d_ub=16 steps=20000 id=C2xC2xC2_c00473
[pilot] MEAS n=288 k=4 dx_ub=20 dz_ub=19 d_ub=19 steps=20000 id=C2xC2xC2_c00496
[saved] id=C2xC2xC2_c00496 -> results/c2xc2xc2_d16_20260120_224649/promising/C2xC2xC2_c00496 (reason: d>=sqrt(n))
[best_by_k] group=C2xC2xC2 n=288
k  | d_ub | steps | dx_ub | dz_ub | id
 4 |   20 | 20000 |    20 |    20 | C2xC2xC2_c00060
 8 |   16 | 20000 |    16 |    17 | C2xC2xC2_c00218
[coverage] group=C2xC2xC2 A_sel=128 B_sel=128 Q_meas=28 ratio_ge_sqrt=0.001 ratio_sel=0.002
[coverage] run summary:
[coverage] group=C2xC2xC2 A_sel=128 B_sel=128 Q_meas=28 ratio_ge_sqrt=0.001 ratio_sel=0.002
[summary] best-by-k (measured; includes rejects):
  k=4 best_d_ub=20 count_measured=23 example_id=C2xC2xC2_c00060
  k=8 best_d_ub=16 count_measured=5 example_id=C2xC2xC2_c00218
[summary] best-by-k (survivors; target=16):
  k=4 best_d_ub=20 count_survivors=19 example_id=C2xC2xC2_c00060
  k=8 best_d_ub=16 count_survivors=2 example_id=C2xC2xC2_c00218
[pilot] top results:
  01 group=C2xC2xC2 n=288 k=4 d_ub=20 permA=7 permB=12 saved=True
  02 group=C2xC2xC2 n=288 k=4 d_ub=20 permA=12 permB=12 saved=True
  03 group=C2xC2xC2 n=288 k=4 d_ub=20 permA=11 permB=11 saved=True
  04 group=C2xC2xC2 n=288 k=4 d_ub=20 permA=27 permB=20 saved=True
  05 group=C2xC2xC2 n=288 k=4 d_ub=20 permA=11 permB=20 saved=True
  06 group=C2xC2xC2 n=288 k=4 d_ub=20 permA=11 permB=20 saved=True
  07 group=C2xC2xC2 n=288 k=4 d_ub=20 permA=27 permB=20 saved=True
  08 group=C2xC2xC2 n=288 k=4 d_ub=20 permA=20 permB=27 saved=True
  09 group=C2xC2xC2 n=288 k=4 d_ub=19 permA=27 permB=11 saved=True
  10 group=C2xC2xC2 n=288 k=4 d_ub=19 permA=11 permB=11 saved=True

