=== mar. 20 janv. 2026 15:21:33 CET steps=5000 batch=57 seed=1768922160 ===
[pilot] base k_table top pairs:
  k_base=18 permA=0 permB=0
  k_base=12 permA=29 permB=0
  k_base=12 permA=22 permB=0
  k_base=12 permA=13 permB=0
  k_base=12 permA=6 permB=0
[pilot] A multisets raw=792 (expected=792) enum_mode=multiset cayley_unique=26 perms=30 -> total scored = 780
[pilot] B multisets raw=792 (expected=792) enum_mode=multiset cayley_unique=26 perms=30 -> total scored = 780
[pilot] A frontier kept 128 candidates with points: (4,20), (0,49)
[pilot] B frontier kept 128 candidates with points: (4,20), (0,49)
[pilot] C2xC2xC2 n=288 d0=17 A_sets=26*30 -> keep 128; B_sets=26*30 -> keep 128
[pilot] TARGET_REJECT d_ub=12 target=16 id=C2xC2xC2_c00021
[pilot] MEAS n=288 k=8 dx_ub=16 dz_ub=17 d_ub=16 steps=5000 id=C2xC2xC2_c00026
[pilot] TARGET_REJECT d_ub=15 target=16 id=C2xC2xC2_c00056
[pilot] TARGET_REJECT d_ub=6 target=16 id=C2xC2xC2_c00082
[pilot] MEAS n=288 k=4 dx_ub=17 dz_ub=20 d_ub=17 steps=5000 id=C2xC2xC2_c00102
[saved] id=C2xC2xC2_c00102 -> results/c2xc2xc2_d16_20260120_152133/promising/C2xC2xC2_c00102 (reason: d>=sqrt(n))
[pilot] TARGET_REJECT d_ub=12 target=16 id=C2xC2xC2_c00112
[pilot] MEAS n=288 k=4 dx_ub=20 dz_ub=20 d_ub=20 steps=5000 id=C2xC2xC2_c00135
[saved] id=C2xC2xC2_c00135 -> results/c2xc2xc2_d16_20260120_152133/promising/C2xC2xC2_c00135 (reason: d>=sqrt(n))
[pilot] TARGET_REJECT d_ub=12 target=16 id=C2xC2xC2_c00152
[pilot] MEAS n=288 k=4 dx_ub=16 dz_ub=16 d_ub=16 steps=5000 id=C2xC2xC2_c00161
[pilot] MEAS n=288 k=4 dx_ub=16 dz_ub=20 d_ub=16 steps=5000 id=C2xC2xC2_c00165
[pilot] MEAS n=288 k=4 dx_ub=20 dz_ub=20 d_ub=20 steps=5000 id=C2xC2xC2_c00172
[saved] id=C2xC2xC2_c00172 -> results/c2xc2xc2_d16_20260120_152133/promising/C2xC2xC2_c00172 (reason: d>=sqrt(n))
[pilot] MEAS n=288 k=4 dx_ub=16 dz_ub=16 d_ub=16 steps=5000 id=C2xC2xC2_c00173
[pilot] MEAS n=288 k=4 dx_ub=16 dz_ub=20 d_ub=16 steps=5000 id=C2xC2xC2_c00176
[pilot] MEAS n=288 k=4 dx_ub=20 dz_ub=16 d_ub=16 steps=5000 id=C2xC2xC2_c00203
[pilot] MEAS n=288 k=4 dx_ub=17 dz_ub=20 d_ub=17 steps=5000 id=C2xC2xC2_c00219
[saved] id=C2xC2xC2_c00219 -> results/c2xc2xc2_d16_20260120_152133/promising/C2xC2xC2_c00219 (reason: d>=sqrt(n))
[pilot] MEAS n=288 k=4 dx_ub=20 dz_ub=20 d_ub=20 steps=5000 id=C2xC2xC2_c00230
[saved] id=C2xC2xC2_c00230 -> results/c2xc2xc2_d16_20260120_152133/promising/C2xC2xC2_c00230 (reason: d>=sqrt(n))
[pilot] MEAS n=288 k=4 dx_ub=20 dz_ub=20 d_ub=20 steps=5000 id=C2xC2xC2_c00250
[saved] id=C2xC2xC2_c00250 -> results/c2xc2xc2_d16_20260120_152133/promising/C2xC2xC2_c00250 (reason: d>=sqrt(n))
[pilot] MEAS n=288 k=4 dx_ub=18 dz_ub=18 d_ub=18 steps=5000 id=C2xC2xC2_c00260
[saved] id=C2xC2xC2_c00260 -> results/c2xc2xc2_d16_20260120_152133/promising/C2xC2xC2_c00260 (reason: d>=sqrt(n))
[pilot] TARGET_REJECT d_ub=6 target=16 id=C2xC2xC2_c00266
[pilot] MEAS n=288 k=4 dx_ub=16 dz_ub=19 d_ub=16 steps=5000 id=C2xC2xC2_c00292
[pilot] MEAS n=288 k=4 dx_ub=20 dz_ub=20 d_ub=20 steps=5000 id=C2xC2xC2_c00301
[saved] id=C2xC2xC2_c00301 -> results/c2xc2xc2_d16_20260120_152133/promising/C2xC2xC2_c00301 (reason: d>=sqrt(n))
[pilot] MEAS n=288 k=4 dx_ub=16 dz_ub=17 d_ub=16 steps=5000 id=C2xC2xC2_c00314
[pilot] MEAS n=288 k=4 dx_ub=16 dz_ub=16 d_ub=16 steps=5000 id=C2xC2xC2_c00316
[pilot] MEAS n=288 k=8 dx_ub=17 dz_ub=16 d_ub=16 steps=5000 id=C2xC2xC2_c00372
[pilot] MEAS n=288 k=4 dx_ub=20 dz_ub=20 d_ub=20 steps=5000 id=C2xC2xC2_c00419
[saved] id=C2xC2xC2_c00419 -> results/c2xc2xc2_d16_20260120_152133/promising/C2xC2xC2_c00419 (reason: d>=sqrt(n))
[pilot] MEAS n=288 k=4 dx_ub=16 dz_ub=16 d_ub=16 steps=5000 id=C2xC2xC2_c00429
[pilot] MEAS n=288 k=4 dx_ub=20 dz_ub=20 d_ub=20 steps=5000 id=C2xC2xC2_c00431
[saved] id=C2xC2xC2_c00431 -> results/c2xc2xc2_d16_20260120_152133/promising/C2xC2xC2_c00431 (reason: d>=sqrt(n))
[pilot] MEAS n=288 k=8 dx_ub=16 dz_ub=17 d_ub=16 steps=5000 id=C2xC2xC2_c00458
[pilot] MEAS n=288 k=4 dx_ub=16 dz_ub=16 d_ub=16 steps=5000 id=C2xC2xC2_c00463
[pilot] MEAS n=288 k=4 dx_ub=17 dz_ub=20 d_ub=17 steps=5000 id=C2xC2xC2_c00490
[saved] id=C2xC2xC2_c00490 -> results/c2xc2xc2_d16_20260120_152133/promising/C2xC2xC2_c00490 (reason: d>=sqrt(n))
[best_by_k] group=C2xC2xC2 n=288
k  | d_ub | steps | dx_ub | dz_ub | id
 4 |   20 |  5000 |    20 |    20 | C2xC2xC2_c00135
 8 |   16 |  5000 |    16 |    17 | C2xC2xC2_c00026
[coverage] group=C2xC2xC2 A_sel=128 B_sel=128 Q_meas=30 ratio_ge_sqrt=0.001 ratio_sel=0.002
[coverage] run summary:
[coverage] group=C2xC2xC2 A_sel=128 B_sel=128 Q_meas=30 ratio_ge_sqrt=0.001 ratio_sel=0.002
[summary] best-by-k (measured; includes rejects):
  k=4 best_d_ub=20 count_measured=22 example_id=C2xC2xC2_c00135
  k=8 best_d_ub=16 count_measured=8 example_id=C2xC2xC2_c00026
[summary] best-by-k (survivors; target=16):
  k=4 best_d_ub=20 count_survivors=21 example_id=C2xC2xC2_c00135
  k=8 best_d_ub=16 count_survivors=3 example_id=C2xC2xC2_c00026
[pilot] top results:
  01 group=C2xC2xC2 n=288 k=4 d_ub=20 permA=27 permB=20 saved=True
  02 group=C2xC2xC2 n=288 k=4 d_ub=20 permA=20 permB=27 saved=True
  03 group=C2xC2xC2 n=288 k=4 d_ub=20 permA=11 permB=20 saved=True
  04 group=C2xC2xC2 n=288 k=4 d_ub=20 permA=11 permB=27 saved=True
  05 group=C2xC2xC2 n=288 k=4 d_ub=20 permA=11 permB=7 saved=True
  06 group=C2xC2xC2 n=288 k=4 d_ub=20 permA=11 permB=27 saved=True
  07 group=C2xC2xC2 n=288 k=4 d_ub=20 permA=27 permB=11 saved=True
  08 group=C2xC2xC2 n=288 k=4 d_ub=18 permA=20 permB=27 saved=True
  09 group=C2xC2xC2 n=288 k=4 d_ub=17 permA=7 permB=11 saved=True
  10 group=C2xC2xC2 n=288 k=4 d_ub=17 permA=27 permB=8 saved=True

