=== mar. 20 janv. 2026 18:09:31 CET steps=5000 batch=100 seed=1768922203 ===
[pilot] base k_table top pairs:
  k_base=18 permA=0 permB=0
  k_base=12 permA=29 permB=0
  k_base=12 permA=22 permB=0
  k_base=12 permA=13 permB=0
  k_base=12 permA=6 permB=0
[pilot] A multisets raw=792 (expected=792) enum_mode=multiset cayley_unique=26 perms=30 -> total scored = 780
[pilot] B multisets raw=792 (expected=792) enum_mode=multiset cayley_unique=26 perms=30 -> total scored = 780
[pilot] A frontier kept 128 candidates with points: (4,20), (0,49)
[pilot] B frontier kept 128 candidates with points: (4,20), (0,49)
[pilot] C2xC2xC2 n=288 d0=17 A_sets=26*30 -> keep 128; B_sets=26*30 -> keep 128
[pilot] TARGET_REJECT d_ub=12 target=16 id=C2xC2xC2_c00003
[pilot] TARGET_REJECT d_ub=12 target=16 id=C2xC2xC2_c00022
[pilot] MEAS n=288 k=4 dx_ub=16 dz_ub=16 d_ub=16 steps=5000 id=C2xC2xC2_c00025
[pilot] MEAS n=288 k=8 dx_ub=16 dz_ub=17 d_ub=16 steps=5000 id=C2xC2xC2_c00029
[pilot] TARGET_REJECT d_ub=14 target=16 id=C2xC2xC2_c00040
[pilot] MEAS n=288 k=8 dx_ub=16 dz_ub=16 d_ub=16 steps=5000 id=C2xC2xC2_c00048
[pilot] MEAS n=288 k=8 dx_ub=18 dz_ub=16 d_ub=16 steps=5000 id=C2xC2xC2_c00052
[pilot] TARGET_REJECT d_ub=12 target=16 id=C2xC2xC2_c00082
[pilot] TARGET_REJECT d_ub=12 target=16 id=C2xC2xC2_c00143
[pilot] MEAS n=288 k=4 dx_ub=20 dz_ub=17 d_ub=17 steps=5000 id=C2xC2xC2_c00169
[saved] id=C2xC2xC2_c00169 -> results/c2xc2xc2_d16_20260120_180931/promising/C2xC2xC2_c00169 (reason: d>=sqrt(n))
[pilot] TARGET_REJECT d_ub=15 target=16 id=C2xC2xC2_c00185
[pilot] MEAS n=288 k=4 dx_ub=19 dz_ub=20 d_ub=19 steps=5000 id=C2xC2xC2_c00212
[saved] id=C2xC2xC2_c00212 -> results/c2xc2xc2_d16_20260120_180931/promising/C2xC2xC2_c00212 (reason: d>=sqrt(n))
[pilot] MEAS n=288 k=8 dx_ub=16 dz_ub=17 d_ub=16 steps=5000 id=C2xC2xC2_c00248
[pilot] MEAS n=288 k=4 dx_ub=17 dz_ub=16 d_ub=16 steps=5000 id=C2xC2xC2_c00291
[pilot] MEAS n=288 k=8 dx_ub=16 dz_ub=17 d_ub=16 steps=5000 id=C2xC2xC2_c00294
[pilot] MEAS n=288 k=4 dx_ub=19 dz_ub=23 d_ub=19 steps=5000 id=C2xC2xC2_c00306
[saved] id=C2xC2xC2_c00306 -> results/c2xc2xc2_d16_20260120_180931/promising/C2xC2xC2_c00306 (reason: d>=sqrt(n))
[pilot] TARGET_REJECT d_ub=6 target=16 id=C2xC2xC2_c00341
[pilot] MEAS n=288 k=8 dx_ub=16 dz_ub=18 d_ub=16 steps=5000 id=C2xC2xC2_c00352
[pilot] MEAS n=288 k=4 dx_ub=20 dz_ub=16 d_ub=16 steps=5000 id=C2xC2xC2_c00355
[pilot] TARGET_REJECT d_ub=14 target=16 id=C2xC2xC2_c00371
[pilot] TARGET_REJECT d_ub=15 target=16 id=C2xC2xC2_c00388
[pilot] TARGET_REJECT d_ub=12 target=16 id=C2xC2xC2_c00394
[pilot] MEAS n=288 k=4 dx_ub=20 dz_ub=20 d_ub=20 steps=5000 id=C2xC2xC2_c00432
[saved] id=C2xC2xC2_c00432 -> results/c2xc2xc2_d16_20260120_180931/promising/C2xC2xC2_c00432 (reason: d>=sqrt(n))
[pilot] MEAS n=288 k=4 dx_ub=20 dz_ub=17 d_ub=17 steps=5000 id=C2xC2xC2_c00435
[saved] id=C2xC2xC2_c00435 -> results/c2xc2xc2_d16_20260120_180931/promising/C2xC2xC2_c00435 (reason: d>=sqrt(n))
[pilot] MEAS n=288 k=4 dx_ub=20 dz_ub=18 d_ub=18 steps=5000 id=C2xC2xC2_c00457
[saved] id=C2xC2xC2_c00457 -> results/c2xc2xc2_d16_20260120_180931/promising/C2xC2xC2_c00457 (reason: d>=sqrt(n))
[pilot] MEAS n=288 k=4 dx_ub=19 dz_ub=16 d_ub=16 steps=5000 id=C2xC2xC2_c00470
[pilot] MEAS n=288 k=4 dx_ub=20 dz_ub=20 d_ub=20 steps=5000 id=C2xC2xC2_c00492
[saved] id=C2xC2xC2_c00492 -> results/c2xc2xc2_d16_20260120_180931/promising/C2xC2xC2_c00492 (reason: d>=sqrt(n))
[pilot] MEAS n=288 k=4 dx_ub=20 dz_ub=20 d_ub=20 steps=5000 id=C2xC2xC2_c00498
[saved] id=C2xC2xC2_c00498 -> results/c2xc2xc2_d16_20260120_180931/promising/C2xC2xC2_c00498 (reason: d>=sqrt(n))
[best_by_k] group=C2xC2xC2 n=288
k  | d_ub | steps | dx_ub | dz_ub | id
 4 |   20 |  5000 |    20 |    20 | C2xC2xC2_c00432
 8 |   16 |  5000 |    16 |    17 | C2xC2xC2_c00029
[coverage] group=C2xC2xC2 A_sel=128 B_sel=128 Q_meas=28 ratio_ge_sqrt=0.001 ratio_sel=0.002
[coverage] run summary:
[coverage] group=C2xC2xC2 A_sel=128 B_sel=128 Q_meas=28 ratio_ge_sqrt=0.001 ratio_sel=0.002
[summary] best-by-k (measured; includes rejects):
  k=4 best_d_ub=20 count_measured=16 example_id=C2xC2xC2_c00432
  k=8 best_d_ub=16 count_measured=12 example_id=C2xC2xC2_c00029
[summary] best-by-k (survivors; target=16):
  k=4 best_d_ub=20 count_survivors=12 example_id=C2xC2xC2_c00432
  k=8 best_d_ub=16 count_survivors=6 example_id=C2xC2xC2_c00029
[pilot] top results:
  01 group=C2xC2xC2 n=288 k=4 d_ub=20 permA=7 permB=27 saved=True
  02 group=C2xC2xC2 n=288 k=4 d_ub=20 permA=11 permB=12 saved=True
  03 group=C2xC2xC2 n=288 k=4 d_ub=20 permA=27 permB=11 saved=True
  04 group=C2xC2xC2 n=288 k=4 d_ub=19 permA=11 permB=20 saved=True
  05 group=C2xC2xC2 n=288 k=4 d_ub=19 permA=12 permB=20 saved=True
  06 group=C2xC2xC2 n=288 k=4 d_ub=18 permA=20 permB=11 saved=True
  07 group=C2xC2xC2 n=288 k=4 d_ub=17 permA=11 permB=8 saved=True
  08 group=C2xC2xC2 n=288 k=4 d_ub=17 permA=20 permB=7 saved=True
  09 group=C2xC2xC2 n=288 k=8 d_ub=16 permA=11 permB=8 saved=False
  10 group=C2xC2xC2 n=288 k=8 d_ub=16 permA=11 permB=20 saved=False

