=== mer. 21 janv. 2026 07:35:24 CET steps=20000 batch=37 seed=1768937140 ===
[pilot] base k_table top pairs:
  k_base=18 permA=0 permB=0
  k_base=12 permA=29 permB=0
  k_base=12 permA=22 permB=0
  k_base=12 permA=13 permB=0
  k_base=12 permA=6 permB=0
[pilot] A multisets raw=792 (expected=792) enum_mode=multiset cayley_unique=26 perms=30 -> total scored = 780
[pilot] B multisets raw=792 (expected=792) enum_mode=multiset cayley_unique=26 perms=30 -> total scored = 780
[pilot] A frontier kept 128 candidates with points: (4,20), (0,49)
[pilot] B frontier kept 128 candidates with points: (4,20), (0,49)
[pilot] C2xC2xC2 n=288 d0=17 A_sets=26*30 -> keep 128; B_sets=26*30 -> keep 128
[pilot] MEAS n=288 k=4 dx_ub=20 dz_ub=20 d_ub=20 steps=20000 id=C2xC2xC2_c00002
[saved] id=C2xC2xC2_c00002 -> results/c2xc2xc2_d16_20260121_073524/promising/C2xC2xC2_c00002 (reason: d>=sqrt(n))
[pilot] MEAS n=288 k=4 dx_ub=16 dz_ub=17 d_ub=16 steps=20000 id=C2xC2xC2_c00022
[pilot] TARGET_REJECT d_ub=12 target=16 id=C2xC2xC2_c00037
[pilot] MEAS n=288 k=4 dx_ub=19 dz_ub=20 d_ub=19 steps=20000 id=C2xC2xC2_c00041
[saved] id=C2xC2xC2_c00041 -> results/c2xc2xc2_d16_20260121_073524/promising/C2xC2xC2_c00041 (reason: d>=sqrt(n))
[pilot] MEAS n=288 k=4 dx_ub=16 dz_ub=16 d_ub=16 steps=20000 id=C2xC2xC2_c00042
[pilot] MEAS n=288 k=4 dx_ub=19 dz_ub=19 d_ub=19 steps=20000 id=C2xC2xC2_c00064
[saved] id=C2xC2xC2_c00064 -> results/c2xc2xc2_d16_20260121_073524/promising/C2xC2xC2_c00064 (reason: d>=sqrt(n))
[pilot] MEAS n=288 k=4 dx_ub=17 dz_ub=17 d_ub=17 steps=20000 id=C2xC2xC2_c00075
[saved] id=C2xC2xC2_c00075 -> results/c2xc2xc2_d16_20260121_073524/promising/C2xC2xC2_c00075 (reason: d>=sqrt(n))
[pilot] MEAS n=288 k=4 dx_ub=20 dz_ub=18 d_ub=18 steps=20000 id=C2xC2xC2_c00082
[saved] id=C2xC2xC2_c00082 -> results/c2xc2xc2_d16_20260121_073524/promising/C2xC2xC2_c00082 (reason: d>=sqrt(n))
[pilot] MEAS n=288 k=4 dx_ub=18 dz_ub=16 d_ub=16 steps=20000 id=C2xC2xC2_c00100
[pilot] MEAS n=288 k=8 dx_ub=16 dz_ub=18 d_ub=16 steps=20000 id=C2xC2xC2_c00113
[pilot] MEAS n=288 k=4 dx_ub=17 dz_ub=20 d_ub=17 steps=20000 id=C2xC2xC2_c00125
[saved] id=C2xC2xC2_c00125 -> results/c2xc2xc2_d16_20260121_073524/promising/C2xC2xC2_c00125 (reason: d>=sqrt(n))
[pilot] TARGET_REJECT d_ub=12 target=16 id=C2xC2xC2_c00134
[pilot] MEAS n=288 k=8 dx_ub=17 dz_ub=16 d_ub=16 steps=20000 id=C2xC2xC2_c00139
[pilot] MEAS n=288 k=4 dx_ub=20 dz_ub=19 d_ub=19 steps=20000 id=C2xC2xC2_c00151
[saved] id=C2xC2xC2_c00151 -> results/c2xc2xc2_d16_20260121_073524/promising/C2xC2xC2_c00151 (reason: d>=sqrt(n))
[pilot] MEAS n=288 k=4 dx_ub=16 dz_ub=18 d_ub=16 steps=20000 id=C2xC2xC2_c00167
[pilot] MEAS n=288 k=4 dx_ub=20 dz_ub=17 d_ub=17 steps=20000 id=C2xC2xC2_c00181
[saved] id=C2xC2xC2_c00181 -> results/c2xc2xc2_d16_20260121_073524/promising/C2xC2xC2_c00181 (reason: d>=sqrt(n))
[pilot] MEAS n=288 k=4 dx_ub=20 dz_ub=19 d_ub=19 steps=20000 id=C2xC2xC2_c00264
[saved] id=C2xC2xC2_c00264 -> results/c2xc2xc2_d16_20260121_073524/promising/C2xC2xC2_c00264 (reason: d>=sqrt(n))
[pilot] MEAS n=288 k=8 dx_ub=16 dz_ub=18 d_ub=16 steps=20000 id=C2xC2xC2_c00294
[pilot] MEAS n=288 k=4 dx_ub=17 dz_ub=16 d_ub=16 steps=20000 id=C2xC2xC2_c00338
[pilot] MEAS n=288 k=8 dx_ub=17 dz_ub=16 d_ub=16 steps=20000 id=C2xC2xC2_c00377
[pilot] TARGET_REJECT d_ub=14 target=16 id=C2xC2xC2_c00403
[pilot] MEAS n=288 k=4 dx_ub=19 dz_ub=20 d_ub=19 steps=20000 id=C2xC2xC2_c00416
[saved] id=C2xC2xC2_c00416 -> results/c2xc2xc2_d16_20260121_073524/promising/C2xC2xC2_c00416 (reason: d>=sqrt(n))
[pilot] TARGET_REJECT d_ub=14 target=16 id=C2xC2xC2_c00430
[pilot] MEAS n=288 k=4 dx_ub=17 dz_ub=16 d_ub=16 steps=20000 id=C2xC2xC2_c00478
[pilot] MEAS n=288 k=4 dx_ub=16 dz_ub=16 d_ub=16 steps=20000 id=C2xC2xC2_c00484
[best_by_k] group=C2xC2xC2 n=288
k  | d_ub | steps | dx_ub | dz_ub | id
 4 |   20 | 20000 |    20 |    20 | C2xC2xC2_c00002
 8 |   16 | 20000 |    16 |    18 | C2xC2xC2_c00113
[coverage] group=C2xC2xC2 A_sel=128 B_sel=128 Q_meas=25 ratio_ge_sqrt=0.000 ratio_sel=0.002
[coverage] run summary:
[coverage] group=C2xC2xC2 A_sel=128 B_sel=128 Q_meas=25 ratio_ge_sqrt=0.000 ratio_sel=0.002
[summary] best-by-k (measured; includes rejects):
  k=4 best_d_ub=20 count_measured=18 example_id=C2xC2xC2_c00002
  k=8 best_d_ub=16 count_measured=7 example_id=C2xC2xC2_c00113
[summary] best-by-k (survivors; target=16):
  k=4 best_d_ub=20 count_survivors=17 example_id=C2xC2xC2_c00002
  k=8 best_d_ub=16 count_survivors=4 example_id=C2xC2xC2_c00113
[pilot] top results:
  01 group=C2xC2xC2 n=288 k=4 d_ub=20 permA=12 permB=12 saved=True
  02 group=C2xC2xC2 n=288 k=4 d_ub=19 permA=27 permB=11 saved=True
  03 group=C2xC2xC2 n=288 k=4 d_ub=19 permA=27 permB=20 saved=True
  04 group=C2xC2xC2 n=288 k=4 d_ub=19 permA=12 permB=11 saved=True
  05 group=C2xC2xC2 n=288 k=4 d_ub=19 permA=11 permB=27 saved=True
  06 group=C2xC2xC2 n=288 k=4 d_ub=19 permA=20 permB=11 saved=True
  07 group=C2xC2xC2 n=288 k=4 d_ub=18 permA=7 permB=27 saved=True
  08 group=C2xC2xC2 n=288 k=4 d_ub=17 permA=27 permB=11 saved=True
  09 group=C2xC2xC2 n=288 k=4 d_ub=17 permA=27 permB=27 saved=True
  10 group=C2xC2xC2 n=288 k=4 d_ub=17 permA=20 permB=20 saved=True

