=== mar. 20 janv. 2026 15:10:56 CET steps=5000 batch=37 seed=1768922140 ===
[pilot] base k_table top pairs:
  k_base=18 permA=0 permB=0
  k_base=12 permA=29 permB=0
  k_base=12 permA=22 permB=0
  k_base=12 permA=13 permB=0
  k_base=12 permA=6 permB=0
[pilot] A multisets raw=792 (expected=792) enum_mode=multiset cayley_unique=26 perms=30 -> total scored = 780
[pilot] B multisets raw=792 (expected=792) enum_mode=multiset cayley_unique=26 perms=30 -> total scored = 780
[pilot] A frontier kept 128 candidates with points: (4,20), (0,49)
[pilot] B frontier kept 128 candidates with points: (4,20), (0,49)
[pilot] C2xC2xC2 n=288 d0=17 A_sets=26*30 -> keep 128; B_sets=26*30 -> keep 128
[pilot] MEAS n=288 k=4 dx_ub=20 dz_ub=22 d_ub=20 steps=5000 id=C2xC2xC2_c00061
[saved] id=C2xC2xC2_c00061 -> results/c2xc2xc2_d16_20260120_151056/promising/C2xC2xC2_c00061 (reason: d>=sqrt(n))
[pilot] MEAS n=288 k=4 dx_ub=20 dz_ub=20 d_ub=20 steps=5000 id=C2xC2xC2_c00064
[saved] id=C2xC2xC2_c00064 -> results/c2xc2xc2_d16_20260120_151056/promising/C2xC2xC2_c00064 (reason: d>=sqrt(n))
[pilot] MEAS n=288 k=4 dx_ub=20 dz_ub=17 d_ub=17 steps=5000 id=C2xC2xC2_c00086
[saved] id=C2xC2xC2_c00086 -> results/c2xc2xc2_d16_20260120_151056/promising/C2xC2xC2_c00086 (reason: d>=sqrt(n))
[pilot] MEAS n=288 k=8 dx_ub=16 dz_ub=16 d_ub=16 steps=5000 id=C2xC2xC2_c00106
[pilot] MEAS n=288 k=8 dx_ub=16 dz_ub=18 d_ub=16 steps=5000 id=C2xC2xC2_c00107
[pilot] MEAS n=288 k=4 dx_ub=16 dz_ub=17 d_ub=16 steps=5000 id=C2xC2xC2_c00127
[pilot] MEAS n=288 k=4 dx_ub=23 dz_ub=20 d_ub=20 steps=5000 id=C2xC2xC2_c00142
[saved] id=C2xC2xC2_c00142 -> results/c2xc2xc2_d16_20260120_151056/promising/C2xC2xC2_c00142 (reason: d>=sqrt(n))
[pilot] TARGET_REJECT d_ub=12 target=16 id=C2xC2xC2_c00150
[pilot] MEAS n=288 k=4 dx_ub=17 dz_ub=17 d_ub=17 steps=5000 id=C2xC2xC2_c00160
[saved] id=C2xC2xC2_c00160 -> results/c2xc2xc2_d16_20260120_151056/promising/C2xC2xC2_c00160 (reason: d>=sqrt(n))
[pilot] TARGET_REJECT d_ub=12 target=16 id=C2xC2xC2_c00164
[pilot] MEAS n=288 k=4 dx_ub=17 dz_ub=20 d_ub=17 steps=5000 id=C2xC2xC2_c00172
[saved] id=C2xC2xC2_c00172 -> results/c2xc2xc2_d16_20260120_151056/promising/C2xC2xC2_c00172 (reason: d>=sqrt(n))
[pilot] MEAS n=288 k=4 dx_ub=17 dz_ub=20 d_ub=17 steps=5000 id=C2xC2xC2_c00185
[saved] id=C2xC2xC2_c00185 -> results/c2xc2xc2_d16_20260120_151056/promising/C2xC2xC2_c00185 (reason: d>=sqrt(n))
[pilot] MEAS n=288 k=8 dx_ub=20 dz_ub=17 d_ub=17 steps=5000 id=C2xC2xC2_c00198
[saved] id=C2xC2xC2_c00198 -> results/c2xc2xc2_d16_20260120_151056/promising/C2xC2xC2_c00198 (reason: d>=sqrt(n))
[pilot] TARGET_REJECT d_ub=12 target=16 id=C2xC2xC2_c00276
[pilot] MEAS n=288 k=4 dx_ub=20 dz_ub=20 d_ub=20 steps=5000 id=C2xC2xC2_c00305
[saved] id=C2xC2xC2_c00305 -> results/c2xc2xc2_d16_20260120_151056/promising/C2xC2xC2_c00305 (reason: d>=sqrt(n))
[pilot] MEAS n=288 k=4 dx_ub=17 dz_ub=20 d_ub=17 steps=5000 id=C2xC2xC2_c00313
[saved] id=C2xC2xC2_c00313 -> results/c2xc2xc2_d16_20260120_151056/promising/C2xC2xC2_c00313 (reason: d>=sqrt(n))
[pilot] MEAS n=288 k=4 dx_ub=17 dz_ub=20 d_ub=17 steps=5000 id=C2xC2xC2_c00320
[saved] id=C2xC2xC2_c00320 -> results/c2xc2xc2_d16_20260120_151056/promising/C2xC2xC2_c00320 (reason: d>=sqrt(n))
[pilot] TARGET_REJECT d_ub=12 target=16 id=C2xC2xC2_c00323
[pilot] MEAS n=288 k=4 dx_ub=17 dz_ub=19 d_ub=17 steps=5000 id=C2xC2xC2_c00332
[saved] id=C2xC2xC2_c00332 -> results/c2xc2xc2_d16_20260120_151056/promising/C2xC2xC2_c00332 (reason: d>=sqrt(n))
[pilot] MEAS n=288 k=4 dx_ub=20 dz_ub=17 d_ub=17 steps=5000 id=C2xC2xC2_c00355
[saved] id=C2xC2xC2_c00355 -> results/c2xc2xc2_d16_20260120_151056/promising/C2xC2xC2_c00355 (reason: d>=sqrt(n))
[pilot] MEAS n=288 k=4 dx_ub=20 dz_ub=16 d_ub=16 steps=5000 id=C2xC2xC2_c00356
[pilot] TARGET_REJECT d_ub=15 target=16 id=C2xC2xC2_c00372
[pilot] TARGET_REJECT d_ub=12 target=16 id=C2xC2xC2_c00406
[pilot] MEAS n=288 k=8 dx_ub=17 dz_ub=16 d_ub=16 steps=5000 id=C2xC2xC2_c00417
[pilot] TARGET_REJECT d_ub=6 target=16 id=C2xC2xC2_c00433
[pilot] MEAS n=288 k=4 dx_ub=20 dz_ub=18 d_ub=18 steps=5000 id=C2xC2xC2_c00439
[saved] id=C2xC2xC2_c00439 -> results/c2xc2xc2_d16_20260120_151056/promising/C2xC2xC2_c00439 (reason: d>=sqrt(n))
[pilot] MEAS n=288 k=4 dx_ub=20 dz_ub=20 d_ub=20 steps=5000 id=C2xC2xC2_c00458
[saved] id=C2xC2xC2_c00458 -> results/c2xc2xc2_d16_20260120_151056/promising/C2xC2xC2_c00458 (reason: d>=sqrt(n))
[pilot] MEAS n=288 k=4 dx_ub=20 dz_ub=23 d_ub=20 steps=5000 id=C2xC2xC2_c00479
[saved] id=C2xC2xC2_c00479 -> results/c2xc2xc2_d16_20260120_151056/promising/C2xC2xC2_c00479 (reason: d>=sqrt(n))
[pilot] MEAS n=288 k=4 dx_ub=20 dz_ub=20 d_ub=20 steps=5000 id=C2xC2xC2_c00482
[saved] id=C2xC2xC2_c00482 -> results/c2xc2xc2_d16_20260120_151056/promising/C2xC2xC2_c00482 (reason: d>=sqrt(n))
[best_by_k] group=C2xC2xC2 n=288
k  | d_ub | steps | dx_ub | dz_ub | id
 4 |   20 |  5000 |    20 |    22 | C2xC2xC2_c00061
 8 |   17 |  5000 |    20 |    17 | C2xC2xC2_c00198
[coverage] group=C2xC2xC2 A_sel=128 B_sel=128 Q_meas=29 ratio_ge_sqrt=0.001 ratio_sel=0.002
[coverage] run summary:
[coverage] group=C2xC2xC2 A_sel=128 B_sel=128 Q_meas=29 ratio_ge_sqrt=0.001 ratio_sel=0.002
[summary] best-by-k (measured; includes rejects):
  k=4 best_d_ub=20 count_measured=18 example_id=C2xC2xC2_c00061
  k=8 best_d_ub=17 count_measured=11 example_id=C2xC2xC2_c00198
[summary] best-by-k (survivors; target=16):
  k=4 best_d_ub=20 count_survivors=18 example_id=C2xC2xC2_c00061
  k=8 best_d_ub=17 count_survivors=4 example_id=C2xC2xC2_c00198
[pilot] top results:
  01 group=C2xC2xC2 n=288 k=4 d_ub=20 permA=27 permB=7 saved=True
  02 group=C2xC2xC2 n=288 k=4 d_ub=20 permA=27 permB=27 saved=True
  03 group=C2xC2xC2 n=288 k=4 d_ub=20 permA=20 permB=12 saved=True
  04 group=C2xC2xC2 n=288 k=4 d_ub=20 permA=11 permB=20 saved=True
  05 group=C2xC2xC2 n=288 k=4 d_ub=20 permA=20 permB=27 saved=True
  06 group=C2xC2xC2 n=288 k=4 d_ub=20 permA=8 permB=7 saved=True
  07 group=C2xC2xC2 n=288 k=4 d_ub=20 permA=11 permB=27 saved=True
  08 group=C2xC2xC2 n=288 k=4 d_ub=18 permA=20 permB=11 saved=True
  09 group=C2xC2xC2 n=288 k=8 d_ub=17 permA=20 permB=20 saved=True
  10 group=C2xC2xC2 n=288 k=4 d_ub=17 permA=8 permB=7 saved=True

