=== mar. 20 janv. 2026 15:40:19 CET steps=5000 batch=84 seed=1768922187 ===
[pilot] base k_table top pairs:
  k_base=18 permA=0 permB=0
  k_base=12 permA=29 permB=0
  k_base=12 permA=22 permB=0
  k_base=12 permA=13 permB=0
  k_base=12 permA=6 permB=0
[pilot] A multisets raw=792 (expected=792) enum_mode=multiset cayley_unique=26 perms=30 -> total scored = 780
[pilot] B multisets raw=792 (expected=792) enum_mode=multiset cayley_unique=26 perms=30 -> total scored = 780
[pilot] A frontier kept 128 candidates with points: (4,20), (0,49)
[pilot] B frontier kept 128 candidates with points: (4,20), (0,49)
[pilot] C2xC2xC2 n=288 d0=17 A_sets=26*30 -> keep 128; B_sets=26*30 -> keep 128
[pilot] TARGET_REJECT d_ub=12 target=16 id=C2xC2xC2_c00003
[pilot] MEAS n=288 k=4 dx_ub=20 dz_ub=19 d_ub=19 steps=5000 id=C2xC2xC2_c00022
[saved] id=C2xC2xC2_c00022 -> results/c2xc2xc2_d16_20260120_154019/promising/C2xC2xC2_c00022 (reason: d>=sqrt(n))
[pilot] MEAS n=288 k=4 dx_ub=20 dz_ub=18 d_ub=18 steps=5000 id=C2xC2xC2_c00072
[saved] id=C2xC2xC2_c00072 -> results/c2xc2xc2_d16_20260120_154019/promising/C2xC2xC2_c00072 (reason: d>=sqrt(n))
[pilot] MEAS n=288 k=4 dx_ub=16 dz_ub=16 d_ub=16 steps=5000 id=C2xC2xC2_c00079
[pilot] TARGET_REJECT d_ub=14 target=16 id=C2xC2xC2_c00109
[pilot] MEAS n=288 k=4 dx_ub=16 dz_ub=16 d_ub=16 steps=5000 id=C2xC2xC2_c00130
[pilot] TARGET_REJECT d_ub=12 target=16 id=C2xC2xC2_c00137
[pilot] MEAS n=288 k=4 dx_ub=16 dz_ub=18 d_ub=16 steps=5000 id=C2xC2xC2_c00153
[pilot] MEAS n=288 k=4 dx_ub=20 dz_ub=17 d_ub=17 steps=5000 id=C2xC2xC2_c00212
[saved] id=C2xC2xC2_c00212 -> results/c2xc2xc2_d16_20260120_154019/promising/C2xC2xC2_c00212 (reason: d>=sqrt(n))
[pilot] MEAS n=288 k=4 dx_ub=20 dz_ub=20 d_ub=20 steps=5000 id=C2xC2xC2_c00243
[saved] id=C2xC2xC2_c00243 -> results/c2xc2xc2_d16_20260120_154019/promising/C2xC2xC2_c00243 (reason: d>=sqrt(n))
[pilot] MEAS n=288 k=8 dx_ub=16 dz_ub=18 d_ub=16 steps=5000 id=C2xC2xC2_c00247
[pilot] MEAS n=288 k=4 dx_ub=20 dz_ub=20 d_ub=20 steps=5000 id=C2xC2xC2_c00255
[saved] id=C2xC2xC2_c00255 -> results/c2xc2xc2_d16_20260120_154019/promising/C2xC2xC2_c00255 (reason: d>=sqrt(n))
[pilot] TARGET_REJECT d_ub=12 target=16 id=C2xC2xC2_c00281
[pilot] MEAS n=288 k=4 dx_ub=23 dz_ub=21 d_ub=21 steps=5000 id=C2xC2xC2_c00312
[saved] id=C2xC2xC2_c00312 -> results/c2xc2xc2_d16_20260120_154019/promising/C2xC2xC2_c00312 (reason: d>=sqrt(n))
[pilot] MEAS n=288 k=4 dx_ub=20 dz_ub=20 d_ub=20 steps=5000 id=C2xC2xC2_c00324
[saved] id=C2xC2xC2_c00324 -> results/c2xc2xc2_d16_20260120_154019/promising/C2xC2xC2_c00324 (reason: d>=sqrt(n))
[pilot] TARGET_REJECT d_ub=12 target=16 id=C2xC2xC2_c00332
[pilot] MEAS n=288 k=4 dx_ub=20 dz_ub=17 d_ub=17 steps=5000 id=C2xC2xC2_c00337
[saved] id=C2xC2xC2_c00337 -> results/c2xc2xc2_d16_20260120_154019/promising/C2xC2xC2_c00337 (reason: d>=sqrt(n))
[pilot] MEAS n=288 k=8 dx_ub=17 dz_ub=16 d_ub=16 steps=5000 id=C2xC2xC2_c00338
[pilot] MEAS n=288 k=4 dx_ub=20 dz_ub=16 d_ub=16 steps=5000 id=C2xC2xC2_c00378
[pilot] TARGET_REJECT d_ub=12 target=16 id=C2xC2xC2_c00413
[pilot] TARGET_REJECT d_ub=12 target=16 id=C2xC2xC2_c00461
[pilot] MEAS n=288 k=8 dx_ub=16 dz_ub=18 d_ub=16 steps=5000 id=C2xC2xC2_c00473
[pilot] MEAS n=288 k=4 dx_ub=23 dz_ub=20 d_ub=20 steps=5000 id=C2xC2xC2_c00476
[saved] id=C2xC2xC2_c00476 -> results/c2xc2xc2_d16_20260120_154019/promising/C2xC2xC2_c00476 (reason: d>=sqrt(n))
[pilot] MEAS n=288 k=4 dx_ub=20 dz_ub=20 d_ub=20 steps=5000 id=C2xC2xC2_c00484
[saved] id=C2xC2xC2_c00484 -> results/c2xc2xc2_d16_20260120_154019/promising/C2xC2xC2_c00484 (reason: d>=sqrt(n))
[pilot] MEAS n=288 k=4 dx_ub=20 dz_ub=20 d_ub=20 steps=5000 id=C2xC2xC2_c00491
[saved] id=C2xC2xC2_c00491 -> results/c2xc2xc2_d16_20260120_154019/promising/C2xC2xC2_c00491 (reason: d>=sqrt(n))
[best_by_k] group=C2xC2xC2 n=288
k  | d_ub | steps | dx_ub | dz_ub | id
 4 |   21 |  5000 |    23 |    21 | C2xC2xC2_c00312
 8 |   16 |  5000 |    16 |    18 | C2xC2xC2_c00247
[coverage] group=C2xC2xC2 A_sel=128 B_sel=128 Q_meas=25 ratio_ge_sqrt=0.000 ratio_sel=0.002
[coverage] run summary:
[coverage] group=C2xC2xC2 A_sel=128 B_sel=128 Q_meas=25 ratio_ge_sqrt=0.000 ratio_sel=0.002
[summary] best-by-k (measured; includes rejects):
  k=4 best_d_ub=21 count_measured=16 example_id=C2xC2xC2_c00312
  k=8 best_d_ub=16 count_measured=9 example_id=C2xC2xC2_c00247
[summary] best-by-k (survivors; target=16):
  k=4 best_d_ub=21 count_survivors=15 example_id=C2xC2xC2_c00312
  k=8 best_d_ub=16 count_survivors=3 example_id=C2xC2xC2_c00247
[pilot] top results:
  01 group=C2xC2xC2 n=288 k=4 d_ub=21 permA=27 permB=12 saved=True
  02 group=C2xC2xC2 n=288 k=4 d_ub=20 permA=8 permB=12 saved=True
  03 group=C2xC2xC2 n=288 k=4 d_ub=20 permA=8 permB=27 saved=True
  04 group=C2xC2xC2 n=288 k=4 d_ub=20 permA=20 permB=7 saved=True
  05 group=C2xC2xC2 n=288 k=4 d_ub=20 permA=27 permB=11 saved=True
  06 group=C2xC2xC2 n=288 k=4 d_ub=20 permA=11 permB=12 saved=True
  07 group=C2xC2xC2 n=288 k=4 d_ub=20 permA=12 permB=8 saved=True
  08 group=C2xC2xC2 n=288 k=4 d_ub=19 permA=8 permB=8 saved=True
  09 group=C2xC2xC2 n=288 k=4 d_ub=18 permA=7 permB=27 saved=True
  10 group=C2xC2xC2 n=288 k=4 d_ub=17 permA=8 permB=11 saved=True

