=== mar. 20 janv. 2026 15:08:09 CET steps=5000 batch=32 seed=1768922135 ===
[pilot] base k_table top pairs:
  k_base=18 permA=0 permB=0
  k_base=12 permA=29 permB=0
  k_base=12 permA=22 permB=0
  k_base=12 permA=13 permB=0
  k_base=12 permA=6 permB=0
[pilot] A multisets raw=792 (expected=792) enum_mode=multiset cayley_unique=26 perms=30 -> total scored = 780
[pilot] B multisets raw=792 (expected=792) enum_mode=multiset cayley_unique=26 perms=30 -> total scored = 780
[pilot] A frontier kept 128 candidates with points: (4,20), (0,49)
[pilot] B frontier kept 128 candidates with points: (4,20), (0,49)
[pilot] C2xC2xC2 n=288 d0=17 A_sets=26*30 -> keep 128; B_sets=26*30 -> keep 128
[pilot] MEAS n=288 k=4 dx_ub=22 dz_ub=20 d_ub=20 steps=5000 id=C2xC2xC2_c00022
[saved] id=C2xC2xC2_c00022 -> results/c2xc2xc2_d16_20260120_150809/promising/C2xC2xC2_c00022 (reason: d>=sqrt(n))
[pilot] MEAS n=288 k=8 dx_ub=16 dz_ub=18 d_ub=16 steps=5000 id=C2xC2xC2_c00037
[pilot] MEAS n=288 k=4 dx_ub=20 dz_ub=19 d_ub=19 steps=5000 id=C2xC2xC2_c00108
[saved] id=C2xC2xC2_c00108 -> results/c2xc2xc2_d16_20260120_150809/promising/C2xC2xC2_c00108 (reason: d>=sqrt(n))
[pilot] MEAS n=288 k=4 dx_ub=21 dz_ub=16 d_ub=16 steps=5000 id=C2xC2xC2_c00127
[pilot] MEAS n=288 k=4 dx_ub=20 dz_ub=20 d_ub=20 steps=5000 id=C2xC2xC2_c00128
[saved] id=C2xC2xC2_c00128 -> results/c2xc2xc2_d16_20260120_150809/promising/C2xC2xC2_c00128 (reason: d>=sqrt(n))
[pilot] MEAS n=288 k=4 dx_ub=21 dz_ub=20 d_ub=20 steps=5000 id=C2xC2xC2_c00132
[saved] id=C2xC2xC2_c00132 -> results/c2xc2xc2_d16_20260120_150809/promising/C2xC2xC2_c00132 (reason: d>=sqrt(n))
[pilot] TARGET_REJECT d_ub=14 target=16 id=C2xC2xC2_c00136
[pilot] MEAS n=288 k=4 dx_ub=20 dz_ub=20 d_ub=20 steps=5000 id=C2xC2xC2_c00157
[saved] id=C2xC2xC2_c00157 -> results/c2xc2xc2_d16_20260120_150809/promising/C2xC2xC2_c00157 (reason: d>=sqrt(n))
[pilot] MEAS n=288 k=4 dx_ub=20 dz_ub=20 d_ub=20 steps=5000 id=C2xC2xC2_c00169
[saved] id=C2xC2xC2_c00169 -> results/c2xc2xc2_d16_20260120_150809/promising/C2xC2xC2_c00169 (reason: d>=sqrt(n))
[pilot] MEAS n=288 k=4 dx_ub=20 dz_ub=20 d_ub=20 steps=5000 id=C2xC2xC2_c00173
[saved] id=C2xC2xC2_c00173 -> results/c2xc2xc2_d16_20260120_150809/promising/C2xC2xC2_c00173 (reason: d>=sqrt(n))
[pilot] MEAS n=288 k=4 dx_ub=16 dz_ub=17 d_ub=16 steps=5000 id=C2xC2xC2_c00185
[pilot] MEAS n=288 k=4 dx_ub=20 dz_ub=20 d_ub=20 steps=5000 id=C2xC2xC2_c00202
[saved] id=C2xC2xC2_c00202 -> results/c2xc2xc2_d16_20260120_150809/promising/C2xC2xC2_c00202 (reason: d>=sqrt(n))
[pilot] MEAS n=288 k=8 dx_ub=18 dz_ub=16 d_ub=16 steps=5000 id=C2xC2xC2_c00218
[pilot] MEAS n=288 k=4 dx_ub=17 dz_ub=16 d_ub=16 steps=5000 id=C2xC2xC2_c00220
[pilot] MEAS n=288 k=4 dx_ub=17 dz_ub=16 d_ub=16 steps=5000 id=C2xC2xC2_c00235
[pilot] MEAS n=288 k=4 dx_ub=21 dz_ub=16 d_ub=16 steps=5000 id=C2xC2xC2_c00241
[pilot] MEAS n=288 k=8 dx_ub=16 dz_ub=17 d_ub=16 steps=5000 id=C2xC2xC2_c00242
[pilot] TARGET_REJECT d_ub=12 target=16 id=C2xC2xC2_c00258
[pilot] MEAS n=288 k=4 dx_ub=17 dz_ub=22 d_ub=17 steps=5000 id=C2xC2xC2_c00267
[saved] id=C2xC2xC2_c00267 -> results/c2xc2xc2_d16_20260120_150809/promising/C2xC2xC2_c00267 (reason: d>=sqrt(n))
[pilot] MEAS n=288 k=4 dx_ub=17 dz_ub=20 d_ub=17 steps=5000 id=C2xC2xC2_c00271
[saved] id=C2xC2xC2_c00271 -> results/c2xc2xc2_d16_20260120_150809/promising/C2xC2xC2_c00271 (reason: d>=sqrt(n))
[pilot] MEAS n=288 k=4 dx_ub=19 dz_ub=20 d_ub=19 steps=5000 id=C2xC2xC2_c00280
[saved] id=C2xC2xC2_c00280 -> results/c2xc2xc2_d16_20260120_150809/promising/C2xC2xC2_c00280 (reason: d>=sqrt(n))
[pilot] MEAS n=288 k=4 dx_ub=20 dz_ub=20 d_ub=20 steps=5000 id=C2xC2xC2_c00293
[saved] id=C2xC2xC2_c00293 -> results/c2xc2xc2_d16_20260120_150809/promising/C2xC2xC2_c00293 (reason: d>=sqrt(n))
[pilot] MEAS n=288 k=4 dx_ub=16 dz_ub=17 d_ub=16 steps=5000 id=C2xC2xC2_c00320
[pilot] MEAS n=288 k=4 dx_ub=18 dz_ub=18 d_ub=18 steps=5000 id=C2xC2xC2_c00350
[saved] id=C2xC2xC2_c00350 -> results/c2xc2xc2_d16_20260120_150809/promising/C2xC2xC2_c00350 (reason: d>=sqrt(n))
[pilot] TARGET_REJECT d_ub=15 target=16 id=C2xC2xC2_c00354
[pilot] MEAS n=288 k=4 dx_ub=20 dz_ub=20 d_ub=20 steps=5000 id=C2xC2xC2_c00368
[saved] id=C2xC2xC2_c00368 -> results/c2xc2xc2_d16_20260120_150809/promising/C2xC2xC2_c00368 (reason: d>=sqrt(n))
[pilot] TARGET_REJECT d_ub=13 target=16 id=C2xC2xC2_c00392
[pilot] TARGET_REJECT d_ub=12 target=16 id=C2xC2xC2_c00393
[pilot] MEAS n=288 k=4 dx_ub=19 dz_ub=20 d_ub=19 steps=5000 id=C2xC2xC2_c00415
[saved] id=C2xC2xC2_c00415 -> results/c2xc2xc2_d16_20260120_150809/promising/C2xC2xC2_c00415 (reason: d>=sqrt(n))
[pilot] TARGET_REJECT d_ub=14 target=16 id=C2xC2xC2_c00425
[pilot] MEAS n=288 k=4 dx_ub=20 dz_ub=19 d_ub=19 steps=5000 id=C2xC2xC2_c00481
[saved] id=C2xC2xC2_c00481 -> results/c2xc2xc2_d16_20260120_150809/promising/C2xC2xC2_c00481 (reason: d>=sqrt(n))
[best_by_k] group=C2xC2xC2 n=288
k  | d_ub | steps | dx_ub | dz_ub | id
 4 |   20 |  5000 |    22 |    20 | C2xC2xC2_c00022
 8 |   16 |  5000 |    16 |    18 | C2xC2xC2_c00037
[coverage] group=C2xC2xC2 A_sel=128 B_sel=128 Q_meas=31 ratio_ge_sqrt=0.001 ratio_sel=0.002
[coverage] run summary:
[coverage] group=C2xC2xC2 A_sel=128 B_sel=128 Q_meas=31 ratio_ge_sqrt=0.001 ratio_sel=0.002
[summary] best-by-k (measured; includes rejects):
  k=4 best_d_ub=20 count_measured=24 example_id=C2xC2xC2_c00022
  k=8 best_d_ub=16 count_measured=7 example_id=C2xC2xC2_c00037
[summary] best-by-k (survivors; target=16):
  k=4 best_d_ub=20 count_survivors=22 example_id=C2xC2xC2_c00022
  k=8 best_d_ub=16 count_survivors=3 example_id=C2xC2xC2_c00037
[pilot] top results:
  01 group=C2xC2xC2 n=288 k=4 d_ub=20 permA=11 permB=27 saved=True
  02 group=C2xC2xC2 n=288 k=4 d_ub=20 permA=11 permB=11 saved=True
  03 group=C2xC2xC2 n=288 k=4 d_ub=20 permA=7 permB=27 saved=True
  04 group=C2xC2xC2 n=288 k=4 d_ub=20 permA=27 permB=11 saved=True
  05 group=C2xC2xC2 n=288 k=4 d_ub=20 permA=20 permB=20 saved=True
  06 group=C2xC2xC2 n=288 k=4 d_ub=20 permA=27 permB=8 saved=True
  07 group=C2xC2xC2 n=288 k=4 d_ub=20 permA=8 permB=12 saved=True
  08 group=C2xC2xC2 n=288 k=4 d_ub=20 permA=12 permB=27 saved=True
  09 group=C2xC2xC2 n=288 k=4 d_ub=20 permA=12 permB=20 saved=True
  10 group=C2xC2xC2 n=288 k=4 d_ub=19 permA=11 permB=8 saved=True

