=== mer. 21 janv. 2026 01:23:57 CET steps=20000 batch=21 seed=1768937124 ===
[pilot] base k_table top pairs:
  k_base=18 permA=0 permB=0
  k_base=12 permA=29 permB=0
  k_base=12 permA=22 permB=0
  k_base=12 permA=13 permB=0
  k_base=12 permA=6 permB=0
[pilot] A multisets raw=792 (expected=792) enum_mode=multiset cayley_unique=26 perms=30 -> total scored = 780
[pilot] B multisets raw=792 (expected=792) enum_mode=multiset cayley_unique=26 perms=30 -> total scored = 780
[pilot] A frontier kept 128 candidates with points: (4,20), (0,49)
[pilot] B frontier kept 128 candidates with points: (4,20), (0,49)
[pilot] C2xC2xC2 n=288 d0=17 A_sets=26*30 -> keep 128; B_sets=26*30 -> keep 128
[pilot] MEAS n=288 k=4 dx_ub=20 dz_ub=20 d_ub=20 steps=20000 id=C2xC2xC2_c00013
[saved] id=C2xC2xC2_c00013 -> results/c2xc2xc2_d16_20260121_012357/promising/C2xC2xC2_c00013 (reason: d>=sqrt(n))
[pilot] MEAS n=288 k=4 dx_ub=17 dz_ub=16 d_ub=16 steps=20000 id=C2xC2xC2_c00030
[pilot] MEAS n=288 k=4 dx_ub=20 dz_ub=20 d_ub=20 steps=20000 id=C2xC2xC2_c00042
[saved] id=C2xC2xC2_c00042 -> results/c2xc2xc2_d16_20260121_012357/promising/C2xC2xC2_c00042 (reason: d>=sqrt(n))
[pilot] MEAS n=288 k=4 dx_ub=20 dz_ub=20 d_ub=20 steps=20000 id=C2xC2xC2_c00050
[saved] id=C2xC2xC2_c00050 -> results/c2xc2xc2_d16_20260121_012357/promising/C2xC2xC2_c00050 (reason: d>=sqrt(n))
[pilot] MEAS n=288 k=4 dx_ub=16 dz_ub=17 d_ub=16 steps=20000 id=C2xC2xC2_c00053
[pilot] MEAS n=288 k=8 dx_ub=17 dz_ub=16 d_ub=16 steps=20000 id=C2xC2xC2_c00075
[pilot] MEAS n=288 k=8 dx_ub=16 dz_ub=17 d_ub=16 steps=20000 id=C2xC2xC2_c00090
[pilot] MEAS n=288 k=8 dx_ub=16 dz_ub=18 d_ub=16 steps=20000 id=C2xC2xC2_c00129
[pilot] MEAS n=288 k=4 dx_ub=19 dz_ub=20 d_ub=19 steps=20000 id=C2xC2xC2_c00145
[saved] id=C2xC2xC2_c00145 -> results/c2xc2xc2_d16_20260121_012357/promising/C2xC2xC2_c00145 (reason: d>=sqrt(n))
[pilot] MEAS n=288 k=4 dx_ub=16 dz_ub=20 d_ub=16 steps=20000 id=C2xC2xC2_c00156
[pilot] MEAS n=288 k=4 dx_ub=20 dz_ub=20 d_ub=20 steps=20000 id=C2xC2xC2_c00189
[saved] id=C2xC2xC2_c00189 -> results/c2xc2xc2_d16_20260121_012357/promising/C2xC2xC2_c00189 (reason: d>=sqrt(n))
[pilot] MEAS n=288 k=4 dx_ub=20 dz_ub=17 d_ub=17 steps=20000 id=C2xC2xC2_c00199
[saved] id=C2xC2xC2_c00199 -> results/c2xc2xc2_d16_20260121_012357/promising/C2xC2xC2_c00199 (reason: d>=sqrt(n))
[pilot] TARGET_REJECT d_ub=12 target=16 id=C2xC2xC2_c00217
[pilot] MEAS n=288 k=4 dx_ub=19 dz_ub=20 d_ub=19 steps=20000 id=C2xC2xC2_c00281
[saved] id=C2xC2xC2_c00281 -> results/c2xc2xc2_d16_20260121_012357/promising/C2xC2xC2_c00281 (reason: d>=sqrt(n))
[pilot] MEAS n=288 k=8 dx_ub=18 dz_ub=16 d_ub=16 steps=20000 id=C2xC2xC2_c00290
[pilot] TARGET_REJECT d_ub=12 target=16 id=C2xC2xC2_c00353
[pilot] MEAS n=288 k=4 dx_ub=16 dz_ub=17 d_ub=16 steps=20000 id=C2xC2xC2_c00359
[pilot] TARGET_REJECT d_ub=6 target=16 id=C2xC2xC2_c00362
[pilot] MEAS n=288 k=4 dx_ub=16 dz_ub=17 d_ub=16 steps=20000 id=C2xC2xC2_c00365
[pilot] MEAS n=288 k=4 dx_ub=18 dz_ub=20 d_ub=18 steps=20000 id=C2xC2xC2_c00385
[saved] id=C2xC2xC2_c00385 -> results/c2xc2xc2_d16_20260121_012357/promising/C2xC2xC2_c00385 (reason: d>=sqrt(n))
[pilot] MEAS n=288 k=4 dx_ub=20 dz_ub=20 d_ub=20 steps=20000 id=C2xC2xC2_c00414
[saved] id=C2xC2xC2_c00414 -> results/c2xc2xc2_d16_20260121_012357/promising/C2xC2xC2_c00414 (reason: d>=sqrt(n))
[pilot] TARGET_REJECT d_ub=6 target=16 id=C2xC2xC2_c00424
[pilot] MEAS n=288 k=8 dx_ub=16 dz_ub=18 d_ub=16 steps=20000 id=C2xC2xC2_c00433
[pilot] TARGET_REJECT d_ub=14 target=16 id=C2xC2xC2_c00438
[pilot] MEAS n=288 k=4 dx_ub=20 dz_ub=16 d_ub=16 steps=20000 id=C2xC2xC2_c00448
[pilot] TARGET_REJECT d_ub=6 target=16 id=C2xC2xC2_c00459
[pilot] MEAS n=288 k=4 dx_ub=20 dz_ub=16 d_ub=16 steps=20000 id=C2xC2xC2_c00460
[pilot] MEAS n=288 k=8 dx_ub=18 dz_ub=16 d_ub=16 steps=20000 id=C2xC2xC2_c00463
[pilot] MEAS n=288 k=4 dx_ub=16 dz_ub=18 d_ub=16 steps=20000 id=C2xC2xC2_c00492
[best_by_k] group=C2xC2xC2 n=288
k  | d_ub | steps | dx_ub | dz_ub | id
 4 |   20 | 20000 |    20 |    20 | C2xC2xC2_c00013
 8 |   16 | 20000 |    17 |    16 | C2xC2xC2_c00075
[coverage] group=C2xC2xC2 A_sel=128 B_sel=128 Q_meas=29 ratio_ge_sqrt=0.001 ratio_sel=0.002
[coverage] run summary:
[coverage] group=C2xC2xC2 A_sel=128 B_sel=128 Q_meas=29 ratio_ge_sqrt=0.001 ratio_sel=0.002
[summary] best-by-k (measured; includes rejects):
  k=4 best_d_ub=20 count_measured=18 example_id=C2xC2xC2_c00013
  k=8 best_d_ub=16 count_measured=11 example_id=C2xC2xC2_c00075
[summary] best-by-k (survivors; target=16):
  k=4 best_d_ub=20 count_survivors=17 example_id=C2xC2xC2_c00013
  k=8 best_d_ub=16 count_survivors=6 example_id=C2xC2xC2_c00075
[pilot] top results:
  01 group=C2xC2xC2 n=288 k=4 d_ub=20 permA=20 permB=7 saved=True
  02 group=C2xC2xC2 n=288 k=4 d_ub=20 permA=20 permB=7 saved=True
  03 group=C2xC2xC2 n=288 k=4 d_ub=20 permA=27 permB=20 saved=True
  04 group=C2xC2xC2 n=288 k=4 d_ub=20 permA=27 permB=12 saved=True
  05 group=C2xC2xC2 n=288 k=4 d_ub=20 permA=27 permB=20 saved=True
  06 group=C2xC2xC2 n=288 k=4 d_ub=19 permA=11 permB=11 saved=True
  07 group=C2xC2xC2 n=288 k=4 d_ub=19 permA=27 permB=11 saved=True
  08 group=C2xC2xC2 n=288 k=4 d_ub=18 permA=27 permB=20 saved=True
  09 group=C2xC2xC2 n=288 k=4 d_ub=17 permA=27 permB=20 saved=True
  10 group=C2xC2xC2 n=288 k=8 d_ub=16 permA=11 permB=11 saved=False

