=== mar. 20 janv. 2026 15:23:11 CET steps=5000 batch=60 seed=1768922163 ===
[pilot] base k_table top pairs:
  k_base=18 permA=0 permB=0
  k_base=12 permA=29 permB=0
  k_base=12 permA=22 permB=0
  k_base=12 permA=13 permB=0
  k_base=12 permA=6 permB=0
[pilot] A multisets raw=792 (expected=792) enum_mode=multiset cayley_unique=26 perms=30 -> total scored = 780
[pilot] B multisets raw=792 (expected=792) enum_mode=multiset cayley_unique=26 perms=30 -> total scored = 780
[pilot] A frontier kept 128 candidates with points: (4,20), (0,49)
[pilot] B frontier kept 128 candidates with points: (4,20), (0,49)
[pilot] C2xC2xC2 n=288 d0=17 A_sets=26*30 -> keep 128; B_sets=26*30 -> keep 128
[pilot] MEAS n=288 k=8 dx_ub=16 dz_ub=16 d_ub=16 steps=5000 id=C2xC2xC2_c00000
[pilot] MEAS n=288 k=4 dx_ub=20 dz_ub=18 d_ub=18 steps=5000 id=C2xC2xC2_c00034
[saved] id=C2xC2xC2_c00034 -> results/c2xc2xc2_d16_20260120_152311/promising/C2xC2xC2_c00034 (reason: d>=sqrt(n))
[pilot] MEAS n=288 k=4 dx_ub=16 dz_ub=16 d_ub=16 steps=5000 id=C2xC2xC2_c00050
[pilot] MEAS n=288 k=4 dx_ub=20 dz_ub=20 d_ub=20 steps=5000 id=C2xC2xC2_c00087
[saved] id=C2xC2xC2_c00087 -> results/c2xc2xc2_d16_20260120_152311/promising/C2xC2xC2_c00087 (reason: d>=sqrt(n))
[pilot] TARGET_REJECT d_ub=15 target=16 id=C2xC2xC2_c00095
[pilot] MEAS n=288 k=4 dx_ub=20 dz_ub=19 d_ub=19 steps=5000 id=C2xC2xC2_c00100
[saved] id=C2xC2xC2_c00100 -> results/c2xc2xc2_d16_20260120_152311/promising/C2xC2xC2_c00100 (reason: d>=sqrt(n))
[pilot] TARGET_REJECT d_ub=14 target=16 id=C2xC2xC2_c00322
[pilot] MEAS n=288 k=4 dx_ub=16 dz_ub=18 d_ub=16 steps=5000 id=C2xC2xC2_c00327
[pilot] MEAS n=288 k=4 dx_ub=20 dz_ub=19 d_ub=19 steps=5000 id=C2xC2xC2_c00338
[saved] id=C2xC2xC2_c00338 -> results/c2xc2xc2_d16_20260120_152311/promising/C2xC2xC2_c00338 (reason: d>=sqrt(n))
[pilot] MEAS n=288 k=4 dx_ub=16 dz_ub=16 d_ub=16 steps=5000 id=C2xC2xC2_c00355
[pilot] MEAS n=288 k=4 dx_ub=20 dz_ub=19 d_ub=19 steps=5000 id=C2xC2xC2_c00361
[saved] id=C2xC2xC2_c00361 -> results/c2xc2xc2_d16_20260120_152311/promising/C2xC2xC2_c00361 (reason: d>=sqrt(n))
[pilot] MEAS n=288 k=8 dx_ub=16 dz_ub=17 d_ub=16 steps=5000 id=C2xC2xC2_c00371
[pilot] TARGET_REJECT d_ub=14 target=16 id=C2xC2xC2_c00376
[pilot] TARGET_REJECT d_ub=12 target=16 id=C2xC2xC2_c00392
[pilot] MEAS n=288 k=4 dx_ub=21 dz_ub=16 d_ub=16 steps=5000 id=C2xC2xC2_c00401
[pilot] MEAS n=288 k=4 dx_ub=20 dz_ub=20 d_ub=20 steps=5000 id=C2xC2xC2_c00402
[saved] id=C2xC2xC2_c00402 -> results/c2xc2xc2_d16_20260120_152311/promising/C2xC2xC2_c00402 (reason: d>=sqrt(n))
[pilot] MEAS n=288 k=4 dx_ub=20 dz_ub=16 d_ub=16 steps=5000 id=C2xC2xC2_c00420
[pilot] MEAS n=288 k=4 dx_ub=16 dz_ub=17 d_ub=16 steps=5000 id=C2xC2xC2_c00421
[pilot] MEAS n=288 k=4 dx_ub=16 dz_ub=17 d_ub=16 steps=5000 id=C2xC2xC2_c00429
[pilot] MEAS n=288 k=4 dx_ub=20 dz_ub=20 d_ub=20 steps=5000 id=C2xC2xC2_c00432
[saved] id=C2xC2xC2_c00432 -> results/c2xc2xc2_d16_20260120_152311/promising/C2xC2xC2_c00432 (reason: d>=sqrt(n))
[pilot] MEAS n=288 k=4 dx_ub=17 dz_ub=21 d_ub=17 steps=5000 id=C2xC2xC2_c00437
[saved] id=C2xC2xC2_c00437 -> results/c2xc2xc2_d16_20260120_152311/promising/C2xC2xC2_c00437 (reason: d>=sqrt(n))
[pilot] MEAS n=288 k=4 dx_ub=18 dz_ub=16 d_ub=16 steps=5000 id=C2xC2xC2_c00454
[pilot] MEAS n=288 k=4 dx_ub=16 dz_ub=17 d_ub=16 steps=5000 id=C2xC2xC2_c00459
[pilot] MEAS n=288 k=4 dx_ub=19 dz_ub=20 d_ub=19 steps=5000 id=C2xC2xC2_c00471
[saved] id=C2xC2xC2_c00471 -> results/c2xc2xc2_d16_20260120_152311/promising/C2xC2xC2_c00471 (reason: d>=sqrt(n))
[pilot] MEAS n=288 k=4 dx_ub=18 dz_ub=20 d_ub=18 steps=5000 id=C2xC2xC2_c00478
[saved] id=C2xC2xC2_c00478 -> results/c2xc2xc2_d16_20260120_152311/promising/C2xC2xC2_c00478 (reason: d>=sqrt(n))
[pilot] MEAS n=288 k=4 dx_ub=17 dz_ub=20 d_ub=17 steps=5000 id=C2xC2xC2_c00480
[saved] id=C2xC2xC2_c00480 -> results/c2xc2xc2_d16_20260120_152311/promising/C2xC2xC2_c00480 (reason: d>=sqrt(n))
[best_by_k] group=C2xC2xC2 n=288
k  | d_ub | steps | dx_ub | dz_ub | id
 4 |   20 |  5000 |    20 |    20 | C2xC2xC2_c00087
 8 |   16 |  5000 |    16 |    16 | C2xC2xC2_c00000
[coverage] group=C2xC2xC2 A_sel=128 B_sel=128 Q_meas=26 ratio_ge_sqrt=0.000 ratio_sel=0.002
[coverage] run summary:
[coverage] group=C2xC2xC2 A_sel=128 B_sel=128 Q_meas=26 ratio_ge_sqrt=0.000 ratio_sel=0.002
[summary] best-by-k (measured; includes rejects):
  k=4 best_d_ub=20 count_measured=21 example_id=C2xC2xC2_c00087
  k=8 best_d_ub=16 count_measured=5 example_id=C2xC2xC2_c00000
[summary] best-by-k (survivors; target=16):
  k=4 best_d_ub=20 count_survivors=20 example_id=C2xC2xC2_c00087
  k=8 best_d_ub=16 count_survivors=2 example_id=C2xC2xC2_c00000
[pilot] top results:
  01 group=C2xC2xC2 n=288 k=4 d_ub=20 permA=27 permB=7 saved=True
  02 group=C2xC2xC2 n=288 k=4 d_ub=20 permA=27 permB=12 saved=True
  03 group=C2xC2xC2 n=288 k=4 d_ub=20 permA=11 permB=12 saved=True
  04 group=C2xC2xC2 n=288 k=4 d_ub=19 permA=11 permB=11 saved=True
  05 group=C2xC2xC2 n=288 k=4 d_ub=19 permA=11 permB=8 saved=True
  06 group=C2xC2xC2 n=288 k=4 d_ub=19 permA=11 permB=11 saved=True
  07 group=C2xC2xC2 n=288 k=4 d_ub=19 permA=27 permB=27 saved=True
  08 group=C2xC2xC2 n=288 k=4 d_ub=18 permA=20 permB=11 saved=True
  09 group=C2xC2xC2 n=288 k=4 d_ub=18 permA=27 permB=20 saved=True
  10 group=C2xC2xC2 n=288 k=4 d_ub=17 permA=27 permB=20 saved=True

