=== mar. 20 janv. 2026 15:26:30 CET steps=5000 batch=66 seed=1768922169 ===
[pilot] base k_table top pairs:
  k_base=18 permA=0 permB=0
  k_base=12 permA=29 permB=0
  k_base=12 permA=22 permB=0
  k_base=12 permA=13 permB=0
  k_base=12 permA=6 permB=0
[pilot] A multisets raw=792 (expected=792) enum_mode=multiset cayley_unique=26 perms=30 -> total scored = 780
[pilot] B multisets raw=792 (expected=792) enum_mode=multiset cayley_unique=26 perms=30 -> total scored = 780
[pilot] A frontier kept 128 candidates with points: (4,20), (0,49)
[pilot] B frontier kept 128 candidates with points: (4,20), (0,49)
[pilot] C2xC2xC2 n=288 d0=17 A_sets=26*30 -> keep 128; B_sets=26*30 -> keep 128
[pilot] MEAS n=288 k=8 dx_ub=16 dz_ub=19 d_ub=16 steps=5000 id=C2xC2xC2_c00023
[pilot] MEAS n=288 k=8 dx_ub=16 dz_ub=17 d_ub=16 steps=5000 id=C2xC2xC2_c00033
[pilot] TARGET_REJECT d_ub=15 target=16 id=C2xC2xC2_c00035
[pilot] TARGET_REJECT d_ub=12 target=16 id=C2xC2xC2_c00038
[pilot] MEAS n=288 k=4 dx_ub=20 dz_ub=20 d_ub=20 steps=5000 id=C2xC2xC2_c00075
[saved] id=C2xC2xC2_c00075 -> results/c2xc2xc2_d16_20260120_152630/promising/C2xC2xC2_c00075 (reason: d>=sqrt(n))
[pilot] MEAS n=288 k=4 dx_ub=22 dz_ub=19 d_ub=19 steps=5000 id=C2xC2xC2_c00094
[saved] id=C2xC2xC2_c00094 -> results/c2xc2xc2_d16_20260120_152630/promising/C2xC2xC2_c00094 (reason: d>=sqrt(n))
[pilot] TARGET_REJECT d_ub=12 target=16 id=C2xC2xC2_c00095
[pilot] TARGET_REJECT d_ub=12 target=16 id=C2xC2xC2_c00099
[pilot] TARGET_REJECT d_ub=14 target=16 id=C2xC2xC2_c00104
[pilot] MEAS n=288 k=8 dx_ub=16 dz_ub=17 d_ub=16 steps=5000 id=C2xC2xC2_c00121
[pilot] TARGET_REJECT d_ub=12 target=16 id=C2xC2xC2_c00177
[pilot] TARGET_REJECT d_ub=15 target=16 id=C2xC2xC2_c00199
[pilot] TARGET_REJECT d_ub=12 target=16 id=C2xC2xC2_c00200
[pilot] TARGET_REJECT d_ub=15 target=16 id=C2xC2xC2_c00206
[pilot] MEAS n=288 k=4 dx_ub=19 dz_ub=19 d_ub=19 steps=5000 id=C2xC2xC2_c00227
[saved] id=C2xC2xC2_c00227 -> results/c2xc2xc2_d16_20260120_152630/promising/C2xC2xC2_c00227 (reason: d>=sqrt(n))
[pilot] MEAS n=288 k=4 dx_ub=20 dz_ub=20 d_ub=20 steps=5000 id=C2xC2xC2_c00256
[saved] id=C2xC2xC2_c00256 -> results/c2xc2xc2_d16_20260120_152630/promising/C2xC2xC2_c00256 (reason: d>=sqrt(n))
[pilot] MEAS n=288 k=4 dx_ub=17 dz_ub=20 d_ub=17 steps=5000 id=C2xC2xC2_c00258
[saved] id=C2xC2xC2_c00258 -> results/c2xc2xc2_d16_20260120_152630/promising/C2xC2xC2_c00258 (reason: d>=sqrt(n))
[pilot] MEAS n=288 k=4 dx_ub=17 dz_ub=20 d_ub=17 steps=5000 id=C2xC2xC2_c00276
[saved] id=C2xC2xC2_c00276 -> results/c2xc2xc2_d16_20260120_152630/promising/C2xC2xC2_c00276 (reason: d>=sqrt(n))
[pilot] MEAS n=288 k=4 dx_ub=17 dz_ub=20 d_ub=17 steps=5000 id=C2xC2xC2_c00304
[saved] id=C2xC2xC2_c00304 -> results/c2xc2xc2_d16_20260120_152630/promising/C2xC2xC2_c00304 (reason: d>=sqrt(n))
[pilot] TARGET_REJECT d_ub=12 target=16 id=C2xC2xC2_c00346
[pilot] MEAS n=288 k=4 dx_ub=17 dz_ub=20 d_ub=17 steps=5000 id=C2xC2xC2_c00352
[saved] id=C2xC2xC2_c00352 -> results/c2xc2xc2_d16_20260120_152630/promising/C2xC2xC2_c00352 (reason: d>=sqrt(n))
[pilot] MEAS n=288 k=4 dx_ub=16 dz_ub=18 d_ub=16 steps=5000 id=C2xC2xC2_c00369
[pilot] MEAS n=288 k=4 dx_ub=16 dz_ub=17 d_ub=16 steps=5000 id=C2xC2xC2_c00401
[pilot] MEAS n=288 k=4 dx_ub=20 dz_ub=20 d_ub=20 steps=5000 id=C2xC2xC2_c00411
[saved] id=C2xC2xC2_c00411 -> results/c2xc2xc2_d16_20260120_152630/promising/C2xC2xC2_c00411 (reason: d>=sqrt(n))
[pilot] MEAS n=288 k=8 dx_ub=16 dz_ub=18 d_ub=16 steps=5000 id=C2xC2xC2_c00475
[pilot] MEAS n=288 k=4 dx_ub=20 dz_ub=20 d_ub=20 steps=5000 id=C2xC2xC2_c00478
[saved] id=C2xC2xC2_c00478 -> results/c2xc2xc2_d16_20260120_152630/promising/C2xC2xC2_c00478 (reason: d>=sqrt(n))
[best_by_k] group=C2xC2xC2 n=288
k  | d_ub | steps | dx_ub | dz_ub | id
 4 |   20 |  5000 |    20 |    20 | C2xC2xC2_c00075
 8 |   16 |  5000 |    16 |    19 | C2xC2xC2_c00023
[coverage] group=C2xC2xC2 A_sel=128 B_sel=128 Q_meas=26 ratio_ge_sqrt=0.000 ratio_sel=0.002
[coverage] run summary:
[coverage] group=C2xC2xC2 A_sel=128 B_sel=128 Q_meas=26 ratio_ge_sqrt=0.000 ratio_sel=0.002
[summary] best-by-k (measured; includes rejects):
  k=4 best_d_ub=20 count_measured=14 example_id=C2xC2xC2_c00075
  k=8 best_d_ub=16 count_measured=12 example_id=C2xC2xC2_c00023
[summary] best-by-k (survivors; target=16):
  k=4 best_d_ub=20 count_survivors=12 example_id=C2xC2xC2_c00075
  k=8 best_d_ub=16 count_survivors=4 example_id=C2xC2xC2_c00023
[pilot] top results:
  01 group=C2xC2xC2 n=288 k=4 d_ub=20 permA=20 permB=11 saved=True
  02 group=C2xC2xC2 n=288 k=4 d_ub=20 permA=7 permB=27 saved=True
  03 group=C2xC2xC2 n=288 k=4 d_ub=20 permA=7 permB=8 saved=True
  04 group=C2xC2xC2 n=288 k=4 d_ub=20 permA=7 permB=20 saved=True
  05 group=C2xC2xC2 n=288 k=4 d_ub=19 permA=27 permB=11 saved=True
  06 group=C2xC2xC2 n=288 k=4 d_ub=19 permA=8 permB=27 saved=True
  07 group=C2xC2xC2 n=288 k=4 d_ub=17 permA=20 permB=12 saved=True
  08 group=C2xC2xC2 n=288 k=4 d_ub=17 permA=27 permB=20 saved=True
  09 group=C2xC2xC2 n=288 k=4 d_ub=17 permA=20 permB=8 saved=True
  10 group=C2xC2xC2 n=288 k=4 d_ub=17 permA=11 permB=20 saved=True

