=== mar. 20 janv. 2026 14:36:35 CET steps=2000 batch=1 seed=1768918196 ===
[pilot] base k_table top pairs:
  k_base=18 permA=0 permB=0
  k_base=12 permA=29 permB=0
  k_base=12 permA=22 permB=0
  k_base=12 permA=13 permB=0
  k_base=12 permA=6 permB=0
[pilot] A multisets raw=792 (expected=792) enum_mode=multiset cayley_unique=26 perms=30 -> total scored = 780
[pilot] B multisets raw=792 (expected=792) enum_mode=multiset cayley_unique=26 perms=30 -> total scored = 780
[pilot] A frontier kept 128 candidates with points: (4,20), (0,49)
[pilot] B frontier kept 128 candidates with points: (4,20), (0,49)
[pilot] C2xC2xC2 n=288 d0=17 A_sets=26*30 -> keep 128; B_sets=26*30 -> keep 128
[pilot] MEAS n=288 k=4 dx_ub=17 dz_ub=20 d_ub=17 steps=2000 id=C2xC2xC2_c00004
[saved] id=C2xC2xC2_c00004 -> results/c2xc2xc2_d16_20260120_143635/promising/C2xC2xC2_c00004 (reason: d>=sqrt(n))
[pilot] MEAS n=288 k=4 dx_ub=16 dz_ub=18 d_ub=16 steps=2000 id=C2xC2xC2_c00027
[pilot] MEAS n=288 k=4 dx_ub=20 dz_ub=23 d_ub=20 steps=2000 id=C2xC2xC2_c00056
[saved] id=C2xC2xC2_c00056 -> results/c2xc2xc2_d16_20260120_143635/promising/C2xC2xC2_c00056 (reason: d>=sqrt(n))
[pilot] MEAS n=288 k=4 dx_ub=16 dz_ub=20 d_ub=16 steps=2000 id=C2xC2xC2_c00063
[pilot] MEAS n=288 k=4 dx_ub=23 dz_ub=20 d_ub=20 steps=2000 id=C2xC2xC2_c00096
[saved] id=C2xC2xC2_c00096 -> results/c2xc2xc2_d16_20260120_143635/promising/C2xC2xC2_c00096 (reason: d>=sqrt(n))
[pilot] MEAS n=288 k=4 dx_ub=16 dz_ub=17 d_ub=16 steps=2000 id=C2xC2xC2_c00108
[pilot] MEAS n=288 k=4 dx_ub=19 dz_ub=21 d_ub=19 steps=2000 id=C2xC2xC2_c00184
[saved] id=C2xC2xC2_c00184 -> results/c2xc2xc2_d16_20260120_143635/promising/C2xC2xC2_c00184 (reason: d>=sqrt(n))
[pilot] MEAS n=288 k=4 dx_ub=20 dz_ub=23 d_ub=20 steps=2000 id=C2xC2xC2_c00230
[saved] id=C2xC2xC2_c00230 -> results/c2xc2xc2_d16_20260120_143635/promising/C2xC2xC2_c00230 (reason: d>=sqrt(n))
[pilot] MEAS n=288 k=4 dx_ub=26 dz_ub=19 d_ub=19 steps=2000 id=C2xC2xC2_c00266
[saved] id=C2xC2xC2_c00266 -> results/c2xc2xc2_d16_20260120_143635/promising/C2xC2xC2_c00266 (reason: d>=sqrt(n))
[pilot] TARGET_REJECT d_ub=12 target=16 id=C2xC2xC2_c00276
[pilot] MEAS n=288 k=4 dx_ub=24 dz_ub=20 d_ub=20 steps=2000 id=C2xC2xC2_c00299
[saved] id=C2xC2xC2_c00299 -> results/c2xc2xc2_d16_20260120_143635/promising/C2xC2xC2_c00299 (reason: d>=sqrt(n))
[pilot] TARGET_REJECT d_ub=12 target=16 id=C2xC2xC2_c00301
[pilot] MEAS n=288 k=4 dx_ub=20 dz_ub=20 d_ub=20 steps=2000 id=C2xC2xC2_c00315
[saved] id=C2xC2xC2_c00315 -> results/c2xc2xc2_d16_20260120_143635/promising/C2xC2xC2_c00315 (reason: d>=sqrt(n))
[pilot] MEAS n=288 k=4 dx_ub=20 dz_ub=20 d_ub=20 steps=2000 id=C2xC2xC2_c00319
[saved] id=C2xC2xC2_c00319 -> results/c2xc2xc2_d16_20260120_143635/promising/C2xC2xC2_c00319 (reason: d>=sqrt(n))
[pilot] TARGET_REJECT d_ub=12 target=16 id=C2xC2xC2_c00327
[pilot] MEAS n=288 k=4 dx_ub=20 dz_ub=20 d_ub=20 steps=2000 id=C2xC2xC2_c00342
[saved] id=C2xC2xC2_c00342 -> results/c2xc2xc2_d16_20260120_143635/promising/C2xC2xC2_c00342 (reason: d>=sqrt(n))
[pilot] MEAS n=288 k=4 dx_ub=16 dz_ub=16 d_ub=16 steps=2000 id=C2xC2xC2_c00387
[pilot] MEAS n=288 k=8 dx_ub=22 dz_ub=16 d_ub=16 steps=2000 id=C2xC2xC2_c00394
[pilot] MEAS n=288 k=4 dx_ub=23 dz_ub=16 d_ub=16 steps=2000 id=C2xC2xC2_c00411
[pilot] MEAS n=288 k=4 dx_ub=16 dz_ub=16 d_ub=16 steps=2000 id=C2xC2xC2_c00443
[pilot] MEAS n=288 k=4 dx_ub=23 dz_ub=20 d_ub=20 steps=2000 id=C2xC2xC2_c00457
[saved] id=C2xC2xC2_c00457 -> results/c2xc2xc2_d16_20260120_143635/promising/C2xC2xC2_c00457 (reason: d>=sqrt(n))
[pilot] MEAS n=288 k=4 dx_ub=19 dz_ub=18 d_ub=18 steps=2000 id=C2xC2xC2_c00497
[saved] id=C2xC2xC2_c00497 -> results/c2xc2xc2_d16_20260120_143635/promising/C2xC2xC2_c00497 (reason: d>=sqrt(n))
[best_by_k] group=C2xC2xC2 n=288
k  | d_ub | steps | dx_ub | dz_ub | id
 4 |   20 |  2000 |    20 |    23 | C2xC2xC2_c00056
 8 |   16 |  2000 |    22 |    16 | C2xC2xC2_c00394
[coverage] group=C2xC2xC2 A_sel=128 B_sel=128 Q_meas=22 ratio_ge_sqrt=0.000 ratio_sel=0.001
[coverage] run summary:
[coverage] group=C2xC2xC2 A_sel=128 B_sel=128 Q_meas=22 ratio_ge_sqrt=0.000 ratio_sel=0.001
[summary] best-by-k (measured; includes rejects):
  k=4 best_d_ub=20 count_measured=18 example_id=C2xC2xC2_c00056
  k=8 best_d_ub=16 count_measured=4 example_id=C2xC2xC2_c00394
[summary] best-by-k (survivors; target=16):
  k=4 best_d_ub=20 count_survivors=18 example_id=C2xC2xC2_c00056
  k=8 best_d_ub=16 count_survivors=1 example_id=C2xC2xC2_c00394
[pilot] top results:
  01 group=C2xC2xC2 n=288 k=4 d_ub=20 permA=11 permB=20 saved=True
  02 group=C2xC2xC2 n=288 k=4 d_ub=20 permA=11 permB=8 saved=True
  03 group=C2xC2xC2 n=288 k=4 d_ub=20 permA=20 permB=27 saved=True
  04 group=C2xC2xC2 n=288 k=4 d_ub=20 permA=27 permB=11 saved=True
  05 group=C2xC2xC2 n=288 k=4 d_ub=20 permA=8 permB=11 saved=True
  06 group=C2xC2xC2 n=288 k=4 d_ub=20 permA=27 permB=8 saved=True
  07 group=C2xC2xC2 n=288 k=4 d_ub=20 permA=27 permB=27 saved=True
  08 group=C2xC2xC2 n=288 k=4 d_ub=20 permA=7 permB=8 saved=True
  09 group=C2xC2xC2 n=288 k=4 d_ub=19 permA=27 permB=20 saved=True
  10 group=C2xC2xC2 n=288 k=4 d_ub=19 permA=11 permB=8 saved=True

