=== mar. 20 janv. 2026 14:43:52 CET steps=2000 batch=1 seed=1768918633 ===
[pilot] base k_table top pairs:
  k_base=18 permA=0 permB=0
  k_base=12 permA=29 permB=0
  k_base=12 permA=22 permB=0
  k_base=12 permA=13 permB=0
  k_base=12 permA=6 permB=0
[pilot] A multisets raw=792 (expected=792) enum_mode=multiset cayley_unique=26 perms=30 -> total scored = 780
[pilot] B multisets raw=792 (expected=792) enum_mode=multiset cayley_unique=26 perms=30 -> total scored = 780
[pilot] A frontier kept 128 candidates with points: (4,20), (0,49)
[pilot] B frontier kept 128 candidates with points: (4,20), (0,49)
[pilot] C2xC2xC2 n=288 d0=17 A_sets=26*30 -> keep 128; B_sets=26*30 -> keep 128
[pilot] MEAS n=288 k=4 dx_ub=23 dz_ub=23 d_ub=23 steps=2000 id=C2xC2xC2_c00006
[saved] id=C2xC2xC2_c00006 -> results/c2xc2xc2_d16_20260120_144352/promising/C2xC2xC2_c00006 (reason: d>=sqrt(n))
[pilot] MEAS n=288 k=4 dx_ub=16 dz_ub=16 d_ub=16 steps=2000 id=C2xC2xC2_c00008
[pilot] TARGET_REJECT d_ub=12 target=16 id=C2xC2xC2_c00039
[pilot] MEAS n=288 k=4 dx_ub=20 dz_ub=21 d_ub=20 steps=2000 id=C2xC2xC2_c00076
[saved] id=C2xC2xC2_c00076 -> results/c2xc2xc2_d16_20260120_144352/promising/C2xC2xC2_c00076 (reason: d>=sqrt(n))
[pilot] MEAS n=288 k=8 dx_ub=18 dz_ub=16 d_ub=16 steps=2000 id=C2xC2xC2_c00078
[pilot] MEAS n=288 k=4 dx_ub=20 dz_ub=20 d_ub=20 steps=2000 id=C2xC2xC2_c00082
[saved] id=C2xC2xC2_c00082 -> results/c2xc2xc2_d16_20260120_144352/promising/C2xC2xC2_c00082 (reason: d>=sqrt(n))
[pilot] MEAS n=288 k=4 dx_ub=16 dz_ub=16 d_ub=16 steps=2000 id=C2xC2xC2_c00094
[pilot] MEAS n=288 k=8 dx_ub=17 dz_ub=21 d_ub=17 steps=2000 id=C2xC2xC2_c00114
[saved] id=C2xC2xC2_c00114 -> results/c2xc2xc2_d16_20260120_144352/promising/C2xC2xC2_c00114 (reason: d>=sqrt(n))
[pilot] MEAS n=288 k=4 dx_ub=20 dz_ub=20 d_ub=20 steps=2000 id=C2xC2xC2_c00146
[saved] id=C2xC2xC2_c00146 -> results/c2xc2xc2_d16_20260120_144352/promising/C2xC2xC2_c00146 (reason: d>=sqrt(n))
[pilot] MEAS n=288 k=4 dx_ub=20 dz_ub=18 d_ub=18 steps=2000 id=C2xC2xC2_c00157
[saved] id=C2xC2xC2_c00157 -> results/c2xc2xc2_d16_20260120_144352/promising/C2xC2xC2_c00157 (reason: d>=sqrt(n))
[pilot] MEAS n=288 k=4 dx_ub=16 dz_ub=16 d_ub=16 steps=2000 id=C2xC2xC2_c00163
[pilot] TARGET_REJECT d_ub=15 target=16 id=C2xC2xC2_c00169
[pilot] MEAS n=288 k=4 dx_ub=20 dz_ub=23 d_ub=20 steps=2000 id=C2xC2xC2_c00191
[saved] id=C2xC2xC2_c00191 -> results/c2xc2xc2_d16_20260120_144352/promising/C2xC2xC2_c00191 (reason: d>=sqrt(n))
[pilot] TARGET_REJECT d_ub=6 target=16 id=C2xC2xC2_c00194
[pilot] TARGET_REJECT d_ub=12 target=16 id=C2xC2xC2_c00198
[pilot] MEAS n=288 k=4 dx_ub=22 dz_ub=22 d_ub=22 steps=2000 id=C2xC2xC2_c00218
[saved] id=C2xC2xC2_c00218 -> results/c2xc2xc2_d16_20260120_144352/promising/C2xC2xC2_c00218 (reason: d>=sqrt(n))
[pilot] TARGET_REJECT d_ub=14 target=16 id=C2xC2xC2_c00236
[pilot] MEAS n=288 k=4 dx_ub=21 dz_ub=23 d_ub=21 steps=2000 id=C2xC2xC2_c00266
[saved] id=C2xC2xC2_c00266 -> results/c2xc2xc2_d16_20260120_144352/promising/C2xC2xC2_c00266 (reason: d>=sqrt(n))
[pilot] MEAS n=288 k=4 dx_ub=19 dz_ub=22 d_ub=19 steps=2000 id=C2xC2xC2_c00275
[saved] id=C2xC2xC2_c00275 -> results/c2xc2xc2_d16_20260120_144352/promising/C2xC2xC2_c00275 (reason: d>=sqrt(n))
[pilot] MEAS n=288 k=8 dx_ub=17 dz_ub=19 d_ub=17 steps=2000 id=C2xC2xC2_c00305
[saved] id=C2xC2xC2_c00305 -> results/c2xc2xc2_d16_20260120_144352/promising/C2xC2xC2_c00305 (reason: d>=sqrt(n))
[pilot] MEAS n=288 k=4 dx_ub=16 dz_ub=20 d_ub=16 steps=2000 id=C2xC2xC2_c00321
[pilot] MEAS n=288 k=4 dx_ub=16 dz_ub=17 d_ub=16 steps=2000 id=C2xC2xC2_c00379
[pilot] MEAS n=288 k=4 dx_ub=18 dz_ub=17 d_ub=17 steps=2000 id=C2xC2xC2_c00435
[saved] id=C2xC2xC2_c00435 -> results/c2xc2xc2_d16_20260120_144352/promising/C2xC2xC2_c00435 (reason: d>=sqrt(n))
[pilot] TARGET_REJECT d_ub=6 target=16 id=C2xC2xC2_c00437
[pilot] MEAS n=288 k=4 dx_ub=20 dz_ub=20 d_ub=20 steps=2000 id=C2xC2xC2_c00438
[saved] id=C2xC2xC2_c00438 -> results/c2xc2xc2_d16_20260120_144352/promising/C2xC2xC2_c00438 (reason: d>=sqrt(n))
[pilot] TARGET_REJECT d_ub=12 target=16 id=C2xC2xC2_c00455
[pilot] TARGET_REJECT d_ub=12 target=16 id=C2xC2xC2_c00483
[best_by_k] group=C2xC2xC2 n=288
k  | d_ub | steps | dx_ub | dz_ub | id
 4 |   23 |  2000 |    23 |    23 | C2xC2xC2_c00006
 8 |   17 |  2000 |    17 |    21 | C2xC2xC2_c00114
[coverage] group=C2xC2xC2 A_sel=128 B_sel=128 Q_meas=27 ratio_ge_sqrt=0.000 ratio_sel=0.002
[coverage] run summary:
[coverage] group=C2xC2xC2 A_sel=128 B_sel=128 Q_meas=27 ratio_ge_sqrt=0.000 ratio_sel=0.002
[summary] best-by-k (measured; includes rejects):
  k=4 best_d_ub=23 count_measured=18 example_id=C2xC2xC2_c00006
  k=8 best_d_ub=17 count_measured=9 example_id=C2xC2xC2_c00114
[summary] best-by-k (survivors; target=16):
  k=4 best_d_ub=23 count_survivors=16 example_id=C2xC2xC2_c00006
  k=8 best_d_ub=17 count_survivors=3 example_id=C2xC2xC2_c00114
[pilot] top results:
  01 group=C2xC2xC2 n=288 k=4 d_ub=23 permA=20 permB=11 saved=True
  02 group=C2xC2xC2 n=288 k=4 d_ub=22 permA=20 permB=11 saved=True
  03 group=C2xC2xC2 n=288 k=4 d_ub=21 permA=27 permB=11 saved=True
  04 group=C2xC2xC2 n=288 k=4 d_ub=20 permA=11 permB=27 saved=True
  05 group=C2xC2xC2 n=288 k=4 d_ub=20 permA=27 permB=8 saved=True
  06 group=C2xC2xC2 n=288 k=4 d_ub=20 permA=12 permB=12 saved=True
  07 group=C2xC2xC2 n=288 k=4 d_ub=20 permA=11 permB=27 saved=True
  08 group=C2xC2xC2 n=288 k=4 d_ub=20 permA=12 permB=8 saved=True
  09 group=C2xC2xC2 n=288 k=4 d_ub=19 permA=11 permB=27 saved=True
  10 group=C2xC2xC2 n=288 k=4 d_ub=18 permA=7 permB=27 saved=True

