=== mar. 20 janv. 2026 14:32:14 CET steps=2000 batch=1 seed=1768917935 ===
[pilot] base k_table top pairs:
  k_base=18 permA=0 permB=0
  k_base=12 permA=29 permB=0
  k_base=12 permA=22 permB=0
  k_base=12 permA=13 permB=0
  k_base=12 permA=6 permB=0
[pilot] A multisets raw=792 (expected=792) enum_mode=multiset cayley_unique=26 perms=30 -> total scored = 780
[pilot] B multisets raw=792 (expected=792) enum_mode=multiset cayley_unique=26 perms=30 -> total scored = 780
[pilot] A frontier kept 40 candidates with points: (4,20), (0,49)
[pilot] B frontier kept 40 candidates with points: (4,20), (0,49)
[pilot] C2xC2xC2 n=288 d0=17 A_sets=26*30 -> keep 40; B_sets=26*30 -> keep 40
[pilot] MEAS n=288 k=4 dx_ub=21 dz_ub=18 d_ub=18 steps=2000 id=C2xC2xC2_c00002
[saved] id=C2xC2xC2_c00002 -> results/c2xc2xc2_d16_20260120_143214/promising/C2xC2xC2_c00002 (reason: d>=sqrt(n))
[pilot] MEAS n=288 k=8 dx_ub=16 dz_ub=17 d_ub=16 steps=2000 id=C2xC2xC2_c00003
[pilot] MEAS n=288 k=4 dx_ub=22 dz_ub=20 d_ub=20 steps=2000 id=C2xC2xC2_c00008
[saved] id=C2xC2xC2_c00008 -> results/c2xc2xc2_d16_20260120_143214/promising/C2xC2xC2_c00008 (reason: d>=sqrt(n))
[pilot] MEAS n=288 k=4 dx_ub=22 dz_ub=23 d_ub=22 steps=2000 id=C2xC2xC2_c00009
[saved] id=C2xC2xC2_c00009 -> results/c2xc2xc2_d16_20260120_143214/promising/C2xC2xC2_c00009 (reason: d>=sqrt(n))
[pilot] TARGET_REJECT d_ub=12 target=16 id=C2xC2xC2_c00013
[pilot] MEAS n=288 k=4 dx_ub=20 dz_ub=19 d_ub=19 steps=2000 id=C2xC2xC2_c00018
[saved] id=C2xC2xC2_c00018 -> results/c2xc2xc2_d16_20260120_143214/promising/C2xC2xC2_c00018 (reason: d>=sqrt(n))
[pilot] MEAS n=288 k=4 dx_ub=21 dz_ub=19 d_ub=19 steps=2000 id=C2xC2xC2_c00020
[saved] id=C2xC2xC2_c00020 -> results/c2xc2xc2_d16_20260120_143214/promising/C2xC2xC2_c00020 (reason: d>=sqrt(n))
[pilot] MEAS n=288 k=4 dx_ub=20 dz_ub=20 d_ub=20 steps=2000 id=C2xC2xC2_c00024
[saved] id=C2xC2xC2_c00024 -> results/c2xc2xc2_d16_20260120_143214/promising/C2xC2xC2_c00024 (reason: d>=sqrt(n))
[pilot] TARGET_REJECT d_ub=12 target=16 id=C2xC2xC2_c00045
[pilot] TARGET_REJECT d_ub=14 target=16 id=C2xC2xC2_c00046
[pilot] MEAS n=288 k=4 dx_ub=19 dz_ub=18 d_ub=18 steps=2000 id=C2xC2xC2_c00057
[saved] id=C2xC2xC2_c00057 -> results/c2xc2xc2_d16_20260120_143214/promising/C2xC2xC2_c00057 (reason: d>=sqrt(n))
[pilot] TARGET_REJECT d_ub=15 target=16 id=C2xC2xC2_c00061
[pilot] MEAS n=288 k=4 dx_ub=20 dz_ub=20 d_ub=20 steps=2000 id=C2xC2xC2_c00062
[saved] id=C2xC2xC2_c00062 -> results/c2xc2xc2_d16_20260120_143214/promising/C2xC2xC2_c00062 (reason: d>=sqrt(n))
[pilot] MEAS n=288 k=4 dx_ub=20 dz_ub=20 d_ub=20 steps=2000 id=C2xC2xC2_c00065
[saved] id=C2xC2xC2_c00065 -> results/c2xc2xc2_d16_20260120_143214/promising/C2xC2xC2_c00065 (reason: d>=sqrt(n))
[pilot] TARGET_REJECT d_ub=6 target=16 id=C2xC2xC2_c00067
[pilot] TARGET_REJECT d_ub=6 target=16 id=C2xC2xC2_c00069
[pilot] MEAS n=288 k=4 dx_ub=20 dz_ub=20 d_ub=20 steps=2000 id=C2xC2xC2_c00081
[saved] id=C2xC2xC2_c00081 -> results/c2xc2xc2_d16_20260120_143214/promising/C2xC2xC2_c00081 (reason: d>=sqrt(n))
[pilot] TARGET_REJECT d_ub=12 target=16 id=C2xC2xC2_c00082
[pilot] TARGET_REJECT d_ub=13 target=16 id=C2xC2xC2_c00085
[pilot] MEAS n=288 k=8 dx_ub=16 dz_ub=16 d_ub=16 steps=2000 id=C2xC2xC2_c00086
[pilot] MEAS n=288 k=8 dx_ub=16 dz_ub=18 d_ub=16 steps=2000 id=C2xC2xC2_c00090
[pilot] TARGET_REJECT d_ub=13 target=16 id=C2xC2xC2_c00093
[pilot] MEAS n=288 k=8 dx_ub=17 dz_ub=16 d_ub=16 steps=2000 id=C2xC2xC2_c00094
[pilot] MEAS n=288 k=4 dx_ub=16 dz_ub=22 d_ub=16 steps=2000 id=C2xC2xC2_c00096
[pilot] TARGET_REJECT d_ub=12 target=16 id=C2xC2xC2_c00098
[pilot] MEAS n=288 k=4 dx_ub=17 dz_ub=16 d_ub=16 steps=2000 id=C2xC2xC2_c00101
[pilot] TARGET_REJECT d_ub=12 target=16 id=C2xC2xC2_c00107
[pilot] MEAS n=288 k=4 dx_ub=16 dz_ub=17 d_ub=16 steps=2000 id=C2xC2xC2_c00111
[pilot] MEAS n=288 k=4 dx_ub=23 dz_ub=20 d_ub=20 steps=2000 id=C2xC2xC2_c00115
[saved] id=C2xC2xC2_c00115 -> results/c2xc2xc2_d16_20260120_143214/promising/C2xC2xC2_c00115 (reason: d>=sqrt(n))
[pilot] TARGET_REJECT d_ub=12 target=16 id=C2xC2xC2_c00116
[pilot] MEAS n=288 k=4 dx_ub=22 dz_ub=19 d_ub=19 steps=2000 id=C2xC2xC2_c00117
[saved] id=C2xC2xC2_c00117 -> results/c2xc2xc2_d16_20260120_143214/promising/C2xC2xC2_c00117 (reason: d>=sqrt(n))
[pilot] MEAS n=288 k=4 dx_ub=19 dz_ub=22 d_ub=19 steps=2000 id=C2xC2xC2_c00118
[saved] id=C2xC2xC2_c00118 -> results/c2xc2xc2_d16_20260120_143214/promising/C2xC2xC2_c00118 (reason: d>=sqrt(n))
[pilot] TARGET_REJECT d_ub=14 target=16 id=C2xC2xC2_c00122
[pilot] MEAS n=288 k=4 dx_ub=20 dz_ub=21 d_ub=20 steps=2000 id=C2xC2xC2_c00124
[saved] id=C2xC2xC2_c00124 -> results/c2xc2xc2_d16_20260120_143214/promising/C2xC2xC2_c00124 (reason: d>=sqrt(n))
[pilot] TARGET_REJECT d_ub=15 target=16 id=C2xC2xC2_c00125
[pilot] MEAS n=288 k=4 dx_ub=20 dz_ub=21 d_ub=20 steps=2000 id=C2xC2xC2_c00132
[saved] id=C2xC2xC2_c00132 -> results/c2xc2xc2_d16_20260120_143214/promising/C2xC2xC2_c00132 (reason: d>=sqrt(n))
[pilot] TARGET_REJECT d_ub=12 target=16 id=C2xC2xC2_c00134
[pilot] MEAS n=288 k=4 dx_ub=20 dz_ub=23 d_ub=20 steps=2000 id=C2xC2xC2_c00135
[saved] id=C2xC2xC2_c00135 -> results/c2xc2xc2_d16_20260120_143214/promising/C2xC2xC2_c00135 (reason: d>=sqrt(n))
[pilot] TARGET_REJECT d_ub=6 target=16 id=C2xC2xC2_c00136
[pilot] TARGET_REJECT d_ub=6 target=16 id=C2xC2xC2_c00138
[pilot] MEAS n=288 k=4 dx_ub=20 dz_ub=21 d_ub=20 steps=2000 id=C2xC2xC2_c00145
[saved] id=C2xC2xC2_c00145 -> results/c2xc2xc2_d16_20260120_143214/promising/C2xC2xC2_c00145 (reason: d>=sqrt(n))
[pilot] MEAS n=288 k=4 dx_ub=20 dz_ub=20 d_ub=20 steps=2000 id=C2xC2xC2_c00147
[saved] id=C2xC2xC2_c00147 -> results/c2xc2xc2_d16_20260120_143214/promising/C2xC2xC2_c00147 (reason: d>=sqrt(n))
[pilot] MEAS n=288 k=4 dx_ub=16 dz_ub=16 d_ub=16 steps=2000 id=C2xC2xC2_c00162
[pilot] MEAS n=288 k=4 dx_ub=16 dz_ub=21 d_ub=16 steps=2000 id=C2xC2xC2_c00168
[pilot] MEAS n=288 k=4 dx_ub=17 dz_ub=16 d_ub=16 steps=2000 id=C2xC2xC2_c00169
[pilot] MEAS n=288 k=4 dx_ub=21 dz_ub=16 d_ub=16 steps=2000 id=C2xC2xC2_c00170
[pilot] TARGET_REJECT d_ub=12 target=16 id=C2xC2xC2_c00179
[pilot] MEAS n=288 k=4 dx_ub=23 dz_ub=20 d_ub=20 steps=2000 id=C2xC2xC2_c00184
[saved] id=C2xC2xC2_c00184 -> results/c2xc2xc2_d16_20260120_143214/promising/C2xC2xC2_c00184 (reason: d>=sqrt(n))
[pilot] MEAS n=288 k=4 dx_ub=20 dz_ub=22 d_ub=20 steps=2000 id=C2xC2xC2_c00185
[saved] id=C2xC2xC2_c00185 -> results/c2xc2xc2_d16_20260120_143214/promising/C2xC2xC2_c00185 (reason: d>=sqrt(n))
[pilot] MEAS n=288 k=4 dx_ub=20 dz_ub=19 d_ub=19 steps=2000 id=C2xC2xC2_c00188
[saved] id=C2xC2xC2_c00188 -> results/c2xc2xc2_d16_20260120_143214/promising/C2xC2xC2_c00188 (reason: d>=sqrt(n))
[best_by_k] group=C2xC2xC2 n=288
k  | d_ub | steps | dx_ub | dz_ub | id
 4 |   22 |  2000 |    22 |    23 | C2xC2xC2_c00009
 8 |   16 |  2000 |    16 |    17 | C2xC2xC2_c00003
[pilot] TARGET_REJECT d_ub=12 target=16 id=C2xC2xC2_c00189
[pilot] MEAS n=288 k=4 dx_ub=16 dz_ub=18 d_ub=16 steps=2000 id=C2xC2xC2_c00192
[pilot] MEAS n=288 k=4 dx_ub=23 dz_ub=20 d_ub=20 steps=2000 id=C2xC2xC2_c00194
[saved] id=C2xC2xC2_c00194 -> results/c2xc2xc2_d16_20260120_143214/promising/C2xC2xC2_c00194 (reason: d>=sqrt(n))
[pilot] MEAS n=288 k=4 dx_ub=18 dz_ub=16 d_ub=16 steps=2000 id=C2xC2xC2_c00195
[pilot] MEAS n=288 k=4 dx_ub=23 dz_ub=23 d_ub=23 steps=2000 id=C2xC2xC2_c00196
[saved] id=C2xC2xC2_c00196 -> results/c2xc2xc2_d16_20260120_143214/promising/C2xC2xC2_c00196 (reason: d>=sqrt(n))
[pilot] MEAS n=288 k=8 dx_ub=16 dz_ub=16 d_ub=16 steps=2000 id=C2xC2xC2_c00197
[pilot] MEAS n=288 k=4 dx_ub=17 dz_ub=20 d_ub=17 steps=2000 id=C2xC2xC2_c00199
[saved] id=C2xC2xC2_c00199 -> results/c2xc2xc2_d16_20260120_143214/promising/C2xC2xC2_c00199 (reason: d>=sqrt(n))
[best_by_k] group=C2xC2xC2 n=288
k  | d_ub | steps | dx_ub | dz_ub | id
 4 |   23 |  2000 |    23 |    23 | C2xC2xC2_c00196
 8 |   16 |  2000 |    16 |    17 | C2xC2xC2_c00003
[coverage] group=C2xC2xC2 A_sel=40 B_sel=40 Q_meas=57 ratio_ge_sqrt=0.001 ratio_sel=0.036
[coverage] run summary:
[coverage] group=C2xC2xC2 A_sel=40 B_sel=40 Q_meas=57 ratio_ge_sqrt=0.001 ratio_sel=0.036
[summary] best-by-k (measured; includes rejects):
  k=4 best_d_ub=23 count_measured=37 example_id=C2xC2xC2_c00196
  k=8 best_d_ub=16 count_measured=20 example_id=C2xC2xC2_c00003
[summary] best-by-k (survivors; target=16):
  k=4 best_d_ub=23 count_survivors=33 example_id=C2xC2xC2_c00196
  k=8 best_d_ub=16 count_survivors=5 example_id=C2xC2xC2_c00003
[pilot] top results:
  01 group=C2xC2xC2 n=288 k=4 d_ub=23 permA=20 permB=11 saved=True
  02 group=C2xC2xC2 n=288 k=4 d_ub=22 permA=11 permB=27 saved=True
  03 group=C2xC2xC2 n=288 k=4 d_ub=20 permA=11 permB=27 saved=True
  04 group=C2xC2xC2 n=288 k=4 d_ub=20 permA=20 permB=11 saved=True
  05 group=C2xC2xC2 n=288 k=4 d_ub=20 permA=11 permB=20 saved=True
  06 group=C2xC2xC2 n=288 k=4 d_ub=20 permA=11 permB=12 saved=True
  07 group=C2xC2xC2 n=288 k=4 d_ub=20 permA=27 permB=20 saved=True
  08 group=C2xC2xC2 n=288 k=4 d_ub=20 permA=11 permB=12 saved=True
  09 group=C2xC2xC2 n=288 k=4 d_ub=20 permA=11 permB=27 saved=True
  10 group=C2xC2xC2 n=288 k=4 d_ub=20 permA=27 permB=11 saved=True

