=== mar. 20 janv. 2026 14:48:11 CET steps=2000 batch=4 seed=1768918841 ===
[pilot] base k_table top pairs:
  k_base=18 permA=0 permB=0
  k_base=12 permA=29 permB=0
  k_base=12 permA=22 permB=0
  k_base=12 permA=13 permB=0
  k_base=12 permA=6 permB=0
[pilot] A multisets raw=792 (expected=792) enum_mode=multiset cayley_unique=26 perms=30 -> total scored = 780
[pilot] B multisets raw=792 (expected=792) enum_mode=multiset cayley_unique=26 perms=30 -> total scored = 780
[pilot] A frontier kept 128 candidates with points: (4,20), (0,49)
[pilot] B frontier kept 128 candidates with points: (4,20), (0,49)
[pilot] C2xC2xC2 n=288 d0=17 A_sets=26*30 -> keep 128; B_sets=26*30 -> keep 128
[pilot] MEAS n=288 k=4 dx_ub=16 dz_ub=20 d_ub=16 steps=2000 id=C2xC2xC2_c00021
[pilot] MEAS n=288 k=4 dx_ub=18 dz_ub=23 d_ub=18 steps=2000 id=C2xC2xC2_c00041
[saved] id=C2xC2xC2_c00041 -> results/c2xc2xc2_d16_20260120_144811/promising/C2xC2xC2_c00041 (reason: d>=sqrt(n))
[pilot] MEAS n=288 k=4 dx_ub=17 dz_ub=17 d_ub=17 steps=2000 id=C2xC2xC2_c00058
[saved] id=C2xC2xC2_c00058 -> results/c2xc2xc2_d16_20260120_144811/promising/C2xC2xC2_c00058 (reason: d>=sqrt(n))
[pilot] MEAS n=288 k=4 dx_ub=20 dz_ub=23 d_ub=20 steps=2000 id=C2xC2xC2_c00059
[saved] id=C2xC2xC2_c00059 -> results/c2xc2xc2_d16_20260120_144811/promising/C2xC2xC2_c00059 (reason: d>=sqrt(n))
[pilot] MEAS n=288 k=4 dx_ub=20 dz_ub=20 d_ub=20 steps=2000 id=C2xC2xC2_c00061
[saved] id=C2xC2xC2_c00061 -> results/c2xc2xc2_d16_20260120_144811/promising/C2xC2xC2_c00061 (reason: d>=sqrt(n))
[pilot] MEAS n=288 k=4 dx_ub=19 dz_ub=23 d_ub=19 steps=2000 id=C2xC2xC2_c00070
[saved] id=C2xC2xC2_c00070 -> results/c2xc2xc2_d16_20260120_144811/promising/C2xC2xC2_c00070 (reason: d>=sqrt(n))
[pilot] MEAS n=288 k=4 dx_ub=16 dz_ub=16 d_ub=16 steps=2000 id=C2xC2xC2_c00079
[pilot] MEAS n=288 k=4 dx_ub=16 dz_ub=16 d_ub=16 steps=2000 id=C2xC2xC2_c00085
[pilot] MEAS n=288 k=8 dx_ub=16 dz_ub=17 d_ub=16 steps=2000 id=C2xC2xC2_c00149
[pilot] MEAS n=288 k=4 dx_ub=23 dz_ub=22 d_ub=22 steps=2000 id=C2xC2xC2_c00162
[saved] id=C2xC2xC2_c00162 -> results/c2xc2xc2_d16_20260120_144811/promising/C2xC2xC2_c00162 (reason: d>=sqrt(n))
[pilot] MEAS n=288 k=4 dx_ub=20 dz_ub=16 d_ub=16 steps=2000 id=C2xC2xC2_c00197
[pilot] MEAS n=288 k=4 dx_ub=16 dz_ub=16 d_ub=16 steps=2000 id=C2xC2xC2_c00199
[pilot] MEAS n=288 k=4 dx_ub=20 dz_ub=22 d_ub=20 steps=2000 id=C2xC2xC2_c00211
[saved] id=C2xC2xC2_c00211 -> results/c2xc2xc2_d16_20260120_144811/promising/C2xC2xC2_c00211 (reason: d>=sqrt(n))
[pilot] TARGET_REJECT d_ub=14 target=16 id=C2xC2xC2_c00220
[pilot] MEAS n=288 k=4 dx_ub=20 dz_ub=21 d_ub=20 steps=2000 id=C2xC2xC2_c00259
[saved] id=C2xC2xC2_c00259 -> results/c2xc2xc2_d16_20260120_144811/promising/C2xC2xC2_c00259 (reason: d>=sqrt(n))
[pilot] TARGET_REJECT d_ub=12 target=16 id=C2xC2xC2_c00288
[pilot] MEAS n=288 k=4 dx_ub=20 dz_ub=17 d_ub=17 steps=2000 id=C2xC2xC2_c00289
[saved] id=C2xC2xC2_c00289 -> results/c2xc2xc2_d16_20260120_144811/promising/C2xC2xC2_c00289 (reason: d>=sqrt(n))
[pilot] TARGET_REJECT d_ub=14 target=16 id=C2xC2xC2_c00323
[pilot] TARGET_REJECT d_ub=6 target=16 id=C2xC2xC2_c00326
[pilot] MEAS n=288 k=8 dx_ub=18 dz_ub=16 d_ub=16 steps=2000 id=C2xC2xC2_c00329
[pilot] TARGET_REJECT d_ub=12 target=16 id=C2xC2xC2_c00334
[pilot] TARGET_REJECT d_ub=12 target=16 id=C2xC2xC2_c00357
[pilot] MEAS n=288 k=4 dx_ub=20 dz_ub=16 d_ub=16 steps=2000 id=C2xC2xC2_c00365
[pilot] MEAS n=288 k=4 dx_ub=20 dz_ub=21 d_ub=20 steps=2000 id=C2xC2xC2_c00370
[saved] id=C2xC2xC2_c00370 -> results/c2xc2xc2_d16_20260120_144811/promising/C2xC2xC2_c00370 (reason: d>=sqrt(n))
[pilot] MEAS n=288 k=4 dx_ub=16 dz_ub=22 d_ub=16 steps=2000 id=C2xC2xC2_c00392
[pilot] MEAS n=288 k=4 dx_ub=19 dz_ub=20 d_ub=19 steps=2000 id=C2xC2xC2_c00413
[saved] id=C2xC2xC2_c00413 -> results/c2xc2xc2_d16_20260120_144811/promising/C2xC2xC2_c00413 (reason: d>=sqrt(n))
[pilot] MEAS n=288 k=4 dx_ub=22 dz_ub=23 d_ub=22 steps=2000 id=C2xC2xC2_c00498
[saved] id=C2xC2xC2_c00498 -> results/c2xc2xc2_d16_20260120_144811/promising/C2xC2xC2_c00498 (reason: d>=sqrt(n))
[best_by_k] group=C2xC2xC2 n=288
k  | d_ub | steps | dx_ub | dz_ub | id
 4 |   22 |  2000 |    23 |    22 | C2xC2xC2_c00162
 8 |   16 |  2000 |    16 |    17 | C2xC2xC2_c00149
[coverage] group=C2xC2xC2 A_sel=128 B_sel=128 Q_meas=27 ratio_ge_sqrt=0.000 ratio_sel=0.002
[coverage] run summary:
[coverage] group=C2xC2xC2 A_sel=128 B_sel=128 Q_meas=27 ratio_ge_sqrt=0.000 ratio_sel=0.002
[summary] best-by-k (measured; includes rejects):
  k=4 best_d_ub=22 count_measured=20 example_id=C2xC2xC2_c00162
  k=8 best_d_ub=16 count_measured=7 example_id=C2xC2xC2_c00149
[summary] best-by-k (survivors; target=16):
  k=4 best_d_ub=22 count_survivors=19 example_id=C2xC2xC2_c00162
  k=8 best_d_ub=16 count_survivors=2 example_id=C2xC2xC2_c00149
[pilot] top results:
  01 group=C2xC2xC2 n=288 k=4 d_ub=22 permA=7 permB=8 saved=True
  02 group=C2xC2xC2 n=288 k=4 d_ub=22 permA=11 permB=20 saved=True
  03 group=C2xC2xC2 n=288 k=4 d_ub=20 permA=27 permB=11 saved=True
  04 group=C2xC2xC2 n=288 k=4 d_ub=20 permA=8 permB=11 saved=True
  05 group=C2xC2xC2 n=288 k=4 d_ub=20 permA=11 permB=11 saved=True
  06 group=C2xC2xC2 n=288 k=4 d_ub=20 permA=8 permB=11 saved=True
  07 group=C2xC2xC2 n=288 k=4 d_ub=20 permA=8 permB=7 saved=True
  08 group=C2xC2xC2 n=288 k=4 d_ub=19 permA=8 permB=12 saved=True
  09 group=C2xC2xC2 n=288 k=4 d_ub=19 permA=27 permB=27 saved=True
  10 group=C2xC2xC2 n=288 k=4 d_ub=18 permA=11 permB=20 saved=True

