=== mar. 20 janv. 2026 14:49:12 CET steps=2000 batch=7 seed=1768918844 ===
[pilot] base k_table top pairs:
  k_base=18 permA=0 permB=0
  k_base=12 permA=29 permB=0
  k_base=12 permA=22 permB=0
  k_base=12 permA=13 permB=0
  k_base=12 permA=6 permB=0
[pilot] A multisets raw=792 (expected=792) enum_mode=multiset cayley_unique=26 perms=30 -> total scored = 780
[pilot] B multisets raw=792 (expected=792) enum_mode=multiset cayley_unique=26 perms=30 -> total scored = 780
[pilot] A frontier kept 128 candidates with points: (4,20), (0,49)
[pilot] B frontier kept 128 candidates with points: (4,20), (0,49)
[pilot] C2xC2xC2 n=288 d0=17 A_sets=26*30 -> keep 128; B_sets=26*30 -> keep 128
[pilot] MEAS n=288 k=4 dx_ub=16 dz_ub=20 d_ub=16 steps=2000 id=C2xC2xC2_c00001
[pilot] TARGET_REJECT d_ub=12 target=16 id=C2xC2xC2_c00041
[pilot] TARGET_REJECT d_ub=12 target=16 id=C2xC2xC2_c00043
[pilot] MEAS n=288 k=4 dx_ub=20 dz_ub=20 d_ub=20 steps=2000 id=C2xC2xC2_c00054
[saved] id=C2xC2xC2_c00054 -> results/c2xc2xc2_d16_20260120_144912/promising/C2xC2xC2_c00054 (reason: d>=sqrt(n))
[pilot] MEAS n=288 k=4 dx_ub=20 dz_ub=18 d_ub=18 steps=2000 id=C2xC2xC2_c00055
[saved] id=C2xC2xC2_c00055 -> results/c2xc2xc2_d16_20260120_144912/promising/C2xC2xC2_c00055 (reason: d>=sqrt(n))
[pilot] TARGET_REJECT d_ub=6 target=16 id=C2xC2xC2_c00086
[pilot] TARGET_REJECT d_ub=12 target=16 id=C2xC2xC2_c00141
[pilot] MEAS n=288 k=4 dx_ub=20 dz_ub=16 d_ub=16 steps=2000 id=C2xC2xC2_c00184
[pilot] MEAS n=288 k=8 dx_ub=16 dz_ub=19 d_ub=16 steps=2000 id=C2xC2xC2_c00208
[pilot] MEAS n=288 k=4 dx_ub=17 dz_ub=20 d_ub=17 steps=2000 id=C2xC2xC2_c00211
[saved] id=C2xC2xC2_c00211 -> results/c2xc2xc2_d16_20260120_144912/promising/C2xC2xC2_c00211 (reason: d>=sqrt(n))
[pilot] MEAS n=288 k=4 dx_ub=17 dz_ub=16 d_ub=16 steps=2000 id=C2xC2xC2_c00217
[pilot] TARGET_REJECT d_ub=12 target=16 id=C2xC2xC2_c00218
[pilot] TARGET_REJECT d_ub=12 target=16 id=C2xC2xC2_c00238
[pilot] MEAS n=288 k=4 dx_ub=16 dz_ub=16 d_ub=16 steps=2000 id=C2xC2xC2_c00264
[pilot] MEAS n=288 k=4 dx_ub=18 dz_ub=16 d_ub=16 steps=2000 id=C2xC2xC2_c00276
[pilot] MEAS n=288 k=4 dx_ub=20 dz_ub=19 d_ub=19 steps=2000 id=C2xC2xC2_c00288
[saved] id=C2xC2xC2_c00288 -> results/c2xc2xc2_d16_20260120_144912/promising/C2xC2xC2_c00288 (reason: d>=sqrt(n))
[pilot] MEAS n=288 k=4 dx_ub=20 dz_ub=17 d_ub=17 steps=2000 id=C2xC2xC2_c00308
[saved] id=C2xC2xC2_c00308 -> results/c2xc2xc2_d16_20260120_144912/promising/C2xC2xC2_c00308 (reason: d>=sqrt(n))
[pilot] MEAS n=288 k=4 dx_ub=20 dz_ub=22 d_ub=20 steps=2000 id=C2xC2xC2_c00355
[saved] id=C2xC2xC2_c00355 -> results/c2xc2xc2_d16_20260120_144912/promising/C2xC2xC2_c00355 (reason: d>=sqrt(n))
[pilot] MEAS n=288 k=4 dx_ub=20 dz_ub=21 d_ub=20 steps=2000 id=C2xC2xC2_c00363
[saved] id=C2xC2xC2_c00363 -> results/c2xc2xc2_d16_20260120_144912/promising/C2xC2xC2_c00363 (reason: d>=sqrt(n))
[pilot] TARGET_REJECT d_ub=12 target=16 id=C2xC2xC2_c00384
[pilot] MEAS n=288 k=4 dx_ub=20 dz_ub=19 d_ub=19 steps=2000 id=C2xC2xC2_c00388
[saved] id=C2xC2xC2_c00388 -> results/c2xc2xc2_d16_20260120_144912/promising/C2xC2xC2_c00388 (reason: d>=sqrt(n))
[pilot] MEAS n=288 k=4 dx_ub=20 dz_ub=18 d_ub=18 steps=2000 id=C2xC2xC2_c00401
[saved] id=C2xC2xC2_c00401 -> results/c2xc2xc2_d16_20260120_144912/promising/C2xC2xC2_c00401 (reason: d>=sqrt(n))
[pilot] MEAS n=288 k=4 dx_ub=16 dz_ub=16 d_ub=16 steps=2000 id=C2xC2xC2_c00426
[pilot] MEAS n=288 k=4 dx_ub=20 dz_ub=20 d_ub=20 steps=2000 id=C2xC2xC2_c00439
[saved] id=C2xC2xC2_c00439 -> results/c2xc2xc2_d16_20260120_144912/promising/C2xC2xC2_c00439 (reason: d>=sqrt(n))
[pilot] MEAS n=288 k=4 dx_ub=16 dz_ub=17 d_ub=16 steps=2000 id=C2xC2xC2_c00445
[pilot] MEAS n=288 k=4 dx_ub=17 dz_ub=20 d_ub=17 steps=2000 id=C2xC2xC2_c00448
[saved] id=C2xC2xC2_c00448 -> results/c2xc2xc2_d16_20260120_144912/promising/C2xC2xC2_c00448 (reason: d>=sqrt(n))
[pilot] MEAS n=288 k=4 dx_ub=20 dz_ub=22 d_ub=20 steps=2000 id=C2xC2xC2_c00473
[saved] id=C2xC2xC2_c00473 -> results/c2xc2xc2_d16_20260120_144912/promising/C2xC2xC2_c00473 (reason: d>=sqrt(n))
[pilot] MEAS n=288 k=8 dx_ub=16 dz_ub=19 d_ub=16 steps=2000 id=C2xC2xC2_c00491
[pilot] MEAS n=288 k=4 dx_ub=20 dz_ub=23 d_ub=20 steps=2000 id=C2xC2xC2_c00497
[saved] id=C2xC2xC2_c00497 -> results/c2xc2xc2_d16_20260120_144912/promising/C2xC2xC2_c00497 (reason: d>=sqrt(n))
[best_by_k] group=C2xC2xC2 n=288
k  | d_ub | steps | dx_ub | dz_ub | id
 4 |   20 |  2000 |    20 |    20 | C2xC2xC2_c00054
 8 |   16 |  2000 |    16 |    19 | C2xC2xC2_c00208
[coverage] group=C2xC2xC2 A_sel=128 B_sel=128 Q_meas=29 ratio_ge_sqrt=0.001 ratio_sel=0.002
[coverage] run summary:
[coverage] group=C2xC2xC2 A_sel=128 B_sel=128 Q_meas=29 ratio_ge_sqrt=0.001 ratio_sel=0.002
[summary] best-by-k (measured; includes rejects):
  k=4 best_d_ub=20 count_measured=22 example_id=C2xC2xC2_c00054
  k=8 best_d_ub=16 count_measured=7 example_id=C2xC2xC2_c00208
[summary] best-by-k (survivors; target=16):
  k=4 best_d_ub=20 count_survivors=20 example_id=C2xC2xC2_c00054
  k=8 best_d_ub=16 count_survivors=2 example_id=C2xC2xC2_c00208
[pilot] top results:
  01 group=C2xC2xC2 n=288 k=4 d_ub=20 permA=8 permB=11 saved=True
  02 group=C2xC2xC2 n=288 k=4 d_ub=20 permA=11 permB=27 saved=True
  03 group=C2xC2xC2 n=288 k=4 d_ub=20 permA=12 permB=11 saved=True
  04 group=C2xC2xC2 n=288 k=4 d_ub=20 permA=27 permB=8 saved=True
  05 group=C2xC2xC2 n=288 k=4 d_ub=20 permA=20 permB=27 saved=True
  06 group=C2xC2xC2 n=288 k=4 d_ub=20 permA=27 permB=20 saved=True
  07 group=C2xC2xC2 n=288 k=4 d_ub=19 permA=8 permB=11 saved=True
  08 group=C2xC2xC2 n=288 k=4 d_ub=19 permA=8 permB=8 saved=True
  09 group=C2xC2xC2 n=288 k=4 d_ub=18 permA=11 permB=20 saved=True
  10 group=C2xC2xC2 n=288 k=4 d_ub=18 permA=11 permB=27 saved=True

