=== mar. 20 janv. 2026 14:50:15 CET steps=2000 batch=10 seed=1768918847 ===
[pilot] base k_table top pairs:
  k_base=18 permA=0 permB=0
  k_base=12 permA=29 permB=0
  k_base=12 permA=22 permB=0
  k_base=12 permA=13 permB=0
  k_base=12 permA=6 permB=0
[pilot] A multisets raw=792 (expected=792) enum_mode=multiset cayley_unique=26 perms=30 -> total scored = 780
[pilot] B multisets raw=792 (expected=792) enum_mode=multiset cayley_unique=26 perms=30 -> total scored = 780
[pilot] A frontier kept 128 candidates with points: (4,20), (0,49)
[pilot] B frontier kept 128 candidates with points: (4,20), (0,49)
[pilot] C2xC2xC2 n=288 d0=17 A_sets=26*30 -> keep 128; B_sets=26*30 -> keep 128
[pilot] TARGET_REJECT d_ub=12 target=16 id=C2xC2xC2_c00029
[pilot] TARGET_REJECT d_ub=12 target=16 id=C2xC2xC2_c00030
[pilot] MEAS n=288 k=4 dx_ub=21 dz_ub=20 d_ub=20 steps=2000 id=C2xC2xC2_c00058
[saved] id=C2xC2xC2_c00058 -> results/c2xc2xc2_d16_20260120_145015/promising/C2xC2xC2_c00058 (reason: d>=sqrt(n))
[pilot] TARGET_REJECT d_ub=6 target=16 id=C2xC2xC2_c00059
[pilot] MEAS n=288 k=4 dx_ub=16 dz_ub=18 d_ub=16 steps=2000 id=C2xC2xC2_c00072
[pilot] MEAS n=288 k=4 dx_ub=20 dz_ub=23 d_ub=20 steps=2000 id=C2xC2xC2_c00079
[saved] id=C2xC2xC2_c00079 -> results/c2xc2xc2_d16_20260120_145015/promising/C2xC2xC2_c00079 (reason: d>=sqrt(n))
[pilot] MEAS n=288 k=8 dx_ub=16 dz_ub=17 d_ub=16 steps=2000 id=C2xC2xC2_c00105
[pilot] TARGET_REJECT d_ub=14 target=16 id=C2xC2xC2_c00110
[pilot] MEAS n=288 k=4 dx_ub=16 dz_ub=16 d_ub=16 steps=2000 id=C2xC2xC2_c00118
[pilot] MEAS n=288 k=4 dx_ub=20 dz_ub=24 d_ub=20 steps=2000 id=C2xC2xC2_c00122
[saved] id=C2xC2xC2_c00122 -> results/c2xc2xc2_d16_20260120_145015/promising/C2xC2xC2_c00122 (reason: d>=sqrt(n))
[pilot] MEAS n=288 k=4 dx_ub=20 dz_ub=20 d_ub=20 steps=2000 id=C2xC2xC2_c00142
[saved] id=C2xC2xC2_c00142 -> results/c2xc2xc2_d16_20260120_145015/promising/C2xC2xC2_c00142 (reason: d>=sqrt(n))
[pilot] MEAS n=288 k=4 dx_ub=22 dz_ub=22 d_ub=22 steps=2000 id=C2xC2xC2_c00160
[saved] id=C2xC2xC2_c00160 -> results/c2xc2xc2_d16_20260120_145015/promising/C2xC2xC2_c00160 (reason: d>=sqrt(n))
[pilot] TARGET_REJECT d_ub=12 target=16 id=C2xC2xC2_c00170
[pilot] TARGET_REJECT d_ub=13 target=16 id=C2xC2xC2_c00196
[pilot] MEAS n=288 k=8 dx_ub=18 dz_ub=16 d_ub=16 steps=2000 id=C2xC2xC2_c00221
[pilot] MEAS n=288 k=4 dx_ub=20 dz_ub=20 d_ub=20 steps=2000 id=C2xC2xC2_c00305
[saved] id=C2xC2xC2_c00305 -> results/c2xc2xc2_d16_20260120_145015/promising/C2xC2xC2_c00305 (reason: d>=sqrt(n))
[pilot] MEAS n=288 k=4 dx_ub=16 dz_ub=18 d_ub=16 steps=2000 id=C2xC2xC2_c00336
[pilot] TARGET_REJECT d_ub=12 target=16 id=C2xC2xC2_c00338
[pilot] MEAS n=288 k=4 dx_ub=20 dz_ub=20 d_ub=20 steps=2000 id=C2xC2xC2_c00358
[saved] id=C2xC2xC2_c00358 -> results/c2xc2xc2_d16_20260120_145015/promising/C2xC2xC2_c00358 (reason: d>=sqrt(n))
[pilot] MEAS n=288 k=4 dx_ub=22 dz_ub=20 d_ub=20 steps=2000 id=C2xC2xC2_c00377
[saved] id=C2xC2xC2_c00377 -> results/c2xc2xc2_d16_20260120_145015/promising/C2xC2xC2_c00377 (reason: d>=sqrt(n))
[pilot] MEAS n=288 k=4 dx_ub=19 dz_ub=20 d_ub=19 steps=2000 id=C2xC2xC2_c00405
[saved] id=C2xC2xC2_c00405 -> results/c2xc2xc2_d16_20260120_145015/promising/C2xC2xC2_c00405 (reason: d>=sqrt(n))
[pilot] MEAS n=288 k=4 dx_ub=20 dz_ub=23 d_ub=20 steps=2000 id=C2xC2xC2_c00439
[saved] id=C2xC2xC2_c00439 -> results/c2xc2xc2_d16_20260120_145015/promising/C2xC2xC2_c00439 (reason: d>=sqrt(n))
[pilot] MEAS n=288 k=4 dx_ub=20 dz_ub=20 d_ub=20 steps=2000 id=C2xC2xC2_c00440
[saved] id=C2xC2xC2_c00440 -> results/c2xc2xc2_d16_20260120_145015/promising/C2xC2xC2_c00440 (reason: d>=sqrt(n))
[pilot] MEAS n=288 k=4 dx_ub=20 dz_ub=16 d_ub=16 steps=2000 id=C2xC2xC2_c00470
[pilot] MEAS n=288 k=4 dx_ub=20 dz_ub=22 d_ub=20 steps=2000 id=C2xC2xC2_c00491
[saved] id=C2xC2xC2_c00491 -> results/c2xc2xc2_d16_20260120_145015/promising/C2xC2xC2_c00491 (reason: d>=sqrt(n))
[best_by_k] group=C2xC2xC2 n=288
k  | d_ub | steps | dx_ub | dz_ub | id
 4 |   22 |  2000 |    22 |    22 | C2xC2xC2_c00160
 8 |   16 |  2000 |    16 |    17 | C2xC2xC2_c00105
[coverage] group=C2xC2xC2 A_sel=128 B_sel=128 Q_meas=25 ratio_ge_sqrt=0.000 ratio_sel=0.002
[coverage] run summary:
[coverage] group=C2xC2xC2 A_sel=128 B_sel=128 Q_meas=25 ratio_ge_sqrt=0.000 ratio_sel=0.002
[summary] best-by-k (measured; includes rejects):
  k=4 best_d_ub=22 count_measured=18 example_id=C2xC2xC2_c00160
  k=8 best_d_ub=16 count_measured=7 example_id=C2xC2xC2_c00105
[summary] best-by-k (survivors; target=16):
  k=4 best_d_ub=22 count_survivors=16 example_id=C2xC2xC2_c00160
  k=8 best_d_ub=16 count_survivors=2 example_id=C2xC2xC2_c00105
[pilot] top results:
  01 group=C2xC2xC2 n=288 k=4 d_ub=22 permA=27 permB=8 saved=True
  02 group=C2xC2xC2 n=288 k=4 d_ub=20 permA=11 permB=8 saved=True
  03 group=C2xC2xC2 n=288 k=4 d_ub=20 permA=12 permB=11 saved=True
  04 group=C2xC2xC2 n=288 k=4 d_ub=20 permA=8 permB=12 saved=True
  05 group=C2xC2xC2 n=288 k=4 d_ub=20 permA=12 permB=27 saved=True
  06 group=C2xC2xC2 n=288 k=4 d_ub=20 permA=11 permB=27 saved=True
  07 group=C2xC2xC2 n=288 k=4 d_ub=20 permA=27 permB=20 saved=True
  08 group=C2xC2xC2 n=288 k=4 d_ub=20 permA=27 permB=11 saved=True
  09 group=C2xC2xC2 n=288 k=4 d_ub=20 permA=27 permB=11 saved=True
  10 group=C2xC2xC2 n=288 k=4 d_ub=20 permA=11 permB=12 saved=True

