=== mar. 20 janv. 2026 14:47:17 CET steps=2000 batch=1 seed=1768918838 ===
[pilot] base k_table top pairs:
  k_base=18 permA=0 permB=0
  k_base=12 permA=29 permB=0
  k_base=12 permA=22 permB=0
  k_base=12 permA=13 permB=0
  k_base=12 permA=6 permB=0
[pilot] A multisets raw=792 (expected=792) enum_mode=multiset cayley_unique=26 perms=30 -> total scored = 780
[pilot] B multisets raw=792 (expected=792) enum_mode=multiset cayley_unique=26 perms=30 -> total scored = 780
[pilot] A frontier kept 128 candidates with points: (4,20), (0,49)
[pilot] B frontier kept 128 candidates with points: (4,20), (0,49)
[pilot] C2xC2xC2 n=288 d0=17 A_sets=26*30 -> keep 128; B_sets=26*30 -> keep 128
[pilot] TARGET_REJECT d_ub=12 target=16 id=C2xC2xC2_c00022
[pilot] MEAS n=288 k=4 dx_ub=20 dz_ub=17 d_ub=17 steps=2000 id=C2xC2xC2_c00038
[saved] id=C2xC2xC2_c00038 -> results/c2xc2xc2_d16_20260120_144717/promising/C2xC2xC2_c00038 (reason: d>=sqrt(n))
[pilot] MEAS n=288 k=4 dx_ub=16 dz_ub=20 d_ub=16 steps=2000 id=C2xC2xC2_c00047
[pilot] MEAS n=288 k=4 dx_ub=20 dz_ub=20 d_ub=20 steps=2000 id=C2xC2xC2_c00087
[saved] id=C2xC2xC2_c00087 -> results/c2xc2xc2_d16_20260120_144717/promising/C2xC2xC2_c00087 (reason: d>=sqrt(n))
[pilot] MEAS n=288 k=4 dx_ub=16 dz_ub=16 d_ub=16 steps=2000 id=C2xC2xC2_c00091
[pilot] MEAS n=288 k=4 dx_ub=20 dz_ub=22 d_ub=20 steps=2000 id=C2xC2xC2_c00093
[saved] id=C2xC2xC2_c00093 -> results/c2xc2xc2_d16_20260120_144717/promising/C2xC2xC2_c00093 (reason: d>=sqrt(n))
[pilot] MEAS n=288 k=4 dx_ub=21 dz_ub=20 d_ub=20 steps=2000 id=C2xC2xC2_c00116
[saved] id=C2xC2xC2_c00116 -> results/c2xc2xc2_d16_20260120_144717/promising/C2xC2xC2_c00116 (reason: d>=sqrt(n))
[pilot] MEAS n=288 k=8 dx_ub=16 dz_ub=18 d_ub=16 steps=2000 id=C2xC2xC2_c00164
[pilot] TARGET_REJECT d_ub=14 target=16 id=C2xC2xC2_c00167
[pilot] TARGET_REJECT d_ub=12 target=16 id=C2xC2xC2_c00197
[pilot] MEAS n=288 k=4 dx_ub=22 dz_ub=20 d_ub=20 steps=2000 id=C2xC2xC2_c00220
[saved] id=C2xC2xC2_c00220 -> results/c2xc2xc2_d16_20260120_144717/promising/C2xC2xC2_c00220 (reason: d>=sqrt(n))
[pilot] MEAS n=288 k=4 dx_ub=20 dz_ub=22 d_ub=20 steps=2000 id=C2xC2xC2_c00222
[saved] id=C2xC2xC2_c00222 -> results/c2xc2xc2_d16_20260120_144717/promising/C2xC2xC2_c00222 (reason: d>=sqrt(n))
[pilot] TARGET_REJECT d_ub=12 target=16 id=C2xC2xC2_c00280
[pilot] MEAS n=288 k=4 dx_ub=16 dz_ub=19 d_ub=16 steps=2000 id=C2xC2xC2_c00320
[pilot] MEAS n=288 k=8 dx_ub=16 dz_ub=19 d_ub=16 steps=2000 id=C2xC2xC2_c00360
[pilot] TARGET_REJECT d_ub=14 target=16 id=C2xC2xC2_c00380
[pilot] MEAS n=288 k=4 dx_ub=20 dz_ub=20 d_ub=20 steps=2000 id=C2xC2xC2_c00383
[saved] id=C2xC2xC2_c00383 -> results/c2xc2xc2_d16_20260120_144717/promising/C2xC2xC2_c00383 (reason: d>=sqrt(n))
[pilot] MEAS n=288 k=4 dx_ub=20 dz_ub=22 d_ub=20 steps=2000 id=C2xC2xC2_c00390
[saved] id=C2xC2xC2_c00390 -> results/c2xc2xc2_d16_20260120_144717/promising/C2xC2xC2_c00390 (reason: d>=sqrt(n))
[pilot] TARGET_REJECT d_ub=12 target=16 id=C2xC2xC2_c00397
[pilot] MEAS n=288 k=8 dx_ub=20 dz_ub=17 d_ub=17 steps=2000 id=C2xC2xC2_c00401
[saved] id=C2xC2xC2_c00401 -> results/c2xc2xc2_d16_20260120_144717/promising/C2xC2xC2_c00401 (reason: d>=sqrt(n))
[pilot] TARGET_REJECT d_ub=14 target=16 id=C2xC2xC2_c00419
[pilot] TARGET_REJECT d_ub=6 target=16 id=C2xC2xC2_c00433
[pilot] MEAS n=288 k=4 dx_ub=17 dz_ub=20 d_ub=17 steps=2000 id=C2xC2xC2_c00452
[saved] id=C2xC2xC2_c00452 -> results/c2xc2xc2_d16_20260120_144717/promising/C2xC2xC2_c00452 (reason: d>=sqrt(n))
[pilot] MEAS n=288 k=4 dx_ub=20 dz_ub=23 d_ub=20 steps=2000 id=C2xC2xC2_c00459
[saved] id=C2xC2xC2_c00459 -> results/c2xc2xc2_d16_20260120_144717/promising/C2xC2xC2_c00459 (reason: d>=sqrt(n))
[pilot] MEAS n=288 k=4 dx_ub=17 dz_ub=20 d_ub=17 steps=2000 id=C2xC2xC2_c00484
[saved] id=C2xC2xC2_c00484 -> results/c2xc2xc2_d16_20260120_144717/promising/C2xC2xC2_c00484 (reason: d>=sqrt(n))
[best_by_k] group=C2xC2xC2 n=288
k  | d_ub | steps | dx_ub | dz_ub | id
 4 |   20 |  2000 |    20 |    20 | C2xC2xC2_c00087
 8 |   17 |  2000 |    20 |    17 | C2xC2xC2_c00401
[coverage] group=C2xC2xC2 A_sel=128 B_sel=128 Q_meas=25 ratio_ge_sqrt=0.000 ratio_sel=0.002
[coverage] run summary:
[coverage] group=C2xC2xC2 A_sel=128 B_sel=128 Q_meas=25 ratio_ge_sqrt=0.000 ratio_sel=0.002
[summary] best-by-k (measured; includes rejects):
  k=4 best_d_ub=20 count_measured=15 example_id=C2xC2xC2_c00087
  k=8 best_d_ub=17 count_measured=10 example_id=C2xC2xC2_c00401
[summary] best-by-k (survivors; target=16):
  k=4 best_d_ub=20 count_survivors=14 example_id=C2xC2xC2_c00087
  k=8 best_d_ub=17 count_survivors=3 example_id=C2xC2xC2_c00401
[pilot] top results:
  01 group=C2xC2xC2 n=288 k=4 d_ub=20 permA=8 permB=27 saved=True
  02 group=C2xC2xC2 n=288 k=4 d_ub=20 permA=12 permB=27 saved=True
  03 group=C2xC2xC2 n=288 k=4 d_ub=20 permA=11 permB=27 saved=True
  04 group=C2xC2xC2 n=288 k=4 d_ub=20 permA=7 permB=20 saved=True
  05 group=C2xC2xC2 n=288 k=4 d_ub=20 permA=20 permB=27 saved=True
  06 group=C2xC2xC2 n=288 k=4 d_ub=20 permA=11 permB=8 saved=True
  07 group=C2xC2xC2 n=288 k=4 d_ub=20 permA=11 permB=8 saved=True
  08 group=C2xC2xC2 n=288 k=4 d_ub=20 permA=27 permB=11 saved=True
  09 group=C2xC2xC2 n=288 k=8 d_ub=17 permA=20 permB=20 saved=True
  10 group=C2xC2xC2 n=288 k=4 d_ub=17 permA=27 permB=20 saved=True

