=== mar. 20 janv. 2026 14:49:55 CET steps=2000 batch=9 seed=1768918846 ===
[pilot] base k_table top pairs:
  k_base=18 permA=0 permB=0
  k_base=12 permA=29 permB=0
  k_base=12 permA=22 permB=0
  k_base=12 permA=13 permB=0
  k_base=12 permA=6 permB=0
[pilot] A multisets raw=792 (expected=792) enum_mode=multiset cayley_unique=26 perms=30 -> total scored = 780
[pilot] B multisets raw=792 (expected=792) enum_mode=multiset cayley_unique=26 perms=30 -> total scored = 780
[pilot] A frontier kept 128 candidates with points: (4,20), (0,49)
[pilot] B frontier kept 128 candidates with points: (4,20), (0,49)
[pilot] C2xC2xC2 n=288 d0=17 A_sets=26*30 -> keep 128; B_sets=26*30 -> keep 128
[pilot] MEAS n=288 k=4 dx_ub=16 dz_ub=18 d_ub=16 steps=2000 id=C2xC2xC2_c00002
[pilot] TARGET_REJECT d_ub=12 target=16 id=C2xC2xC2_c00024
[pilot] MEAS n=288 k=4 dx_ub=20 dz_ub=18 d_ub=18 steps=2000 id=C2xC2xC2_c00034
[saved] id=C2xC2xC2_c00034 -> results/c2xc2xc2_d16_20260120_144955/promising/C2xC2xC2_c00034 (reason: d>=sqrt(n))
[pilot] MEAS n=288 k=4 dx_ub=20 dz_ub=16 d_ub=16 steps=2000 id=C2xC2xC2_c00058
[pilot] MEAS n=288 k=4 dx_ub=16 dz_ub=16 d_ub=16 steps=2000 id=C2xC2xC2_c00086
[pilot] TARGET_REJECT d_ub=12 target=16 id=C2xC2xC2_c00091
[pilot] MEAS n=288 k=4 dx_ub=22 dz_ub=20 d_ub=20 steps=2000 id=C2xC2xC2_c00129
[saved] id=C2xC2xC2_c00129 -> results/c2xc2xc2_d16_20260120_144955/promising/C2xC2xC2_c00129 (reason: d>=sqrt(n))
[pilot] MEAS n=288 k=4 dx_ub=16 dz_ub=20 d_ub=16 steps=2000 id=C2xC2xC2_c00194
[pilot] MEAS n=288 k=4 dx_ub=20 dz_ub=20 d_ub=20 steps=2000 id=C2xC2xC2_c00209
[saved] id=C2xC2xC2_c00209 -> results/c2xc2xc2_d16_20260120_144955/promising/C2xC2xC2_c00209 (reason: d>=sqrt(n))
[pilot] MEAS n=288 k=4 dx_ub=17 dz_ub=16 d_ub=16 steps=2000 id=C2xC2xC2_c00225
[pilot] TARGET_REJECT d_ub=12 target=16 id=C2xC2xC2_c00244
[pilot] MEAS n=288 k=4 dx_ub=21 dz_ub=21 d_ub=21 steps=2000 id=C2xC2xC2_c00279
[saved] id=C2xC2xC2_c00279 -> results/c2xc2xc2_d16_20260120_144955/promising/C2xC2xC2_c00279 (reason: d>=sqrt(n))
[pilot] TARGET_REJECT d_ub=6 target=16 id=C2xC2xC2_c00284
[pilot] MEAS n=288 k=4 dx_ub=23 dz_ub=20 d_ub=20 steps=2000 id=C2xC2xC2_c00344
[saved] id=C2xC2xC2_c00344 -> results/c2xc2xc2_d16_20260120_144955/promising/C2xC2xC2_c00344 (reason: d>=sqrt(n))
[pilot] TARGET_REJECT d_ub=14 target=16 id=C2xC2xC2_c00351
[pilot] MEAS n=288 k=4 dx_ub=16 dz_ub=16 d_ub=16 steps=2000 id=C2xC2xC2_c00363
[pilot] MEAS n=288 k=8 dx_ub=16 dz_ub=17 d_ub=16 steps=2000 id=C2xC2xC2_c00373
[pilot] MEAS n=288 k=4 dx_ub=20 dz_ub=19 d_ub=19 steps=2000 id=C2xC2xC2_c00375
[saved] id=C2xC2xC2_c00375 -> results/c2xc2xc2_d16_20260120_144955/promising/C2xC2xC2_c00375 (reason: d>=sqrt(n))
[pilot] TARGET_REJECT d_ub=12 target=16 id=C2xC2xC2_c00385
[pilot] MEAS n=288 k=4 dx_ub=17 dz_ub=17 d_ub=17 steps=2000 id=C2xC2xC2_c00415
[saved] id=C2xC2xC2_c00415 -> results/c2xc2xc2_d16_20260120_144955/promising/C2xC2xC2_c00415 (reason: d>=sqrt(n))
[pilot] MEAS n=288 k=4 dx_ub=20 dz_ub=20 d_ub=20 steps=2000 id=C2xC2xC2_c00419
[saved] id=C2xC2xC2_c00419 -> results/c2xc2xc2_d16_20260120_144955/promising/C2xC2xC2_c00419 (reason: d>=sqrt(n))
[pilot] MEAS n=288 k=4 dx_ub=17 dz_ub=16 d_ub=16 steps=2000 id=C2xC2xC2_c00449
[pilot] MEAS n=288 k=8 dx_ub=16 dz_ub=18 d_ub=16 steps=2000 id=C2xC2xC2_c00455
[pilot] MEAS n=288 k=4 dx_ub=22 dz_ub=20 d_ub=20 steps=2000 id=C2xC2xC2_c00462
[saved] id=C2xC2xC2_c00462 -> results/c2xc2xc2_d16_20260120_144955/promising/C2xC2xC2_c00462 (reason: d>=sqrt(n))
[pilot] MEAS n=288 k=4 dx_ub=20 dz_ub=20 d_ub=20 steps=2000 id=C2xC2xC2_c00471
[saved] id=C2xC2xC2_c00471 -> results/c2xc2xc2_d16_20260120_144955/promising/C2xC2xC2_c00471 (reason: d>=sqrt(n))
[pilot] MEAS n=288 k=4 dx_ub=20 dz_ub=20 d_ub=20 steps=2000 id=C2xC2xC2_c00479
[saved] id=C2xC2xC2_c00479 -> results/c2xc2xc2_d16_20260120_144955/promising/C2xC2xC2_c00479 (reason: d>=sqrt(n))
[pilot] MEAS n=288 k=4 dx_ub=18 dz_ub=16 d_ub=16 steps=2000 id=C2xC2xC2_c00481
[best_by_k] group=C2xC2xC2 n=288
k  | d_ub | steps | dx_ub | dz_ub | id
 4 |   21 |  2000 |    21 |    21 | C2xC2xC2_c00279
 8 |   16 |  2000 |    16 |    17 | C2xC2xC2_c00373
[coverage] group=C2xC2xC2 A_sel=128 B_sel=128 Q_meas=27 ratio_ge_sqrt=0.000 ratio_sel=0.002
[coverage] run summary:
[coverage] group=C2xC2xC2 A_sel=128 B_sel=128 Q_meas=27 ratio_ge_sqrt=0.000 ratio_sel=0.002
[summary] best-by-k (measured; includes rejects):
  k=4 best_d_ub=21 count_measured=21 example_id=C2xC2xC2_c00279
  k=8 best_d_ub=16 count_measured=6 example_id=C2xC2xC2_c00373
[summary] best-by-k (survivors; target=16):
  k=4 best_d_ub=21 count_survivors=19 example_id=C2xC2xC2_c00279
  k=8 best_d_ub=16 count_survivors=2 example_id=C2xC2xC2_c00373
[pilot] top results:
  01 group=C2xC2xC2 n=288 k=4 d_ub=21 permA=8 permB=11 saved=True
  02 group=C2xC2xC2 n=288 k=4 d_ub=20 permA=11 permB=27 saved=True
  03 group=C2xC2xC2 n=288 k=4 d_ub=20 permA=12 permB=12 saved=True
  04 group=C2xC2xC2 n=288 k=4 d_ub=20 permA=7 permB=27 saved=True
  05 group=C2xC2xC2 n=288 k=4 d_ub=20 permA=7 permB=20 saved=True
  06 group=C2xC2xC2 n=288 k=4 d_ub=20 permA=27 permB=8 saved=True
  07 group=C2xC2xC2 n=288 k=4 d_ub=20 permA=8 permB=27 saved=True
  08 group=C2xC2xC2 n=288 k=4 d_ub=20 permA=11 permB=7 saved=True
  09 group=C2xC2xC2 n=288 k=4 d_ub=19 permA=27 permB=8 saved=True
  10 group=C2xC2xC2 n=288 k=4 d_ub=18 permA=12 permB=11 saved=True

