=== mar. 20 janv. 2026 14:49:34 CET steps=2000 batch=8 seed=1768918845 ===
[pilot] base k_table top pairs:
  k_base=18 permA=0 permB=0
  k_base=12 permA=29 permB=0
  k_base=12 permA=22 permB=0
  k_base=12 permA=13 permB=0
  k_base=12 permA=6 permB=0
[pilot] A multisets raw=792 (expected=792) enum_mode=multiset cayley_unique=26 perms=30 -> total scored = 780
[pilot] B multisets raw=792 (expected=792) enum_mode=multiset cayley_unique=26 perms=30 -> total scored = 780
[pilot] A frontier kept 128 candidates with points: (4,20), (0,49)
[pilot] B frontier kept 128 candidates with points: (4,20), (0,49)
[pilot] C2xC2xC2 n=288 d0=17 A_sets=26*30 -> keep 128; B_sets=26*30 -> keep 128
[pilot] MEAS n=288 k=4 dx_ub=20 dz_ub=16 d_ub=16 steps=2000 id=C2xC2xC2_c00005
[pilot] MEAS n=288 k=4 dx_ub=20 dz_ub=20 d_ub=20 steps=2000 id=C2xC2xC2_c00008
[saved] id=C2xC2xC2_c00008 -> results/c2xc2xc2_d16_20260120_144934/promising/C2xC2xC2_c00008 (reason: d>=sqrt(n))
[pilot] MEAS n=288 k=4 dx_ub=19 dz_ub=19 d_ub=19 steps=2000 id=C2xC2xC2_c00055
[saved] id=C2xC2xC2_c00055 -> results/c2xc2xc2_d16_20260120_144934/promising/C2xC2xC2_c00055 (reason: d>=sqrt(n))
[pilot] TARGET_REJECT d_ub=12 target=16 id=C2xC2xC2_c00071
[pilot] MEAS n=288 k=4 dx_ub=23 dz_ub=20 d_ub=20 steps=2000 id=C2xC2xC2_c00120
[saved] id=C2xC2xC2_c00120 -> results/c2xc2xc2_d16_20260120_144934/promising/C2xC2xC2_c00120 (reason: d>=sqrt(n))
[pilot] MEAS n=288 k=4 dx_ub=20 dz_ub=20 d_ub=20 steps=2000 id=C2xC2xC2_c00165
[saved] id=C2xC2xC2_c00165 -> results/c2xc2xc2_d16_20260120_144934/promising/C2xC2xC2_c00165 (reason: d>=sqrt(n))
[pilot] MEAS n=288 k=4 dx_ub=20 dz_ub=18 d_ub=18 steps=2000 id=C2xC2xC2_c00166
[saved] id=C2xC2xC2_c00166 -> results/c2xc2xc2_d16_20260120_144934/promising/C2xC2xC2_c00166 (reason: d>=sqrt(n))
[pilot] MEAS n=288 k=4 dx_ub=20 dz_ub=16 d_ub=16 steps=2000 id=C2xC2xC2_c00178
[pilot] MEAS n=288 k=4 dx_ub=19 dz_ub=21 d_ub=19 steps=2000 id=C2xC2xC2_c00181
[saved] id=C2xC2xC2_c00181 -> results/c2xc2xc2_d16_20260120_144934/promising/C2xC2xC2_c00181 (reason: d>=sqrt(n))
[pilot] MEAS n=288 k=4 dx_ub=19 dz_ub=16 d_ub=16 steps=2000 id=C2xC2xC2_c00199
[pilot] MEAS n=288 k=8 dx_ub=16 dz_ub=18 d_ub=16 steps=2000 id=C2xC2xC2_c00213
[pilot] MEAS n=288 k=4 dx_ub=24 dz_ub=17 d_ub=17 steps=2000 id=C2xC2xC2_c00237
[saved] id=C2xC2xC2_c00237 -> results/c2xc2xc2_d16_20260120_144934/promising/C2xC2xC2_c00237 (reason: d>=sqrt(n))
[pilot] MEAS n=288 k=4 dx_ub=16 dz_ub=16 d_ub=16 steps=2000 id=C2xC2xC2_c00250
[pilot] MEAS n=288 k=4 dx_ub=18 dz_ub=18 d_ub=18 steps=2000 id=C2xC2xC2_c00251
[saved] id=C2xC2xC2_c00251 -> results/c2xc2xc2_d16_20260120_144934/promising/C2xC2xC2_c00251 (reason: d>=sqrt(n))
[pilot] MEAS n=288 k=4 dx_ub=20 dz_ub=20 d_ub=20 steps=2000 id=C2xC2xC2_c00279
[saved] id=C2xC2xC2_c00279 -> results/c2xc2xc2_d16_20260120_144934/promising/C2xC2xC2_c00279 (reason: d>=sqrt(n))
[pilot] TARGET_REJECT d_ub=12 target=16 id=C2xC2xC2_c00292
[pilot] MEAS n=288 k=4 dx_ub=20 dz_ub=18 d_ub=18 steps=2000 id=C2xC2xC2_c00295
[saved] id=C2xC2xC2_c00295 -> results/c2xc2xc2_d16_20260120_144934/promising/C2xC2xC2_c00295 (reason: d>=sqrt(n))
[pilot] TARGET_REJECT d_ub=14 target=16 id=C2xC2xC2_c00310
[pilot] MEAS n=288 k=4 dx_ub=16 dz_ub=17 d_ub=16 steps=2000 id=C2xC2xC2_c00326
[pilot] TARGET_REJECT d_ub=12 target=16 id=C2xC2xC2_c00335
[pilot] MEAS n=288 k=4 dx_ub=20 dz_ub=17 d_ub=17 steps=2000 id=C2xC2xC2_c00378
[saved] id=C2xC2xC2_c00378 -> results/c2xc2xc2_d16_20260120_144934/promising/C2xC2xC2_c00378 (reason: d>=sqrt(n))
[pilot] MEAS n=288 k=8 dx_ub=17 dz_ub=18 d_ub=17 steps=2000 id=C2xC2xC2_c00384
[saved] id=C2xC2xC2_c00384 -> results/c2xc2xc2_d16_20260120_144934/promising/C2xC2xC2_c00384 (reason: d>=sqrt(n))
[pilot] MEAS n=288 k=4 dx_ub=20 dz_ub=19 d_ub=19 steps=2000 id=C2xC2xC2_c00385
[saved] id=C2xC2xC2_c00385 -> results/c2xc2xc2_d16_20260120_144934/promising/C2xC2xC2_c00385 (reason: d>=sqrt(n))
[pilot] MEAS n=288 k=4 dx_ub=20 dz_ub=19 d_ub=19 steps=2000 id=C2xC2xC2_c00387
[saved] id=C2xC2xC2_c00387 -> results/c2xc2xc2_d16_20260120_144934/promising/C2xC2xC2_c00387 (reason: d>=sqrt(n))
[pilot] TARGET_REJECT d_ub=6 target=16 id=C2xC2xC2_c00391
[pilot] TARGET_REJECT d_ub=12 target=16 id=C2xC2xC2_c00393
[pilot] TARGET_REJECT d_ub=14 target=16 id=C2xC2xC2_c00410
[pilot] MEAS n=288 k=4 dx_ub=17 dz_ub=17 d_ub=17 steps=2000 id=C2xC2xC2_c00427
[saved] id=C2xC2xC2_c00427 -> results/c2xc2xc2_d16_20260120_144934/promising/C2xC2xC2_c00427 (reason: d>=sqrt(n))
[best_by_k] group=C2xC2xC2 n=288
k  | d_ub | steps | dx_ub | dz_ub | id
 4 |   20 |  2000 |    20 |    20 | C2xC2xC2_c00008
 8 |   17 |  2000 |    17 |    18 | C2xC2xC2_c00384
[coverage] group=C2xC2xC2 A_sel=128 B_sel=128 Q_meas=28 ratio_ge_sqrt=0.001 ratio_sel=0.002
[coverage] run summary:
[coverage] group=C2xC2xC2 A_sel=128 B_sel=128 Q_meas=28 ratio_ge_sqrt=0.001 ratio_sel=0.002
[summary] best-by-k (measured; includes rejects):
  k=4 best_d_ub=20 count_measured=20 example_id=C2xC2xC2_c00008
  k=8 best_d_ub=17 count_measured=8 example_id=C2xC2xC2_c00384
[summary] best-by-k (survivors; target=16):
  k=4 best_d_ub=20 count_survivors=19 example_id=C2xC2xC2_c00008
  k=8 best_d_ub=17 count_survivors=2 example_id=C2xC2xC2_c00384
[pilot] top results:
  01 group=C2xC2xC2 n=288 k=4 d_ub=20 permA=27 permB=11 saved=True
  02 group=C2xC2xC2 n=288 k=4 d_ub=20 permA=12 permB=27 saved=True
  03 group=C2xC2xC2 n=288 k=4 d_ub=20 permA=27 permB=27 saved=True
  04 group=C2xC2xC2 n=288 k=4 d_ub=20 permA=27 permB=11 saved=True
  05 group=C2xC2xC2 n=288 k=4 d_ub=19 permA=12 permB=11 saved=True
  06 group=C2xC2xC2 n=288 k=4 d_ub=19 permA=8 permB=27 saved=True
  07 group=C2xC2xC2 n=288 k=4 d_ub=19 permA=27 permB=20 saved=True
  08 group=C2xC2xC2 n=288 k=4 d_ub=19 permA=27 permB=11 saved=True
  09 group=C2xC2xC2 n=288 k=4 d_ub=18 permA=20 permB=27 saved=True
  10 group=C2xC2xC2 n=288 k=4 d_ub=18 permA=12 permB=27 saved=True

