=== mar. 20 janv. 2026 14:48:52 CET steps=2000 batch=6 seed=1768918843 ===
[pilot] base k_table top pairs:
  k_base=18 permA=0 permB=0
  k_base=12 permA=29 permB=0
  k_base=12 permA=22 permB=0
  k_base=12 permA=13 permB=0
  k_base=12 permA=6 permB=0
[pilot] A multisets raw=792 (expected=792) enum_mode=multiset cayley_unique=26 perms=30 -> total scored = 780
[pilot] B multisets raw=792 (expected=792) enum_mode=multiset cayley_unique=26 perms=30 -> total scored = 780
[pilot] A frontier kept 128 candidates with points: (4,20), (0,49)
[pilot] B frontier kept 128 candidates with points: (4,20), (0,49)
[pilot] C2xC2xC2 n=288 d0=17 A_sets=26*30 -> keep 128; B_sets=26*30 -> keep 128
[pilot] MEAS n=288 k=8 dx_ub=19 dz_ub=16 d_ub=16 steps=2000 id=C2xC2xC2_c00010
[pilot] MEAS n=288 k=4 dx_ub=18 dz_ub=20 d_ub=18 steps=2000 id=C2xC2xC2_c00034
[saved] id=C2xC2xC2_c00034 -> results/c2xc2xc2_d16_20260120_144852/promising/C2xC2xC2_c00034 (reason: d>=sqrt(n))
[pilot] MEAS n=288 k=8 dx_ub=16 dz_ub=18 d_ub=16 steps=2000 id=C2xC2xC2_c00035
[pilot] MEAS n=288 k=4 dx_ub=19 dz_ub=21 d_ub=19 steps=2000 id=C2xC2xC2_c00058
[saved] id=C2xC2xC2_c00058 -> results/c2xc2xc2_d16_20260120_144852/promising/C2xC2xC2_c00058 (reason: d>=sqrt(n))
[pilot] MEAS n=288 k=4 dx_ub=16 dz_ub=17 d_ub=16 steps=2000 id=C2xC2xC2_c00123
[pilot] MEAS n=288 k=4 dx_ub=16 dz_ub=20 d_ub=16 steps=2000 id=C2xC2xC2_c00173
[pilot] TARGET_REJECT d_ub=6 target=16 id=C2xC2xC2_c00187
[pilot] MEAS n=288 k=4 dx_ub=23 dz_ub=20 d_ub=20 steps=2000 id=C2xC2xC2_c00218
[saved] id=C2xC2xC2_c00218 -> results/c2xc2xc2_d16_20260120_144852/promising/C2xC2xC2_c00218 (reason: d>=sqrt(n))
[pilot] TARGET_REJECT d_ub=12 target=16 id=C2xC2xC2_c00226
[pilot] MEAS n=288 k=4 dx_ub=21 dz_ub=19 d_ub=19 steps=2000 id=C2xC2xC2_c00237
[saved] id=C2xC2xC2_c00237 -> results/c2xc2xc2_d16_20260120_144852/promising/C2xC2xC2_c00237 (reason: d>=sqrt(n))
[pilot] MEAS n=288 k=4 dx_ub=21 dz_ub=20 d_ub=20 steps=2000 id=C2xC2xC2_c00247
[saved] id=C2xC2xC2_c00247 -> results/c2xc2xc2_d16_20260120_144852/promising/C2xC2xC2_c00247 (reason: d>=sqrt(n))
[pilot] MEAS n=288 k=4 dx_ub=17 dz_ub=16 d_ub=16 steps=2000 id=C2xC2xC2_c00250
[pilot] MEAS n=288 k=4 dx_ub=19 dz_ub=20 d_ub=19 steps=2000 id=C2xC2xC2_c00270
[saved] id=C2xC2xC2_c00270 -> results/c2xc2xc2_d16_20260120_144852/promising/C2xC2xC2_c00270 (reason: d>=sqrt(n))
[pilot] MEAS n=288 k=4 dx_ub=21 dz_ub=18 d_ub=18 steps=2000 id=C2xC2xC2_c00300
[saved] id=C2xC2xC2_c00300 -> results/c2xc2xc2_d16_20260120_144852/promising/C2xC2xC2_c00300 (reason: d>=sqrt(n))
[pilot] TARGET_REJECT d_ub=13 target=16 id=C2xC2xC2_c00306
[pilot] MEAS n=288 k=4 dx_ub=21 dz_ub=20 d_ub=20 steps=2000 id=C2xC2xC2_c00314
[saved] id=C2xC2xC2_c00314 -> results/c2xc2xc2_d16_20260120_144852/promising/C2xC2xC2_c00314 (reason: d>=sqrt(n))
[pilot] MEAS n=288 k=4 dx_ub=16 dz_ub=16 d_ub=16 steps=2000 id=C2xC2xC2_c00340
[pilot] TARGET_REJECT d_ub=12 target=16 id=C2xC2xC2_c00345
[pilot] TARGET_REJECT d_ub=14 target=16 id=C2xC2xC2_c00362
[pilot] TARGET_REJECT d_ub=12 target=16 id=C2xC2xC2_c00374
[pilot] TARGET_REJECT d_ub=12 target=16 id=C2xC2xC2_c00399
[pilot] TARGET_REJECT d_ub=12 target=16 id=C2xC2xC2_c00405
[pilot] MEAS n=288 k=4 dx_ub=20 dz_ub=21 d_ub=20 steps=2000 id=C2xC2xC2_c00406
[saved] id=C2xC2xC2_c00406 -> results/c2xc2xc2_d16_20260120_144852/promising/C2xC2xC2_c00406 (reason: d>=sqrt(n))
[pilot] TARGET_REJECT d_ub=12 target=16 id=C2xC2xC2_c00420
[pilot] TARGET_REJECT d_ub=12 target=16 id=C2xC2xC2_c00434
[pilot] MEAS n=288 k=4 dx_ub=23 dz_ub=16 d_ub=16 steps=2000 id=C2xC2xC2_c00449
[pilot] TARGET_REJECT d_ub=12 target=16 id=C2xC2xC2_c00477
[pilot] MEAS n=288 k=4 dx_ub=20 dz_ub=18 d_ub=18 steps=2000 id=C2xC2xC2_c00485
[saved] id=C2xC2xC2_c00485 -> results/c2xc2xc2_d16_20260120_144852/promising/C2xC2xC2_c00485 (reason: d>=sqrt(n))
[best_by_k] group=C2xC2xC2 n=288
k  | d_ub | steps | dx_ub | dz_ub | id
 4 |   20 |  2000 |    23 |    20 | C2xC2xC2_c00218
 8 |   16 |  2000 |    19 |    16 | C2xC2xC2_c00010
[coverage] group=C2xC2xC2 A_sel=128 B_sel=128 Q_meas=28 ratio_ge_sqrt=0.001 ratio_sel=0.002
[coverage] run summary:
[coverage] group=C2xC2xC2 A_sel=128 B_sel=128 Q_meas=28 ratio_ge_sqrt=0.001 ratio_sel=0.002
[summary] best-by-k (measured; includes rejects):
  k=4 best_d_ub=20 count_measured=21 example_id=C2xC2xC2_c00218
  k=8 best_d_ub=16 count_measured=7 example_id=C2xC2xC2_c00010
[summary] best-by-k (survivors; target=16):
  k=4 best_d_ub=20 count_survivors=15 example_id=C2xC2xC2_c00218
  k=8 best_d_ub=16 count_survivors=2 example_id=C2xC2xC2_c00010
[pilot] top results:
  01 group=C2xC2xC2 n=288 k=4 d_ub=20 permA=20 permB=20 saved=True
  02 group=C2xC2xC2 n=288 k=4 d_ub=20 permA=8 permB=11 saved=True
  03 group=C2xC2xC2 n=288 k=4 d_ub=20 permA=8 permB=8 saved=True
  04 group=C2xC2xC2 n=288 k=4 d_ub=20 permA=20 permB=7 saved=True
  05 group=C2xC2xC2 n=288 k=4 d_ub=19 permA=27 permB=8 saved=True
  06 group=C2xC2xC2 n=288 k=4 d_ub=19 permA=20 permB=11 saved=True
  07 group=C2xC2xC2 n=288 k=4 d_ub=19 permA=27 permB=20 saved=True
  08 group=C2xC2xC2 n=288 k=4 d_ub=18 permA=20 permB=8 saved=True
  09 group=C2xC2xC2 n=288 k=4 d_ub=18 permA=11 permB=11 saved=True
  10 group=C2xC2xC2 n=288 k=4 d_ub=18 permA=20 permB=8 saved=True

